subreddit,selftext,title
LifeProTips,"So I know you're not supposed to piggy back off of LPTs here but I think this is super important information to share. 

  I am a long hail truck driver in the US. I live OTR ( over the road) most of the time in my semi truck with my spouse. Here are some general LPTs for dealing with semis on the road because I saw one trending and it wasn't that great of advice imho. 

  1. If you cant see my mirrors, I can't see you. Generally true but I also can't see you if you can see my mirrors in certain spots. If you're on my passengers side/ right side of the vehicle I probably can't see you. Just as a general rule. We are trained to look as much as we can but shit still happens. 

  2. Don't hang out behind me. Ever. Unless there's a lot of traffic but you should still maintain a distance from me that will allow me to see your vehicle behind me. If there's no traffic and you can pass me just do it. Don't sit behind me for an hour because your headlights are blinding me and I am encouraged to slow down and get you to go around me because it could be a sign that I could be high jacked if someone is hanging around me too long. We are trained to look out for things like this. 

  3. If you can pass me, please just do it. I don't want your lights blinding me anyway and I'm governed as most company drivers are. Governed means that the speed of my truck is set at a maximum ( ie 65 mph) and I can't go any faster than that. Which sucks because companies demand you hurry up and get to your destination as fast as possible. 

  4. Driving in front of me? Go the speed limit please. If I'm governed at 65 and you're driving 64 mph I'm going to get a beeping sound saying I'm too damn close to you. And that sets the front camera off and then I get in trouble. So I have to slow down to get way behind you. Which eats into my allotted time to make a delivery on time. Just please stop driving 10 miles under the speed limit. 

  5. That brings me to texting/ distracted driving. I can see you texting.  I can see every. Single. Thing. You. Are. Doing. I can see you picking your nose. Talking on speaker phone with your phone in your hand. I can see your name on facebook or Instagram. I can see you jerking off. Literally 9/10 vehicles that pass me are texting or scrolling on their phones. You have to stop doing this. If not for anyone else, do this for yourself. If you're ever in an accident with a semi you will likely not survive it. 

  6. Driving on the side of me? Just pass me. The left lane is for passing. The right lane is for chilling ( as long as you are going the speed limit and not inhibiting my driving). Don't chill in the left lane because other cars and trucks want to pass you. Even if they are speeding it's better to just let them. They'll get pulled over one day. But you never know if you're hindering someone from passing you that needs to. Like a cop. Or ambulance way down the road. You may not be able to see it but I can see miles back how far you're hindering traffic. 

  7. Your headlights. For godssake people. Don't turn your brights lights on on the interstate. Why do people do this. I know a lot of people have these bright lights nowadays that arent "" bright lights "". So I try to be calm about it. But almost every day someone is driving the opposite direction with bright lights on or behind me with them on. Your brights can be seen in my rear view mirrors and it makes it difficult to see the road. Which is dangerous. 

  8. Accidents on the shoulder. If your car breaks down move it to the shoulder with your hazards on. If you dont have your hazards on I'm probably not going to move over into the left lane for you because I assume the car is abandoned. And if another car is broken down on the shoulder with their hazards on and I am able to get over safely to make some room for them then I'm going to try. So please don't try and gun it around me the minute you see my blinker. There's a reason I'm getting over. 

  9. Flashing your lights at me doesn't mean "" hey I'm here DONT get over. It means "" There's space between us so you CAN get over."" I've had a few miscommunications I think with cars over the years. I put my blinker on to get over. They flash their lights. I get over. They start wilding blaring their horn. For truck drivers, if someone flashes their lights it means "" You are safe to get over in front of me because there is an adequate amount of space between us"". So if a truck driver wants to get over you should either A. Slow down to allow them to.  Or B. Pass them. I know you can see my blinker. I have 6 on each side. And if you can't then you need to be paying more attention to the road. 


  Sorry if I come across a little crass here. But I've been a driver for 4 to 5 years now and on the road for like 9 with my spouse. I've seen it all by this point. I'm an extremely cautious driver with a half million safe miles under my belt. But I can't say the same for every other driver on the road. I have this belief that educating others will eventually lead to safer roads and less road rage. I also have seen at least 3 dead bodies in the past few years on the road and it's not something I ever want to see again. 

  Please stay off of your phones and stay safe out there.",LPT for driving around Semi-Trucks in the US.
LifeProTips,[removed],LPT: Keep your personal information (incl. name) out of all social media and anything tied to that account.
LifeProTips,"If you invite guests to your house/flat, you will tidy up and clean your home more likely because you don’t won’t them to see a messy home. This works for me pretty well since I moved out and every guest always says: wow your flat is so clean and nice!","LPT: If you are not motivated to tidy up your flat/house, then just invite every week at least one guest because you have to clean then!"
LifeProTips,[removed],Do not use an account with anything tied to your personal information if you want to voice your opinion.
LifeProTips,"It sounds counter intuitive, but when an object is being swung in an arc, it has the most power on the outer edges and near the end of the swing. If you move closer to the assailant, they have less room to swing and less time for the object to build up speed. It will still hurt, but hopefully it will reduce the amount of damage incurred and give you a chance to fight back or run.","LPT: If someone starts swinging a blunt object at you, and you know you’re going to get hit, move closer to the assailant."
LifeProTips,"Now this is all from personal experience, a friend had her photos leaked and the sister of one of another friend as well. It was on Pornhub and XNXX Board and was appearing on Google Search when you searched their names

I reported the images on the Website and I even DM'ed Pornhub on Twitter, as for Google, there is a simple method to report certain images, sometimes even after the images were gone from the website it was appearing on Google Images so I reported it to be false and Google removed it [slowly]

The Person tried to upload it again and again and after three tries he just gave up. 

**This is all if you cannot garner the strength to report to the cyber police**

The above can help you get your name off the internet however if you contact Cyber Police they will be sure to help you in all of this as well!!",LPT : If you have your Photos of Videos leaked on the Internet you can get them removed!
LifeProTips,"It sounds counter intuitive, but when an object is being swung in an arc, it has the most power on the outer edges and near the end of the swing. If you move closer to the assailant, they have less room to swing and less time for the object to build up speed. It will still hurt, but hopefully it will reduce the amount of damage incurred and give you a chance to fight back or run.","If someone starts swinging a blunt object at you, and you know you’re going to get hit, move closer to the assailant."
LifeProTips,"If you’re in a movie theatre, breaking and entering, or just drinking beer alone in your parents house on a weeknight at 12:30 am, this trick works anytime and anywhere.
Take your preferred beverage of choice (Guinness for me), and with your dominant hand place your index finger and thumb on that metal bit that opens it (I know you know what I mean). Now, firmly grip both sides and squeeze hard with your non-dominant hand (you should hear aluminum crackling). Take those fingers of yours and open just enough before it pops (easy does it). Finally, (*important*) shout loudly enough to cover up the sound of the can being opened and presto, you can enjoy your bev",LPT: To open a can silently
LifeProTips,"I used to find these messages very cringey, but I've come to realise that it helps my parents stay grounded and connected to me, even though we are in different countries and timezones. I've even set a daily phone reminder.","LPT: Take the time out to wish your parents a good morning, every day"
LifeProTips,,"LPT: If the PS5 is over $700, you might as well build a PC"
LifeProTips,"This seems so obvious to me as I drive different cars regularly and always check it before refuelling, but it's come up in conversation a few times and people are always surprised",LPT: The instrument cluster in your car has a little triangle/arrow next to the fuel gauge that tells you what side of the vehicle the fuel cap is on
LifeProTips,,LPT: The odds of you being born is incredibly low. Being alive is a gift and a privilege. Never take it for granted!
LifeProTips,"This seems so obvious to me as I drive different cars regularly and always check it before refueling, but every time it's brought up I get a shocked reaction, so I guess maybe the internet should hear about it",The instrument cluster in your car has a little triangle/arrow next to the fuel gauge that tells you what side of the vehicle the cap is on
LifeProTips,[removed],LPT: Avoid breaking the law while committing crimes. This helps minimize your time in jail if caught.
LifeProTips,,Avoid breaking the law while committing crimes. This helps minimize time in jail if caught.
LifeProTips,"If you are getting arrested and the officers have their hands on you, no matter how much you may fight you are not getting away so ignore that thought immediately. You’re only making it worse for yourself physically, not to mention fighting back and trying to get away is going to make you look suspicious, *and* they will tack on resisting arrest to the charges and you do not want that. Bottom line, just seethe. Curse under your breathe, just please don’t give them an excuse. I can’t tell you how many do these videos I’ve seen where somebody innocent of something wouldn’t cooperate and that scuffle is what put them in jail. Don’t fight back against the police! Just dont because they have a power trip and will make your life hell. I dislike them just as much as you but stop resisting, no good will come of it. If you’re sure you’re innocent and you didn’t do anything then you’ve got nothing to worry about and the best thing you can do for yourself is to be calm and let them take you, that will be included in their reports and will be better for your case, but trust me you’re going either way.","LPT: When getting arrested, simply seethe"
LifeProTips,[removed],LPT: An Easy Way To Get Free Food Legally If You Run Out Of Money
LifeProTips,[removed],An Easy Way To Get Free Food Legally If You Run Out Of Money
LifeProTips,"It's a bit difficult to put into words hence why the title is a bit weird but I stand by it. I've done quite a few snake talks in my life, or I've just been handling the snakes at work and people will see them and ask a question which I'm always very happy to answer.

I've had many people now come up to me while I'm handling the snakes, and once I offer to let them touch or hold they back away and say ""No thank you I'm terrified of snakes"" but are still wanting to know about the one I'm holding. Many times with these people I've turned the snakes head away from them, usually behind my shoulder while I'm facing them (as that's usually the scariest part) and after learning about them they are comfortable enough to touch the very tip of the tail. People are FASCINATED by how soft and sweet they are and usually give them a nice pat before saying ""ok I'm done"" but this is a HUGE step.  Going from being so scared you can't even be near them to touching the animal at all is a huge step up even if you're only touching a little bit.

If you're terrified by something but give yourself the chance to experience it in a tiny tiny dose, not only will you learn more about the thing you're afraid of, but you might also get the chance to realise that they're not as scary as you thought.",LPT Being open to touching/being near animal you are scared of will expand your horizons immensely
LifeProTips,[removed],Being open to touching/being near animal you are scared of will expand your horizons immensely
LifeProTips,[removed],LPT: Dab hand sanitizer on both your index fingers and rub them behind your ears before you put on your mask.
LifeProTips,[removed],[request] cooling your house down for cheap
LifeProTips,,"LPT: See a Redditor expressing suicidal thoughts or appearing to be depressed? You can request Reddit to reach out to a Redditor from their profile, by clicking 'More Options' on the side-bar and clicking 'Get them Help and Support' in which they will have a trained counsellor speak to them."
LifeProTips,My company's legal plan covered all the attorney review fees AND they'll go to court for you if you have speeding/parking tickets. $20 a month well spent.,"[LPT] If you want to buy a house in 2021 and your company provides a legal plan, enroll in it ASAP."
LifeProTips,[removed],"[LPT] If you want to buy a house in 2021 and your company provides a legal plan, enroll in that shit ASAP."
LifeProTips,[removed],Explanation of why sometimes kids get sick in school. LPT
LifeProTips,[removed],"If you want to buy a house in 2021 and your company provides a legal plan, enroll in that shit ASAP."
LifeProTips,[removed],Explanation of why sometimes kids get sick in school.
LifeProTips,[removed],LPT - Use Just Dance videos on YT to keep you and your kids entertained and fit during this quarantine.
LifeProTips,"If you have a lot of stress in your life, a lot on your mind, are anxious, depressed, or just having a crappy day, just tell yourself to make it to tomorrow. If you have friends that are going through a lot, just tell them to make it to tomorrow. Having this small accomplishment / victory can be daunting or extremely difficult for some people but making it to tomorrow means you made it and survived. The next day you should have the same goal: make it to tomorrow. 

So today, the next day, and every day after that, I want you to make it to tomorrow.

Note: This is not to be mistaken with ""push it off until tomorrow"". That is completely different and just procrastinating... just get it done today... but make it to tomorrow.",LPT: Just make it to tomorrow
LifeProTips,"My best friend (which is my roommate) and I insult each others a lot of times and we both don't mind as we knows its just joking 

but my friend sometimes try to insult me in front of other friends which I don't like it at all, I tried to talk to him and give him hints to not do that in front of others but he keeps doing it

DO NOT make fun of him just to entertain others.","LPT: If your friend does not mind insulting him, this does not mean that he does not mind insulting him in front of others"
LifeProTips,[prayish](http://www.prayish.com),LPT : Ppl goin through anxiety or mental stress nw should immediately start meditation. Sit in one place with your eyes closed and start counting your breath. It's that simple. A total of upto 10 or 20 counts is a good start. Make use of this 6000 year old tool for wellbeing at ths difficult time.
LifeProTips,[removed],"A good/fun way to get young kids to open up wide enough to brush their teeth is to ask them to pretend to be a dinosaur and ""roar"" or ""growl"" to get their front and sides."
LifeProTips,"It's easy to use, cart them anywhere, lightweight, powerful &amp; energy efficient.

[Aposen](https://aposen.com/collections/vacuum-cleaner/products/a7-b) - 40% off Handheld Vacuum Cleaner A7-B [Code:  A7B-31]","LPT : Big messes are inevitable, especially if you have rambunctious pets or kids in the household. Always keep a handheld vacuum next to you."
LifeProTips,,"LPT: You might think you can't type without looking at the keyboard, but if you've never tried, and you've done a fair amount of typing in your life, you probably can. Give it a try, your fingers might just know what to do!"
LifeProTips,[removed],Microwave S’mores — cut the marshmallow
LifeProTips,It took me 40+ years on this planet to figure out that it’s infinitely easier to put the refried beans onto the tortilla first and then the meat. Idk if it’s just my family but we’ve always done meat first. Then trying to drop the beans over it awkwardly.,"LPT: spread/schmear refried beans onto the taco shell or tortilla first, then put the taco meat over it."
LifeProTips,"I had undiagnosed PTSD as a child, and I would annoy my parents by talking about that incident a lot. They were great parents, and I’m sure it just never crossed their mind that I could need some mental help.","LPT: If your child continues to talk about an incident that upset them, consider having them talk to a therapist."
LifeProTips,,"LPT: If someone is giving you life advice, stop giving them the obvious alternative. This is a toxic reoccurrance in this thread and is frustrating. Take everything with a pinch of salt and apply the advicr where you can."
LifeProTips,"Never shake your spice/seasoning bottle directly over the dish you are cooking.  The steam and moisture cause them to clump up, and loose flavor.  Even if you are not the measuring type pour them into the cap first or a separate dish and toss in.   Bonus tip, approximate measure,  first thread of cap is a teaspoon,  full cap is a tablespoon",LPT: Stop the Spice Shake
LifeProTips,[removed],LPT never trust a fart
LifeProTips,"ReDdIt

rEdDiT

See? Much better.","LPT: wHeNeVeR wRiTiNg TeXt LiKe ThIs, StArT wItH a LoWeR cAsE lEtTeR. It looks much better"
LifeProTips,,"wHeNeVeR wRiTiNg TeXt LiKe ThIs, StArT wItH a LoWeR cAsE lEtTeR. It makes it look much better"
LifeProTips,"This may not be the case for everyone, but it is difficult to get out of those negative vibes sometimes and can make you not in the mood for anything. Playing music is an easy button to press on your phone and is usually very effective on the brain.","LPT: If you’re ever sad, lonely, depressed, for no reason, play happy music. It’s an easy way to help you feel better"
LifeProTips,[removed],"If you’re ever sad, lonely, or depressed for no reason, playing happy music will usually lift your spirits."
LifeProTips,"As I'm listening to the birds, I realize not a lot of people know this. You can tell a lot about weather and other animals just by listening to birds. I'm not sure how city birds such as pigeons work with this tip, so let me know! A few things you can tell are:

1. Birds go CRAZY when there is a snake nearby. I don't mean like mating season crazy, I mean constantly screaming and sometimes dive-bombing the actual snake. Use this to locate the snake and keep yourself or your family safe.

2. Birds 'go to sleep' when rain is coming and stay quiet in their nests. 

3. If it is raining and the birds are still loud outside, the rain is going to continue for a long time (8-10+ hours). They're basically panicking and trying to solve the problem of running out of food soon.",LPT: Birds can give you a lot of useful information just by listening to them.
LifeProTips,,"LPT: If you're concerned about strangers on social media finding out where you live, make sure the address side of your pet's name tag is never facing outward in photographs."
LifeProTips,,"If you're concerned about strangers finding out where you live through social media, make sure the address side of your pet's name tag is never facing forward in a photograph."
LifeProTips,,LPT - Next time your at your parents/grandparents house install team viewer on their computer. Now anytime they have a problem or need any computer help you can tap in and help them!
LifeProTips,[removed],"LPT: If you're about to get a new cell phone number, make ABSOLUTELY certain you don't have any two factor authentication methods attached to the old one."
LifeProTips,"Most times when a new poll comes out it is available for download. This information is not interpreted, and allows you to draw your own conclusions. You may even make novel interpretations that you didn't hear or read anywhere, which is sort of fun.","LPT: When new polls come out, consider downloading the poll itself. Often it's not the poll that's biased but instead it is the interpretation and resulting article."
LifeProTips,[removed],LPT - Everyone is so sad and there is so much hateness in world.Only we can help each other So I have written something about that....
LifeProTips,[removed],LPT: Pee efficiently by only opening up the zipper and no buttons
LifeProTips,[removed],Next time your at your parents/grandparents house install team viewer on their computer. Now anytime they have a problem or need any computer help you can tap in and help them!
LifeProTips,[removed],How to not hate anyone
LifeProTips,,LPT: If you tell siri you are being pulled over she will record your interaction with the police
LifeProTips,"We know that strong passwords use a combination of lowercase letters, Uppercase Letters, numb3rs, and symbols! You know what else contains these features? A common street address. Some examples:

102MainSt.

5569S.HickoryWay

4437JuniperAve. 

330GregoryRoadUnit:184

It’s probably not a good idea to use an address where you own property (that is public record), but you can use relatives addresses, school addresses, or any random address you like, real or fake.",LPT: Need a good password? Use an address
LifeProTips,,Need a good password? Use an address
LifeProTips,"You may think this is common sense, but i’ve seen a surprising amount of people getting so upset over arguments and going to google just to be proven wrong. Relationships and Friendships have been broken because of arguments like this. Its never happened to me, but yeah, don’t make yourself look stupid.",LPT: Never get into an argument that can be resolved with google
LifeProTips,"Honestly, this is almost like a superpower if done right. It sounds odd or awkward at first, but it really works.

From Sean Covey's book, *The Seven Habits of Highly Effective Teens*:

&gt;Think like a mirror; it doesn't judge and it doesn't give advice. It reflects. Mirroring is simply repeating back in your own words what the other person is saying and feeling.

As an example, let's say your significant other comes to you angry that you left the TV on overnight. ""Hey, you forgot to turn the TV off before bed! Our electric bill is going to cost a fortune!"" Now, simply repeat back what they said. You can start it with ""I hear..."" or phrase it as a question. ""I hear you saying that I left the TV on before bed, and our electric bill is going to cost a fortune?""

As awkward as this sounds, I've had exchanges that would have been big arguments in the past cool off almost immediately after a bit of mirroring. And most of the time the other party doesn't even notice that you're mirroring them, especially after you've practiced a little. It comes very naturally to me now.

I use mirroring for even the smallest exchanges. If my friend comes to me all excited that she's going on a road trip, I match her affect by becoming excited myself and repeating her words before responding to them. (""You're spending the night in NYC with Becky? That's great!"") I also use this a lot at work. If my boss tells me ""Hey Mr. Skippy, could you take that pallet of water out back?"" I'll say ""Take that pallet of water out back, got it!"" (In commercial aviation, pilots are actually required to Mirror instructions back to air traffic control to prevent misunderstandings in communication!)

If anything, my only complaint about mirroring is that sometimes it works too well. I've had complete strangers share their darkest secrets mere minutes after meeting them, especially if I combine mirroring with *another* technique called Unconditional Positive Regard. But that's for another LPT!

P.S. In the NLP community, mirroring refers to mimicking another person's mood, posture, mannerisms, and speaking style to build rapport. This is related to, but a little different from mirroring as discussed by Sean Covey. Influential American therapist Carl Rogers used the term ""reflective listening"" instead of mirroring.","LPT: ""Mirroring"" is a simple but extremely powerful communication technique that helps the other party feel that they've truly been heard"
LifeProTips,"If you don't want to date someone anymore, that's a good reason to not date them! People can get trapped in toxic relationships, because the person ""hasn't done anything 'bad enough' to break up with them.""","LPT: You don't have to have a ""good reason"" to break up with someone."
LifeProTips,,"LPT: Always drink water before you eat. Just like when you go to restaurants, drinking before you eat results in not eating as much. So, you may just save a nice portion of food for later"
LifeProTips,[removed],If you have trees in your front yard check your home insurance for service line protection.
LifeProTips,[removed],"LPT: If a doctor tells you that you have a 3% survival rate after imbibing alcohol (or if you are an alcoholic), please never drink alcohol again"
