subreddit,selftext,title
LifeProTips,[removed],LPT 3 Chords &amp; The Truth! EP. 626 “Radio You Can See” Live Acou Songwriter C...
LifeProTips,,"LPT: When watching tv/talking to someone while eating, always take a look at your food/drink before taking a bite/sip. You never know if a fly, cockroach, fragments of anything goes there while you're not looking or the food has some surprise."
LifeProTips,"If you suspect the account is using an old post to squeeze out some extra karma and you see their Post Karma is in the millions, chances are you've stumbled upon a karma farming post. 

I've already left r/interestingasfuck because more than half of the posts are getting reposted each month by these accounts","LPT: If you are using reddit on mobile, you can block accounts and their content. This way you can slowly filter out the annoying reposts or low effort/sensationalized content by karma farming accounts. Most of them have 100k+ karma. My feed is getting clean."
LifeProTips,[removed],Smoking doesn’t relieve stress unless your already a smoker
LifeProTips,[removed],Acting vs modeling which is more preferable
LifeProTips,[removed],"LTP: If you are using reddit on mobile, you can block accounts and their content. Alot of reposts or meta posts are farmed out by these accounts and it can become frustrating or annoying to see the same post over and over."
LifeProTips,[removed],"LPT: On death row? Ask for a McDonald’s ice cream as your last meal, they’ll never find a working machine and you’ll get to live."
LifeProTips,,"LPT: Put a message like ""Did you find this phone? If so, please contact me @ [email address] OR [alternative phone #]"" on your smartphone lock screen so you can increase the chances of retrieving your phone. Bonus: Include a monetary reward in the message."
LifeProTips,[removed],LPT [META] Unwanted Posts
LifeProTips,"Use ‘ctrl + shift + esc’ to open the task manager. From here, select the ‘startup’ tab, now, just right click on the applications that you don’t want to be opened, and choose ‘deselect’.",LPT: how to stop apps opening upon startup of a windows computer.
LifeProTips,[removed],[META] Non-LPTs
LifeProTips,[removed],[META] Unwanted posts
LifeProTips,[removed],How to stop apps opening upon the startup of a windows computer.
LifeProTips,It’s a sub with precisely that sort of content. It has less activity I guess because this sub has more reputation.,LPT: Tired of the constant barrage of vague advice being passed off as Life Pro Tips? Want ACTUAL tips? Join r/lifehacks instead
LifeProTips,,"LPT: If you worry a lot, keep a worry list and mark against it every time a worry is proven true or false. You will ultimately see that the large majority of your worries are unfounded, and this will allow you to apply a filter across all future worries."
LifeProTips,,"LPT: When you get a new manager, tell them that you will assume everything is fine unless they specifically tell you otherwise."
LifeProTips,,"LPT: If you’re organising a date, ask them what their favourite way to be greeted and farewelled. Knowing whether someone is a hugger, cheek kisser or totally not into physical contact removes that terrible awkwardness that can define a first date if not managed well."
LifeProTips,,"LPT: If a task takes less than 10 minutes to complete, do it while you're thinking about it so they don't all pile up and become cumbersome."
LifeProTips,[removed],"If something takes less than 10 minutes to complete, do it while you're thinking about it so it doesn't all pile up"
LifeProTips,[removed],Tips to remember folks
LifeProTips,[removed],"If you’re organising a date, ask them what their favourite way to be greeted and farewelled. Knowing whether someone is a hugger, cheek kisser or totally not into physical contact removes that terrible awkwardness that can define a first date if not managed well."
LifeProTips,,"LPT: If you are antisocial, or don’t feel like interacting with others, wear a MAGA hat. Most people will try to avoid you at all costs."
LifeProTips,[removed],"If you are antisocial, or don’t feel like interacting with others, wear a MAGA hat. Most people will try to avoid you at all costs."
LifeProTips,[removed],"When you get a new manager, tell them that you will assume everything is fine unless they specifically tell you otherwise."
LifeProTips,[removed],"If you worry a lot, keep a worry list and mark against it every time a worry is proven true or false. You will ultimately see that the large majority of your worries are unfounded, and this will allow you to apply a filter across all future worries."
LifeProTips,"It's called ""secondary victimisation"", and it means that you will start feeling the effects of your partner's affliction. This is one reason why self-care is critical if you're in a relationship with someone whose own care requirements are high - don't be a martyr!","LPT: if you're in a relationship with a person who has trauma or other similar afflictions, be aware that you could suffer from a ""diet"" version of the same affliction."
LifeProTips,,"LPT: be cool if a lady refuses a drink in a social setting. She may be pregnant and not ready to announce it, and will appreciate you not making a deal out of it."
LifeProTips,"Whether it is some celebrity or any kind of businessman or anyone.

They are just people,the only difference is that they excel themselves in their field,that's it!

So if some celebrity share his opinion,it's their personal opinion,it's absolutely not necessary to agree with them or follow them blindly,you should check the facts 

Whether the person is celebrity,the president,the prime minister,businessman,
Irrespective of their profession,ANYONE CAN BE A$$WHOLE...
Remember they are just people who excels themselves in their profession,that's it .nothing more than that,
They can be as stupid as us or may be more.

Do not judge people by their profession or status.
P.S. English is my 3rd language,so excuse me if I made some horrible grammor mistakes.",LPT:You should not blindly follow anybody on social media or in general.
LifeProTips,[removed],You should not blindly follow anybody on social media or life
LifeProTips,[removed],LPT the only dish washer packs that work are cadcade platinum.
LifeProTips,"If you ask a favor and borrow something off a friend or family member, don't wait for them to ask for it back.  It's not your birthday. Get your shoes on, and walk your newfound gift back to its rightful owner wirh a smile and a thank you.  They'll appreciate it and you'll be a better person because of it!",LPT: Return it yesterday!
LifeProTips,[removed],the only dishwasher tabs that actually clean your dishes is Cascade Platinum.
LifeProTips,[removed],"LPT: If you are a pedophile, do nothing to hide the fact you are one. The world lives your kind already."
LifeProTips,[removed],"If you're trying to photograph something on your phone and can't fit it all in frame, turn your phone around and use your forward facing camera. These typically have a wide angled lens and can fit much more into the frame."
LifeProTips,"If someone enjoys to tell others secrets, they will tell yours to others. If someone speaks ill of someone behind their back, they’ll speak ill of you too. Paying attention to people’s behavior is extremely important.","LPT: Pay attention to how people talk about others, they will talk about you the same way."
LifeProTips,"I’ve found that when I shop for shirts that match shorts or vice versa, I tend to pass up nice clothes that definitely match or look good simply because what I’m currently wearing looks or matches better. I overthink things a lot so maybe this won’t work for everyone but it’s handy to remember that just because what you’re wearing looks BETTER doesn’t mean it doesn’t look good.","LPT: When looking for a shirt to match your shorts/pants, wear a neutral color or something that you only look ok in."
LifeProTips,"Works on windows only. For Mac, use the shortcut Ctrl+Shift+⌘ Cmd+3.

To save a screenshot to your computer (In windows, located in Pictures&gt;Screenshots), use the shortcut Win+Print Screen (Mac, use the shortcut Shift+⌘ Cmd+3.)

If you use Linux, sorry. This post is completely useless for you.","LPT: If you want to quickly take a screenshot of your computer's screen, use the Print Screen key on your keyboard. Pressing it automatically saves a screenshot of your screen to the clipboard."
LifeProTips,"Sometimes we forget just because we can't see someone they are not there. I just know from experience how stressful it is, a simple reply, courtesy, and interest in another person can spread positivity no matter what line of work or instance the interaction takes place.","LPT: If the drive-thru person asks how you are doing while they are taking your order, be polite and return the favor by asking how they are as well instead of going straight to ordering food."
LifeProTips,"If the culture is in decline, if you’re not learning anything, if you’re bored and growth is slowing, keep your eyes open for the next opportunity. Starting something new always entails some risk and uncertainty, but you will likely rise to the occasion and staying longer will probably drag you down.",LPT - Know when it’s time to move on from your job
LifeProTips,[removed],You can gain easy karma by always saying 'happy cake day' to the user having their cake day... because they are most likely to upvote
LifeProTips,,"LPT: I looked in the mirror, half of my jaw was missing from half my mouth, man I couldn't believe it But I'm still here for y'all right now, man"
LifeProTips,It reminds you that you're never stuck being who you are or who you think you are at any given moment and that you should seek to constantly improve and revise yourself. Say it to yourself often,"LPT: ""This isn't even my final form"" is actually a great philosophy to live by"
LifeProTips,,"LPT: If you can be charging your phone (at home, next to an outlet at work) charge it. You never know when there will be an emergency and you won't be able to charge it for a while"
LifeProTips,[removed],Take It Easy!
LifeProTips,[removed],Create a second Netflix profile for upbeat shows
LifeProTips,[removed],Help?
LifeProTips,"It doesn't really increase your chances of being correct, but it does increase your chance of saving you from the embarrassment that comes with getting an incredibly obvious question wrong.","LPT: If you don't know the answer to a question, pick the answer that will be least embarrassing if it's wrong."
LifeProTips,[removed],"If you don't know the answer to a question, pick the answer that will be least embarrassing if it's wrong."
LifeProTips,"I've always had issues remembering or just taking the time to take care of my self due to forgetfulness or mental health reasons. Things like brushing my teeth or hair.

I've now made it a habit of making sure I do those things right before bed. Even if my sleep schedule is wonky due to the previous stayed reasons. I've been sleeping better because of it too!","LPT If you are someone that has a problem practicing self care, make it something you do right before bed."
LifeProTips,,"LPT: when cooking a meal, always clean as you cook to avoid a large backlog of plates, bowls and utensils, with baked on food."
LifeProTips,"I think a lot of us feel alone right now, and are hyperaware of how unpredictable life is. Let the people know how important they are to you! You never know how that may impact their day or week, and you never know if it will be the last time you get a chance to tell them. 
I’ve had two friendships end with an argument, never imagining it would be the last time we would speak before they passed. Life is too short. Choose love, and be loud with that love!!!","LPT: Tell people in your life what they mean to you, often."
LifeProTips,"Freeze your Credit if you aren’t opening new accounts, or needing it checked any time soon

YSK about Credit Freezes. It’s basically like putting a lock on your credit door so that new accounts can’t be opened up. It also stops people from doing hard checks on your credit as well. It’s fairly new and was created to prevent identity theft. It doesn’t affect your credit score in any way and if you need to open new accounts or things like that you can do temporary credit thaws, and then freeze it again.

You have to freeze each one of the 3 branches of credit individually and it’s free to freeze and unfreeze.

Protect thineself from thieves.

Here’s some more info about the matter:

https://www.consumer.ftc.gov/articles/0497-credit-freeze-faqs",LPT Freeze Your Credit
LifeProTips,,"LPT: If you find yourself getting stressed out by work calls, try changing your ringtone. You're probably associating negative emotions with the ringtone, and a change may put you in a better mindset when answering the phone."
LifeProTips,,"LPT: If you're tired of political ads playing before YouTube and adblock doesn't work, turn a VPN on and switch the region."
LifeProTips,[removed],"Freeze your Credit if you aren’t opening new accounts, or needing it checked any time soon"
LifeProTips,"This is another good reason to have different passwords as well. It's a pain in the ass, but you don't want someone getting access to all of your accounts at once. That's no bueno.","LPT: Google your account names once in a while. I once found my username and password on a foreign facebook page, along with about 100 others."
LifeProTips,"Whether it’s yourself, or your family, don’t force the practice of cleaning your plate of food. Put the food in Tupperware and store it away for later.

Practice portioning. Take slightly less food than what you think you may eat, and go back for seconds if you need to. Most of the time when you go back for seconds, you have a better feel of how hungry you are and how filling the food is, and you’ll take a better portion.

Portioning food can be difficult, as it changes overtime, especially with growing children or aging elders, but eventually you will become better and better at deciding just how much food you need to take. 

Here’s a resource for the issue:

https://www.google.com/amp/s/www.psychologytoday.com/us/blog/comfort-cravings/201407/4-ways-quit-the-clean-plate-club%3famp","LPT: Don’t force yourself, or others, to clean the plate of food. Instead practice taking correct portions."
LifeProTips,"So my dad is 76 year old with one left leg polio ,I was wondering what exercise do I recommend for him at this age.

Any of the information about what sorts of exercise he should starts with .Does he had to take extra ordinary diet for doing it?

Thank you ,",LPT request: What exercise to you recommend for your dad?
LifeProTips,"Whenever I go skiing with my friends, one of them fell and got stuck. He tried getting up but it doesn't work sometimes. The easier way to get up if you are stuck it to just **take off you skis**. If you are worried about it going down the hill, just stick it in the snow. Trust me, taking off your skis is way better than you trying to get up for 5 mins.","LPT: If you are skiing and you fall and can't get up, take off you skis."
LifeProTips,"It’s hard to do, but worth it.","LPT: If your depression stems from not having the life you want, start by deleting your social media"
LifeProTips,[removed],"LPT: if you're looking for motivation, spend some time with your pet and/or do something nice for a dog you see on the street."
LifeProTips,"...A sentence should contain no unnecessary words, a paragraph no unnecessary sentences, for the same reason that a drawing should have no unnecessary lines and a machine no unnecessary parts. This requires not that the writer make all his sentences short, or that he avoid all detail and treat his subjects only in outline, but that every word tell. 

\-\*The Elements of Style\*",LPT: Vigorous writing is concise...
LifeProTips,[removed],Vigorous writing is concise...
LifeProTips,You can install an app called Z lib for free on your android (im not sure if its on apple) to have access to millions of free ebooks! It has saved me a fortune!,LPT: install Z lib for free ebooks
LifeProTips,[removed],"If your depression stems from not having the life you want, start by deleting your social media"
LifeProTips,[removed],LPT: always wash your hands before washing your face
LifeProTips,"With so many app based ride share choices I don't take many cabs anymore. When I do it's usually because I'm in a bind, like a helluva hurry or something. In these moments, I turn on as much Midwest charm as I can muster to make it clear that the cabbie is in the driver's seat. Calling them ""sir"" or ""ma'am"" as much as possible, especially in the initial exchange with your cabbie, seems to help. I basically never get ""taken for a ride"" as a tourist and by the end of the ride try to be on first name basis with the person behind the wheel.","LPT: Always call your cabbie ""sir"" or ""ma'am"""
LifeProTips,"One time I accidentally called my grandpa instead of my mom. I told him I didn’t mean to call him and that I was trying to reach my mom. It’s been years now, and I always feel guilty about it. I’m sure it would have made him happy to think I was just calling him to say hi rather than calling him by mistake.","LPT: If you call the wrong person on the phone, don’t tell them. Just say you were calling to say hi and check in."
LifeProTips,[removed],"LPT: If you want to donate or make a purchase from less secure websites, buy a reloadable Visa card."
LifeProTips,"I’ve always had a lazy eye and I’ve never been unhappy about it. I’ve actually always felt that it made my outward appearance match my personality even more. However, sometimes people will ask why I seem to be peering off into the distance when talking to them and when I explain that I have a lazy eye they get very embarrassed and apologetic, which actually is the only thing that makes me feel somewhat bad about it, like this little thing that really doesn’t affect me at all makes me somehow pathetic. A much better response would be something like “ah, gotcha” and then move on. Although, if someone DOES appear to be embarrassed by a comment you make then you should probably still apologize, haha.","LPT: Don’t assume that people are ashamed of their unique, or even conventionally unattractive traits"
LifeProTips,[removed],"If you want to donate if make purchases from less secure sites, buy a reloadable visa gift card."
LifeProTips,[removed],"LPT: When consoling someone who has lost a loved one, avoid saying “you can talk to me anytime”. Just talk to them."
LifeProTips,"This will give autocorrect or spell check a chance to correct that final word since it would send whatever you typed right or wrong.

Of course this depends on how good your autocorrect is...","LPT: Press space at the end of a sentence before sending an IM, text message, or whatever."
LifeProTips,,"LPT. If you need to defend yourself, punch them in the chin. That's how you get the K.O."
LifeProTips,[removed],"If you need to defend yourself, hit them in the lower chin. That's how you get the K.O."
LifeProTips,[removed],LPT: Always flush the toilet before you poop at someone else's house.
LifeProTips,"Hear me out here, I know it sounds silly. I reorganized apps on my home page and I’m finding I spend much less time on my phone since my fingers aren’t trained on the new configuration. For example, my calendar is in the location where facebook used to be. There’s a split second when I tap that my brain is like this isn’t what I was expecting to see, even if I don’t even open the app. And I’m subconsciously uninterested in that second. I’m also finding that the few seconds it takes to find the new location is also triggering an uninterested reaction. I’m definitely thrilled since I’ve been trying to cut back on phone time.",LPT: rearrange the apps on your smart phone if you find yourself mindlessly clicking and scrolling.
LifeProTips,"One of my best friend recently found out he’s raising a bastard. Broke his heart. Don’t make the same mistake.
You, YES YOU the reader. Go book an appointment right now",LPT. Always get a DNA test. 1/10 fathers are raising a child that’s not their.
LifeProTips,,"LPT: If you ever forget your phone number, type “my phone number is” and your phone number will come up as a suggestion. (works on ios only)"
LifeProTips,[removed],1/10 fathers are raising a son that is not theirs. Always get a DNA test. never get married
LifeProTips,[removed],LPT like your salad!
LifeProTips,[removed],To enjoy your salad...
LifeProTips,,"LPT: Lay your snacks out for the day. It’ll help you visualize how much you have left to eat. If you’re someone who over-snacks like me and there’s only one snack left by noon that needs to last until the evening, it’ll make you ask yourself if you’re truly hungry."
LifeProTips,,"LPT: During the course of business, never put anything in an email or text that you don’t want read in front of a judge."
LifeProTips,[removed],LPT: Morse Code is a stress reliever
LifeProTips,,"LPT: Stop scrolling, get up, and drink a glass of water."
LifeProTips,[removed],Morse Code is a stress reliever
LifeProTips,"Most of the time, when we open a plastic packaging (lets say ketchup). Try not to make the packaging into two pieces. (like tearing the top part and throwing it). You have no idea how much of the tiny plastic waste ends up in the landfills. If they are part of the bigger plastic package, it will be easy to transport and recycle. No one wants to recycle a tiny piece of plastic. But if that tiny piece is still haning onto a bigger part, It will be easier to recycle","LPT: If you want to reduce the plastic waste, try not to cut plastic into small pieces"
LifeProTips,,LPT hate insulation making you all itchy? I use a lint roller to remove those death itch crystals. 1 sheet per arm does the trick.
LifeProTips,[removed],Hate insulation making you all itchy?? I use a lint roller to get it off and help out with the itchiness.
LifeProTips,,"LPT: Before you write anything down in a text, email, memo or on social media, ask yourself if you'd mind if your words ever wound up on the front page of a national newspaper. If you would mind, don't write it."
LifeProTips,"I don't know the science behind this, but it forces the eyelash to the corner of your eye where you can easily take it out.","LPT: If you have an eyelash stuck in your eye, shut your eyes tightly for 30 seconds to a minute."
LifeProTips,"Instead of waiting in the hallway or whatever, always stay with the dog/cat when it gets put down. It'll be better for all parties involved. The animal is passing on from this life to the afterlife with his favourite human by its side, whilst you can comfort him in his last minutes, making your peace and thinking of all the good memories you had. 

Stay with the animal when it gets put down. You'll regret it if you don't. 
Unless it's not allowed for any reason.","LPT: When putting down your dog or cat at the vet, stay with them until it's over."
LifeProTips,"Settings, General, Reset, Keyboard memory.",LPT: Reset your iPhone keyboard memory once a year. It makes typing way easier.
LifeProTips,[removed],LPT: Avoid listening to a bomb new song to cope immediately after something bad happens.
LifeProTips,"As the title says, if it's been a couple of years since you last updated your mobile or internet plan, check what your provider currently offers. Chances are you can get a much better deal.

Just recently I moved house and found I wasn't able to get broadband internet immediately, so I was burning through my 9GB of mobile data a lot faster than usual. (I'm in Australia where we have very low data caps). Upon checking to see if I could get a larger data package I realised that the package I bought a few years ago is no longer offered, and with their current offerings, I could get 25GB for $7 less a month, with all the same unlimited calls and text. 

Often companies won't tell you if they upgrade their packages because they can keep charging you the same amount of money for less service and they will hope you don't notice.

(However on the flip side to this, I have heard that some companies offered unlimited data packages that they no longer offer for various reasons, so do your research and make sure that you are definitely getting an upgrade)","LPT: If you haven't updated your mobile/internet plan in a while, check what your providers current plans are. You may be paying for an outdated/discontinued plan"
LifeProTips,"People change. People pretend, and people hurt. It could be your relationship, your childhood friend, your family, or a complete stranger. Never take one’s behaviour for granted thinking that since they treat you well now, their behaviour will always stay like that. Believe red flags,love yourself and your flaws, don’t feel guilty for moving on. Even if it is a person you had high expectations and did you like that, you don’t always get what you want, not because you don’t deserve it, but because you deserve better.","LPT:Even the people you think ""Nah, they would never do me like that” could actually do you like that. If a person behaves well today,it does not mean that they will behave well tomorrow."
