subreddit,selftext,title
LifeProTips,[removed],Sweep your car for trash every time you stop for gas
LifeProTips,"The U.S. Geological Survey (USGS) has been creating incredibly detailed topographic maps for 125 years. Almost all of them have been made digital and are available to download through the [USGS Map Store](http://store.usgs.gov/).


Don't rely on your phone, they get wet, die, etc. Print one out and bring it with you. Also leave one in your car with a planned route in case of emergencies. Also make sure you have a compass on you and you know how to use it. 

And if you don’t go hiking, check out this awesome free resource that is available to you to get a map of basically anywhere in the US. Extremely detailed and free info for you.",LPT: Before you go hiking download a free USGS topographic map of the area and print a copy
LifeProTips,"I'm not sure if it the same everywhere but a lot of areas follow these criteria: 
Red=caution do not approach
Yellow=nervous
Blue=in training
Orange=no dogs, just people
Green=friendly
White=deaf and/or blind
Purple=do not feed

If the colors are different in your are I'd love to know!","LPT: If you see a dog with a coloured leash, harness and/or collar their owners are letting you know they have a certain trait about them you should be aware of and to not approach unless given permission."
LifeProTips,"Just follow these easy instruction to get your old beat up box cutter back to it's sharp former glory

https://imgur.com/a/5Zrn5AI",LPT: Do you have a box cutter with a worn out or broken blade? Bet you didn't know that there is usually a spare blade inside the handle of the box cutter that you can use to replace the broken one!
LifeProTips,[removed],IPhone LPT-Hold Space Key to Go To Curser Mode
LifeProTips,"Tires usually aren't the reason someone is scrapping their car, so if you're mechanically inclined at all, you can go to a scrap yard and get a set of tires incredibly cheap. A set of 4 tires is $75 at my local scrap yard and I've seen plenty of like new condition tires in there. 

You don't even really have to be *that* mechanically inclined. You literally just have to know how to change a tire, and be able to tell the difference between a good and bad tire.","LPT: If you need tires, check your local scrap yard."
LifeProTips,[removed],"LPT: When you want to pull an all-nighter, try to take a power nap (1-3 hours or even less if you can't strech it enough). Some sleep is always better than no sleep."
LifeProTips,"The chemical reaction of capsaicin (found in chili peppers) on your brain is an endorphin shot, basically. Like caffeine.","LPT: If you need to stay awake/alert for a little while but don't want the full effect of a cup of coffee, just take a bit out of a hot pepper. Even a fairly mild pepper like a pepperoncini will give you a short boost."
LifeProTips,[removed],this video will surely please you
LifeProTips,"Keep all of your 4 cycle engines happy, and keep up on the maintenance!",LPT: change the oil on your lawnmower at least once annually.
LifeProTips,,"LPT: Take the hint. Stop chasing other people who do not reach out to you , cancel plans , or always make you their last option only if nothing better comes along. Go find better people."
LifeProTips,[removed],"LPT: when you see an ‘influencer’ post COVID misinformation, tag or send it to one of their sponsors"
LifeProTips,[removed],LPT: Having a call with your laptop and a second external monitor? Use the second as a ring light by displaying a white image
LifeProTips,[removed],LPT: Pour boiling water over dishes before cleaning them
LifeProTips,,LPT- if you need more karma just write some bs tip about being polite and post it here!
LifeProTips,[removed],LPT
LifeProTips,You can thank me later,LPT: Let your cottage cheese get to room temp before eating it.
LifeProTips,[removed],Pro tip I guess
LifeProTips,,"LPT: Create a folder in your work mailbox to store ‘feel good’ emails (thank you messages, kudos, etc). Read through them when you’re feeling overwhelmed."
LifeProTips,,"LPT: Before buying something online, use Honey (free chrome extension) to find a discount on it!"
LifeProTips,,"LPT: Pens getting stolen? Buy decoy pens! I like using Pilot G2's at work, but they were disappearing from my desk at an astounding rate. Purchased a bulk pack of Zebra Z-Grips, loaded them up in a pencil holder, and locked up the G2's. Problem solved, I just refill the Z-Grips every few weeks!"
LifeProTips,"You ready to hear the absolute best secret to a happy home life?

When you have a 'list' to complete...whether it be for your wife/husband/partner or even your kids....get caught when they come home completing one of or even better the final task on the list. Depending on their time away from the house you can plan to be ""just finishing up the dishes"" or ""almost done with the yard"". If you learn to time it correctly you can get everything done and then be seen doing the last thing on the list. (this is kind of a mastery level so it takes time)

We all have lists to get done around the house....if it needs done and they see you completing upon their arrival home....then you win on so many levels. Been successfully doing this for 21 years.

If everything is done before they get home you are watching golf when they arrive...then you get credit for watching golf......time it just right and you get credit for everything....and every one is smiling at the end.",LPT: Married Men of Reddit
LifeProTips,,"LPT: Stop being a victim of your own thoughts. Every time you think something negative, put something positive back."
LifeProTips,[removed],Married Men of Reddit...
LifeProTips,[removed],"Pens getting stolen? Buy decoy pens! I use Pilot G2's at work, and while not super expensive, I like them, and those suckers were disappearing from my desk at an astounding rate. I bought a bulk pack of Zebra Z-Grips, loaded up a pencil holder on my desk, and locked up the G2's. Problem solved!"
LifeProTips,[removed],Pour boiling water over the dishes before cleaning them
LifeProTips,Reusable straws made out of steel are environmentally friendly and they can keep your teeth white.,LPT: Buy a set of steel straws &amp; drink coffee without staining your teeth
LifeProTips,,"LPT: Never forget that. Saying ""thank you"" is really easy and it makes the other person feel useful and respectable. It doesn't matter if its his/her work or what you deserved, it's always important to be grateful with others."
LifeProTips,,"LPT: To avoid germs, put leftover plastic produce bags in your car. Gas pump handles are disgusting, and the bags can serve a second life as a temporary glove."
LifeProTips,This saves you any embarrassment from having a child scream in the background or you whisper something critical of management under your breath and them hearing it. Make it a habit,LPT when on conference calls always mute yourself right after speaking.
LifeProTips,,"LPT: If you have trouble reading time in a 24-hour format, just subtract twelve from the number and you'll get the time. e.g. 15 minus 12 is 3, so the time is 3pm."
LifeProTips,[removed],Calling your girlfriend a “bitch” or telling her that she is acting “like a bitch” may seem different but she will not agree with you.
LifeProTips,"Even if you have the same phone number, your 2FA is tied to your specific phone and if you switch then you will not be able to access your 2FA easily. Set up your new phone for 2FA while you still can access your old one and then reset it.","LPT - If you use 2FA, do not reset your old phone until you have set up your authenticator app/2FA on your new phone."
LifeProTips,[removed],"If you use 2FA, don’t reset your current phone until you have switched over your 2FA authenticator app to your new phone."
LifeProTips,"I have a side gig in customer service for a TV and appliance retailer. I have the feeling this isn't known enough by people.

Depending on your country and the store you bought your new expensive device, the return period can be around 30-60 days. During this period, at least in my country (Netherlands) you are entitled to a full refund if you don't like the item or find a defect or such. Without the original packaging and accessories, there's a solid chance you will not get a full refund or you might be unable to return it at all.

So save them packaging at least until you know you like what you bought, it might save you quite a lot of money",LPT: Keep boxes/packaging of any expensive electronics at least for the return period
LifeProTips,"Also works if you're loaded (I hear). The thoughtful gesture and personal touch goes a long, long way in today's digital world.",LPT: The ultimate way to thank someone when strapped for cash? A hand-written thank-you note.
LifeProTips,"Just watched a coworker get extremely uncomfortable when someone ignored them saying no thank you to some food and insisting they try it in front of everyone. Turns out they are really sensitive to spicy stuff and we’re trying to avoid embarrassment, but had that explanation forced out of them because they other guy thought, “you love trying new food though!” and kept going...","LPT: Respect the word “no,” even if you know the person might think differently - they probably have a good refusing for saying no to something."
LifeProTips,"I recently had a kitchen fire and even though I opened those drawers and cupboards multiple time a day, recalling every item in my kitchen for the insurance claim took ages and lots of time wading through website receipts.  My brother is evacuating his home in California right now and I passed this advice on to him. Hopefully you never need these pictures - but it will make things so much easier if you have them.","LPT: You should occasionally take pictures of everything your house. Open every drawer, get brand names, get serial numbers. Set a reminder to do this at least annually. If you lose your home to a fire or items to burglary you’ll be so grateful you did."
LifeProTips,[removed],"LPT: At the end of the day, fresh drinkable water is the best moisturiser for the skin and hair, not products. Purposely incorporate drinking a consistently adequate amount of water everyday."
LifeProTips,"For as long as I've used windows, I only stumbled upon this a few months ago randomly. It has been useful and gets odd reactions when I do it in front of people.","LPT: For those using Windows. You can grab the top of an application, like windows explorer or your chrome browser, and shake it side to side to minimize all ""other"" applications. You can grab it shake it again to maximize all ""other"" applications."
LifeProTips,[removed],"At the end of the day, the best moisturiser for your hair and skin is drinkable water. Drink an adequate and consistent amount of water everyday."
LifeProTips,"I have seen many posts about people showing their letter carrier appreciation by leaving them drinks or tips, or even thank you notes or playing Tic-Tac-Toe.  While this may brighten up your letter carriers day a bit, it will do nothing to help with the current issues.  We have gallons of water.  We know you love us.  We know all tic-tac-toe games are unwinnable.

What we can't do is speak for the masses.  We can't petition your local politicians or vote for you.","LPT:. If you Want to save the USPS, Vote! Simply offering your carrier water and thank you notes will do nothing!"
LifeProTips,[removed],Let your cottage cheese get to room temperature before eating it.
LifeProTips,,LPT: switching to incognito mode will often remove the pay wall for news websites. This often works for pages like the NYT or other local sites.
LifeProTips,[removed],LPT: If you are taking a ride share to the airport for a trip or vacation do not request the ride from your home address.
LifeProTips,[removed],Life Pro Tip: Use Rain-X or a similar product to prevent your glasses from fogging up when you wear a mask. Available at any auto parts store for $7.
LifeProTips,[removed],If you are taking a ride share to the airport for a trip or vacation do not request the ride from your home address.
LifeProTips,"When drafting a long (or otherwise complex) block of text, regularly use “Select All” then “Copy” as insurance against something happening that would result in loss of progress.",LPT Select All+Copy is the new “Don’t forget to save”
LifeProTips,"I know when I was in school it felt like every assignment I had to write was rigid, structural, and filled with facts and references.

Realize that ""what you did over the summer"" essays are free-form story telling. Write about anything and everything you mind can imagine. A trip to the moon, riding a dinosaur, or going on a yacht. How you went undercover for the CCP and used harvested social data to spy on your country as a double agent, leading to tik-tok getting banned in the US.

It doesn't matter, your teacher wants you to write your first paper of the year, and show that you have the ability to craft and write a well told story. The content is  trivial.



Good luck!","LPT: For kids going back to school and fearing ""what did you do over the summer essays"". You don't have to tell the truth, they just want to see if you can write and tell a story."
LifeProTips,"I'm not sure on the food safety of this or whatever, but if you get a candle from the dollar store with an exotic glass shape, burn the candle and remove the wax, the glasses look like nice glasses for liquor, and all they are is the waste product of a one dollar candle. I suggest the mocha or caramel candles, they just look nice","LPT: Dollar store candles can be used for some cheap, yet interesting liquor glasses."
LifeProTips,"Let your kids watch you vote. It will increase their interest in voting when they are older.

I have always brought my kid to the polling place when I went to vote, pre-Covid, and now she is looking forward to being old enough to vote herself and wants to volunteer as a high school poll worker this year. 

This year she will see me fill in a mail-in ballot and drop it off. If we want to have a democratic society, we parents have to model participation.",LPT: Let your kids watch you vote. It will increase their interest in voting when they get older.
LifeProTips,"Best case scenario you will get some money back. Worst case scenario you stay the same. This does not affect your standing with the bank at all. Fees you can negotiate are overdraft, NSF, monthly maintenance fees as well as interest charges and late fees in your credit cards. You can do this in a variety of ways:

\- Call them and ask them nicely. If you have any extenuating circumstances they are more likely to issue refunds.

\- Send them a message through email or live chat. They might ask you to call but it usually works as well.

\- Use an automatic service that negotiates on your behalf. This cuts down the time you spend talking to the bank and can be more effective since they have experience doing so.

I have successfully done this a few times for my checking, savings and credit cards. Sometimes they'll decline the request but about 75% of the time they issue some refunds.",LPT: Contact your bank 2 or 3 times a year and ask for refunds for any bank fees and credit card interest charges you have incurred.
LifeProTips,From my own experience of having had 3 elderly dogs in my time I guarantee this is true. You will see their confidence skyrocket when they're not having to be careful with every step.,LPT: If you have an elderly pet please put rugs or carpet down. Their quality of life will be vastly improved.
LifeProTips,[removed],"LPT: If you don't want to give money to a beggar, give them a warm smile instead and say hello. It makes them feel human."
LifeProTips,Tried doing this at lunch today when I ordered from Grubhub and it helped keep my fingers clean and and my burger and mood intact.,"LPT: If you’re eating a monster-sized burger (like the ones they serve at sports bars and such), and you notice that the flimsy bottom bun seems do disintegrate after a few bites, try flipping the burger upside down so that the stronger, thicker, top bun holds the weight of the burger."
LifeProTips,[removed],LPT If you don’t want to wear a mask just stop breathing! We don’t want you living anyways
LifeProTips,[removed],To avoid paying $35 at the Badlands take Sage Creek Road.
LifeProTips,[removed],LPT: Don't throw away left over Visa/MC gift cards
LifeProTips,[removed],Don't throw away left over Visa/MC gift cards
LifeProTips,[removed],Don't throw away left over Visa/MC gift cards
LifeProTips,[removed],Don't throw away leftover Visa/MS gift cards
LifeProTips,"If you are buying something that you are sure you will be using frequently over a long period of time then you should be willing to pay a premium for quality. This does not mean to buy the most expensive option. High price does not equal high quality.

Do your due diligence to find the best option for you. Check out /r/BuyItForLife mega threads for common items such as cookware, tools, clothing, etc. I have plenty of items discovered on that sub that have lasted me a very long time. Specifically knives, tools, and a pair of slippers.

I used to have to replace my $15 slippers from Walmart every 6-12 months. Per a recommendation on that sub I dropped $80 on a pair of slippers and they're still holding up nicely 3 years on.",LPT: Buy Nice or Buy Twice
LifeProTips,"Small tip but might be useful if you are lazy. When you are watching Youtube and you get hit with double ads, if you watch 10 seconds of the first ad before pressing skip, it will take you directly to your video and you won't have to watch the second ad.",LPT: Skip the second Youtube ad by watching 10 seconds of the first ad
LifeProTips,[removed],Skip the second youtube ad by watching 10 seconds of the first ad
LifeProTips,"I’m just fed up with that one person who’s always talking, asking rhetorical questions, always replying out loud, and as soon as there is a pause, ALWAYS goes up to the teacher to continue.",LPT: If you’re take a course. Don’t talk to the teacher like you’re in a private one to one. There are 20 others there who want to learn. Just shut up and listen!
LifeProTips,,LPT: Using dry mode on your air conditioner when it is humid will cool the room better than using cool mode.
LifeProTips,[removed],‪LPT: iPhones have a different set of alarms to wake up to. The alarms most people use are too loud and more for general use. Use the Bedtime feature instead of Alarms &gt; Options &gt; choose your Wake Up sound. Much better than having a heart attack‬ first thing in the morning.
LifeProTips,I remember my bil doing it when driving on a highway and saw a truck speeding over the limit. It can save your hide in a hit and run if the person who crashed into you is visible on the cam.,"LPT: if you have a dash cam that cant pick up plate numbers, say them out loud so the audio picks it up."
LifeProTips,,LPT: NEVER deny any bad sign or bad feeling you feel about someone. I can pretend to be a good friend to you and treat you nice then when the timing feels right I will rob your credit card and move to somalia.
LifeProTips,"If you're struggling to know where to hammer in the nail / picture hook when hanging up a frame / piece of art - you can use paper. 

Using paper the same size as the frame, draw a line from the top of the paper to exactly where the frame hangs. Now you know exactly where to hammer in the nail. 

Hammer the piece of paper with the nail onto the wall, then tear off the paper and hang the frame. Voila.","LPT: When hanging a frame, using paper the same size as the frame helps you know where to put the nail"
LifeProTips,[removed],"LPT: Have issues with brushing your teeth for the recommended three minutes? Wait until you need to pee, grab your toothbrush, sit on the pot, and brush away."
LifeProTips,"As we start our adult journey, jobs will come and go. Often you never give them or the people you reported to a second thought. That is until your faced with a background check for a security clearance. As a former HR payroll clerk at a small resort I’ve been amazed at the amount of details I’ve been asked regarding staff who had not worked for us in years, often college students working as banquet servers.  We went thru at least 100 staff members a year. Not all businesses have employee records on computers, often times we are digging thru old file boxes in storage to try to verify what a government document is asking for.  Occasionally government officials would appear in person. We would never want to infringe on someone’s ability to seek better employment but often we were are flying blind. Worse yet is our business was sold a few years ago and I doubt the new owners would be helpful. But the more records you keep, such as paystubs, W2s, the name of your supervisor the better able your old place of employment can verify the validity of your Employment.",LPT - keep all employment records.
LifeProTips,[removed],"LPT: if your SO seems like someone incapable of being wrong or bad in any way, they just care about apperances more than anything."
LifeProTips,I’ve had some significant struggles with self worth lately and I texted my friends asking for reassurance and I received the most lovely replies. It helped me get past that hurtle and I am so incredibly grateful. We often dismiss that thinking we will be a burden but if I got that request I would happily tell my tribe how incredibly I find them.,"LPT if you’re having a hard time remembering who you are, ask your friends and family for a reminder."
LifeProTips,[removed],"If you’re having a hard time remembering who you are, ask your friends and family for reminders"
LifeProTips,[removed],"LPT: Sit down when trying on clothes, including underwear."
LifeProTips,,"LPT: When opening a plastic bag, cut it's top into a thin strip but leave its end still attached. Now use it to tie the bag closed again."
LifeProTips,,"LPT: If you're writing a document that uses the word ""public"" in it, make sure you CTRL+F ""pubic"" before sending it out."
LifeProTips,[removed],"Don't ask a first responder ""What's the worst thing you've ever seen"" instead, ask ""What's the funniest thing you've seen"""
LifeProTips,"This major change in volume can help your mind re-focus on what you hear. Turning the volume way up makes your mind concentrate on what the speaker is saying, but it will start to lose interest after a while. This is when you need to turn the volume way down- forcing your ears make out what words are being heard. Repeating this can help you stay on point and interested.","LPT: If you find yourself zoning out during an online lecture or meeting, try drastically changing the volume of the speaker every few minutes."
LifeProTips,[removed],"When opening a plastic bag, cut it's top into a thin strip but leave its end still attached. Now use it to tie the bag closed again."
LifeProTips,,LPT: Put a soft paper towel in your sock
LifeProTips,[removed],Let your kids watch you vote. It will increase their interest in voting when they are older.
LifeProTips,"You'll just create a GIANT chain of comments of you and the person. These chains are endless until one of you gives up. But something in your brain keeps telling you to make another response. If you dont respond to it, they will feel like you dont care or didnt even notice. Theyll realize that no one cares about their comment and will continue doing whatever theyre doing. They are NOT waiting for your response. Congratulations, you won.","LPT: If you recieve a hate comment on reddit, or anywhere on the internet DONT RESPOND TO IT"
LifeProTips,,LPT: If you own a GoPro take a video of yourself saying your name or phone number so if you lose it people will know how to find you.
LifeProTips,,LPT: Saturday morning coffee is so much better when the kitchen is cleaned up Friday night.
LifeProTips,[removed],LPT: if you have a felony you may still be able to vote
LifeProTips,[removed],"If you have a felony you, still can potentially vote"
LifeProTips,[removed],"LPT: In order to get rid of fruit flies leave some alcohol in a glass, seal it with some cling wrap and poke a couple of holes in it. Leave this out on your counter overnight and all the flies should be in the glass by the morning."
LifeProTips,,LPT: It’s important to listen with both ears. Many people are half listening while thinking about how to respond. Respectfully listen 100% and then give a response.
LifeProTips,,LPT: It’s important to listen with both ears. A lot of people are half listening while thinking about how to respond. Respectfully listen 100% and then give a response.
LifeProTips,[removed],If drugs cause happiness then drug addicts would be the happiest people in the world.
LifeProTips,"A very important tenet of card magic is knowing the audience, but equally as important is quickly identifying the type of person to *not* perform the trick to. People who try to trip up the card demonstrator or verbally state ""I saw that"" are exhibiting extremely poor card etiquette and simultaneously alerting the magician as to who not to perform more tricks to. The majority of audiences want to be entertained, but it is not uncommon to get the occasional hustler. 

&amp;#x200B;

This is obviously not the case if the magician is asking you to do this for them to help them practice.","LPT: If someone is showing you a card trick, don't attempt to stumble them or figure out how they did it in front of them."
LifeProTips,,LPT: It’s important to listen with both ears. Too many people are half listening while thinking about how to respond. Respectfully 100% listen and then give a response.
