subreddit,selftext,title
LifeProTips,"Asking for what you want has an unwarranted stigma attached to it.  Maybe it's too many Karens insisting on special treatment and then demanding to talk to a mAnAgEr if they don't get exactly what they want.  Maybe it's the idea that it's selfish to ask for what you want.  Or maybe it's memories of the power monster in your life who didn't ask for what they wanted, they just extracted it from you because they could.

But negotiation isn't a bad thing.  You have wants and needs.  Other people have wants and needs.  Talk them through.  Sometimes an out-of-the-box solution can be found in the rubble of an unusual situation.  ""Can I have X?""  ""No?""  ""What if if I included Y in the deal?""  If the answer is still ""no"" after you've talked through the options, then accept it gracefully.

You don't know what's possible until you put your ideas on the table and hear the other person's ideas and counteroffer.  Sometimes it'll surprise you.  :)","LPT: If you want it (and it's not unreasonable), ask for it. ""Negotiation"" isn't a dirty word."
LifeProTips,And you won't lose your stuff as often. Get rid of the clutter easily when your remotes are not mixed with it. Put it on the wall and you may not even want to remove it. I use my tv remote like a bed side light switch. My android tablet and phone are on the wall next to each other like mini flatscreen panels to play music and videos. I also have a spot to attach battery packs to charge them. Its 2020 lets make our homes look different!,"LPT: Make use of your walls. If you have remote or wireless devices laying around and there is a blank wall next to you, buy some velcro stickers or hooks. You will walk more and it will look high tech and sophisticated."
LifeProTips,,"LPT: The cliques and popularity that are formed in school mean absolutely NOTHING later in life. So once you're an adult: if you don't like where you live, go somewhere new. If you don't like who youre with, make new friends. If you don't like who you are, reinvent yourself!"
LifeProTips,[removed],"The cliques and popularity that are formed in school mean absolutely NOTHING later in life. So once you're an adult, if you don't like where you are, go somewhere new. If you don't like who you're with, make new friends. If you don't like who you are, reinvent yourself!"
LifeProTips,I clean my phone with some disinfecting wipes and wash my phone case seperately with some soapy water,"LPT: Your phone and phone case are probably the two dirtiest things you own, so take time at least once a week to clean them both to remove all the germs and stuff from everyday use"
LifeProTips,[removed],LPT Request Cook tofu in a George Foreman to drain and cook it at the same time.
LifeProTips,[removed],Cook tofu in a George Foreman to drain and cook it at the same time.
LifeProTips,,"LPT: If you are ordering takeout, always call the restaurant to place your order. Online ordering almost always goes through a third party like Door Dash (even for in-store pickup) and the price of each dish will be $1-4 more expensive, and you'll be charged a service fee."
LifeProTips,[removed],LPT: What should I do to decline a job offer but also have a second chance later?
LifeProTips,[deleted],"LPT: The best way to stop procrastinating is to use ""the Two-Minute Rule""."
LifeProTips,[removed],"LPT: If your boyfriend\husband\male partner looks good, smells good, etc, Tell them! Right there and then in that moment, proudly, sincerely, and genuinely!"
LifeProTips,,"LPT- When replacing your car windshield, after it's done, spray the car with water and test for leaks. Don't just trust they did a good job or wait for the rain."
LifeProTips,"Label this box ""Important!"" or ""Open first!"". Don't let this box out of your sight until you reach your new location. And then put it somewhere away from the rest of the boxes. Include a towel, shower curtain, sheets, a cup, plate, spoon, a set of clothes, toothbrush, shampoo, medications, phone charger and lysol wipes. This way if you don't get to anything else that day, you can at least shower and go to bed without digging through all your boxes.",LPT When moving put everything you will need the first 24 hours in a separate box.
LifeProTips,,"When moving, put everything you will need in the next 24 hours in 1 box."
LifeProTips,[removed],Gambling
LifeProTips,[removed],What should I do when decline a job offer but also want to have a second chance?
LifeProTips,[removed],LPT: Helpful Apps You Use Random Password Generator
LifeProTips,"When I was a corporate recruiter, I was always a sucker for a good objective statement at the top of a resume. This is a great compromise between blasting out resumes and spending time customizing each one. It’s a quick thing to add in but makes it look like you actually want THIS job in particular, not just ANY job. 

Just add one sentence like “career objective: to help (company) with (main point of the job) as a (job title).”",LPT: Add an objective statement to your resume.
LifeProTips,"But the best part is, the more you accomplish. the more you'll want to do, the higher you'll want to reach. So as long as you have the hunger for success, you will always have the power with in you to achieve it. 

[https://youtu.be/E5uo7OIeK18](https://youtu.be/E5uo7OIeK18)","[LPT]To be successful, you have to use each day as an opportunity to improve, to be better, to get a little bit closer to your goals. It might sound like a lot of work- and with a busy schedule, next to impossible."
LifeProTips,,"LPT: There are two kinds of people - those who stack empty bins at the end of the airport security line, and those who don't. Be the former."
LifeProTips,[removed],Secure Passwords
LifeProTips,,LPT: Get off of Reddit right now.
LifeProTips,[deleted],"LPT: Please don't be that person starting sentences with ""Do you like my...?"" It forces the other person to say yes, and becomes awkward on both parties if they're a terrible liar. Speaking from experience here"
LifeProTips,,LPT Get off of Reddit right now.
LifeProTips,[removed],I'm just gonna leave this link here for anyone who wants to laugh while hearing some opinions about improving your life :))
LifeProTips,"One of my favorite quotes (Henri Bergson). I think this is a perfect approach to your work and personal life - as you plan and strategize, do it with an action-oriented mindset - aggressive, not afraid, bold. But as you actually execute, do so thoughtfully - with reflection, constant feedback loops, and introspection.","LPT: Think like a man of action, act like a man of thought."
LifeProTips,"New COVID related legislation has added feminine care products (such as pads, tampons, cups, feminine wipes, etc.) to the list of FSA eligible expenses. 

If you still have receipts for any of these products, you can submit them for reimbursement through your FSA provider! 

[More details](https://www.cnbc.com/amp/2020/04/23/use-your-fsa-or-hsa-funds-for-over-the-counter-medications.html)

Edit: Title was supposed to be **anything purchased",LPT: (USA) Feminine care products are now FSA eligible - and you can be reimbursed for anything purchases after January 1.
LifeProTips,[removed],"LPT: Wear a mask, but don’t touch it!"
LifeProTips,,"Wear a mask, but don’t touch it!"
LifeProTips,,"LPT: When wearing a face mask, brush your teeth beforehand. That way your bad breath won't come back to haunt you."
LifeProTips,[removed],LPT Request: Getting a dog in your 20s?
LifeProTips,,Getting a dog in my 20s?
LifeProTips,[removed],Getting a dog in my 20s?
LifeProTips,[removed],LPT: Covid-19 tracker is out on phones now.
LifeProTips,[removed],Covid-19 tracker on phones now
LifeProTips,[removed],LPT - wearing a mask for long periods of time can cause bad breath and make mask smell. Carry minty gum to help
LifeProTips,,LPT: You can have a dancing insect as your reddit picture!
LifeProTips,"I’ve noticed that most YouTube videos on mobile won’t play their ads after you close and reopen them around 3-4 times.  This might not save time if the video has 5-10 second ads, but it’s a nice way of doing it if you just hate advertisements like I do and don’t want to listen to them for any amount of time",LPT: Don’t feel like dealing with YouTube ads on mobile? Close and reopen the video until you don’t get ads
LifeProTips,,"LPT: Your SO’s parents can give off huge red flags, and insight as to what your SO may have learned growing up. The apple never falls far from the tree."
LifeProTips,,Don’t feel like dealing with YouTube ads on mobile? Close and reopen the video until you don’t get ads
LifeProTips,,"LPT: If you're looking back on something you did or said in truly good intent and stressing yourself out, DON'T. If you fall in this hole try to remind yourself that you did what you did with the best of intentions and you'll see yourself slowly but surely climbing back up. You're a great person."
LifeProTips,"I’ll probably get a lot of hate about this but whatever. If you don’t purchase their product or service, your contact information will be sold to other companies as a “lead” and your phone will forever get phone calls from sales reps and others. 

Yes, you are not obligated to purchase anything that you expressed interest in. Most people don’t know this but when you fill out a direct mailer or internet form (and even sometimes a phone call), it almost always goes to someone who has to PAY for your lead. It can cost them anywhere from $5-$65 PER LEAD depending on what their company costs are and what industry it is in. This is how some people make a living. Before you say anything, yes it is the industry I’m in and no we are not all sleazy business men trying to make a quick buck. Some of us are actually empathetic and want to help with the product we believe in, but we also don’t like wasting our money. 

If you don’t intend on hearing the person out, or if you’re going to just not show up to their appointment, then don’t fill out the form. It’s a waste of their time and a waste of yours. Plus you’ll have to forever get phone calls about it unless you change your number.",LPT: Don’t fill out any forms in the mail or the internet that you don’t intend on following through with.
LifeProTips,,LPT: Not being sure whether or not someone is abusive or if you have an addiction are pretty strong indicators that something serious is wrong.
LifeProTips,,"LPT: Always read packing before you tear into it; Most modern packaging will indicate the best/optimal point from which to open it - e.g. ""Open Here"""
LifeProTips,"It sounds like a cliche, I know, but it will open your eyes to just how many more kinds of cool there really are.

Music, food, slang, traditions, clothes, drinks, etc. It’s easy to settle in the familiar. Travel to strange places is scary, but infinitely valuable in our perceptions and world views.","LPT - Travel to somewhere completely different from your home, if you’re able."
LifeProTips,"I'm not sure about other areas, but at least in Louisiana, don't go for the big named areas. It's always crowded and people can be very rude. Even the wildlife reserves that you can fish on are usually crowded. What you can do instead is drive in areas known for their vicinity to the water. There are usually areas you can pull off to be able to set up and fish or crab. Of course, if there are 'no fishing' signs, use common sense, but otherwise, there can be some hidden gold mines full of possibilities. So have fun, be safe, and keep an eye out for areas by the water!",LPT: don't fish at reserves and Marinas when you can find areas off the side of the road
LifeProTips,,Don't fish at huge tourist areas or beaches when you can find off-road areas
LifeProTips,[removed],"LPT: In the morning If you want to feel fresh and energetic take a shower but just before you're done take a 15 second cold shower, the cold shock will make you feel super charged and alert as if you drank 10 cups of coffee."
LifeProTips,,"LPT: if your air conditioner is having trouble ""keeping up"" on super hot days, aim a hose mist (or very very light spray) at the coils."
LifeProTips,[removed],When you’re feeling down and can’t break free
LifeProTips,[removed],"LPT: Do yourself a favor and get a bidet, these things are amazing."
LifeProTips,[removed],LPT Home Remedies for Bad Breath (Halitosis) | 7 Home Remedies that work | Natural Remedies
LifeProTips,[removed],"If you can, get a bidet. These things are amazing."
LifeProTips,Xpost - twitter @DannyMullan6,LPT: delete one app a week. Add one interesting app a month.
LifeProTips,"If you’re ever on the market for a rental unit, sometimes you’ll come across units where the outgoing tenant has not moved out yet. NEVER commit to such a unit until you’ve had the chance to perform a full walkthrough of the unit after the previous tenant has 1) fully moved out and 2) the landlord has deemed the unit to be in a “move-in ready” state.

Some landlords do a piss-poor job of properly turning the unit over (ensuring the unit is 100% clean, ensuring all broken things have been fixed, repainting where necessary, etc). You CANNOT do a proper and thorough inspection if the unit is occupied.

You should be clear with the landlord that you will not commit until you’ve seen the unit in it’s move-in ready state. Do not hand over any payments (first months rent, security deposit, commission if applicable, etc) until you’ve had this opportunity.",LPT: Never commit to a currently occupied rental unit if you haven’t seen it empty.
LifeProTips,[removed],"LPT To seal a bag of chips, crackers, etc, Make a big fold in the end of the bag, fold that fold in half, and then fold that in half again. Then clip you triple fold. Its how dry bags work and will keep anything fresh."
LifeProTips,,LPT: Take a plug extension cord with you when you’re travelling. Then you only need one plug adapter to charge everything!
LifeProTips,"I was writing an email and it began offering suggesitons/auto complete. This drove me nuts! Here's how to turn it off:

1. Click the settings wheel near the top right of the Hotmail/Outlook window.

2. Click ""View all Outlook settings"".

3. Make sure you are in the Mail tab, then click on the Compose and Reply tab.

4. Scroll down until you see ""Text Predictions"" and uncheck the box that's labeled ""Suggest words or phrases as I type""

5. A button to Save your selections will appear near the bottom. Click that and go back to composing your email in a carefree and prediction-free manner...",LPT: Turn off autocomplete/text predictions in Hotmail/Outlook.com
LifeProTips,"I just found out I was “caught in a mass purge.” The State of Texas has no rationale on file as to why my file was purged, and the person at the Secretary of State office said it was “really weird.” Right.

Edit: www.vote.org",LPT: Stop scrolling Reddit and check your voter registration right now.
LifeProTips,[removed],LPT: do not waste your doctor's time asking non-relevant questions you can easily Google
LifeProTips,[removed],Choose the dog.
LifeProTips,,"LPT If find you are having to top up your water feature due to splashing or evaporation,run a line of your drip irrigation into it or nearby. Then, as the flowerbeds are watered so the water feature is topped up"
LifeProTips,[removed],Ultimatum? I don't think so
LifeProTips,[removed],"If you find you are constantly having to top up your water feature due to splashing or evaporation, run a line of your drip irrigation into or nearby. As the flower beds are watered, so the water feature is topped up."
LifeProTips,[removed],LPT Using Facebook bans against them
LifeProTips,,“LPT” using Facebook bans against them
LifeProTips,[removed],"How to get reliable connectivity when live streaming, working / learning remote or gaming ""LPT Request"""
LifeProTips,,Facebook and their “bans”
LifeProTips,[removed],"How to get reliable connectivity when live streaming, working / learning remote or gaming (LPT)"
LifeProTips,[removed],"How to get reliable connectivity when live streaming, working / learning remote or gaming"
LifeProTips,Read title.,LPT: Drink water.
LifeProTips,[removed],Drink water.
LifeProTips,"Posting this because I see it way too often at work, especially from management, and it's probably one of my biggest professional pet peeves. I've worked in some form of financial services or another for the past 4 years, so Excel &gt; everything else, and I don't even want to think how much of my time this kind of stuff has wasted. Of course I have asked people to resend me the information in the email body rather than a screenshot, but you get mixed results there (I've even been called rude before). Just adopt the best practice, and save everyone, including yourself, some time.","LPT, Stop emailing people screenshots of spreadsheet data . Copy and paste the table directly from the spreadsheet into the body of the email. It takes fewer steps than a screenshot, recipients will be able to use the data with much greater ease, and you will not needlessly irritate people."
LifeProTips,,"LPT: Kids... yes, we’re your parents, but stop making us parent you so much. Things would be so much cooler if you’d just chill and listen."
LifeProTips,[removed],LPT: Close the lid before flushing the toilet.
LifeProTips,"I guess you don’t even have to wait for them to be leftovers, you could just make pasta like this","LPT: Instead of microwaving leftover pasta, throw some olive oil and a handful of mozzarella cheese in a non-stick skillet. Layer your pasta on top, let it cook, and then flip it. Now you have delicious, crusty, cheesy goodness and crispy pasta!"
LifeProTips,"You’ll never use a knife on pizza again. 

(Unless you’re one of THOSE that eats it with a fork/knife)",LPT: Cut Homemade Pizza Using Scissors
LifeProTips,[removed],Use Scissors to Cut Homemade Pizza
LifeProTips,,LPT: Fruit Loops are infinitely better if you use chocolate milk instead of regular milk.
LifeProTips,"No matter what I do, it seems i am unable to avoid the illfate that is my mind racing whenever i go to bed. 

I've tried everything: melatonin, exhausting myself physically during the day, avoiding blue light at least 1 hour before bedtime, etc.

I just can't fall asleep. It takes me 30-40 mins, and that fact stresses me out even more, resulting in further insomnia.

Anybody got some tips on how i can doze off quickly?",LPT request: how to fall asleep quickly
LifeProTips,[removed],"LPT: Don’t argue with idiots, onlookers usually can’t distinguish who is who!"
LifeProTips,[removed],You should join my discord and you will be happy https://discord.gg/NKDaZw
LifeProTips,My wife who works for hospice just took a class today with better techniques to handle patients with dementia. something she shared with me that stuck out was how patients with dementia when given a mp3 player with music personal to them (and headphones to avoid distractions) became emersed in the music and if even for just a few minutes could use the music to recall a happy moment in their life associated with that song. i guess the part of the brain that stores music is one of the strongest to succumb to dementia. my wife had a couple other cool takeaways for helping those with dementia but i thought i should share this tip with the reddit community for those with loved ones battling and not knowing what they can do to help them,LPT: Make a personal music playlist for a loved one with dementia
LifeProTips,,"LPT: When you receive an email from someone, read it in your head with no inflection. As we read in our head, we tend to add tones that aren’t really there. Sometimes an email can sound harsh when it really isn’t."
LifeProTips,[removed],LPT: Save $60 by not buying the Last of Us Part 2
LifeProTips,I learned this the hard way and now I have nowhere to find a nice and comfortable pair of pants that doesn’t look awful on me.,"LPT: Take note of the brands of your favorite pieces of clothing so if you misplace them, you can hopefully go straight to finding others you like."
LifeProTips,,"If you are forced to acknowledge/respond to someone's statement, but are unable or unwilling to voice disagreement, say, ""I hear what you are saying,"" instead of ""I understand"" or ""Ok"""
LifeProTips,"This was a public bathroom thought, if you will.

I had to stop and use the grocery store restroom while shopping. I noticed a flyer on the stall door sharing a phone number to call if struggling with suicidal thoughts with around 5 tabs already missing. My initial thought was *wow, more people are struggling with this than I thought*. But then I also thought *well, maybe whoever posted this actually tore off a few to make others feel like they're not alone in struggling and wanting help*. Clever idea if so, I'm totally on board with making people feel comfortable with mental health care. 

Either way, I'm thinking about that flyer hours after seeing it, all because a few tabs were missing already.",LPT: Making an advertising flyer with tear-off tabs? Remove a few tabs yourself before posting.
LifeProTips,"I was talking with my aunt today and she was mentioning how I never call her. I felt pretty bad at the time. But, I realized that she is equally capable of calling me and she isn't doing it either. So, don't let people guilt you for doing exactly what they are doing to you(or not doing in this case)",LPT: Don't let people guilt you for not being in contact with them. They're not making any effort to stay connected with you either.
LifeProTips,"If you're doing something you shouldn't at work or school this makes it look like you've got your work open, but also have many work related windows behind it, reinforcing your bluff. Additionally, the sound of alt-tabbing is very distinct, this is more obscure.","LPT: Instead of alt-tab, use ctrl-alt-esc to send your focused window to the back."
LifeProTips,,"LPT: If you get ash (cigarette, etc) on your clothes, don't rub it off, shake it off. Rubbing will grind it into the fabric."
LifeProTips,"I recently left an awful career I had been in for ~12 years. It was an aerospace maintenance/engineering career and throughout the industry it carries a tough guy persona that is highly unhealthy and toxic. For example, do you eat quinoa? Gay. Did you bring a salad for lunch? Must have grabbed your wife's lunch. Do you exercise? Rofl, just do 22oz. curls. Wear anything except cargo pants an XXL shirts? Metrosexual right there. I might mention 80% of my co workers in the past decade have been a combination of fat, skinnyfat, alcoholics, addicted to cigarettes and occasionally drug abusers.

Obviously there's nothing wrong with being gay, or metro, or sober, or anything else. But there's no reason to not do anything just because shallow, insecure people label you a certain way. If you have been, you have no idea what you are missing! 

Pedicures are amazing. Skincare feels great and it's way more important than people realize. Exercise solves so many problems you don't know you had. Quinoa is actually delicious and a great source of fiber and protein. A haircut that you actually love is one of the best confidence boosts. I've known people to say ""look at &lt;insert celebrity&gt;, no homo but damn"". Those celebrities do all this shit thats why they look so great. Im not saying you need to wear makeup and get a professional makeover... but none of this stuff is ""not manly"" and a lot of it has immediate benefits and is very accessible to men. (There's a lot of great hair stylists that charge a little more than shitty chains like supercuts that will shampoo and condition, straight razor, style, etc... im talkin a difference of 15 bucks.)

So get out there, get your nails done, get a fresh ass haircut, get some slimmer jeans and do some yoga man. You'll feel better about yourself and other people's attitude will reflect that.

P.S. If you wanna put on some makeup, go for it. There's a lot of makeup tutorials on YouTube for men if you have blemishes and stuff. I asked my fiancée to do mine ""movie style"" once and its actually a lot of fun.","LPT: Men - don't shy away from anything because it seems, or you have been told, that it's ""gay"" or ""for women""."
LifeProTips,,"Men: don't shy away from doing something because it seems, or you've been told, it's ""gay"" or ""for women""."
LifeProTips,[removed],"Have all your socks from one brand, and of one color. You won't lose much on laundry day, and becomes a grab n' go item in the wardrobe."
LifeProTips,"I've made this mistake so many times but most recently while watching *Deadwood* for the first time. Was wondering who plays one of the major characters, look him up, see he only appears in five episodes, and realized quickly what's about to happen.","LPT: When you're watching a TV show and want to look up a cast-member, be careful about using IMDb since it lists the number of episodes the character appears in. Seeing this information can spoil surprises down the road."
LifeProTips,"The key is to “move on” and constantly checking in to their life keeps you static. You won’t move forward with your own life if you’re constantly tethered to theres. It’s ok to miss them, and long for them, but you have to keep moving. Snooping is something we can truly control, and after a week or two you will be proud of yourself for not giving in.","LPT: After going through a breakup don’t snoop your ex’s social media. At best you’ll see something you don’t care about, at worst you’ll see something that breaks your heart."
LifeProTips,[deleted],LPT: NEVER PUT ANYTHING INTO A SEIZING PERSONS’ MOUTH
