subreddit,selftext,title
LifeProTips,New York recently moved to reusable bags in grocery stores.   I use this LPT to ensure I never forget the bags when I go shopping.    It also helps keep the bags out of the way while im shopping.,"LPT: Use a string backpack to store reusable grocery bags, and keep that backpack inside your car. Not only will you not forget them, but the backpack makes it easier to tote the bags inside the store."
LifeProTips,"[Studies show](https://www.healthline.com/health/benefits-of-reading-books#increases-empathy) that when you read, along with having fun, you build knowledge, increase vocabulary, improve writing, develop empathy, develop personal identity, improve life-achievement likelihood, and more. 

The problem is that reading is (typically) far less accessible, affordable, and user-friendly than Netflix.

With Netflix, there are always a hundred good shows that are recommended, trending, bookmarked, and shared, and you can instantly access any of them from anywhere.

You get what you want when you want it. And once you finish one show, you can instantly start the next. It’s frictionless. 

But with reading, you either have to make a long treks to a library or store, or you have to wait around for an Amazon delivery. 

If you don't like the books you chose, you have to rinse and repeat the whole lengthy process. Plus, buying new books and magazines is far more expensive than just using Netflix.

But it doesn't have to be like this. Here are some ideas I came up with to make reading like Netflix.

&amp;#x200B;

#### GIVE YOURSELF QUICK ACCESS TO LOTS OF CHEAP OR FREE READING MATERIALS

&amp;#x200B;

#### --- Fill an E-Reader or Phone to The Brim With Good Content. 

&amp;#x200B;

To give yourself lots of books to read, you can download free E-books from [manybooks.com](http://manybooks.com/). There are also several other places to get free books; just have a look around on Google.  

With a ton of books ready to go, if you ever get sick of a book, or finish one, you can quickly start a new one. No more waiting for deliveries, or going for long treks.  

You can also subscribe to several magazines and newspapers on your E-reader or phone, so you always have something quick and easy to read. 

And, although it can be hard to flip through the pages of an E-book, it is easy to flip through the pages of an e-magazine or e-newspaper. They really do a slick job with the menus. 

&amp;#x200B;

\---- SET UP AN RSS FEED

&amp;#x200B;

RSS feeds are like a Facebook Newsfeed of all of your favorite websites.

The way it works is that you add different websites into your RSS reader, and then you can just go to your RSS reader to read all the content from your favorite websites.

By putting all your favorite content in one place, you save time from having to visit each website independently.

I really like Feedly as my RSS reader. And to bring it back to the point of this post, if you start going to Feedly as a form of entertainment, you will definitely read more. 

Go [here to watch a video](https://conorwriter.com/rss-feed/) if you want to understand better how RSS works. 

Also, if you have a Kindle - you can send your RSS to your kindle with [www.kindle4rss.com](https://www.kindle4rss.com)

&amp;#x200B;

\--- BUY BOOKS AND MAGAZINES FROM YOUR LOCAL THRIFT STORE

&amp;#x200B;

Buy books and magazines from your local thrift store and then leave them in easy to reach places around your house ( by your bed, next to the toilet, etc  ) 

&amp;#x200B;

\--- LISTEN TO BOOKS AND ARTICLES

&amp;#x200B;

Listening to books and articles may not count in your books, but it does in mine.

Studies show that audiobooks can improve your reading accuracy, speed, fluency, pronunciation, comprehension, and more.

You can find a lot of great audiobooks for free on YouTube. Podcasts may also provide many of the same benefits; however, I doubt conversational podcasts will be as beneficial linguistically as a well-produced audiobook, but who doesn't love a good conversational podcast. In the end, having a good time is probably more important!

Another alternative that you may enjoy is the AUDM App.

With the Audm app, you get to listen to stories from the most prestigious publishers including *The New Yorker, The Atlantic, WIRED, Vanity Fair, Rolling Stone, The New York Times*, and many more. 

There are a good amount of new stories added every day, and although they can be a bit depressing, its deffinitely an App worth having. 

&amp;#x200B;

\---- MAKE READING SOCIAL

&amp;#x200B;

You can join a book club in your area, or you can join an online book club. r/bookclub

Also, it can be helpful to ask close friends about a book they like, because if you read it, you are showing them you care about their recommendations, and you will have someone to talk to about the book. 

&amp;#x200B;

\---- CONCLUSION

Good luck reading more! 

\--

Check out more of my practical life-improvement articles at [www.conorwriter.com](https://www.conorwriter.com/)

\--

Subscribe to my monthly newsletter [here.](https://mailchi.mp/a737444dbf1b/conorwriter) RSS = [www.conorwriter.com/feed/](http://www.conorwriter.com/feed/)",LPT: Read More: Make Reading Like Netflix
LifeProTips,[removed],My Life Starts Now...
LifeProTips,,"LPT : If you have to draw two symmetrical shapes (like eyes), do NOT start by drawing the side you’re comfortable with. If you right-handed, start by drawing the left side first."
LifeProTips,[removed],Easy Techniques for Practicing Mindfulness
LifeProTips,"I get this all the time when I am trying to make sure my kid doesn't develop bad habits. If someone is correcting their child it is not for your benefit, even though they are correcting something involving you. By telling the parent or child it is okay you invalidate the parent's correction. Even if what is happening doesn't bother you it may bother the next person the child does it to.","LPT If a parent is trying to stop their child from doing something, just let them. Don't say ""Oh it's okay"""
LifeProTips,[removed],LPT: Colder showers reduce acne
LifeProTips,"If you have a product that you can't get back in the box due to very specific cut outs, foam or what have you, watch an unboxing video for that product.

Just watch the way the people in the video take the product out and do the steps in reverse.

While not every product has an unboxing video, there are a lot that do.",LPT: Don't struggle getting items back in their packaging. Watch an unboxing video then reverse the steps.
LifeProTips,"Growing up, we always fed our cats first thing in the morning. This led them to want to be fed early, early hours in the morning and meow until you get up... only to find a full dish of food already..",LPT: Feed your cat before bed rather than first thing in the morning. Feeding them in the morning conditions them to wake you up at 4 am so they can get food.
LifeProTips,"I set the goal to do atleast 50 push ups each day without a break. So instead of counting up to 50, i count 5x to 10. this trick helped me to stay motivated in saying: „oh I only did 5“. But in reality I did 35 etc.","LPT: when you do push ups and reach 10, dont keep counting on „eleven“, „twelve“ and so on. Instead start again from one. This lets you stay motivated because you „only“ did a certain amount of push ups."
LifeProTips,,"LPT: If you're looking for an emoji on your phone, you can type it in as a word and it will appear as the first suggestion in your quick emoji box."
LifeProTips,[removed],LPT: Don’t take every Life Pro Tip you see in this sun at face value; Read through some of the top comments to get a better understanding.
LifeProTips,[removed],"Theo các bác sĩ da liễu, việc sản xuất dầu của da là hết sức bình thường, tuy nhiên đối với những người da dầu, lượng dầu được sản sinh hàng ngày cao gấp nhiều lần người bình thường, kết hợp với bụi bẩn từ môi trường dẫn đến bí tắc lỗ chân lông khiến lỗ chân lông to, thiếu tinh tế."
LifeProTips,,"LPT You can use a long stick or similar object, such as a bat, umbrella or tennis racket, to protect yourself from an aggressive dog. Point the stick directly at the dogs face wherever it moves and it won’t be able to get passed it"
LifeProTips,"Never opt-in for a company to hold the record of invoices sent and paid. If a dispute comes up, they have all the records and can prevent you from accessing them easily. They can freeze your account, delete them, etc. If you have print copies sent to you, then they cannot prevent you from accessing your own records.","LPT: Never opt-in for electronic invoices, always get paper."
LifeProTips,[removed],LPT : If everything went normal today then you won't remember this day again in your life ever.
LifeProTips,"Not a lot of people know about this, but you can turn your old phones into an IP camera pretty easily by downloading an app from the app store/play store, which makes it function like a CCTV. Very useful for people who want a camera for their homes, with spending the least money possible. Even the oldest phones camera is good enough for home use (I'm using my sisters A5 (2015)). If you want to go the extra mile for it, buy it an adjustable phone holder too, as it can help with the positioning, or a long charging cable so that it can be placed freely anywhere in the house.","LPT: Don't throw away your old phone, turn it into an IP camera!"
LifeProTips,"This is now my mom got her ample folder of me wearing camisoles over collared shirts (I was a teen in the early 2000s), jeans with holes so big my whole leg was out in the front, and just about every early 2000 terrible hair trend you can imagine, including those lovely skunk white on black chunky streaks. 

Not only to avoid the fight with your teenager but then you also get fun for years to come. 
Now we go back and laugh our asses off together over it. She literally has it labeled, “Someday she might regret this.” 😂","LPT: If your teenagers ever want to participate in a fashion trend that looks stupid to you, don’t fight it. Just insist that they have to let you take a picture of them in said trend."
LifeProTips,"Buying a car doesn't have to be a back and forth, nonsensical hassle. All manufacturers will post the MSRP to the sticker of the vehicles. What most people don't know, is that they also post the invoice cost to the dealership. Now, with new cars, the dealerships will also make money with what's called ""holdback."" Most large manufacturers pay dealers and additional 1-3% on the new cars they sell, regardless of the final sale price.
With websites that will compare the recent sales in your area, you can use all of this to considerably help you get a great deal.
I've done this multiple times and skip all of the back and forth between the manager and salesperson, and I always get a great deal for me, at a fair profit for them",LPT New Car buying made stress-free
LifeProTips,[removed],LPT: if you’re ugly you should find a career that doesn’t require you to show your face
LifeProTips,[removed],LPT : need some inspiration for my morning routine
LifeProTips,[removed],Inspiration for morning routine
LifeProTips,"When I was younger I would look through old 'reels' of newspapers, for the life of me I can't think... MICROFILM  is what it was called.

So for my girlfriend's birthday last year I did the same and came to find out that many cities have their newspaper archives online. For my city, they require a library card for certain publications but I think it's amazing.

Also, many libraries have an ancestry.com subscription you can take advantage of.",LPT: Interested in your ancestry? Many libraries have moved their newspaper archives online and offer free genealogy services
LifeProTips,"Talking from personal experience, your brain can actually trick you. The brain is like a muscle and if you’ve trained it to always doubt itself, it will continue to do this. Teach yourself how to step back and make the best decision for you, not the one that comes naturally to your brain.",LPT: Sometimes that “gut feeling” which affects your decision making is actually your insecurities and inner self saboteur. Assess fully before you rely on it.
LifeProTips,That’s it. That’s the post.,LPT: Add the birthdays of your friend’s kids to your calendar. It’s important to them and means a lot when you remember.
LifeProTips,,LPT: You can find tons of LPT by reading r/TIFU. Just don't do what they did!
LifeProTips,,"LPT: Trouble dropping eye drops in your eyes? Close your eyes, put your head back, squeeze the bottle into the corner of your eyes, then open them and shake your head."
LifeProTips,,"LPT: if you feel a bad headache coming on, take two Benadryl and lay down in the dark. Odds are your headache will disappear within half an hour and you can sleep it off."
LifeProTips,[removed],Informed new-car buying
LifeProTips,,"LPT: Dont immediately shoot down someone who says something stupid, instead ask them questions about it, they may realise their mistake themselves and depending on how long it takes their will be alot of hilarity"
LifeProTips,[removed],AIs from AI Dungeon 2 to sexy to funny and one based wholly on Reddit!
LifeProTips,Plan accordingly.,"LPT: If someone tells you that they are ""a little drunk"", you can be quite certain that they are about 1 drink away from being totally wasted."
LifeProTips,[removed],"My job and co-workers make me unhappy, what shall I do? LPT"
LifeProTips,[removed],"My jobs and co-workers make me unhappy, what shall I do?"
LifeProTips,You’ll get fewer and better recommendations if you ask a more specific question.,"LPT: When you need a recommendation for a service such as a plumber, don’t ask “does anyone know a local plumber?”. *Everyone* knows a plumber and they’ll happily tell you. Instead, ask “Has anyone used a local plumber that they would absolutely hire again?”."
LifeProTips,"I have always had a tendency to brood over events and arguments from my past and I find that this leaks out into my frame of mind in the way I portray myself to others.  I'll end up muttering curse words or get aggressive with inanimate objects.

More recently I have started a job which does not require any great amount of thought and so I'll be brooding as I work meaning I will get looks from co-workers as I mutter away.  

The thing is, I don't want to lose this job and moreover on Sunday when I managed to not to do it (for the most part) I was a lot more productive.  It has made me wonder if I could be more successful in a lot of things if I wasn't known as someone who is fairly negative all the time.  But equally, when I get bored, my mind returns to replaying these past events over and over, which I know is pointless but do it anyway.

I wondered if anyone had any advice for mental exercises I could do whilst working to kind of steer my brain away from this events which I cannot do anything about anyway.",LPT: Learning to think positively instead of negatively
LifeProTips,[removed],"To protect yourself from an aggressive dog, you can point a stick or similar object such as an umbrella, or tennis racket straight at the dogs face wherever it goes and it won’t be able to get around it"
LifeProTips,[removed],"LPT: If you’re not using your dishwasher, you can use it as extra storage space for canned goods etc."
LifeProTips,"This works on nearly all android versions and devices. I don't recommend changing anything else within Developer Settings. Every time I get a new phone it feels so damn slow until I change these 3 settings, been doing it since my OG Moto Droid.

- Go to Settings &gt; System &gt; About phone

- Tap Software info &gt; Build number.

- Tap Build number seven times. After the first few taps, you should see the steps counting down until you unlock the developer options. You may also have to tap in your PIN for verification. Once developer options are activated, you will see a message that reads, You are now a developer!

- Go back to the Settings pane, where you will now find Developer options as an entry.


Once you get into Developer Settings you have to scroll down a bit to find them. On Samsung it's listed in the Drawing category or you can just use the search feature to find these: 

- Window animation scale 1x

- Transition animation scale 1x

- Animator duration scale 1x

Change this to .5x and your phone will run noticably faster!","LPT: Android users - Speed up your phone significantly by changing your Window, Transition, and Animator Duration to .5x in Developer Settings. Enable Developer Settings by going to Settings &gt; About Phone &gt; Software Info and tapping where it's says Build Number 7 times."
LifeProTips,,"LPT: Guys of Reddit, don't use 2 in 1 shampoo and conditioners, use them separately. 2 in 1s cancel each other's purposes out and actually makes your hair dry."
LifeProTips,,"LPT: Guys of Reddit, when taking a shower, don't use 2 in 1 shampoo and conditioner. Use them separately because the 2 in 1s cancel each other out and make your hair dry."
LifeProTips,"The govenment food report is something that all places that serve any kind of food, must have. Its by Law that its visible at the entrance.
The report is very user friendly as it uses smileys. So dont worry if you dont know how to read Danish.
If it says elite with a very happy smiley, its the best grade. Sad smileys are not good. And even worse is, some places remove them. Stay clear at all cost from these places. 
Travel and eat safe dear redditors","LPT: If you travel to Denmark and are going out to eat, always check out the Govenment Food Report at the entrance."
LifeProTips,,LPT Request: How do you bypass family link restrictions?
LifeProTips,"For example [www.youtube.com/watch?v=XkEGGLu\_fNU](https://youtube.com/watch?v=XkEGGLu_fNU)

Would turn into [www.nsfwyoutube.com/watch?v=XkEGGLu\_fNU](https://www.nsfwyoutube.com/watch?v=XkEGGLu_fNU)",LPT: Want to watch a age restricted YouTube video without signing in? Simply put nsfw infront of youtube.com
LifeProTips,[removed],Want to watch a age restricted YouTube video? Simply put nsfw infront of youtube.com
LifeProTips,[removed],"LPT: Always and I mean always, rinse your plate or anything you've used that is considerably dirty before leaving it on the side/putting it in the dish washer."
LifeProTips,[removed],LPT: Check app permissions before installing the app
LifeProTips,It would basically be Easter egg shenanigans on Halloween. Or hide one halloween basket per kid and make it a scavenger hunt.,"LPT: Instead of trick or treating this year, hide candy around your house/yard/apartment for your kids to find, make ghoulish treats, and tell scary stories!"
LifeProTips,"Especially if it's an event or something with a time limit, don't miss out on it because your friend/date/SO/whoever canceled, you don't want to look back and regret not going","LPT: if you made plans with someone and they canceled, go alone, learning to enjoy your own company is a life changer!"
LifeProTips,"Real estate websites, like Zillow, will have pictures of the house when you search it up. It is much easier to find the house when you know what it looks like.","LPT: If you can not find someone’s house, look up their address on a real estate website."
LifeProTips,"Long story short, I left not one but two sharpies in a pocket and put it in the wash. My white [shirt](https://imgur.com/gallery/7sxIOYw) came out with bluish gray stains. I would simply bleach it, but it has a wide grid plaid pattern on it so I’m not sure if that’s a good idea. I’m sorry if this is the wrong sub to post, but I’m getting really desperate.",LPT Request: How do you remove laundered Sharpie off a white blouse?
LifeProTips,,"LPT: When driving, drive as if everyone around is an idiot"
LifeProTips,"I can't tell you how much I've saved on water bills and bottled water, but I can say it's pretty significant. Filters only need to be replaced once a year and you can choose how many filters you need.

May be a steep price at first, but I find myself almost never using tap water. Also, if the water company shuts off your water you still have rations for a few days.

Sorry if this is not a real pro tip.",LPT: Want filtered water that you can store for extended use? Invest in a gravity filter like a Berkey.
LifeProTips,"Short girls require like half the calories at feeding time, this can add up to thousands of dollars/ euro’s a year.",Lpt: want to save tons of money? Date short girls.
LifeProTips,,"LPT: If you can smell someone’s vape, you are breathing air that was in their lungs"
LifeProTips,"That little dopamine hit may feel good in the short term, but websites with upvote and downvote options condition us through the Pavlovian response to become more judgmental and to believe we are entitled to judge and comment on every little thing we see and hear in real life.

Increased judgment and entitlement often lead to feelings of separation, anxiety, pain, or anger. 

Try to take breaks from liking, disliking, and judging.  Try sometime to actively practice accepting and allowing others to have different experiences and opinions without reacting.

If you're successful, this may begin to help you feel more connected and calmer.

Yes, I realize the irony of posting this on Reddit.",LPT: Take breaks from engaging with and reacting to social media to feel more connected and calmer.
LifeProTips,,"LPT: if someone is staring you down, don't try and act tough and stare them down, run away instead - it could save your life"
LifeProTips,,"LPT: Before eating a delicious meal, take a picture of it. Then, you can enjoy the memory again and again, at your leisure."
LifeProTips,[removed],LPT: Store an extra roll of toilet paper in your room if you're living in a shared flat. When shit hits the fan you still got a backup
LifeProTips,,"LPT: don’t ask deaf people if they can read lips, they are sick of hearing stereotypes"
LifeProTips,[removed],Store an extra roll of toilet paper in your room if you're living in a shared flat. When shit hits the fan you still got a backup
LifeProTips,[removed],"Before eating, take a picture of a delicious meal. You can then relive the memory again and again, with gaining extra calories."
LifeProTips,[removed],Swallows nesting battle. “LPT”
LifeProTips,Was looking for a tips to boost body immunity  naturally .,LPT request:What are some of the best Immune system boosters?
LifeProTips,Any tips to be productive a whole day.,LPT request:What are some possible way to be productive ?
LifeProTips,"Instead, switch to the ""scientific"" calculator.  
My calculation was: 60 x 9 + 120 x 6 + 240 x 2

The standard calculator gave me 8400 as a result

the scientific ""mode"" calculator gave me the correct result (1740)","LPT don't use the ""Standard"" Calculator of Windows. Switch to the ""Scientific""-Mode instead"
LifeProTips,[removed],LPT: Get your news from both left and right wing media outlets. Neither alone will give you the full picture.
LifeProTips,[removed],Get your news from both left and right wing media outlets. Neither alone will give you the full picture.
LifeProTips,"It's basically a very cheap wasp-nest dummy.

I really don't get it why this works. But it works really well. 
Important is to build the the egg with many layers so you can't look trough it anymore and to hang it a little bit centered in the area you want to protect. 
It doesn't work on larger areas (you will need a few of them) But on a balcony or smaller terrace it's quite reliable.",LPT: Problems with wasps? Build an egg with brown wrapping paper/baking paper and hang it on a thin cord.
LifeProTips,"It's basically a very cheap wasp-nest dummy.

I really don't get it why this works. But it works really well. 
Important is to build the the egg with many layers so you can't look trough it anymore and to hang it a little bit centered in the area you want to protect. 
It doesn't work on larger areas (you will need a few of them) But on a balcony or smaller terrace it's quite reliable.",LPT: Problems with wasps? Build a egg with brown wrapping paper/baking paper and hang it on a thin cord.
LifeProTips,[removed],Swallows nesting
LifeProTips,[removed],LPT keep an eye out in this presidential election
LifeProTips,[removed],keep an eye out in this election
LifeProTips,,"LPT: If you want to be a hero to your family, friends and lovers, learn to cook popcorn on the stove. Its cheap, easy, and you get to provide hot snacks you prepared over a fire like a Triumphant God."
LifeProTips,[removed],"If yet you want to be a hero to your family, friends and lovers, pop popcorn on the stove lt is cheap, easy, tastes far better than microwaved and let's you cook over the flames like a Triumphant God."
LifeProTips,,"LPT: If you pay with PayPal, many merchants automatically set up a subscription on your account and can then collect money as often as they want. Therefore you should check your PayPal account regularly for unwanted direct debit authorizations."
LifeProTips,,LPT: Put a flag with the blue stripe (supporting police) on your back window/bumper to reduce your chances of getting pulled over/getting a ticket.
LifeProTips,[removed],If you’re bored and want to do good deeds
LifeProTips,"If you're about to fall into this classic trap, simply reply with, _She is pretty, I just don't find her attractive_","LPT: If your lady ever asks you if you find a particular girl pretty/ ""don't you think this girl is pretty?"""
LifeProTips,[removed],"Women: Get a copper IUD, it will boost your sex life in so many ways."
