subreddit,selftext,title
LifeProTips,"“Hidden” photos can’t be locked (for some reason), but notes can be. Put your secret photos into a locked note instead.

Bonus: if you long-press on a photo within a note, you can select “small images” to make them easier to tile.",LPT: iPhone users — Hide secret photos in a password-protected note.
LifeProTips,"Got in my car to head home for lunch, and about 5 minutes in felt a pain in my leg.  Rubbed once and nothing.  It started hurting again and on a second rub felt something.  Do the ""WTF did I just rub?!"" hand fling and notice I flung something into the passenger side.  Turns out I sat on a bumblebee.  Lil' guy stung my leg and hand, but nothing big.  It is Summer and the bees are out en-mass.

TLDR: Glance at your seat, something may already be there.",LPT: Check your car seat for bees. Especially if you frequently have the windows down in the Summer time.
LifeProTips,[deleted],"LPT: Stop bullshitting yourself through inspiration quotes and way of thinking. Unless you put yourself in certain situations that foster your goals, things will only get worse."
LifeProTips,,LPT: Read all of the rules in a subreddit carefully before posting. People are extremely unforgiving towards even the smallest rule violations.
LifeProTips,,LPT: Read all of the rules in a subreddit carefully before posting. Mods are extremely unforgiving towards even the smallest rule violations.
LifeProTips,,LPT: Read all of the rules in a subreddit carefully before posting. Mods are extremely unforgiving towards even the smallest rule violations.
LifeProTips,,"LPT: Whenever you get a subscription service (like Netflix, Hulu, Adobe, etc.), go to cancel the subscription, and it will often offer you deals (like 30 days free) to continue your subscription."
LifeProTips,[removed],LPT. Instead of listening to yes or no when working as a cashier listen for please and thank you.
LifeProTips,,Instead of listening for yes or no when working as a cashier listen for please and thank you.
LifeProTips,,"[LPT] Often, when people say science can't explain something, it often already has. And when it actually hasn't, usually it already has five or six good ideas of what it could be. Most actual unsolved questions take a scientist to understand the question in the first place."
LifeProTips,"This helps clean rugs that are too big to take outside and shake. You'll need: a dirty rug, a vacuum cleaner with a beater bar (rotating brush), broom or dust mop.

Vacuum the rug as usual. Flip it upside-down onto a smooth floor. Slowly run the vacuum over it a few times, making sure the beater bar is touching the rug. You're not trying to suck dirt through the rug backing, just using the vibration of the machine to shake the dirt out of the fibers.

Carefully pick up the rug (don't roll it because you'll just transfer a bunch of dirt from the dirty side to the clean side.) Sweep up all the dust that has fallen out of the rug, then lay the rug right-side-up and vacuum the top again. For very dirty rugs you might have to repeat a few times.

The first time we did this, we were shocked at how much sand and dirt came out of the rug. Now we do it 2-3 times a year.",LPT: Vacuum area rugs upside down to deep clean them. It shakes out dirt that has settled down between the fibers.
LifeProTips,[removed],LPT: Cringe with a smile
LifeProTips,[removed],LPT: Free McDonald's fries every time!
LifeProTips,,"LPT : To maintain a good health, good relationship or any other long lasting thing, it's not about doing short term intensive things, it's all about consistency."
LifeProTips,[removed],Cringe happily
LifeProTips,[removed],"LPT: if someone invites you to do something or go somewhere, don't assume they will be okay if you bring other people with you"
LifeProTips,,"If someone you know invites you to do something or go somewhere, don't assume they'll be okay with your bringing people with you"
LifeProTips,[removed],LPT: The Eisenhower Matrix gave me the framework I needed to distinguish between urgent and important tasks
LifeProTips,"Phone number, address, or anything else that they wouldn't want to share works. Just make sure it can't be easily cropped/edited out.",LPT: Want to send nudes to someone you don't fully trust? Watermark them with that person's personal info.
LifeProTips,"Just in case one of the eggs is bad, you don’t have to toss everything","LPT: if you are cooking/baking things that require multiple eggs, always crack each egg in a separate bowl."
LifeProTips,[deleted],LPT: Any time you sign up for a trial or subscription
LifeProTips,[removed],LPT: Life is full of doors and these doors lead to opportunities. Just because 1 door won't open doesn't mean you have to leave the entire building.
LifeProTips,Talc-free baby powder is also recommended.,"LPT: For a beach trip, fill a cotton sock with cornstarch (corn flour in the UK), tie it off with a rubber band/elastic, and keep it in a waterproof bag. Use the sock to remove sticky, wet sand. It helps apply the powder without a lot blowing away in the wind."
LifeProTips,[removed],"LPT: MEN If it’s late and you're alone in an elevator with a woman you don’t know, get off first."
LifeProTips,"Obviously this isn’t the only ingredient to success, but it’s a huge part of it. 

Why does being humble work? Being humble gives you unlimited growth. You’ll never want to stop learning and you’ll soak in so much info from people and tough times. The second your pride clouds your judgement, you lost. 

How to be more humble? Realize you didn’t get to where you are all by yourself and be grateful for what you’ve been given in life. I highly suggest spending a few minutes a day being thankful for things in your life. 

Why is being humble better than being smart? It’s not. Take a dumb humble person and they’ll learn all they need to know. Take a smart prideful person and their growth will be stunted. Take a smart humble person and the possibilities are endless. 

I wish you all great success!!","LPT: To be successful, you don’t necessarily need to be the smartest in the room, rather the most humble"
LifeProTips,[removed],"MEN: If it’s late and you're alone in an elevator with a woman you don’t know, get off first."
LifeProTips,[removed],"LPT: Keep your old headphones, don't immediately trash them"
LifeProTips,[removed],"If you have a business idea or just a side hustle, don't expect it to make you independent from a job in a short time, also don't believe anyone who tells you that you can get rich quick (obviously)"
LifeProTips,[removed],"LPT: Use reddit for amazing cooking/baking secrets, tips, tricks and recipes. I’ve learned so much in such a short amount of time. It’s a treasure trove of knowledge."
LifeProTips,"Just paste it to your drafts. That way, you don't actually have to send it, and you can delete it without leaving any trace of it on your email account.",LPT: Need to send a questionable email to yourself?
LifeProTips,[removed],LPT: most of the time ppl don't judge you based on your flaws or failures but how you respond to them so don't stress out so much about potential failure &amp; learn how to respond properly
LifeProTips,,Need to send a questionable email to yourself?
LifeProTips,[deleted],"LPT: Go to Reddit for cooking/ baking tips, secrets, and awesome recipes. I’ve learned so much in such a short amount of time. A treasure trove of knowledge."
LifeProTips,[removed],"LPT: Always call out someone you suspect of being racist. Generally you will have the full support of the people around you, and thus nothing to fear, and it will take another racist off the streets."
LifeProTips,,"LPT: For a beach trip, fill a cotton sock with baby powder or cornstarch (corn flour in the UK), tie it off with a rubber band/elastic, and keep it in a waterproof bag. Rub the sock on wet, sandy skin to clean it off quickly. The sock helps apply the powder without a lot blowing away in the wind."
LifeProTips,[deleted],"LPT: If you're ever at a point in life where you have no water and can't shower, you can go to a truck stop and ask a driver for a shower token, most will gladly give them away since they get them for free and have plenty to spare."
LifeProTips,[removed],"LPT: Real-life drama not cutting it for you anymore? Go to r/politics, and click on the first post that shows up. Go to the comment section and sort by controversial. Voila!"
LifeProTips,"If you want to find out if you have brickwork or drywall, just unscrew a power outlet and see how the plastic housing the outlet sits in looks. If it is orange and you had to loosen two screws to get the outlet out of the housing, said wall is hollow (-&gt; you have drywall). 

If the housing is grey or black and the outlet is fastened to it with claws, the wall is solid (-&gt; you have brickwork).

I don't know about the regulations elsewhere, but at least that is how we do it over here in Germany. And please make sure the power to that outlet is turned off before you unscrew anything.",LPT: Find out what your walls are made of by unscrewing a power outlet
LifeProTips,,ProProblem
LifeProTips,[removed],"LPT - You can tear a disinfecting wipe into thin strips if you want to clean small items like keys and phone, instead of wasting a whole wipe."
LifeProTips,[removed],"Resubmitting as I forgot “LPT:Request” in title, looking for tips as I messed up my neck this morning when rolling over in bed."
LifeProTips,[removed],LPT: When at a festival of any kind change your phone lock screen to a list of friend contact details so that in the event that you do lose your phone the finder can easily contact a person you are with
LifeProTips,,"Messed up my neck rolling over in bed this morning, any tips?"
LifeProTips,It's quite easy for them to delete low rated reviews for no reason at all. Always use an external review site for large purchases.,LPT Never trust the reviews on a companies own site
LifeProTips,,"LPT: If you ever have dental braces and when its time for your Orthodontist to remove them and switch you to a removable retainer, ask politely if you can have a permanent retainer put behind your teeth instead."
LifeProTips,[deleted],LPT: Never buy or trade in a car to a dealership
LifeProTips,[deleted],"LPT: If you ever have dental braces and when its time for your Orthodontist to remove them and switch you to a removable retainer, ask politely if you can have a permanent retainer put behind your teeth instead."
LifeProTips,Pretty self explanatory,"LPT: If you ever second guess a big decision, or any decision for that matter, just think “would an idiot do this?”. If so don’t do it."
LifeProTips,,Never buy or trade in a vehicle to a dealership.
LifeProTips,[removed],"LPT: If you're making a decision you think is important, ask yourself: ""Will this matter in 5 years?"" If yes, put energy into it. If no, decide and move on."
LifeProTips,,"LPT: When you aim to complete several tasks and are unable to focus, try using a reward based system. It might seem like a child's act, but tricking your brain into that really helps, and gets work done."
LifeProTips,"One of my friends was doing something else during a call, and the host could see everything reflected on his glasses.","LPT: If you’re in a video conference, do not wear glasses..."
LifeProTips,"If you ever run of conditioner for your hair, use lotion or moisturizer instead! It works just as well. Any kind of hand lotion will do, even the cheap kinds. You don't need to use it in the shower. Use it outside of the shower. Works better on wet hair. But you can do it on dry hair too","LPT: If you are out of conditioner, use lotion instead"
LifeProTips,[deleted],LPT: The grout between tile makes a pretty good impromptu nail file.
LifeProTips,,The grout between tile makes a pretty good impromptu nail file.
LifeProTips,[deleted],"LPT: when looking up movie ratings on Rotten Tomatoes, use the audience rating to decide whether you want to watch it or not. You want to know if you’ll enjoy it or not, not how harshly critics rate it."
LifeProTips,"Reposted due to lack of understanding of how Android phones work. 

I don’t even know if this’ll work for androids. Definitely works for iPhones though!","LPT: if you’re like me and lose track of your phone often (and know roughly where it is) you can say loudly “Hey &lt;Siri/Google, etc&gt; set timer for 1 second. Your timer will go off, allowing you to find your phone more easily"
LifeProTips,,LPT: If you're unsure of whether you need to fart or shit ALWAYS assume you need to shit and plan accordingly.
LifeProTips,Use your swiffer! No need to hop on the counter or use a step stool.,LPT: too short to clean mirrors?
LifeProTips,,An Old Man's Advice
LifeProTips,[removed],"When contemplating anything, ask yourself ""will this matter in 5 years?"" Put your energy into things you answer ""yes"" to. Don't sweat everything else."
LifeProTips,[removed],LPT: Want to improve yourself? Choose something you are bad at and work on it. In a short period you will see major improvements vs something you are good at.
LifeProTips,,Too short to clean mirrors?
LifeProTips,"Bees deal with wind all the time, so blowing on them isn't going to get them riled up. They'll just go find someone less windy to buzz around.  
  
Swatting them is a good way to get stung, especially if there's a hive nearby to answer a call for reinforcements.","LPT: If a bee or wasp lands on you, gently blow them away instead of swatting and they won't get agitated."
LifeProTips,,Want to improve yourself? Choose something you are bad at and work on it. In a short period you will see major improvements vs something you are good at.
LifeProTips,,"LPT: If you are near-sighted and find yourself without glasses, turn on your phone camera and look at the screen"
LifeProTips,[removed],Never lift a to go drink by the lid
LifeProTips,"I recently came across this Workaround. So if you don't have YouTube Premium try this workaround to listen to music while multitasking on an other app.

You _can_ use splitscreen but it takes up space on your screen so this one works out better if you just want to listen to music.

P.S. : Don't redirect yourself to the YouTube app play the video in the browser itself.",LPT : For Android Devices : If you don't have YT premium play the videos on your Chrome Browser and it'll play in background
LifeProTips,,For Android Devices : If you don't have YT premium play the videos on your Chrome Browser and it'll play in background
LifeProTips,,LPT Request - Life Lessons About Entrepreneurship for Data Scientists
LifeProTips,,LPT : Rethink recording/posting a video of yourself doing something charitable.
LifeProTips,[removed],"LPT: Sick of your glasses fogging up while wearing your mask? You can buy mask defogger spray, usually used for scuba masks, to help keep the fog at bay"
LifeProTips,,Rethink whether you want to record/post a video wherein you do something charitable.
LifeProTips,[removed],"If you are going to walk down the street carrying a bag of shit, bring a dog along so as to not arouse suspicion"
LifeProTips,[removed],"LPT: If your friends are due for a baby, stop asking about it"
LifeProTips,[deleted],LPT: Best Way to Get Rid of Water Before Frying
LifeProTips,,Life Lessons About Entrepreneurship for Data Scientists
LifeProTips,"If a friend or loved one is just on your mind, send them a text or a message to let them know you’re thinking about them - even if it’s someone you haven’t talked to in a while. It will make them smile and feel cared for, and help keep your connection solid.",LPT: let your people know you’re thinking about them!
LifeProTips,[removed],"LPT: if someone is wearing a mask with a valve, it exhales unfiltered air, which may pose a risk to you. Avoid these people."
LifeProTips,[removed],"LPT: Whatever the weather, if you’re on a motorbike, where the correct gear"
LifeProTips,[removed],"No matter what the weather is if you’re on a motorbike, where the correct gear."
LifeProTips,,LPT: If your sanitary/wet wipes dry out just add water. Don't throw them away.
LifeProTips,[removed],LPT: Not flossing your teeth is like wiping your ass without getting the crack.
LifeProTips,,"Videos where you gives a stranger a nice thing, but felt the need to record and upload it are tacky."
LifeProTips,[removed],LPT: Use clips to hang your shower curtain after a shower. This will let it air-dry and prevent mold from building up.
LifeProTips,[removed],Breathing with a face mask
LifeProTips,,LPT: Fill out your contact info on your own iPhone so if you lose your iPhone the finder can simply ask Siri who owns the phone.
LifeProTips,,"LPT: quickly get to iPhone passcode unlock from FaceID screen by clicking “FaceID” after the first FaceID attempt. No need to wait to fail a few times, just click “FaceID” when it’s trying to read your face."
LifeProTips,[removed],LPT: An attic insulation blanket (DIY) shouldn’t contact your roof on the edges of your house as this will limit ventilation.
LifeProTips,,"LPT: If you’re introducing someone to a physical activity, be the one to propose frequent breaks. Even if they’re fit, doing something new is demanding and they often won’t want to interrupt you by asking for rest."
LifeProTips,,LPT: Get yourself a TENS machine against pain
LifeProTips,,"LPT: If you’re ever feeling particularly self-critical at work, write a list of all the negative feedback you hear from others at work and compare that against the positive feedback. More times than not, you’ll have nothing listed under “negative”. Don’t be so hard on yourself."
LifeProTips,[removed],"LPT: If someone asks you personal questions about a person you know in common, before answering, ask yourself why they can't ask that person directly."
LifeProTips,,"If someone asks you personal questions about a person you know in common, before answering, ask yourself why they can't ask that person directly."
LifeProTips,"Stay home, stay safe, stay positive, and enjoy your life!",LPT Never compare yourself with anybody. This will help you every day in bringing more happiness and peace in your life.
LifeProTips,"Don't ever try to work hard and get restless. Be smart and efficient - be focused. Passion, interest, and a learning attitude towards the particular task you are performing are the things that make you a smart worker. The day you start enjoying your work you become smart. Enjoy the life.",LPT Don't ever try to work hard.
LifeProTips,,Don't ever try to work hard.
LifeProTips,,Don't ever try to work hard.
LifeProTips,,Never compare yourself with anybody. This will help you every day in bringing more happiness and peace in your life.
LifeProTips,,"LPT: If you rely solely on your car insurance company's app for proof of insurance, screenshot your card before leaving on a road trip. If you are pulled over in an area with poor or no signal, you will still be able to access and present your card."
LifeProTips,,"LPT : Despite phones cases having holes to let through the microphone sound, I learned today you lose up to 10-13 decibel. So if you have to yell to be heard or want to talk quieter, just remove the case."
LifeProTips,"Seriously, you wait for them to land somewhere, and you can get pretty close to them, take aim, and suddenly... BANG! Insta-death. With some practice, you'll almost never miss.","LPT: You will never find a flyswatter more fun or effective than a small, accurate Nerf pistol"
LifeProTips,,"Despite phones cases having holes to let through the microphone sound, I learned today I lose up to 10-13 decibel with the phone case on. So if you have to yell to be heard or want to talk quieter, just remove it"
LifeProTips,[removed],"LPT: If you want to lose weight or gain muscle, only take advice from people who you want to eventually look like."
LifeProTips,[deleted],LPT- Dont vote for Kanye as a joke
LifeProTips,[removed],"If you want to lose weight or gain muscle, only take advice from people who you want to eventually look like."
LifeProTips,[deleted],"LPT: during hot summers, take a beer mug, fill it 1/3 with water and throw it in the freezer overnight. In the morning you’ll have a frosted mug with a giant ice cube at the bottom that cools your water naturally. I usually add a slice of lemon for flavor and health."
LifeProTips,"Say you registered your e-mail as admin@gmail.com. If an e-mai, is sent to a.dmin@gmail.com, it will arrive in your inbox just fine. Useful when creating lots of account to on websites!",LPT: Use Gmail? Gmail doesn't doesn't care about dots. Use this trick instead of creating lots of e-mail addresses.
LifeProTips,[removed],LPT: how do I make friends in a new city during a pandemic?
LifeProTips,[removed],"If you wake up in the middle of the night, try to not look at the clock."
LifeProTips,"It's helped me a lot over the years, particularly through bouts of depression. What would future me say if I did this washing up/vacuuming/homework now. They'd say hell yeah, great job past you, because you did that I can now do x. It's important to reflect on it either immediately afterward, or as you're about to do the activity you can now do because you did x earlier, and give yourself the praise you deserve for accomplishing it. I've found it's a particularly good habit to get into, and is actually really easy to stay in the rhythm of doing it. I guess from a psychological standpoint it's some sort of positive reinforcement, correct me if I'm wrong.","[LPT] Whenever you're feeling demotivated, change your mindset to; what would future me say if I did this now?"
LifeProTips,[deleted],"LPT: Add a question at the end of argumentative statements like “it doesn’t do that, does it?” This allows others to comfortably counter-argue without feeling combative and keep the conversation friendly."
LifeProTips,[deleted],LPT: Change your middle name to a Roman numeral if you want your name to look like that of a monarch + satisfy your ego
LifeProTips,[removed],"Whenever you're feeling demotivated, change your mindset to, what would future me think if I did this thing now"
LifeProTips,USPS tries their best to return any items of value to their owner so any kind of ID with an address will be returned if placed in a US mailbox.,"LPT: IF you find a US driver's license or a wallet containing one, put it in any mailbox and the USPS will return it to the owner."
LifeProTips,[deleted],LPT: Loving and respecting yourself first will enable you to love your SO with less insecurities and more peace
LifeProTips,"Just as the title suggests. If you ever get a call from anyone saying your Apple ID was compromised, it’s a scam. Apple doesn’t call their customers. I get a dozen or so calls a day telling me to press “1” to talk to an Apple specialist.  I have heard things from they work in the “Apple fbi department” to the Apple fbi fraud department. Neither of these departments exist.   I used to press “1” just to have fun with them. Now I just find them annoying.","LPT if you get a call saying your Apple ID or account has been compromised, it’s a scam."
LifeProTips,,"LPT: First rule of family gatherings, always bring your own vehicle so you can leave when you want."
LifeProTips,[removed],Follow my spotify account and listen endless music😍 will follow you back. Wanna make 500 followers. Pls follow.
LifeProTips,Especially with stuff like “Completely free VPN”.,"LPT: If the service is free, then you are the product."
LifeProTips,"A nice trick when you’re running late and know you put your phone down somewhere, but are unsure where!","LPT: If you ever lose your apple or Android phone and know it’s somewhere in your house, walk into each room and say loudly “Siri/Cortana - set timer for 1 second” - if your phone can hear you it will set off the timer, making it easier to find"
LifeProTips,,"LPT: To reheat meat in a microwave without turning it to leather, cover the meat with a damp paper towel and let the steam warm your meal up."
LifeProTips,"This is an effective way to save money by critically thinking about each purchase you make. For example if you're buying a video game, think about the problem. Do you not have any games to play? are you bored of your games? Maybe there's a game in your library that you've forgotten about. We tend to spend money out of boredom rather than necessity.

Another example is ordering food in. What problem is that solving? Do you legitimately have no food in the house or are you being lazy? Try it out, eventually the habit of checking yourself before each purchase will become the norm and you'll have a bunch more money in the bank.",LPT - Ask yourself what problem you're solving before purchasing something
LifeProTips,[removed],"Before buying something, ask yourself what problem it will solve"
LifeProTips,"The same goes for finding an object that belongs to something (Wallet, phone, keys, a dog). Do not expect a reward, rather, tell them that you would hope that somebody would do the same for you. Somebody found my wallet and when it was returned, it was still full of the cash that I left in it. They said this and it changed my life.",LPT: Treat others the way you would want them to treat your grandma.
LifeProTips,[removed],LPT: Set up automatic payments from credit card to phone bill then online bank to credit card for double the recognition on your credit report. This also helps increase your credit rating faster.
LifeProTips,,LPT Request: what to ask while on an apartment tour.
LifeProTips,[removed],do grate organic spotify music promotion
