subreddit,selftext,title
LifeProTips,"It's very good for clearing up clutter on your screen, and for other reasons I won't go into detail about. I'll just say if you still live with your family or with roommates... This hotkey **WILL** save your life. It might also work on Windows 7 and 8, but I haven't tested it.",LPT: Pressing the windows key+M in Windows 10 will instantly minimize all windows
LifeProTips,,"LPT: If you want to get better about spending, think of your money in terms of time and not dollars. If you make $15/hr and something costs $10, that’s 40 minutes of your life you are spending to purchase that item."
LifeProTips," 

After using an elevator you can help out your fellow humans by sending it back!

For  example, I usually park on the 3rd floor of my work's parking garage.  I  take the elevator down, then enter the office building.  Then I take  another elevator to the 3rd floor to my office.

In  the morning when I exit the garage elevator I hit the ""3"" button on my  way out.  I do this because I know there is a 99% chance the next person  who needs to use the elevator is going to come from 3 down to ground  floor.  When I exit the office elevator I hit ""1"" on my way out.  Again  99% chance next guy is gonna need to come up.

Later in the afternoon when I'm leaving for the day I reverse the above activities.

Imagine if everyone did this, you'd hardly ever have to wait for the elevator.  :)",LPT Elevator Etiquette
LifeProTips,,"LPT, are you stressing over something? Then use the 10-10-10 rule, will it matter in 10 days? 10 months? 10 years? After getting some perspective, you will notice how very few things end up worth stressing over."
LifeProTips," **When you borrow tools, make sure you treat them with respect. They may seem to be unbreakable, but a lot of people spend a lot more to have a quality tool for life.**",LPT
LifeProTips,,"LPT, If you want to connect with someone (date/potential friend) go for a long scenic walk with them, it takes off the pressure of face to face interactions, and set you both in the right mood to talk and open up."
LifeProTips,[removed],"When you borrow tools, make sure you treat it with respect. They may seen too be unbreakable but many trades people spend a lot more to have a quality tool for life."
LifeProTips,"Lots of college libraries have fantastic printing equipment and can print large posters on high quality paper for super cheap. I was able to get full color 16”x24” prints for under a dollar each, I just had to provide the file on a drive. 

Your milage may vary",LPT: Need cheap wall art? Check your local college’s library
LifeProTips,,"LPT: If your partner can't decide on a restaurant to go to, play the guess game, let them guess what restaurant you want to pick and whatever they choose, you go eat there."
LifeProTips,[removed],"If your partner can't decide on a restaurant to go to, play the guess game, let them guess what restaurant you want to pick and whatever they choose you go eat there."
LifeProTips,[removed],Have a positive thinking
LifeProTips,"Didn't really know what subreddit to ask this on but whats happens if I don't do my course culminating for grade 12? Cause of Quarantine I'm kinda too lazy to do them but I just need to make sure my mark won't drop from what it was in March, cause I had high 90s.",School Work
LifeProTips,"It’s been handy for those packages you don’t expect or have knowledge of. You’ll be notified of all packages sent to your address, even if addressed to someone else in your household.",LPT: Use the FedEx and UPS apps and register your home address. You will be notified of all FedEx and UPS shipments en route to your address.
LifeProTips,I set alarm at 5:30am to wake up but when I open my eyes I have not power to get out of bed then I sleep back. Could you give me some tips?,LPT request : Wake up early in the morning.
LifeProTips,[removed],"LPT: When drinking in a social setting, always hold cold drinks in your left hand. As most people offer their right hands, this will help avoid clammy handshakes."
LifeProTips,[removed],Wake up early in the morning.
LifeProTips,,"LPT: When meeting someone you know on the street and talking to them, just before saying goodbye ask them where they're headed. This will prevent the awkward situation originated by the two of you walking in the same direction after saying goodbye."
LifeProTips,[removed],You should spend more time eating.
LifeProTips,Take it from someone who’s song choices have absolutely bummed out the bar following a dynamite performance.,"LPT: Worried your Karaoke song choice is gonna ruin the vibe? Ask the DJ what song is on before yours to help you make a decision. You can ride the energy/theme of the previous song, or better choose what direction to change the mood."
LifeProTips,[removed],"LPT: if you need to poop and you’re somewhere where clogging a toilet would be rather embarrassing (small restaurant, friend/SO house, etc.) poop and flush, then wipe and flush. That way if the toilet does clog it’ll only be toilet paper and not feces as well."
LifeProTips,[removed],"If you’re hiring someone that is going to be in your home daily or very frequently (childcare or maid), pay them in cash but give them extra on purpose. If they tell you that you overpaid when they notice the ‘mistake’, it tells you a lot about their character."
LifeProTips,"When you proof read anything over again, your brain starts interpreting what it expects to see rather than what is there.

To give your brain a nudge, save a copy and change the font to comic sans (or a very different font) then read through it again. You are more likely to pick up any sneaky errors or clunky grammar.","LPT When proof reading something important like a C.V. or resume, save a copy, change the font to Comic Sans and read again."
LifeProTips,,LPT: always side with the victim and never the aggressor.
LifeProTips,If you have right wing ideas (please keep it civil) it is better to post said ideas after most of the US gets off of work.  Most redditors who post are from the US and most redditors tend to be slightly left in their political views (all respect to anyone's views) so your best chances for a good reception tend to be around 7 PM eastern time.,LPT: If you have right wing ideal posts on reddit it is better to post them later on in the evening.
LifeProTips,[removed],LPT: It's often better to text than call
LifeProTips,[removed],"When proof reading something important like a C.V./resume, save a copy, change the font to Comic Sans and read again."
LifeProTips,[removed],Give advice for student
LifeProTips,"It's BS that dental care is treated like a luxury rather than a healthcare right. You *can* die from complications related to a tooth infection. If you have swelling call your dentist, if you don't have a dentist call an emergency clinic. PUSH PUSH PUSH. If the receptionist is stonewalling, get hysterical. They don't want bad reviews or bad press. I've had to tell patients who were clearly in a ton of pain but were too polite to put their needs first that they have to act mad at me loudly before I could authorize discounts on $1600-1800 bills that had to be paid in full UPFRONT for 1 tooth, while each doctor made out with 100k+ per month. When you show up to a healthcare establishment, your reasonable expectation of being listened to and treated with care should be met.",LPT Health is a business in the U.S. including dental care. Ask for discounts! I used to work at an emergency root canal specialist and we were not allowed to offer discounts or financial breaks unless a patient pushed for one or their general dentist advocated on their behalf.
LifeProTips,[removed],"LPT: Reheating leftovers often over-cooks them, and eating them cold may be much more enjoyable"
LifeProTips,sometimes a person wont share your point of view because theyve had an experience thats changed theirs.take the time to understand why a person has their opinion before you dismiss and label them,"""lpt"" dont assume everyone you meet is a racist because they dont share your point of view"
LifeProTips,"I've seen so many discussions, especially now, where people ask something slightly controversial and everyone flames the person and they get downvoted to hell for being simply uninformed.

From reddit:
&gt; Vote. If you think something contributes to conversation, upvote it. If you think it does not contribute to the subreddit it is posted in or is off-topic in a particular community, downvote it.

Note there is nothing there about ""liking"" a post or ""not liking"" a post. It's all about contributing to a dialogue. If you disagree, you should be fighting the idea, not the person. Downvoting just makes both sides upset, and hides the potential discussion and learning experience from others who may benefit from it.

Sure, downvote someone spouting blatantly toxic stuff, but if someone has a different stance than you try to start a discussion first before making their voice disappear.","LPT: The downvote button is not a ""disagree"" button"
LifeProTips,"I’m not even really getting into health, it just tastes better. People say Coca Cola from a glass bottle tastes better because it does. It has cane sugar instead of what you’d find in the canned version. Same goes for my orangina and other soft drinks. Also gummy bears! The difference between gummies made with organic ingredients and the ones made with high fructose corn syrup is night and day. When I went to Australia they only had organic gummies and they were the best.

So yeah I guess my point is high fructose corn syrup sucks.",LPT: if there’s an alternative for a sugary treat you like without high fructose corn syrup. Get it.
LifeProTips,[removed],What's your favourite cooking hack?
LifeProTips,I recently lost my key fob and they run around 300$ a piece. AAA gave me a 200$ credit and also sent a key master to my house and made the key on the spot. So many places have AAA discounts. They are usually at least 20% off and are for just about everything. DONT BE AFRAID TO ASK  AT THE PLACES THAT YOU SPEND MONEY AT!,"LPT- If you are a AAA member, you big discounts almost everywhere - just ask!"
LifeProTips,,"LPT: Saying “sorry could you repeat that, I was muted” makes you look dumb. Instead, at least blame your connection for mishearing the question you ignored."
LifeProTips,Sorry for being a grammar nazi but I can't stand it. It makes me cringe.,"LPT: do never use the expressions ""should of"" and ""would of"", it's just wrong. Instead, use ""should have"" and ""would have""."
LifeProTips,[removed],dont assume a person you just met is a racist because they disagree with your opinion
LifeProTips,"Firstly I'm talking about people who don't suffer from depression I understand how wildly different that is.
Secondly, I don't really feel down much, but unlike my friends when I do I know something isn't making me happy. Instead of worsening it I listen to some upbeat music, come off social media, get an early night. Don't underestimate how much an early night and no social media can help you. Point being if you want to shift a bad mood listen to some happy music, exercise get some endorphins flowing. Don't expect listening to the world's saddest songs on a loop to get you out of it.","LPT Request. If you want to shake a bad mood don't sit there listening to sad songs, it's like saying ""I have a headache let me repeatedly pound my skull with The Cats in the Cradle album"""
LifeProTips,[removed],"If you feel generally sad or down (with no apparent reason) don't listen to sad songs on repeat. It's like saying ""I have a headache let me repeatedly pound my head with The Cats in the cradle album"""
LifeProTips,"Data online lasts a long, long time, potentially forever.  It’s one huge, non-deleting hard drive for everyone to see.  One day you’ll regret that online argument, that stupid picture you took on your 18th birthday.  Control your online data footprint from a young age, unless you want your grandkids to think your a dick, potentially great grandkids and then after them.","LPT: Don’t write stuff online unless your prepared for it to read out in front of family and a court of law, including pictures. It never truly goes away."
LifeProTips,"Regardless of what the politicians say, what your/our society may say, and what your peers and friends might say in the heat of the moment, *it is okay to be wrong.*  


Being wrong is frustrating, but admitting you were wrong is the only way to grow and expand as a person.   


For some reason, we (almost all of us) have this NEED to be right. It is natural to become combative when someone has accused you (or me) of being incorrect. Perhaps they are being aggressive; perhaps they are lording it over you. Perhaps there is a momentary cost to acknowledging that your piece of data was wrong. But it shows greater strength of character, and costs MUCH less in the long run, to overcome those instincts to say ""you know what, you are correct"" and move forward with a conversation or topic.  


At the very least, it might help you learn more. At the very most, it might save a relationship or even a career. Don't double-down if you don't know for sure.","LPT: Being wrong is frustrating, but admitting that you are wrong does not make you weak; it makes you strong."
LifeProTips,"One of the biggest differences for me going to concerts or particularly fireworks is the vibrations that shake your chest cavity. I can't speak for how it might be for those more endowed in that area, but I've been listening to music more often when relaxing by placing my phone/speaker right on my sternum which really sends those waves right to the core of your being, literally. For safety I have to add, do not attempt this if you have a pacemaker or similar implanted medical device, this can cause interference.",LPT: Simulate a live sound experience at home by putting the speaker on your ribs
LifeProTips,,"LPT: If you’re upgrading phones, keep the previous as long as it turns on. When the emergency comes having a back-up is always a life saver."
LifeProTips,,LPT: Take your trash bins inside at the end of garbage day or else your bins will be communal bins for anyone walking by for as long as they're outside
LifeProTips,"I know people care about the homeless but might not know how they can help them. They might not trust charity foundations to give the money to the poor.

One simple way to help the poor (besides giving them money outright) is to give them any plastic bottles you have on hand. You can also make a point to collect bottles at home and drop off bundles of them near one of those cash-for-bottles machines. While it is not the biggest thing in the world, you'd be indirectly recycling *and* serving the poor and homeless at the same time. 

It's such a small thing to do that there is almost no reason to not help the homeless in this small fashion.","LPT: If you want to help the homeless, then give them your spare bottles"
LifeProTips,"If you're like me and not keen on drinking 20, 16.9 or 12 ounces of soda at once, you can use the line in the bottom as a gauge of what is half. 

Note: This has been true (I've measured and tested) for all Coca Cola products and up to 20 oz bottles. Have not tested other sizes or non-Coca Cola products but I would imagine it's the same.",LPT: The Line Below the Labels on Small Soda Bottles Is Always Half the Total Volume
LifeProTips,,LPT: Let’s normalize men saying ‘I love you’ to each other (without bro or man)
LifeProTips,"If you struggle to read for extended periods of time, or are a slow reader and want to pick up your reading pace, listening to the text while you are reading can help both speed and focus. You can use either audiobooks or text-to-speech software, but the ideal is having a way to adjust the speed at which the text is read. When reading and listening at the same time you should be able to increase the speed to faster than you would be able to comprehend either just by reading or listening on their own. In addition to aiding focus and speed, this technique may help with general comprehension and retention as well.",LPT: Boost reading speed and focus by reading and listening to text at the same time
LifeProTips,,"LPT: If you're unsure what gift to get your girlfriend, Pay attention to what products she uses (Shampoos, Make-up, Perfumes etc) and note which ones she's running low on. You can't go wrong with a gift like this because it's useful, thoughtful and you know for sure she likes it before you gift it."
LifeProTips,,LPT: Don’t mess with people that have cauliflower ear
LifeProTips,"Love is a an extremely beautiful feeling that can be experienced by any livin' mortal. It's the cure for all kind of mental stress. A hug, a simple hug can give a person goosebumps when he/she is in need of it. 

If you're here and reading my post then you must be born out of your mom's womb. Right? You definitely share a loving relationship with your parents. That doesn't mean that you'll be ripped off your right to love someone else? For eg, your siblings, as you're already in a relationship with your parents.

If one is in a relationship with someone, that doesn't mean that that person has lost his/her right to love anyone else. He/she can fall for someone once again. Why is there an upper limit to the number of relationships one can be at a time? Who's the one who created such rule? Lets breakdown such rules as they don't make any sense.

Spread love &amp; keep smiling.","LPT: Love is like Black Magic. No one wants to get involved in it but once they get their hands dirty, there is no going back."
LifeProTips,,"LPT: Don't know what gift to get your girlfriend/wife? Pay attention to what products she uses (Shampoos, Make-up, Perfumes etc) and note which ones she's running low on. You can't go wrong with a gift like this because it's useful, thoughtful and you know for sure she likes it before you gift it."
LifeProTips,[removed],Love is like Black Magic.
LifeProTips,"Over my whole stoner life I’ve had a lot of advice on how to clean your bong: alcohol, no alcohol, just salt, only soap, boil the bong, just buy a new bong etc. All hail BAKING SODA! Soak and scrub parts of your bong in baking soda, rinse and repeat!",LPT: Clean your bong with baking soda a toothbrush and pipe cleaners.
LifeProTips,"I've only experienced this in Canada but I'm sure it applies elsewhere too. Just got $300 worth of meds for free after mentioning I didn't have benefits. 

Make sure you have a super nice doctor too, though. That usually helps.","LPT: always tell your doc if you can't afford a medication, sometimes they will have free samples they can give you."
LifeProTips,"I don't know how I just learned this at 25 years old, but I think it is important for all women to know.  There have been countless times I've specifically put on foundation with SPF to protect me from the sun not knowing this fact I feel that *everyone* should know",LPT: SPF in makeup is not enough. You need to apply up to 15 times the normal amount to get the SPF protection on the bottle.
LifeProTips,[removed],LPT: Do not name your children Karen
LifeProTips,,LPT Do not name your child Karen
LifeProTips,"My local ice cream shop sells coffee as well.  Instead of buying coffee, I decided to use my stainless steel insulated mug for ice cream.  After almost 1/2 hr, my ice cream is still firm and  I’m enjoying it at my desk.  Now I don’t have to rush and finish one of my favourite treats!",LPT: bring an insulated mug to an ice cream shop. Ice cream lasts longer.
LifeProTips,"Let's say you post something to your Facebook page and make the privacy setting public on that post... Unless you specifically change the privacy on your next post back to just friends, from then on every post will be readable by the public. I recommend if you need to do that, never change the privacy until AFTER you post so you don't accidentally make all your future posts public.

Opposite is true as well, you make a post to just certain friends or a group. Every post after that will only be seen by that group.  


I saw on another post a guy lost his job because he made some BLM post or something and it was public. I've also done it where I posted to a single person, and wondered why nobody was commenting on my posts, then I saw it was only being seen by one person. LOL","LPT: Facebook defaults to the last ""Audience"" you posted to..."
LifeProTips,[removed],"LPT: Somewhere in the fine print at the bottom of a package of TP or paper towels will be a ""total sq. ft."" This tells you EXACTLY how much paper you are getting so you can compare without having to decipher Insane Toilet Paper Math."
LifeProTips,,LPT: Do everything in your power to take care of your teeth. *Most* dental issues are entirely preventable. You can save tens of thousands of dollars over a lifetime by simply brushing your teeth properly twice a day and flossing a few times a week.
LifeProTips,"1. If you see somebody in need for help, only approach if you don't put yourself in imidiate danger, just call police or an ambulance, theres no need for you to get hurt too. 
2. If the person seems unconcious, talk to them, if they dont respond shake them (lightly, you dont want them to jolt around). Before you continue, make sure you called police/EMT, maybe you wont have the time later.
3. ALWAYS protect yourself; watch out for hazards, try to avoid blood and other body liquids, etc.
4. The person doesn't respond, so you check if she/he's breathing; hover your head above their mouth, look at their chest; if you feel their breath and/or see their chest heaving, their good. 
5. If they don't breath, look if there's anything obstructing it from the outside (maybe you haven't seen the corset crushing them). If not, open their mouth and take a look, if needed pull the tounge back, but try not using your fingers, if you cant see something there, carry on.
6. If there is no visible damaged to their neck/spine/head, lay them flat on their back, make sure to take of puffering clothes like jackets, for an easy approach, draw an invisible line from the belly button to the center of where their nipples would sit, if they were a man. 
7. Start compressions about 5-6cm deep (all this is for adults, please dont crush a child), work at a speed between 100-120 compressions per minutes, its hard to keep the rhythm, so heres a [site](https://www.npr.org/sections/health-shots/2017/04/03/521913341/what-do-hanson-and-madonna-have-in-common-hits-ideal-for-saving-a-life) with good songs humm or think about while doing it.
8. If you can, change after 2 minutes of pressing so you wont get to tired and lose your power. 
9. The major thing here are the compressions, so dont sweat it, if you dont know how to do mouth-to-mouth.

This are just basics, but from what i've learned during my nurse school, there could be saved many more lives, if everyone would know this. Is this the same way you do it in your country? Did i forget something? (this is only about cpr, I know theres alot more to do normally.)","LPT for first aid including chest compressions, cpr"
LifeProTips,,"LPT: When starting a chat with your college (through instant communication apps such as Skype, Slack, Teams, etc.), don't just say ""Hi"" and wait for the other person to respond. Add your actual message with the greetingso that the person receiving can prioritize responding to you accordingly"
LifeProTips,"What I do is when I notice it's getting too small, after I shower I find a new bar of soap, press the old bar against the bottom of the new one and the next time I go to shower it fuses to the new bar and becomes part of it.
I'm assuming the water that dissolves some of the soap on the bar eventually dries off leaving the soap to reharden. Hope this is helpful in some way and prevents wasted soap or annoyingly having to use soap that is as big as a chip.","LPT: if you use bar soap and don't want to throw it away when it gets too small to use, or try to use the small piece. You can fuse it to a new bar of soap."
LifeProTips,One of the things I learned managing retail was that sometimes people are lazy and lie about their work being done. An old boss told me to put small change in places people wouldn’t want to clean. If I looked there and the dime was still there after a few days I know I need to have a conversation with someone about doing their side work.,"LPT: Retail workers of reddit. If you see a penny, dime, or nickle in a weird spot at work, pick it up."
LifeProTips,[removed],"Be kind to hearing impaired. No matter how many time you ask, no one remembers to speak up and worse, they get annoyed when you ask them to repeat themselves. Masks make reading lips is impossible. It’s awful not knowing what’s going on, missing jokes, etc., makes you feel like an idiot."
LifeProTips,[removed],"Be kind to hearing impaired. No matter how many time you ask, no one remembers to speak up and worse, they get annoyed when you ask them to repeat themselves (esp. family). Masks make reading lips is impossible. It’s awful not knowing what’s going on, missing jokes, etc. makes you feel like an idiot"
LifeProTips,"Husband laid off from 32 year job due to covid.  Even though he paid for the policy, it can't be cashed out or converted without triple the cost. He would have to pay for three years on his own for it to have value. Get an independent policy while you are young and healthy to protect your loved ones.",LPT: even if your employer provides life insurance get your own outside work.
