subreddit,selftext,title
LifeProTips,,"LPT: When you stand up too fast and get dizzy, flex your abs or some part of the body, it makes the blood go to the brain faster. This works in seconds."
LifeProTips,"Having a spare laptop that you know functions and has most of the programs you need on it is obviously a good idea for when your main computer inevitably breaks. 

Another thing that is great to have around is a USB to SATA cable. This will allow you to take (most) hard drives / ssd's out of your main computer and hook it up to anything with a USB connection. So when something in the computer breaks you can take the hard drive out and back up the data instead of paying someone to do the same thing. 

Note that when windows boots into recovery  it's usually because the operating system is corrupt and taking out the hard drive and copying over the files will allow you to keep everything and reinstall windows or fix it without the fear of data loss.",LPT: A spare laptop and a USB to sata cable can really come in handy
LifeProTips,"I just started a new job at a warehouse, and wanted some recommendations on how to keep my body and especially feet/ankles healthy. All I do is order picking and it’s super easy but it’s a lot of walking. Does anyone have any ideas on how to prevent soreness in ankles and feet?",LPT Request: How to keep body feeling good during warehouse job
LifeProTips,,"LPT: Open bags of chips from the bottom. After spending all their time sitting right side up on a shelf, it helps to redistribute all the flavoring that fell to the bottom of the bag."
LifeProTips,,LPT: learn to start a fire using a sandwich bag
LifeProTips,,"LPT: for those with Apple earphones or AirPods, use a Q-tip with rubbing alcohol and clean your earphones. The sound will immediately get better and you will see all the wax that’s been hiding In the sound nets."
LifeProTips,[removed],Buy Negative Google Reviews
LifeProTips,,LPT: If your black and need to walk somewhere bring a dog with you and play music on your phone speaker. The music alerts scared white people as to your presence and the dog gives you a reason to be outside. Can’t break into houses or cars playing loud music and with a dog!
LifeProTips,"The title sounds kind of mean, but I think people who frequently have guests will get it. I’ve lived in a “dream location” for a couple years now and have had multiple friends/family ask to come visit. I think people often forget that the host doesn’t always get to take a vacation (I have an average of 1 guest every 2 months - I don’t always have the PTO, nor do I always want to spend it on guests visiting, and I have to request off 3 months in advance). I don’t have a problem telling friends when it isn’t a good time to visit, but telling one family member no, and another family member yes causes some conflict. The best guests have been the ones who don’t expect to have me constantly entertaining and planning something every single day. For example when my FIL visited he stayed for a week and had multiple places he had researched and made plans in advance to visit. My husband and I had a couple of things planned with him and we made dinner or went out to eat together every night, but all of the days we worked he left and did his own thing for the whole day instead of just sitting around our house waiting for us to get home to do something. Another relative stayed with us for a week, refused to do anything on their own, and was extremely pouty that we didn’t want to be up at 6 AM on the weekend ready to eat breakfast and be gone all day. You can guess which one we have limited stay time with.","LPT: When you travel to visit friends/relatives, remember that person may not be on vacation like you are. Try to find some things around the area you would like to do on your own."
LifeProTips,,If your black and need to walk somewhere bring a dog with you and play music on your phone speaker. The music alerts scared white people as to your presence and the dog gives you a reason to be outside.
LifeProTips,"Whenever I see something (article, picture, video, funny meme, person/place/thing out in the real world) that reminds me of a particular friend or family member, I make a point to send it to them with a simple message like “this made me think of you”. It’s an especially great way to keep in touch with people who are struggling (e.g. with depression) because it lets them know you care and doesn’t require a response.",LPT: keep in touch with friends who are struggling by sending them ‘this made me think of you’ messages
LifeProTips,[removed],"LPT: If you get a burn in your skin, use lavender essential oil to alleviate the pain/burning sensation!"
LifeProTips,[removed],"If you get a burn, use lavender essential oil to allieve the pain/burning sensation!"
LifeProTips,"Don't instantly give away your address to local buyers when selling online

When selling an item online for local pickup (on sites like CL, Nextdoor, or FB Marketplace) instead create a ""Contact Schedule"" with the buyer. 

For example, if they tell me that they want to pick up the item on Tuesday at 5, I would send them this:

""I'll send you a message at X time on Tuesday to confirm you are able still able to pick this up. Once you confirm, I'll send you my address. Please contact me immediately if anything changes.""

I make ""X time"" about 30 minutes before they would need to leave to get to my place. So if they live an hour away, I would message them an hour and a half earlier than their pick up time. Do NOT give them your address until they respond and confirm the time.  Telling them you'll do this at the beginning ensures that they will respond in a timely manner when you send that message. 

Unfortunately, there are a lot of flakes when selling items locally online. I've learned through trial and error that this is the best way to make sure that only serious buyers have your address.",LPT: Don't instantly give away your address to local buyers when selling online
LifeProTips,"When selling an item online for local pickup (on sites like CL, Nextdoor, or FB Marketplace) instead create a ""Contact Schedule"" with the buyer. 

For example, if they tell me that they want to pick up the item on Tuesday at 5, I would send them this:

""I'll send you a message at X time on Tuesday to confirm you are able still able to pick this up. Once you confirm, I'll send you my address. Please contact me immediately if anything changes.""

I make ""X time"" about 30 minutes before they would need to leave to get to my place. So if they live an hour away, I would message them an hour and a half earlier than their pick up time. Do NOT give them your address until they respond and confirm the time.  Telling them you'll do this at the beginning ensures that they will respond in a timely manner when you send that message. 

Unfortunately, there are a lot of flakes when selling items locally online. I've learned through trial and error that this is the best way to make sure that only serious buyers have your address. 

Stay safe out there!",Don't instantly give away your address to local buyers when selling online
LifeProTips,"Disclaimer: This is in no way the one or only way to pick a major! 

But it's an easy and free way to check if it's something you would actively pursue, or if it's just a field you would love to stay up to date on by reading articles. It's a good sign if you can not only sit through the lectures, but are actually curious to learn more! 

I've unfortunately seen to many people be absolutely miserable for years or even quitting because the idea they had about the programs or what they loved about it was not actually the day-to-day. Hell, it's what happened to me. Realistic expectations from online courses, on top of all the other research, has really helped when deciding to go back to uni.",LPT: Free online courses with assignments and introductory lectures are a great way to see if you actually want to pursue the Major you are interested in.
LifeProTips,[removed],Advice needed. I have no idea what I'm doing!
LifeProTips,,"LPT: Use bleach to kill ringworm, topical ointments take weeks and won't contain a spread, bleach kills it instantly"
LifeProTips,[removed],"LPT: If you find yourself in a situation where someone tells you ""You don't need a condom"", USE A CONDOM"
LifeProTips,"In other words, make sure your confession isn’t selfish. Example: Telling someone you never loved them after a breakup might make you feel better for telling the truth, but it will only hurt them much more than necessary. Just keep it to yourself unless it will be productive.","LPT: Before you confess something to someone, ask yourself if it’s it’s only going to hurt them to clear your conscience or if it’s actually going to be helpful to them."
LifeProTips,"Hang around a second where you found them so momma will spot you. If you leave the kitten there and go somewhere within seeing distance and remain hidden for a while, you might catch momma picking them up and moving them. Which is pretty cute and entertaining to watch. 
Chances are the mom will be around along with their brothers and sisters. They move them around one by one, and they move them fairly often; so she may be coming back for her last baby. 
Too many people think “awesome a cute new kitty I can take home” and take the kitty thinking it’s abandoned, just to have the heartache of the kitty dying as it’s too young to be separated from their mother.","LPT: if you find a small kitten and you think it’s abandoned, don’t pick it up and take it home immediately."
LifeProTips," Did anyone before experienced the feeling of moving from childhood to adulthood ? I really feel i'm getting into a stage that I never felt before that is full of responsibilities , which is college that is mixed with different cultures and people that i never communicated with. I used to be a privileged private high school student , which I never used to be responsible for a lot of things, Also the feeling that mattered a lot to me is that i'm actually aging and entering the 20ish phase which scares me the most because its full of serious steps in your life like college grad , finding work, and marriage. Also, The fact that i'm almost done with 25% of the time that left to me on earth concerns me from time to time. I regret that i didn't care to my health and I used to ate a lot of unhealthy food , but I got high marks and used to travel. I feel like the competitiveness I used to have for college entrance in my grades - after i applied to the college that i wished and got accepted - now i feel it didnt really matter because i sacrificed a lot of my health-overweight- to enter it , while my friends where enjoying their health. also my brother that was almost the same age as me died last year 11 months ago who was my backbone that i used to rest on and my bestfriend and now i had to communicate with other people to satisfy the big gap he left which is exhausting. Please, if you do have any advices to me in the next phase of my life tell me. sorry for this whole essay but i really wanted to remove things out of my chest. 

also i'm 18 years and 5 months old.",LPT Request- NEW PHASE I'm Entering and need advies.
LifeProTips,[removed],New phase i'm IN. Please give a advice.
LifeProTips,This especially helps if you have a personal/business brand account or a simple community account that you are an admin of and you find a post in your personal account but you want to reply with your brand account just for the visibility.,"LPT: If you want to access multiple accounts of the same site in one browser at the same time, use 'containers' feature"
LifeProTips,,"LPT Build a life around the person you are, not the person you wish that you were."
LifeProTips,[removed],"Build a life around the person that you are, not the person that you wish you were."
LifeProTips,[removed],"Anyone who participates in peaceful protests, wave at cars that go by, they will smile and wave back. They will even honk to show support."
LifeProTips,"It’s easy to miss the areas right next to the edge of our clothing/swimsuits when putting on sunscreen, whether due to laziness or an attempt to avoid get it on your clothes. Applying sunscreen naked lessens the likelihood that you’ll make this mistake, thus saving you from a sunburn in random and uncomfortable spots.",LPT: Get naked before applying sunscreen.
LifeProTips,,LPT: Clamshell packaging can be opened safely using a can opener.
LifeProTips,"It normally will be long enough...if not put the name twice. Also by having a number and a symbol, you'll never have to think what their password regulations are as some require symbols and some don't.

Also with this you can avoid using your ""normal"" password that you use. Making what ever you would use your ""normal"" password for a little more secure.","LPT think of any account you've made for what ever it maybe, amazon, ebay, to play games etc. Make your password the name of the game with the first letter capitalized then a number and an exclamation mark..example if it's a Activision account Activision123!"
LifeProTips,,"LPT: just because life may be a leisurely stroll for you, doesn’t mean it’s not like a treadmill for others, who are struggling to keep up. Remember that."
LifeProTips,[removed],don’t date someone who only has one pillow* on their bed.
LifeProTips,,"LPT: have the photos on your phone made into prints and throw them in a shoebox— if you pass, loved ones might not be able to get into your phone or accounts."
LifeProTips,"Found out my two year phone contract finished in March, I was still paying the same every month since. Went in to discuss why and found that the company allows phone plans to be changed online after the contract expires which wasn’t discussed initially when I signed. I was paying $90 for a phone and 15GB of data. After looking online the same company offers 60GB of data for 45$ a month. They changed the plan without any issues or new contract.

Since then I found my ISP contract expired in a similar way. I called them saying I’m looking to change ISP for a better deal but before I do are there any changes they can make for me to stay. They increased the speed from 21Mbps to 70Mbps with no change in cost to suit similar packages they have to offer.","LPT: Always follow up after a contract (phone, gym, internet etc.) expires. Most of the time they keep you on the same cost even when there are better options available since you signed up"
LifeProTips,[removed],"Just because life may be a leisurely stroll for you, doesn’t mean it’s not like a treadmill for others, who are struggling to keep up. Remember that."
LifeProTips, I bought a Motorola G7 with 32gb internal storage instead of the 64gb and saved $50. A 128 gb card is only $25.,LPT: Use a micro SD card instead of buying more internal storage for your phone to save money.
LifeProTips,[removed],"LPT: Everytime you masturbate using lotion or moisturizer, also rub some on your forehead and between/beside your eyes."
LifeProTips,"Approximately 9 years ago, I opened an account with ""ccva bompass bank."" I spelled my last name correctly as ""Marlow"" (obviously changed for anonymity.) They incorrectly entered my name as ""Marlon."" Once I received my debit card, I realized the error and went back to the bank to have it corrected, without incident. 

Soon after, I started getting new junk mail addressed to ""Marlon."" They obviously sold my incorrect info to USPS spammers before I could correct the misspelled name. Nine years and two moves later, I'm still getting junk mail  addressed to ""Marlon."" This makes filtering junk mail into the trash much easier without having to open it. 

If I open another bank account in the future, I will purposely spell my name incorrectly on the first attempt to hopefully continue this. Also, avoid ""ccva bompass bank."" They will sell your info to USPS spammers.","LPT: Misspell your name on bank account applications. After you get approved and receive your card, go back to the bank and correct the spelling error. This small unnecessary headache will allow you to quickly filter junk mail for years to come."
LifeProTips,Watching a trailer in full can spoil a scene that you would have enjoyed better as a surprise.,"LPT: Don’t watch a movie trailer in full. Instead, just watch it until the moment you say, “I want to see that movie”."
LifeProTips,[removed],"Everytime you masturbate using lotion or moisturizer, also rub some on your forehead and between/beside your eyes."
LifeProTips,[removed],"“LPT” before going full blown Karen on delivery drivers and staff, it might be worth it to ask a couple of questions."
LifeProTips,I mean it's mostly water anyways.,"LPT: When eating instant ramen, and it's too hot, just put some icecubes in it."
LifeProTips,[removed],Misspell your name on bank account applications to quickly filter junk mail.
LifeProTips,"Too many times, I see people stressing about a last-minute commitment they completely forgot about. I've been using this tip for years and it (almost) never fails.","LPT when you schedule anything in advance, set an alarm/notification for the day/week before so you aren't caught off-guard when your appointment rolls around."
LifeProTips,,"LPT: Before you put a fresh stack of paper into a printer, riffle through the pages and gently bend the stack a few times. This dramatically lowers the chance of multiple pages coming out stuck together and jamming the printer."
LifeProTips,"I got stinky feet. Now they smell like laundry. Even if shoes have been stinky for long time, dryer sheet makes them smell like laundry. Preferable to feet smell. Got Covid? Put dryer sheets in shoes. Won’t help with virus but will help foot smell. Good life pro tip.",LPT: If you suffer from stinky feet put dryer sheets in your shoes.
LifeProTips,[removed],If you have stinky feet put dryer sheets in your shoes.
LifeProTips,,"LPT: if you're a gamer who doesn't feel they're getting enough exercise try doing 5 situps, 5 pushups or 5 jumping jacks everytime you die or lose in your game. Increase that number by 2 each week. Just try 1 if you're having a hard time starting! You can do it!"
LifeProTips,"Cancelling 10minutes before the meeting is not in advance. The person you're meeting has already committed a chunk of their time to being available. They have already started heading towards the meeting place or they're already there. They have already put off other tasks to make sure they're available for the meeting time.

This seems like such a common sense LPT but I've seen way too may people try to re-schedule interviews 5minutes before the scheduled start time. I've had way too many people cancel a Zoom meeting AT the scheduled start time because they no longer need to meet. I've had way too many sellers/buyers wait until I'm at the meetup point to tell me they no longer want to meet. Rest assured that if you do this, you will be put on someone's sh\*t list. I've had potential job applicants and renters come back asking for another meeting. I always refuse. You've wasted my time once, I will not give you the opportunity to do it again.",LPT: If you need to cancel/postpone a meeting do so in advance
LifeProTips,[removed],LPT Request: What some (useful) Skills you can learn while watching series or movies?
LifeProTips,[removed],I just had a poo
LifeProTips,[removed],"LPT: If you have a lot of free time at the moment, you can generate a little income on the side by doing online work like evaluations, teaching, transcription, microtasks or surveys. It's not a fortune but if you have time to spare anyway it's a good way to pay a few bills. (list of sites attached)"
LifeProTips,"So to amplify it here is how:     
1. Right click the speaker icon on the right side of your taskbar of your desktop Windows 7 or Windows 10    
2. Click on ""Playback devices""  
3. Right click the 'green ticked' device  
4. Click Properties at the very bottom  
Then it will open another window with 4 tabs -&gt; \[ General(current one), Levels, Enhancements, Advanced\]   
5. Click on ""Enhancements""  
6. Check ""Loudness Equalization""  
7. Click OK  
  
Voila!",LPT: If your speakers or headsets are too quiet on your computer you can enhance them by activating 'Playback devices'
LifeProTips,[removed],"LPT: Donate to the NAACP or ACLU, not BLM."
LifeProTips,"This is something I've learned being a dual citizen and spending time between the US and Canada. The title is self explanatory, but essentially nobody will ask if you want to fight them and actually try to fight you if you say no or walk awaytl they are trying to assert dominence. If they actually wanted to fight you or do harm to you they will swing with out much warning best thing you can do is walk away, and then jump them at a later time. I've always said fighting people straight up is too risky and dangerous because you don't know what they have or what they will do. Walk away if you really feel you gotta prove something after the fact prepare your self walk up behind them and go to work. There are no set rules in a fight unless you're in a ring its their fault for thinking thats the case. Some might say thats not honorable or whatever, but that opinion will change when you see a situation like this happen and you or your friend get stabbed etc. I never believed my grandmother until my friend got stabbed there are no rules out there you can't count on other people having the same morals as you.",LPT;Usually anyone that asks if you want to fight doesn't want to fight
LifeProTips,"You just login and cancel by clicking a few buttons, and since I was just charged I got a 100% refund.",LPT: Amazon Prime memberships can be cancelled with up to a FULL refund for any unused portion. It's easy too!
LifeProTips,"Basically if a friend helps with something like moving out, putting up a fence, painting a room, fixing your car, etc where they are doing a job that you would otherwise be paying someone to do Its great to pay them back by taking them out for a meal or drinks. Its a simple way to show gratitude whilst avoiding the awkwardness of monetary transactions between friends.",LPT: If a friend helps you in a way that is essentially doing a job for you pay them back in food and drinks!
LifeProTips,,"LPT: If somebody is criticizing you, you can respond with the phrase “I’m still learning.” This could significantly cut down on their lecture because most people don’t want to perceive themselves as mean or overly critical."
LifeProTips,[removed],"If somebody is criticizing you, you can respond with the phrase “I’m still learning.” This will significantly cut down on their lecture because most people don’t want to perceive themselves as mean or overly critical."
LifeProTips,[removed],Beware Vexusfiber internet company
LifeProTips,"If you typically order the same thing from places like Chipotle, Subway, Starbucks, etc. save it as a note on your phone. That way if/when that magical day comes where someone makes a run for you, you have it easily on hand and don’t risk missing your window. This has saved me countless minutes over the years.",LPT: Save your go-to orders for fast food spots as a note in your phone
LifeProTips,"Inspired by another post about florists I just saw. If you use maps to search for the business that you want, you bypass the behemoths that pay to be first in the regular search results. So for example bring up maps and search for florist in Anytown, NJ, and then look at the results. It also helps to use street view to see if this is a nice looking place or a warehouse.","LPT: use Google Maps to find businesses, not Google"
LifeProTips,[removed],LPT: Want to know if the dishes in the dishwasher are clean or dirty? Check the inside of the coffee mugs.
LifeProTips,,"LPT: If you're lifting weights at the gym, chalk your hands up to avoid touching your face. Knowing your hands are smothered in chalk gives that dirty texture you can feel all over your hands"
LifeProTips,"I know this sounds like obvious advice, and I know that it might be easier said than done in some people’s circumstances. But when COVID first hit, I saw a lot of posts about students losing their jobs and were then panicking because they were unable to pay rent. And when I was in college, I knew so many people who lived paycheck to paycheck and couldn’t afford food and other stuff because they were barely able to pay rent - most of the income from their part time job went to rent. 

What I always did was get a summer job or two, and save up the entirety of my lease so I could continue to pay my rent comfortably...even if I did lose my job during the school year, or needed to quit to focus on school. So if my rent was $500 for ten months, I’d work as much as possible during the summer to save $5000 - or at least get as close to $5000 as I possibly could (and even better if I could save more). 

That helped reduce a lot of stress in that I didn’t have to worry about making enough money to pay rent each month. That meant I could work at an easy job for like 10 hours a week during the school year, and whatever money I made there went to food and gas.


EDIT: Obviously things are different right now because of covid. I know jobs are a bit hard to find right now. But consider this advice for our post-covid world.",LPT: Get a job (or two) during the summer to pay for your living expenses so you don’t have to work (or work that much) during the school year.
LifeProTips,,Get a job (or two) during the summer to pay for your living expenses so you don’t have to work (or work that much) during the school year.
LifeProTips,[removed],How to get help to your mental health issues LPT
LifeProTips,,How to get help to your mental issues
