subreddit,selftext,title
LifeProTips,,LPT ; It's easier to build the upper body
LifeProTips,,"LPT Request: what is your best advice for how to stay safe online. Phishing, passwords, using safe apps, online banking, cyber bullying... Please share your wisdom!"
LifeProTips,,LPT for the empath.. observe don’t absorb.
LifeProTips,[removed],Measurements: stuck buying clothes online without a fabric measuring tape on hand? Use a ribbon or shoelace and in place and then use a standard ruler or tape measure to find out how long it is.
LifeProTips,,"LPT: Get two months free of Adobe products by going to cancel your subscription and saying ""it's too expensive"" as your reason."
LifeProTips,,"LPT: If your shoe size is difficult to find online and is often but is often sold out, try customizing a shoe. Most of the major shoe manufacturers have this option. You pay a bit more but it beats not getting your size."
LifeProTips,,LPT: memorize your credit card information
LifeProTips,[removed],"LPT: If you are asking someone what is important to them, DO NOT respond with what you think is more important."
LifeProTips,[removed],"LPT if you have a treadmill at home, try playing round based strategy games on your laptop"
LifeProTips,,How can we ourselves be generous when the world around us is based on greed?
LifeProTips,[deleted],"LPT: If you ever forget what you were thinking/wanting to do, retrace your steps and redo your recent actions and your thought will most likely come back."
LifeProTips,[removed],"LPT: If you want to get rid of a larger household item, do not place it at the end of your driveway with a sign that says “FREE!” Instead, put “$50” on the sign. Someone will think it’s more valuable than it is and help themselves to it."
LifeProTips,"I constantly screenshot guides for camping/outdoors/survival, woodworking tips and tricks, and interesting recipes I see on here thinking, “this will be useful for later.”

They almost immediately get lost and forgotten in all the other photos and screenshots I take on a daily basis.

Since making myself a separate album for outdoor guides, I am actually able to see the guides more often and can pull them up more quickly. I can *actually* use them when I’m camping, instead of forgetting that I saved the info at all.

I went from never using any of the guides I’d screenshot, to using them nearly every time I go camping or do other outdoor activities.","LPT: If you screenshot helpful guides, cool recipes, or other useful information here on Reddit, take the time to give them their own separate albums in your photos."
LifeProTips,"I've only heard of strawmanning (and even then I don't understand it completely), so I want to know of other fallacies to look out for so I don't fall victim to them",LPT Request: Identifying common logical fallacies
LifeProTips,"There have been many times I remember the words of an older German acquaintance one time when I was asking myself if I should get this. He replied simply, ""What you have now, you have. Nothing will stop you from getting it now, but something may stop it later. Take it now.""

This applies in many ways. If I see a gift I think someone would like, I buy it then, and if they don't want it, I exchange it. Same for career opportunities. It won't be offered twice, so if you want it, take it.","LPT: From German, ""Was du jetzt hast, hast du."" ""What you have now, you have."" In other words, if there is an item or opportunity that you want available to you at that time, take it. Don't wait, don't come back to it, because the next time it may not be there."
LifeProTips,[deleted],LPT: Deal with the psycho-somatic burden of anxiety by leaning into it. (Paradoxical Intention)
LifeProTips,[removed],"LPT: If you want to pay someone to do a job that you know yourself, but you can't be bothered, always calculate how much time you would do your regular job to earn that money and think about what would you do rather. Laziness is expensive!"
LifeProTips,,LPT: WHEN YOUR DOG WIGGLING ITS TAIL IT MEANS THAT HE/SHE WANTED TO PLAY WITH YOU OR HE/SHE IS HUNGRY.
LifeProTips,[removed],"Post a printout of what to do in case of a kitchen fire, especially if you have kids start using the kitchen (and of course keep fire extinguishers nearby)."
LifeProTips,,LPT: use the label of your towel to know which side you whiped your ass with.
LifeProTips,,LPT: we quickly forget the lessons we learned. And then we have to learn them all over again.
LifeProTips,"      If you post a great photo with beautiful scenery,  interesting costumes, natural phenomena- please add the location or at least the country of the image. 
     There are many times I see something and want to learn more but find it difficult without locations.","LPT, please list location when posting a photo."
LifeProTips,,LPT- Every time your post or comment gets to the magical numbers of 69 and 420 upvotes. Upvote yourself to get past this number.
LifeProTips,,Every time your post or comment gets to the magical numbers of 69 and 420 upvotes. Upvote yourself to get past this number.
LifeProTips,"[This](https://youtu.be/jRLJdp1ZgBA) video will get you started. At first it seems annoying... And then it gets good. So, so good. I use it for more than just suitcases. My entire house is Ranger rolled. Learn it, you won't regret it.","LPT: Learn to fold your clothes, the army way. You will save so much space in your suitcase!"
LifeProTips,[removed],"LPT: If you have something really important to attend in the morning and can't afford to wake up late, set the alarm tone to be your ring tone and put your phone in a walking distance from your bed"
LifeProTips,"For those of you still fine-tuning your adulting, here are a couple cleaning tricks. (Thanks mom)

1. If you're dusting or wiping surfaces stuff will end up on the floor. So do your thing, starting with dusting in the higher places and work your way downwards ending your cleaning routine with sweeping/vacuuming/washing the floors last.


2. Keep separate sets of cloths/rags for use in different areas in the home to help reduce cross-contamination. Eg Don't use dish cloths to wipe surfaces in the bathroom. Don't use hand towels on the floor, etc. If a towel or rag has been demoted to use on the floor, don't use it on a countertop again until it's been through the wash.


3. Wash cleaning cloths/rags separate from bath, hand and face towels. Wash both bundles on high heat with a disinfectant detergent. 


4. If you're a guy who's ever cleaned your own toilet, you'll know that sitting down to pee helps make the life of whoever's cleaning your toilet a little less bleak.","LPT when cleaning your home: Work from top downwars, keep separate sets of cloths, dusters and towels for separate cleaning purposes. Sweep and wash floors at the very end. Sit down to pee."
LifeProTips,,"LPT: If you test the gullibility of a friend or relative by convincing them of an outlandish ""fact,"" be sure to clarify with the truth during the same conversation. Otherwise, they may resent you for lying."
LifeProTips,[removed],The Real Happiness
LifeProTips,"I’m a recent college grad starting a job soon that pays $60k a year in a low-cost area. I have $20k saved up from working since I was 16 years old. I’ve been driving a pretty trashy Volkswagen that constantly breaks down since then. I’m trying to decide whether it would be better if I buy a used fancy car (I.e Mercedes, Audi) or a brand new Honda/Kia for the same price. I’m concerned that if I buy a used car, it’ll have tons of maintenance issues. At the same time, I’d like to have something nice for myself. I plan to get my MBA after working for a few years, and after that, I’d expect my salary to at least double. Should I just wait to buy a brand new fancy car after I have a higher salary?",LPT Request: buy brand new car or used fancy car after graduating?
LifeProTips,[deleted],"LPT: Learn the Ranger Roll folding method. Your clothes will take so much less space. [This](https://youtu.be/jRLJdp1ZgBA) video will get you started. At first it seems annoying... And then it gets good. So, so good. Trust me."
LifeProTips,"There's a quick trip to getting the right pronoun if you're unsure: just try it on its own in a sentence without the other parties.

 For example:

""Her and her mom drove to the house""
Say it without the mom and it sounds like this:

""Her drove to the house""
That sounds like someone imitating a cave man.

Try the other female pronoun instead
""She drove to the house.""
That sounds better.

""She and her mom drove to the house""


Another example:
""Me and her took pictures""
Try it with just me: ""me took pictures""
Cave man!
Try it with just her:
""Her took pictures""
Cave woman!

Try the other pronouns: she and I.
""She and I took pictures""

One more example
""He took a picture of her and I""

Ok break it down
""He took a picture""
Ok no problem..
""He took a picture of her""
Still good...
""He took a picture of I""
This time the cave man was hiding at the end. Try the other first person pronoun:
""He took a picture of me""
""He took a picture of her and me""
 The cave man is gone but who the fuck are all these people? This is getting complicated. Why not use proper nouns to clarify?

""Jon took a picture of me and Jane""","LPT: He, she, me, her and him and I forgot which pronoun to use when multiple people were involved"
LifeProTips,,LPT Request: How to ask for a pay rise.
LifeProTips,[deleted],"LPT: Pay Attention to the smell of your home when you come back from a trip - that's what it smells like to guests all the time, you just get used to it."
LifeProTips,[removed],LPT: You can only see the light in others once you have seen the darkness within yourself.
LifeProTips,[removed],"LPT request: I wanna learn day trading, become a python data scientist &amp; read about 5 personal dev books. Oh &amp; I wanna lose 30 lbs. all this is very is very overwhelming. How do I come up with a game plan?"
LifeProTips,[removed],Learn the Ranger Roll folding method. Your clothes will take so much less space.
LifeProTips,"Always have an answer prepared for this. It shows your ability to be critical of yourself and can self manage. Nothing makes hiring managers roll their eyes more than ""oh I'm a perfectionist"" .","LPT: If a potential employer asks what is your biggest weakness, answer in two parts: an honest things you've struggled with, and how you've worked on it."
LifeProTips,"if it shows you""delete for everyone"" then the message hasn't been opened yet , and if it says delete for me then the message has been seen  and marked as unread                            

it works at least for WhatsApp Facebook  and Instagram","LPT: if you wany to know that your message sent was seen and ""marked as unread"" try deleting it"
LifeProTips,[deleted],"LPT: if you need to do something in a specific time, but cant look at your timer to know how much time you have left, play a song/songs you like that equal to how long youd set your timer."
LifeProTips,[removed],"LPT: If you want to give something away for free, don’t. Charge a small price, that way you can avoid choosing beggars. When the buyer comes to pick it up, you can say it’s free."
LifeProTips,,"If you want to give something away for free, don’t. Charge a small price, that way you can avoid choosing beggars. When the buyer comes to pick it up, you can say it’s free."
LifeProTips,"It can truly be the line between a $50 tow truck ride and a free one, making an attempt to have a chat and improve their days. My car has a habit of breaking down, and I can't tell you how often a nice chat has helped make things so much better.","LPT: Have a nice, polite chat with tow truck drivers/police officers when you're in a jam"
LifeProTips,[deleted],"LPT: If you get lost in the city, don't stop at a gas station to ask for directions. A pizza place's delivery drivers know the area much better."
LifeProTips,"i have this annoying ""friend"". both me and my other friends doesnt like him and want to get rid of him. but dont know how to do it in a nice way. what do i do (age. 15)","LPT request: how do i get rid of a ""friend"" in a nice way."
LifeProTips,,"LPT: burnt sugar stuck on a pot or pan that you can't scrub off? Simple! Add some water to the pan and boil it. The sugar will loosen up and mix with the water, making it easy to pour out"
LifeProTips,,LPT: GUYS I FOUND A CLOTH MASK THAT DOESNT FOG UP GLASSES!!
LifeProTips,,LPT: GUYS I FOUND A CLOTH MASK THAT DOESNT FOG UP GLASSES!!
LifeProTips,"This goes for any liquid dairy in general, but milk is a big one. My husband had me start doing it while we were dating and I thought he was paranoid at first. (Growing up, his mother would buy milk in bulk and by the time they got to the last 1-2 containers, it was roulette at that point. Mind you, he came from a family of 7) Although, this has saved me from wasting ingredients from using spoiled milk multiple times. Earlier today I was about to pour milk onto cereal (I had checked the expiration date and it was was in August.) Last minute I remembered to smell it and turns out it had spoiled. More often than not, your milk will be just fine. But the few times your dairy turns deadly, it will pay off.",LPT: ALWAYS smell your milk before using it
LifeProTips,[deleted],LPT If you’re a man asking a woman out start with a compliment then say “Do you have a boyfriend?” It gives them an easy out and if they are single and interested they will usually say they don’t.
LifeProTips,[removed],LPT: How to write the best ‘leavers speech’ for a work colleague.
LifeProTips,[removed],LTP If you’re a man asking a woman out start with a compliment they ask “Do you have a boyfriend?” It gives them an easy way of out and most of the time if they are single and interested they will say they don’t.
LifeProTips,[removed],If you’re a man asking a woman out open with a compliment then say “Do you have a boyfriend?” It gives them an easy out and if they are even a bit interested they usually say they don’t.
LifeProTips,[removed],"LPT: When doing someone a favor expect nothing in return, and don't hold it over them in the future."
LifeProTips,,How to craft the best ‘leavers speech’.
LifeProTips,,LPT: When making a playlist just call it the current year I.e 2020 and put all your tunes in it for that year that way when you want to get some nostalgia you can go back to the year.
LifeProTips,[deleted],"LPT: If you are given a prepaid debit card as a gift, save it after you spend the money. You can use it to sign up for free trials online without worry about being scammed."
LifeProTips,I worry so much to the point that I have problems getting to sleep and it is causing me to wake up too early and have poor sleep. Has anyone had a problem with this and can share how to stop it and fix it?,LPT Request How to stop worrying.
LifeProTips,Also make sure that if your salary that you are not being purposely misclassified as salary exempt from overtime. An example is If you are called a manager but perform the duties of a front desk person or housekeeper than you are not exempt and should be paid hourly and overtime. Look up the requirements for being exempt and you will see that usually only white collar highly skilled qualify for being exempt.,LPT: If you are being paid salary and are exempt make sure it is at least $684 a week the federal minimum.
LifeProTips,If you’re having an issue with something personal and can imagine them saying to ask others for support you might as well do it. This may only work for some but if a part of yourself is only trying to make sure you’re doing well you’ll be more likely to be kind to yourself,LPT live like you’re trying to make your hero or the person you look up to proud and when you're feeling down or having a hard time imagine them supporting you
LifeProTips,"Never give away stuff for free on social media (charity shops are acceptable). It will attract the bottom of the gene pool and your whole experience will be unpleasant, with no communication and entitled behaviours. Just like the person who was supposed to pick up the kids slide from me today at 2pm from 8 miles away. No comms, they were “leaving now”. Now it’s 8pm.",LPT: Never offer stuff for free
LifeProTips,[deleted],LPT: Use individual snack bags for throwing parties instead of huge ones.
LifeProTips,"For example, videos of you waking up your kids or eating dinner will be way better to watch in the future than Christmas Eve. Remembering how was a whole part of your day for years is better than remembering one unique night in one specific year, so prioritize them.","LPT: If you want to make videos of your children for them later, videos of activities you make daily are more impactful than videos of specific events."
LifeProTips,[removed],Never offer stuff for free
LifeProTips,,LPT: Several clothing retailers are doing their end of season sales right now. Load up your wardrobe for next spring and summer now for cheap!
LifeProTips,,"LPT - (1) Don't take a no from someone who doesn't have the permission to give you a yes. (2) Mean what you say, say what you mean, but don't be mean in how you say it."
LifeProTips,,LPT Need help... How to stop over thinking ?
LifeProTips,[deleted],"LPT: If you need to deal with being called a ""sheep"" remind the person that Wolves are also pack animals who use shared knowledge to increase the packs survivability and for the common good. Sheep make uniformed, panic decisions originating from any member. The person calling you out is the sheep."
LifeProTips,,Need advice.. How to stop over thinking ? Plz help community
LifeProTips,,"1) Don't take a no from someone who can't give you a yes. 2) Say what you mean, and mean what you say, but don't be mean in how you say it."
LifeProTips,,LPT: Straight earrings are the perfect size to eject a SIM card.
LifeProTips,,"If you’re out to eat and you enjoyed the food, thank the kitchen on your way out if you can. They’re not seen as much and therefore not thought of or thanked for the job they do."
LifeProTips,,"To deal with being called a ""sheeple"" by someone for doing the common good - remind them that Wolves are also pack animals who use collective knowledge to strengthen the pack and better their odds of survival. Sheep make panic decisions from any one member. The person calling you it is the sheep."
LifeProTips,"Maybe if you're like me and you generally don't have a lot of new things to talk to someone about, you can easily focus in on their interests. If they talk about a new show they're watching, ask who is in it? What is the plot line? Where are they watching it? Who's their favorite character? You can do this with almost anything they bring up about what they've been up to when they give you an update. But this way you get to keep the conversation going, show interest and they will feel like you really care about them and their interests.","LPT: When you don't have much to say or if you want to direct the conversation away from yourself, ask the person questions about their interests or things they've brought up"
LifeProTips,,"LPT: ""You're right"" is almost always superior to ""I know."""
LifeProTips,"Ink cartridges are obscenely expensive and I always have the print settings on ""black &amp; white"".",LPT request: How to keep printer cartridges from sucking up all the magenta ink when I only ever print in black &amp; white?
LifeProTips,[removed],"LPT: If you're a passenger in a stressful driving driving situation, reassure the driver that they're doing a great job."
LifeProTips,"If you're about to have a drink of something and want it to last longer, or just drink less, have a glass of water before you start. That way you won't drink it all at once just because you're thirsty. It'll last longer, and you might find you didn't actually want it after all, saving you what would have been an unsatisfying beverage.",LPT: Chug a glass of water before drinking something tasty.
LifeProTips,[removed],Chug a glass of water before drinking something tasty.
LifeProTips,"This basically gains relevance when buying something like a car, phone or a laptop. The are certain years wherein the industry overhauls its design or core features - this can leave you with a new product that not only looks outdated but lacks certain feature (based of personal experience).

Industry Insider does not include salespersons; Execs of companies or industry-specific journalists could fall in the category.",LPT: Consult an Industry Insider before making a big purchase
LifeProTips,"When I recently bought mynew house, dealing with the number of different people involved is insane and keeping everything under control can be overwhel,ing.

Mortgage brokers, insurance people, contractors, inspectors, banks, movers, cable and internet, bills, loan servicers, plumbers... it's creating a whole other, significant aspect of your life that requires clear management.

By creating a (123MainStreet at Gmail) account that is used specifically for the house, it has made organizing everything a lot easier. Not only are all your house related digital records in one place, but so are all your contacts for people who you may not need to talk to very often, but may need to get back in touch with 3 years from now. Be sure to use descriptive, searchable words in the title so if you need to find the ""drywall"" guy again at some point down the line, you don't have to try and remember his name...

Edit: People suggesting that using the Google + hack instead, a lot of web forms don't accept + in the data field. It just doesn't work everywhere, the point of a dedicated email is for it to work, seamlesly, everywhere and be distinct from everything else. ","LPT: When buying a house, create a dedicated email address for the house and use it for everything (but only for things) related to the house. Mortgage, insurance, lawn person, contractors, etc. It's so much easier, having it all in one place."
LifeProTips,[removed],"LPT: When you get married, take 5 minutes to review the pronunciation of everybody in the wedding party’s name w/ the DJ/MC before introductions."
LifeProTips,,"LPT: When starting a new job, tell short stories that involve your name or make occasional statements in third person. This will help people learn your name for those who missed/forgot it and will make you more approachable and easier to become part of the social part of your new workplace."
LifeProTips,You should be able to slide a finger under it. Pets grow!,LPT: Take a minute to check if your pet’s collar is too tight.
LifeProTips,[deleted],"LPT: Don’t have serious arguments over text (especially with your SO.) Tone does not translate, comments can be misunderstood, and if things really go south, the messages you send can be used against you. Calling them has a better chance to deescalate the problem."
LifeProTips,,Is your pets collar too tight?
LifeProTips,[removed],LPT: Wash your white socks with your darks and your dark socks with your whites to easily pick them out afterwards.
LifeProTips,,"When starting a new job, tell short stories that involve your name or make occasional statements in third person. This will help people learn your name for those who missed/forgot it and will make you more approachable and easier to become part of the social part of your new workplace."
LifeProTips,[removed],Sunday reflections
LifeProTips,[removed],LPT: Ever wonder why people think so highly of you? It's because they see you for who you truly are not the lie that you have told yourself.
LifeProTips,[removed],"Ever wonder why people think so highly of you? It's because they see you for who you actually are, not the lie that you have told yourself."
LifeProTips,[removed],Plugged plumbing pipes at home...do not use harmful chemical products.
LifeProTips,[deleted],LPT: Want to correct someone without correcting?
LifeProTips,[removed],LPT: Don't propose to your SO or announce a pregnancy at someone else's wedding. It's their day. Not yours. In no case is this a good idea.
LifeProTips,[removed],LPT: You can permanently hide the automated mod posts (the first comment of most subreddits) by blocking the user (bot) that posted it.
LifeProTips,[deleted],"LPT: When your done heating up your pizza rolls in the microwave, tear open all of them just a little bit so they can cool down."
LifeProTips,"
I wish I would have done this. By writing small initials somewhere you can send that person pics in the outfit/playing with toys to let them see the gift in action. 

We wrote down everything on paper for thank you cards but can’t find it anywhere. 

My grandma passed away last year and we can’t remember which gifts were hers to put aside and keep for when our toddler gets older.",LPT: Write the gift-giver’s initials on clothes tags and under toys at baby showers/birthdays to remember who gave the gift
LifeProTips,,Write the gift-giver’s initials on clothes tags and under toys at baby showers/birthdays to remember who gave the gift
LifeProTips,"Redhead here. My spiritual gift is getting sunburned. My mom would put sunscreen on us in the winter before we went sledding. Keep a bottle of aloe in the fridge, the cold will feel amazing. 

On a serious note: Skin cancer is real. Wear sunscreen.",LPT: Keep aloe in the fridge for sunburns.
LifeProTips,[removed],"If you're sleeping on an old mattress that sags, lift up the mattress and put old clothes between the mattress and the box spring. The clothes will lift the compressed area of the mattress leveling it off."
LifeProTips,,Sunburn? Keep the aloe in the fridge.
LifeProTips,[removed],"LPT: The expiration date on children's car seats is bogus. 10-20 years after they expire, you still wouldn't find any degradation of the plastic."
