subreddit,selftext,title
LifeProTips,,"LPT: stick a magnetic box with a spare key under your car, it’s a $10 investment that will eventually save you from a bad situation"
LifeProTips,[removed],"After washing every pair of socks, make sure each is the right way out and stick one into the other before putting them away. When you need a fresh pair next time, no time wasting."
LifeProTips,"You'll be really glad you did when you get a brand new dryer in 8 years because the old one was still under warranty and you have everything, including your proof of purchase.","LPT: When you make a large purchase for your home put the receipt, warranty info, instructions, etc. in a document protector and tape it to the back of the item so you can easily find it in the future."
LifeProTips,[removed],"LPT: If you feed your pets with dry food always put a dollop of wet food or something like that on top, for your pet it’s a nice little treat, and for you it’s a convenient place to put pills your pet may need to take without arousing their suspicions."
LifeProTips,[removed],LPT:If you’re feeling down...
LifeProTips,[removed],If you’re feeling down
LifeProTips,,"LPT: If you have an overstock of things in your home and need to cut back, think you have “X” extra, not “Z” total with “Y” needed and “X” too many. Thinking in total numbers can make you think you aren’t happy with all of them or believe you need to save the overstock for replacements."
LifeProTips,[removed],"LPT: when taking a dump, line your toilet with toilet paper to avoid water splashing your bum"
LifeProTips,"This way, you aren’t throwing away trash into a new bag that will sit around for a day or two and cause the trash to smell up your house more.","LPT: Before taking out the trash, check to see if there is any trash"
LifeProTips,[removed],New Living Situation
LifeProTips,"If you have a smart TV, (even an old one which isn't connected to the Internet) with a USB port on the back, you should be able to plug in a USB stick with video files (.mp4s usually work the best, other types may or may not work, depending on your TV.)

1)Plug it in

2)Then navigate to the drive. For me this is under Video, but it may also come under External Inputs.

3)Find the file like you would on a computer, then click play.

Note that certain USB devices may not work correctly. I also tried an external hard drive, and that didn't work. Your results may vary, and not all TVs or drives are compatible, or support this feature at all.",LPT: Many smart TVs can play video files from a USB stick.
LifeProTips,,LPT: Eating seasonal foods is not only more nutritious but also more economical
LifeProTips,[removed],"Whenever taking a dump, line the toilet with toilet paper to avoid a splishy splashy bum"
LifeProTips,[removed],Frozen bong LPT
LifeProTips,[removed],Frozen bong
LifeProTips,"When we are eating in the garden, we always burn some incense. Food is attracting insects. The moment the incense is depleted, the mosquito's and wasps start to turn up again!",LPT: Burning incense helps to keep away mosquito's and wasps.
LifeProTips,"There are people who say their DM or inboxes and emails are open for people, but they actually are saying out of empathy or a word I won't say here. But I would surely say that before you get to talk to someone you don't know.you need to approach people you know from very close and you need to ask them who are most insecure, alone and vulnerable about their well beings, at times. If you don't understand someone who is your friend or someone you know for so long,how would you understand a stranger? Instead of writing in your bio, do the actual talking to your friends or people you know. My own experiences are devastating however I am pulling through anyhow and I have very few friends whose existence in my life is very minimal. We only talk on several occasions,we talk about the future aspects of life and that's it.I share comic with them just to keep in touch with them. But there are certain days when I am absent,they don't quest about it. My friends are not different than your friends these are the same people who post about mental health but don't know one of their own is suffering from it. They don't know the extent of mental pressure and
physical pain I go through as they see me smiling in my photos and sharing snaps everyday. I have my own worse fears,severe anxiety and anger issues when I don't get myself out of bed and there are worse days when I'm 24 x7 on the bed. I'm just pulling it through. There are days when I want to talk to someone but I find no one in my sights.

So, Learn to understand your people first and then jump to strangers.",LPT Learn to understand your people first and then jump to strangers.
LifeProTips,"My results:

https://imgur.com/a/YeQiVsr","LPT: If your table has water stains, cover the area with a tea towel and iron the towel"
LifeProTips,,LPT: Check the air pressure in your vehicle’s spare tire a few times each year. A tire loses about 1-2 PSI per month.
LifeProTips,,"LPT: Before tying off the line on the flagpole, wrap the line around the pole once. This will keep the line from slapping against the pole in the wind."
LifeProTips,"This is one of those tools I learned in therapy over a decade ago. And it's helped me a lot since. Keep in mind that this is a tool for you to use, but not impose on other people. If someone else is having a difficult time explaining what they are really trying to say, repeat back what they are saying by rephrasing it. Repeat until they say ""that's right"".","LPT: If you feel like someone isn't hearing what you're trying to say, it might be because you're not actually saying what you're trying to say in a clear way."
LifeProTips,[removed],"If your table has water stains, cover the area with a tea towel and iron the towel"
LifeProTips,,"LPT: If you can't afford a security system, just order a sign for a security system for your yard or door online. It will make people think you have a system and deter criminals."
LifeProTips,[removed],Tap the top right corner on reddit. They are giving away a random free medal
LifeProTips,,"LPT: Wipe out your microwave after your make ramen noodles. The steam from the noodles will loosen (most of) dried, stuck on, bits."
LifeProTips,[removed],Parents of college students: make sure your child knows how to follow-up with people they need to contact.
LifeProTips,"Alot of people think that its rude or makes them look bad if they just straight up say they won't be there, instead opting for a last minute cancelation due to some ""unforseen"" circumstances. While there will also be the possibility somthing really does come up and you can't make it, rsvping means food was bought for you. Catering isn't cheap and when you have 10+  diffrent people that cancel at the last minute thats alot of money wasted that didn't have to be. If you know that you aren't interested in attending, be up front about it. Thats way less of a dick move than bailing last minute and costing the host money that didn't need to be wasted.","LPT: If you're invited to a wedding or any event that is catering food, and you know youre not going to come to the event, just be up front about it."
LifeProTips,"I realize there are going to be some polar opposite opinions here - but if you are at all planning a wedding that goes beyond you and your immediate family members and such, getting a wedding planner will save you endless headaches and actually allow you to enjoy the day of your wedding. 

I'm in that phase of life where all my college/high school friends have been getting married, and the difference is literally night and day. I've been to five weddings now where the bride and groom planned the day of, and every single time without fail they've spent the day double and triple checking lists, showing up late to various activities, missing out on things/photos they wanted to take, stressing about whether all the food was going to come out right, and in one case without asking anyone to run out to buy more beer. (If they'd mentioned it to anyone there they would've done it for them.) 

I've been to two weddings where a wedding planner was involved, and all I can say is that the difference is astounding. Even for a small (50 person) wedding it was light-years different. The bride and groom were stress free, everything went like a smoothly oiled machine, and the couple was clearly enjoying dancing on the dance floor instead of figuring out where they'd put the last case of vodka.

I'm not going to say that a wedding planner solves all problems with your wedding, and they are certainly a bit of a luxury expense, and I've definitely heard more than a couple horror stories. But if you want to increase the chance of you enjoying your wedding day - get a wedding planner.",LPT: Get a Wedding Planner
LifeProTips,[removed],"LPT: If you want to start saving time in your life, start by stopping the habit of taking your phone/book to the toilet."
LifeProTips,,"LPT:If you're a smoker, be sure to empty out your ash trays before taking out the trash."
LifeProTips,[removed],LPT How to build a proper commune:
LifeProTips,,LPT: empty the rubbish bin when it is full
LifeProTips,[removed],How to build a proper commune:
LifeProTips,[removed],LPT: Not black? Don’t attend a BLM protest
LifeProTips,,"LPT: instead of using a knife or grater, buy a garlic press to prepare garlic quickly and easily."
LifeProTips,"When in a fight with anyone mostly emotion comes through and wanting to be right, or at least proving the other wrong. 

Even when you don’t know the person, they feel the way they do for a reason. Instead of just flat out arguing - take a second or a few and think logically and not with emotion. Talking with less emotion makes hard conversations a little bit easier, even when it’s about a topic that’s difficult to discuss.","LPT: If you are in a fight with someone, take some time to think logical thoughts before you continue."
LifeProTips,,LPT Always lock your door with your keys so that you will never lock your keys inside
LifeProTips,,"LPT: If someone you barely know tells you their birthday, do not save it in your calendar as this will make you look creepy or like a loser"
LifeProTips,[removed],"If your car was made in 2001 or newer, it most likely can use E-15 gas. E-15 gas is usually cheaper than regular gas, so it can save you some money when filling up."
LifeProTips,Not only for fight nights. If your SO is pregnant she may find the need to sleep alone for extra comfort so sleeping on your couch won't suck that much.,"LPT: when moving in with your SO, consider buying a good couch"
LifeProTips,"It's easy to damage the soft plastic threads in some cheap appliances by essentially cutting a new thread beside the old one, eventually making both fail.",LPT: When putting a screw back into a plastic thread first turn counter clockwise with slight pressure until you hear and feel a click and then slowly screw it in. This way you don't damage the soft plastic thread.
LifeProTips,,LPT: Most instant oatmeal packets can also be used as a measuring cup for how much water/milk to put in your oatmeal before microwaving it. Just fill to the line.
LifeProTips,[removed],Most instant oatmeal packets can also be used as a measuring cup for how much water/milk to put in your oatmeal before microwaving it. Just fill to the line.
LifeProTips,[removed],Prevent shoelace creep
LifeProTips,"So that you don't drop it on your carpeted floor and then crawl around to find it and then get it stuck in your knee, it will be easier to find that way.","LPT: After using a sewing needle, thread it with odd coloured thread before putting it away"
LifeProTips,"Just a small tip if you're someone who gets anxious at weird silences. Also, someone undoubtedly will start talking right when you're about to leave and it always seems like you're cutting them off when you leave.","LPT: If you're leaving a Zoom meeting, first click on ""Leave Meeting"" (not the confirmation though) before saying your goodbyes so there's so no awkward pause afterwards while you try to exit."
LifeProTips,,LPT: Ask parents before posting photos of their kid(s) on social media.
LifeProTips,,LPT: Ask parents before posting a photo of their kid(s) on social media.
LifeProTips,"Almost every post on here is someone giving their option about something that’s happened to them in a passive aggressive way.

As the title suggests, nobody cares how you feel or what you think. The whole world isn’t out to get you, and they don’t wish you ill will, they just simply do not care about your existence. People have enough going on in their lives to worry about offending that person on the bus who thinks everyone should know their pronouns, or upsetting a vegan by eating meat near them.

You don’t have the right to change other people’s perfectly reasonable behaviour because it offends you personally. It is completely unreasonable to think that you are important enough to demand people change their ways for the brief moment they are blessed with your presence.

The key to happiness is to stop making yourself the victim in every situation and learn to enjoy the little things in life. Find a little joy in every day life and you will be happier than ever.",LPT: Nobody cares how you feel or what you think
LifeProTips,"Having a lot of followers on social media doesn’t automatically make you special. Conversely, not having very many followers doesn’t make you any less special. Also, basing happiness on your social media success trains you to conform to what other people like instead of being your true self. A quote I like is: “The race is long, and in the end, it’s only with yourself” by Mary Schmich.",LPT: Don’t base your self worth/happiness on the amount of likes/followers you have on social media.
LifeProTips,[removed],Always lock your door with your keys so that you will never lock your keys inside
LifeProTips,As it can get stuck under the brake pedal or interfere with the gas pedal and course serious damage.,LPT: Stop the car and take up any items you drop by accident close to your feets imidiatly when driving
LifeProTips,[removed],"Tự làm mặt nạ tẩy tế bào chết cho da mặt tại nhà đơn giản, an toàn và rất hiệu quả với hầu hết các nguyên liệu thân quen, có sẵn hoặc dễ tìm."
LifeProTips,"This makes the other person as stress as you may feel after hearing that. It should make it easier for both of you to have the conversation as soon as possible. Additionally, if they ask you what you need to talk about. Tell them that they should go first since they ask first and it’s fairer that way. It’ll make conversations more productive.",LPT: Whenever someone says “we need to talk” always reply with “yes we do”
LifeProTips,[removed],If someone says “we need to talk” always reply “yes we do”
LifeProTips,"We don't use our WIFI router password much since it automatically connects. However, once we need it to share with our friends then we have a hard time remembering it or worse yet we have to reset it.",LPT: Put a sticky note with your Wifi password under your router so you will never have to remember or look for that password again
LifeProTips,[removed],Put a sticky note with your Wifi password under your wifi router so you will never have to remember or look for that password again
LifeProTips,"It is a very sensitive topic and even though you may be interested how the person died, it may be traumatic to the family. Some choose not to tell the method at all",LPT: If a friend completes suicide do not ask the family the method
LifeProTips,"It is a very sensitive topic and even though you may be interested how the person died, it may be traumatic to the family. Some choose not to tell the method at all",LPT: if a friend dies via suicide do ask the family the method
LifeProTips,[removed],US CENSUS - Please fill it out!
LifeProTips,[removed],Be careful leaving magnifying mirrors in rooms with a lot of sun. They can start fires by focusing it on small points.
LifeProTips,"Dealerships always have room to negotiate on service. 


Just took my car in for service. Cost was going to be over $2600 plus tax. With some very easy negotiating, I talked them down to $2000 plus tax and a few added services for free.  


Never be afraid to ask a service department to come down on their price.",LPT: You can negotiate with service departments at Car Dealerships on the price of the parts and service being done to your car.
LifeProTips,[removed],LPT: US Election - Worried about Corona Virus or long queues on election day try mail in voting.
LifeProTips,This will save you significant effort later if you end up needing to plug something in there later. I recommend using one with a flat/low profile plug so it doesn't interfere with the clearance of your furniture against the wall.,"LPT: before placing any pieces of large furniture against a wall, plug an extension cord or power strip into any electrical outlets you're about to cover up, even if not needed at the time."
LifeProTips,I was replacing the water filer in my fridge yesterday and somehow snapped the nozzle..... this caused an insane amount of water to come out in the time it took for me to finally find my water shut off valve. Lesson learned!,"LPT: Take the time out of your day today to find where your shut off valves are for the water and gas supply to your home. Even if you are renting, it is important to know in case of emergency!"
LifeProTips,"**Disclaimer: Some people use these forums as their only support system. If this is you, please disregard this entire post.** 

Read this: [https://www.psychologylounge.com/why-you-should-not-read-online-illness-or-medication-forums/](https://www.psychologylounge.com/why-you-should-not-read-online-illness-or-medication-forums/)

TLDR: 

1. The people on these message boards are generally are newcomers, or longtime (and worst sufferers) of the illness(es). Many people with the same illness, who lead healthy and productive lives via treatment/medication, do not frequent such message boards to balance out the negative experiences with positive/hopeful ones.
2. Many people on these boards suffer from debilitating side effects from their medication and often post about these side effects. When others read these posts, they become hesitant/fearful to start taking medication, not knowing that many similar patients with the same medication may have no issues at all. Again, the latter group are generally not the ones to visit and post their experiences.
3. The two things above will make newcomers (even those with mild cases) terrified, depressed, and think that their life is over.","LPT: Stay away from internet messages boards, forums, and subreddits related to your health or medical condition(s)"
LifeProTips,"don't know if somebody said this before, but always choose 'update &amp; restart' instead 'update &amp; shutdown' in Ms. Windows. If you choose the last option, you'll still have to wait (possibly a lot) the next time that you want to use you computer for the remaining part of the update process","LPT If damn Microsoft Windows give you just 2 options: 'update &amp; restart' and 'update &amp; shutdown', choose 'update &amp; restart'!"
LifeProTips,,"LPT: I was today years old when I realized that there are actually hotkeys you can press while watching YouTube videos. They are: i, j, k, l along with both the period and comma. I don't think I'll be using them much, but it's a cool feature."
LifeProTips,[removed],"I was today years old when I realized that there are actually hotkeys you can press while watching YouTube videos. They are: i, j, k, l along with both the period and comma. I don't think I'll be using them much, but it's a cool feature."
LifeProTips,"When I got my first graduate job I had literally £30 until payday, and only a handful of suitable smart casual clothes. It took a little bit of trial and error, but over the next few years I learned a lot about how to spend the minimum and keep up a professional appearance. 

Choose natural fibres like cotton, linen or wool over polyester if you can, as they wash better and will keep you cool in an overheated office

Buy classic, plain colours like olive, navy, black, grey, beige and white, as you can mix and match. It might not be your style, but if you keep it simple you can’t fuck it up, and people are less likely to spot you rewearing the same items again and again. 

Inexpensive clothes can be sloppily made, but you can hide that by cutting off any loose threads at the ends of seams, checking for loose buttons and resewing, ironing flat puckered seams. 

Even the cheapest men’s clothes are often better made than the female equivalent. A plain white T shirt in size S or M from the men’s basics section with the bottom 3 inches cut off is way better. 

A dab of clear nail polish to the thread in the middle of shirt buttons will stop them unravelling and falling off. If your shirt doesn’t come with a spare sewn to the label, you can take a button from the bottom and move it up. 

Don’t wash your clothes too often as it wears out your clothes - provided you have good hygiene yourself you can usually get at least a couple of wears out of tops and shirts, more for trousers and skirts.

A hand-held clothes steamer is quicker and takes up less space than an ironing board. You can get one for under £20 and you’ll look 100% more groomed if your clothes are crease free and hanging right. 

You can’t save money everywhere - cheap accessories look cheap, and it’s better to buy a leather belt and bag second hand than plastic lookalikes. Unfortunately I never found a way round the expense of shoes - for the sake of your feet it’s best to buy those new, as expensive as you can afford. 

I really wish someone had explained these things to me - it would have saved me a lot of bad outfits and sloppy dressing. Hope you find them useful.",LPT: Looking polished and professional on a budget
LifeProTips,[removed],"If damn Microsoft Windows give you just 2 options: 'update &amp; restart' and 'update &amp; shutdown', choose 'update &amp; restart'!"
LifeProTips,"All you have to do is:

1.) Fill a gallon-size Ziploc bag with pork rinds and use a rolling pin to crush them down into a fine powder.

2.) Toss whichever seasonings you want into the bag, and shake it up well.

3.) Coat the chicken with an egg wash and cover them with the crumbs.

4.) Fry and enjoy!

Your chicken will turn out a bit crisper and should still have that beautiful, golden-brown look. They also won't sustain the flavor of the pork rinds. If you didn't tell anyone that that's what you used, they'd probably never know. I personally prefer the flavor and consistency over traditional breading.

Because the only carbs from pork rinds come from whichever flavorings they use (usually negligible anyway), original pork rinds are carb-free and a great way to curb the munchies on a low/no-carb diet.","LPT: You can still have delicious, homemade fried chicken or chicken tenders while on a low/no-carb diet by substituting the flour or bread crumbs with pork rinds."
LifeProTips,"I started skipping breakfast when I started working, and realized how little concept of eating three meals a day is overrated.  Most of my meals averaged around 5$.  By skipping even one meal a day I was able to roughly save $1,825 a year.",LPT: Forgo a meal a day to save money.
LifeProTips,"Read this: [https://www.psychologylounge.com/why-you-should-not-read-online-illness-or-medication-forums/](https://www.psychologylounge.com/why-you-should-not-read-online-illness-or-medication-forums/)

&amp;#x200B;

TLDR: 

1. The people on these message boards are generally are newcomers, or longtime (and worst sufferers) of the illness(es). Many people with the same illness, who lead healthy and productive lives via treatment/medication, do not frequent such message boards to balance out the negative experiences with positive/hopeful ones.
2. Many people on these boards suffer from debilitating side effects from their medication and often post about these side effects. When others read these posts, they become hesitant/fearful to start taking medication, not knowing that many similar patients with the same medication may have no issues at all. Again, the latter group are generally not the ones to visit and post their experiences.
3. The two things above will make newcomers (even those with mild cases) terrified, depressed, and think that their life is over.","LPT: Stay away from internet messages boards, forums, or subreddits related to your health or medical condition(s)"
LifeProTips,"You can download Maps of whatever areas you want in Google maps that way when you're there, your phone will use the downloaded map if you lose cell service. This was helpful for me when I was traveling in Wisconsin and an entire city's Sprint Service went down and I had no way to get home, but thankfully I had the map downloaded and it got me far enough to get service again!","LPT: If you're traveling to somewhere you haven't been before, and you're not sure you'll have good cell reception, download the map of the area in Google maps using their offline maps feature so you won't find yourself lost if you lose coverage!"
LifeProTips,"You can carry way more, has compartments for spare bags if necessary. No handles cutting into your hands. In fact both hands are free and I'm carrying a weeks worth of shopping home as I type this!",LPT: Use a travelling backpack instead of plastic bags for shopping.
LifeProTips,[removed],Looking polished on a budget
