subreddit,selftext,title
LifeProTips,,"LPT: If you store important documents on google drive, you should periodically download a local copy in case Google has an outage. It's easy to do by simply going to https://takeout.google.com/, deselect all, and only select Drive, click Next and follow instructions."
LifeProTips,"A lot of people say short people have a grudge against the world for being short that’s not necessarily the case. I don’t mind being short, that often I mean it definitely has its negatives. But I’m not mad at the world for my height. I’m mad that I’ve been constantly bullied my entire life for something I cannot control. It is a form of body shaming and it kind of sucks. Obviously there is a time and place for jokes about people’s height, maybe with your good friends but I swear it comes up way to often and it kind of sucks. There’s already a lot of prejudice against shorter people so just adding onto it by bullying them is just a dick move. Some short people love short jokes about them but not everyone. It’s just kind of rude, you can’t say you are body positive if you are going bash on someone solely because of their height.",Lpt your short friends do not like being made fun of because of their height all the time
LifeProTips,If you start a screen recording on an iPhone the time in the top left hand corner will glow. When you want to finish your recording just tap the glowing red button and it will end your video right then! That way you won’t have to record yourself opening the control center to tap the button to stop it,LPT: Tap the red button in the corner of your phone to end a screen recording—no need to reopen Control Center!
LifeProTips,"Step 1-Track your normal day expenditure (without exercise)

Step 2- Track calories burned through exercise (if any)

Step 1+2 is your calories for the day, track your meals for this value adjust accordingly to your goal lose weight eat less gain weight eat more (calories)


Simple yet effective, I'm tired of constantly seeing, you can only eat this or that diets, no, you can eat whatever as long as at the end of the day your calories are accounted.",LPT if u want to lose/ gain weight track calories
LifeProTips,"This works on adults too, and is particularly effective with smart kids who figure they'll just zone out at whatever learning pace they're spoonfed as rebellion to the lesson or other things unrelated.","LPT: If you want to teach a fact adversely, get the fact wrong and pick a fight over it."
LifeProTips,[removed],the ghost city in Japan
LifeProTips,"
I’ve been seeing a lot of slacktavists on reddit and social media lately all patting themselves on the back how good a person they are cause a lot of people liked or saw something they reposted online. People saying how if you don’t agree with them you are a problem etc. which sure there’s some merit to educating people, but at some point you actually have to take action. Putting stories up to the same echo chamber for months does not really do as much as you think even if you believe you are so woke and helping. What you can do is volunteer at a boys and girls club, food banks, homeless shelters. 1 day at any one of those places has such a larger impact on individual and groups than you posting to your 500 followers on Instagram about how they are bad people and need to change to be as good as you are. Put in the work earn, become a real activist, make a real impact, stop blaming everyone else for issues. You’ll feel like a better person and help so many more people. There’s no excuses if you got time to post, you got time to help. Go out and be the change! Remember face book likes don’t save the starving children in Africa or solve racial inequality in America. Don’t take the easy way out get your hands dirty and help :)",LPT Community service is a brilliant way to combat inequality and it seems to be forgotten about
LifeProTips,"**TL;DR** Many car insurance adjusters' systems use a geographical search radius for specific types of cars. If you have a lesser popular/known car, you might benefit by expanding the search radius to include more comparisons. 

Late last year, I was involved in an accident, caused by someone, else that ended up totaling my car--a decade old Hyundai. They were at fault and luckily they had insurance that agreed to pay for damaged.

I chatted with the adjuster for a little and stood nearby while he did his thing. He then informed me the car would be considered totaled and then provided me the amount they would pay.

Having done my research on the value of the car, their number seemed WAY off--like $1500 off.

I asked out him how many cars his system was comparing to. He said six. That's terribly low. I then asked him if he could expand the search radius further because comparing to 6 cars only doesn't make sense.

He did and the number of cars when up considerably, as did the value--about $1300 more.

I agreed on this amount and they hauled the car away shortly after.

Insurance companies want to pay you as little as possible. Push and press and poke them to pay you what you deserve and what is right.","LPT: If the price an insurance adjuster gives you seems low when your car gets totaled, ask them how many cars they are comparing to and to try expanding the search radius."
LifeProTips,,LPT “weary” means tired. “Wary” and “leery” mean cautious or suspicious.
LifeProTips,[removed],Community service is a brilliant way to combat inequality and it seems to be forgotten about
LifeProTips,"You appear inverted to others, but when you press ""Effects"" other see you how you see yourself.","LPT To flip your image while FaceTiming on your phone, select ""Effects"""
LifeProTips,Developer's put out new updates before the weekend. There are always going to be bugs in any update. So once the weekend is over they have time to fix any bugs from the new update on Monday putting the bug fixes into effect on tuesday.,"LPT: The best time to update you phones apps is Friday and Tuesday, as those are the days ""most"" developers put out updates and bug fixes."
LifeProTips,"If you live in the US, sign up for [Informed Delivery Digest](https://informeddelivery.usps.com/box/pages/intro/start.action) from USPS which sends you electronic scans of all your mail to be received each day. I've used it twice in the last few months. First, The IRS sent me a letter after the date I was supposed to reply by and I used it to prove that I received the letter late. Second, I received a check from a company that never was in my mailbox so I was able to call them and get a stop pay on the check and get it reissued.   
It's also just sweet to see what's gonna be in your mailbox on any given day!",LPT: Sign up for Informed Delivery Digest
LifeProTips,,LPT Always imagine your CEO reading your business emails before you send them out. Make sure they are appropriate. You never know what will get forwarded!
LifeProTips,Some people will just ignore car alarms unaware that it could be theirs getting jacked.,LPT: Get to know your cars alarm
LifeProTips,Settings &gt; General Settings &gt; Default notification action,"LPT : Set default notification action on Gmail app to delete, for an uncluttered inbox"
LifeProTips,[removed],Wanna a free steam key?
LifeProTips,"Most unmarked police vehicles will be black or dark blue and will have steel rims with no visible bolts, instead of the standard aluminum rims or hubcaps that most cars have.

Always good to be aware of your surroundings while on the road.","LPT: In order to identify unmarked police cars, look at the bottom of the rear and front windshields, to see whether there is an additional row of police lights (low profile) installed."
LifeProTips,[removed],"LPT: Picking Berries (or peaches or whatever) is one of the most wholesome, safe, and rewarding ways to spend a sunny summer day with folks in your quarantine bubble. And NOW is the time!"
LifeProTips,[removed],"LPT: if you wear your glasses OVER your mask, they won't fog up as much"
LifeProTips,"To increase your overall happiness, it is very  helpful to write a little ""Diary of Thanking"" - Write down 5 to 10 things you really appreciate and that either happened or people you'd miss when they're gone.... it doesn't matter WHAT you're thankful for.  


[This video can give you a much better explanation](https://www.youtube.com/watch?v=WPPPFqsECz0)",LPT: Fight your own dissatisfaction and write down what you appreciate
LifeProTips,[removed],"LPT: Always masturbate twice before starting an argument with your girlfriend, so that she won't be able to seduce you"
LifeProTips,[removed],Remember: having history together isn't the same thing as trust.
LifeProTips,,"LPT: If you have to get up early in the morning but still feel really drowsy, go and stretch from top to bottom, nice and slow. It will wake up your muscles and give you some energy to start the day."
LifeProTips,,"LPT Be weary of Reddit posts/accounts that make it to the front page - many of them are bots, paid users or propaganda. Check their post history and if they‘ve made hundreds of posts in the past month with 100k+ karma, they have an agenda"
LifeProTips,[removed],LPT after you're done with your mask cut the ear straps so wildlife doesn't get stuck in it!
LifeProTips,[removed],"Be weary of Reddit posts/accounts that make it to the front page - many of them are bots, paid users or propaganda. Check their post history and if they‘ve made hundreds of posts in the past month with 100k+ karma, they’re trying to manipulate you"
LifeProTips,,"LPT: If you are walking on a sidewalk and a person Is coming from the opposite direction, look straight at one of their shoulders so they will know which side of the sidewalk pick to let you pass"
LifeProTips,[removed],Before starting an argument with your girlfriend
LifeProTips,,LPT: Go to your shower right now and throw out all the empty shampoo bottles/trash
LifeProTips,[removed],"YSK If you wear glasses OVER the top of your mask, they won't fog up as often."
LifeProTips," Let's face it, giving feedback is hard. Starting the conversation is harder. Try this.

If they say no, you can figure out what needs to be overcome before they are in a place to accept it.

If they say yes, you have an open door to get into the details of your feedback.","LPT: Before you attempt to deliver feedback ask the recipient ""Are you open to some feedback?"""
LifeProTips,"I hate people who do it, you want attention that bad? Just don’t.","LPT if you see a chain of comments, don’t interrupt!"
LifeProTips,[removed],LPT: Ordering a large print job? Order a small one first for a returner’s discount
LifeProTips,[removed],"Before you attempt to deliver feedback ask the recipient ""Are you open to some feedback?"""
LifeProTips,[removed],Ordering a large print job? Order a small one first for a returner’s discount
LifeProTips,"Doing this, people won't ask for ""What he said?"", instead they will see the message. 

&amp;#x200B;

NOTE: If you feel that comment is breaking the rules of the sub, **do not quote it**. Let it get deleted by the mods.","LPT: When someone's comment is being downvoted or you feel he's gonna delete it when you answer it, QUOTE THE COMMENT so it gets copied into your comment."
LifeProTips,[removed],LPT: Apply sunscreen 20-30min before going outside or doing activities. It needs to absorb into your skin for it to work best.
LifeProTips,,"LPT: Don't ever, for any reason, do anything to anyone for any reason ever, no matter what, no matter where, or who, or who you are with, or where you are going, or where you've been... ever, for any reason whatsoever..."
LifeProTips,"You can set most credit cards to message you when your account has been used over a limit of x dollars set it at 5 and you'll know everytime your card is used to help Protect against fraud, overcharging etc. 


Warning: this is not for everyone. Might start your day off shitty for some to he reminded broke you are. Just remember money is not everything, just because you are poor does not mean you are a failure or less than other people. You most certainly matter. You will make it through the hard times just focus on doing 1% better a day or week and over time things will change.",LPT: if you need a better hold on your finances most banks have a notification system where you can get a text sent every morning of your balance.
LifeProTips,[removed],"LPT: In these times of mask wearing, go to the frozen section first before you hit the produce section. That way when you go to open produce bags you can use the moisture off the frozen good in place of licking your fingers."
LifeProTips,I just did. TBH I feel like I waste my time reading stuff from this subreddit when scrolling the main page. Probably will get roasted for it but it's my belief so I'm standing by it.,LPT: Unsubscribe from r/LifeProTips
LifeProTips,[removed],Lifeprotip: Unsubscribe from r/Lifeprotip
LifeProTips,[removed],"LPT: When navigating someone who's driving and about to take a wrong turn, never scream or use a panicked voice - this is a leading cause of accidents, try to tell them in a calm voice and if they don't have the time to make the correct turn, then they shouldn't risk it anyway."
LifeProTips,,"LPT: DON'T switch to airplane mode when playing a game, just turn off the data and WiFi. That way, if an emergency happens, people are still able to call you."
LifeProTips,[removed],"LPT: to avoid bumps when shaving your nether regions, remember to go with the grain, not against it."
LifeProTips,,"LPT: if booking an Airbnb or VRBO in a popular vacation spot, make sure to check the property owner section. If the listed owner is a local property management company, Google the company and book directly through their website to save hundreds in fees"
LifeProTips,,"LPT: If you need to turn on the light when getting out of bed in the middle of the night, cover one eye with your hand. When you turn the light off again, you'll be able to see clearly with the eye that was covered so you don't run into anything."
LifeProTips,[removed],"LPT: Don't chew on mints while wearing a mask and glasses, its like pepper spraying yourself with your own breath"
LifeProTips,[removed],"If you need to turn on the light when getting out of bed in the middle of the night, cover one eye with your hand. When you turn the light off again, you'll be able to see clearly with the eye that was covered so you don't run into anything."
LifeProTips,"Every time i realize i drank to much alcohol, i try to throw up. You can use your finger, but this is a very unpleasent experience which is why drinking a lot water (up to 2l for me) alone can handle your job or makes it a lot easier to get rid of the alcohol by hand.",LPT Drink as much water as you can to the point where you either throw up or notice that you are not able to vomit. Either way you are avoiding or atleast lowering the symptoms of a hangover.
LifeProTips,[removed],Trip to london
LifeProTips,,"LPT If a grocery store has a sale and the item is empty on the shelves check the end caps, sale items are usually put there as well."
LifeProTips,"I always have had anxiety over dirty/messy areas. So when my kids would eat and get crumbs on their tray table or floor it would raise my anxiety. Crumbs are annoying to get up with your hand or napkin. The vacuum made things so much easier and I don’t have any anxiety when they eat messy stuff now. 

Clean up takes 2 seconds. It’s also great for dog hair on hardwood. My husky sheds like crazy. I get my kids to chase the tumbleweeds with the vacuum. They love it. Seems like a stupid pro tip but it’s definitely the best thing I’ve bought in years lol.",LPT: If you have kids/messy adults buy yourself a chargeable handheld vacuum. (Got one off amazon for $15)
LifeProTips,[removed],Negativity is Temporary
LifeProTips,[removed],"LPT: If you don't have COVID-19 symptoms and don't have the money/insurance to get tested for COVID, donate blood to the American Red Cross (if you meet the requirements). They test eligible donations for antibodies."
LifeProTips,"Disclaimer: It’s a lot of work. 

Download: VLC and Documents. 
(Any app that plays sound files and allows you to browse through files)

1- Export the Whatsapp chat to Documents. 
2- Open the audio file in Documents. 
3- From documents, press the Open With button and choose VLC. 

Voila, from VLC you’ll be able to listen to what a person recorded without needing them to know.

Of course someone will find an easier way to do it.
Hopefully, in the comments.",LPT: Whatsapp: How to listen to audio messages without showing the sender that you’ve listened to it.
LifeProTips,[removed],"When navigating someone who's driving and about to take a wrong turn, never scream or use a panicked voice - this is a leading cause of accidents, try to tell them in a calm voice and if they don't have the time to make the correct turn, then they shouldn't risk it anyway."
LifeProTips,[removed],Make sure your kids know to never reset their iPhone if they've locked out their Apple ID and also verify that the Apple ID recovery # and email is yours.
LifeProTips,"Water stuck in your ear is annoying, but when you slam your head sideways on a pillow, the water will be removed. It really works.","LPT: To remove water from your ear after swimming, slam your head sideways on a pillow."
LifeProTips,[removed],"When you're making a playlist of your songs on YouTube, use lyric videos, not music videos!"
LifeProTips,"Note: Since this fits into many categories, I selected miscellaneous as my flair. Please correct me if I’m wrong. 

Many states, if not all, have a website where they auction surplus items to the public. Google “state name” and surplus to find your state’s site(s). Some states may have two sites, so look around. You’d be amazed what you can find for sale!


https://www.usa.gov/state-surplus-sales","LPT: check your state’s surplus website for inexpensive cars, office equipment, sometimes even land."
LifeProTips,[removed],LPT: No need to get fancy with fruit fly traps. Simply leave a tad of red wine in the bottle and set it out. The flies will be attracted to the fragrance and drown in the wine.
LifeProTips,"By compressing your chest you keep your blood in your upper body, therefore keeping you from going lightheaded. It makes your head hurt a little for a few seconds but it's worth doing.",LPT: compress your chest with your abs when you stand up quickly to avoid getting lightheaded
LifeProTips,,"LPT If you ever play a mobile game play it in airplane mode, so you won’t get ads."
LifeProTips,[removed],"If you ever play a mobile game play it in airplane mode, so you won’t get ads."
LifeProTips,[removed],No need to get fancy with fruit fly traps. Simply leave a tad of red wine in the bottle and set it out. The flies will be attracted to the fragrance and drown in the wine.
LifeProTips,It really boils my beans when I see a screen recording and someone ends it by swiping up and pressing the record button again to end it.,"LPT: If you’re using the screen record function on an iOS device, you can end the recording by pressing the lock button."
LifeProTips,[removed],"When entering a porta-potty, slightly open the door then wait briefly, then open it all the way. It's pretty common that people forget to flip the lock."
LifeProTips,,"LPT Always clean your house before you go on vacation, coming home to a dirty house is the worst!"
LifeProTips,[removed],How to Get out of a Rut (6 Useful Ways to Get Unstuck)
LifeProTips,The sheet doesn't slide off anymore. Changed my life for the better.,"LPT: When changing bedsheets, tie a knot on all four corners before tucking in the sheet below the bed."
LifeProTips,[removed],"Whenever you post the latest scandal news from Don (in any medium), make sure to include a one line summary of the previous two scandals for reference."
LifeProTips,[removed],LPT: Someone not wearing a mask and invading your personal space in a grocery store? Fart on them
LifeProTips,If the installation team damages your property the claims office will be closed and you will have to wait until Monday to get help.,LPT: Don't schedule an appliance delivery and installation on a Saturday.
LifeProTips,Even if your employer encourages open dialog. Don’t do it. Do not open yourself up to termination. Keep your opinions to yourself. Work is a place to discuss work not hot button items. Even if you know you are correct. Or woke. Or whatever.,"LPT: do not under any circumstance discuss race, religion, or politics at work"
LifeProTips,[removed],LPT: For selecting a proper life pro tip. Go and read the rules of this sub. [META]
LifeProTips,"This is, by far, the quote that hit me the hardest.

Thankful to whoever who wrote this. :)","LPT: “Best career advice that I can give: Don't ever attach yourself to a person, a place, a company, an organization or a project. Attach yourself to a mission, a calling, a purpose ONLY. That's how you keep your power &amp; your peace.”"
LifeProTips,[removed],[META] For selecting a proper life pro tip. Go and read the rules of this sub.
LifeProTips,"This is also applicable for virtual communication like emails and texting. When dealing with email, you'll usually have all your questions in one email. , list them out with bullet points so your recipient can respond to each one easily and it's clear if they decided to skip answering one. When texting/messaging, I ask questions one by one and sometimes preface the conversation with ""I've got a couple questions for you about...."" so they know to expect several","LPT: When asking questions, start with the most important question to you. Discuss the question until you are satisfied with the answer and then move on to the next one. When faced with multiple questions people tend to answer the one that's the easiest, divert the conversation and ignore the others"
LifeProTips,"1. If the ball is deflated there could be a problem with the ball. Might be a leak. Better to play it safe and buy one that is nice full.
2. Even if it doesn't have a leak and is just out if air, you'll have to refill when you get home. And putting the inflating needle into a deflated ball sucks and you can damage the ball and cause a leak.","LPT: When you buy a ball(soccer, football, volleyball, etc) don't just grab one off the shelf, feel them and buy one that is well inflated."
LifeProTips,"I'm just looking at my monitors and thinking how superior would a different arrangement be in my case.

It applies to so many various things. You want a tattoo? Make it your wallpaper or even better - get a temporary one for a while. 
Deciding on a new paint? Get a few samplera first that you can later cover with your final color.",LPT: Before making something fixed try out a desired setting you want to mount it in to avoid changing it later on.
LifeProTips,,"LPT: In many industries, the most irreplaceable skill to have is the relationships you have built with customers over time. When layoffs come, most technical skills are replaceable, often at a lower cost. Management is usually very leery of severing a great connection between employee and customer."
LifeProTips,[removed],LPT most online keto and diet pill retailers will offer you a postage and packaging only offer for your first purchase then without telling you will enter you into a recurring payment for a high amount that will debit monthly.
LifeProTips,[removed],Before making something fixed always try out the setting you want to mount something in to avoid changing it later on.
LifeProTips,[removed],"When you by a ball(soccer ball, football, volleyball, etc), try to buy one that is well inflated."
LifeProTips,[removed],If you are with a girl who cannot ever figure out what they want to eat do the 4/2/1 method.
LifeProTips,[removed],"LPT: Use Z-Lib.org, when you write essays for University."
LifeProTips,[removed],"When changing bedsheets, tie a knot on all four corners before tucking in the sheet below the bed."
LifeProTips,,LPT: Buy a leather bag knowing that it looks great when brand new but will lose it's shape as it ages and gets broken in making it look damaged.
LifeProTips,[removed],Save lots of money before u buy a pet.
LifeProTips,"For example, if I typed “reddit” into the address bar and pressed CTRL + ENTER, it becomes www.reddit.com and opens Reddit!",LPT: Tired of typing typing www. and .com? Press CTRL + ENTER to automatically fill them in!
LifeProTips,[removed],"Tired of typing www. and .com, press CTRL + ENTER to automatically fill them in!"
LifeProTips,"... if you don’t want the sender notified you’ve read the message. Not exactly James Bond and I’m sure someone has a better solution (always willing to learn!), but it’s helped me out a few times.","LPT: If you’re trying to read a message on Messenger or WhatsApp without opening it, turn your phone to landscape mode. You may not be able to read the whole the whole thing, but certainly a lot more."
LifeProTips,"To put it simply, sodium can hurt you in two main ways

1: makes your body hold water, preventing you from noticing your progress ""losing pounds/kilos""  when trying to lose weight.

2: High sodium intake is one of the main causes for high blood pressure, which is just as bad as diabetes.","LPT: When trying to lose weight, it's just as important ""if not more"" to watch your sodium intake as much as you watch your sugar intake"
LifeProTips,[removed],"When trying to lose weight, it's just as important ""if not more"" to watch your sodium intake as you watch your sugar intake"
