subreddit,selftext,title
LifeProTips,,"LPT: Who you vote for is secret. If you've been behind a politician who you kinda want to NOT vote for now, you can do it secretly and without anyone you know finding out. If you can't switch back publicly, you can at least do it in the voting booth."
LifeProTips,"Plus, you probably won't have many instances to look through anyway.","LPT: When editing a paper or similar, do a text search of the word ""form"". It is a very common misspelling of the word ""from"" and many times is not picked up by spell-check or by re-reading the paper."
LifeProTips,"This relates to me very well. I'm 15 years old and am rather infamous for being a picky eater. I'm not as bad as I used to be, but I'll admit I'm still pretty bad.

Part of the reason I hardly ever try new food is because somebody always has to make a comment if I do. It's like me actually trying to eat something new is like taking my first steps. People act so shocked. If people would just leave me alone and let me do what I want without making me feel weird, maybe it would actually help me be able to branch out. Another one for me is music. I always told my family I didn't like music when I was younger and honestly at the time I didn't. Now I actually listen to music several times a day, but my family has no idea and still thinks I dislike music because I know it will go exactly the same way as it does with food. Then whenever my dad asks who sings a song or something and I actually know who it is he's like ""but you don't know anything about music"" and it's just awkward for me because I don't want to admit.

Not sure if anybody else feels this way, but it does bug me.",LPT: Don't act surprised when someone changes or does something different. Instead act like it's normal
LifeProTips,"       Instead of saying sorry and making the other person also feel bad since you feel bad, say thank you, Like for example don’t say “sorry I was late”, but say “Thanks for waiting for me”, because that makes them feel good about themselves and makes them not feel that bad for the problem.","LPT, don’t say sorry"
LifeProTips,,"LPT: If you enjoy the edge pieces of a brownie more than you do the center, make them in a cupcake/muffin pan instead."
LifeProTips,"I used to have contracted internet/cable with my apartment complex and literally did not have a choice. I've had a 100% success rate immediately getting out of the conversations with people selling internet/electricity in supermarkets by telling them I have the contract, even now. They know that some apartments have contracts and that there is no use in even trying to sell to you if you have a contract.

For reference: in the terms of my rent I was legally obligated to pay for the contracted service whether or not I even had it installed and running.",LPT: Tell people selling electricity/cable/etc in stores that your apartment has a contract for the services and you don't have a decision.
LifeProTips,"hehe 

from r/goodboye",LPT: pretend to be afraid of the vet so they give you more treats
LifeProTips,[removed],pretend to be afraid of the vet so they give you more treats
LifeProTips,[removed],LPT: wear a damn mask
LifeProTips,"My native language is English. However, I have found it very helpful and fun to give my Google commands in different languages I am trying to learn. It is challenging and super exciting when you get them right. You learn simple commands and it helps with vocabulary a lot. Plus, asking Google what the weather is in Japanese is pretty impressive in front of people who are not so ready. Maybe this will be fun for you. Thanks.",LPT: You can speak to Google in different languages to make commands for home and Google assistant even if your native language setting is x.
LifeProTips,,"LPT: When we're about to die, we see a light at the end of the tunnel because our metabolism slows down. In the eye, the peripheral photoreceptors are deactivated before those at the centre of the retina."
LifeProTips,[removed],"When we're about to die, we see a light at the end of the tunnel because our metabolism slows down. In the eye, the peripheral photoreceptors are deactivated before those at the center of the retina."
LifeProTips,"Get a paper towel/napkin, put a solid dab of olive oil on it, rub it on the bite, and give it 1-2 minutes and it’ll stop itching.",LPT: Mosquito bites won’t itch if you put olive oil on it.
LifeProTips,[removed],How can I increase my breast size?
LifeProTips,[removed],Mosquito bites won't itch if you put olive oil on them
LifeProTips,"For instance, if your email is FirstnameLastname@gmail.com , but you've already used that email to register for something, register using Firstname.Lastname@gmail.com, you'll still get the verification email but the website thinks it's a different email.","LPT - Most mail servers disregard periods in email addresses, so if you need to register for something with a new email, add a period to it -most websites will recognize it as a unique email but emails sent to that address will be received normally, example below"
LifeProTips,"By that I mean any food/drink you have on very special occasions, prepared by a significant family member in your life, the food will lose that sentimental feeling which can be attached to a good memory.

Same thing applies for foods we absolutely adore for being a delicious dish or even a store bought item, such as a yoghurt of a certain flavour - my mouth used to water every single time I ate one, but once I could buy it myself on a fairly regular basis, it lost the ‘charm’. Don’t get me wrong, it’s still very enjoyable, but it definitely diminished the ‘impact’. 

My formatting and sentence layout probably suffered because I am tired, but I hope my point is somewhat clear - reserve those special foods for special occasions :)",LPT: Never eat something special/occasional like it’s a normal thing
LifeProTips,[removed],Drunk Driving
LifeProTips,[removed],Oreos on forks
LifeProTips,After the shower the fogged up mirror allows you to clean it really well and it's really easy,LPT: After you take a shower use a towel to wipe down the mirror to clean it
LifeProTips,,"LPT: Clean out the fridge of spoiled / expired food just before you leave to do your grocery shopping. You will know exactly what you have and don't have, and there will be room in the fridge for the new stuff when you get back."
LifeProTips,,"LPT: Clean out the fridge of spoiled / expired food just before you leave to do you're grocery shopping. You will know exactly what you have and don't have, and there will be room in the fridge for the new stuff when you get back."
LifeProTips,"For example, I speak English natively and if I'm trying to speak Italian with a proper Italian accent I go full on bobbity boopity mama mia's spaghehhhti and say ""Car-mell-uhh"" in Fabio from the Sopranos voice. If I'm trying to speak French I go hunh, hunh, hunh, ahh em so Frensh, you stoopide Am-air-ee-cuns. If I'm doing German I talk about Zie Germans and nearly scream about not violating the sacred REINHEITSGEBOT!!, which I'm aware of thanks to a Beck's ad at my favorite bar in college. I assume this would work for people who speak other languages natively,  but I can only speak to my personal experience, so I say English. But seriously, it works. It's easier to hear the correct tones of a language when you're listening in your native language. It's like there's less to focus on because you know the words and can devote your whole mind to the sound without the distraction of discerning meaning.","LPT: If you're learning a language and having trouble with pronunciation, say a couple sentences in your native language with the most stereotypical, downright offensive accent of native speakers of the language you're trying to learn and then try again."
LifeProTips,[removed],"Always clean your house before you go on vacation, coming home to a clean house is the best!"
LifeProTips,[removed],"LPT: If you have your duvet cover inside out, you can put your hands on the inside corners and roll it over the duvet like a foreskin"
LifeProTips,"You'd be surprised how many places have complimentary chocolates, champagne, cakes, and other gifts on standby for people who chose their hotel to celebrate an anniversary. They don't know your anniversary and they wont ask.

And if you feel bad, just tell yourself it's the anniversary of you going on vacation last year.","LPT: When booking a hotel for 2 or 3 people, make sure to always leave a note telling them it's your anniversary, even if it's not."
LifeProTips,[removed],"When booking a hotel for 2 or 3 people, make sure to always leave a note telling them it's your anniversary, even if it's not."
LifeProTips,"Works 99% of the time. If for some reason this does not work, try clearing your cookies and trying again.",LPT: If you enjoy reading articles but are halted by paywalls; enter a dot after the website (www.*website*.com.) and you will be granted access without payment.
LifeProTips,,"LPT: You can get overworked and sick of the things you love and are passionate about. It is ok to take time away from a hobby or person, but It doesn’t mean it’s not something you still love."
LifeProTips,[removed],LOT Request
LifeProTips,[removed],Need help opening a stainless steel water bottle
LifeProTips,,"LPT: fold your clothes AS you take them out of the dryer. It only takes a bit longer, and if you don’t get them put away, they’re not wrinkled. But you’re more likely to put them away because they’re folded!"
LifeProTips,[removed],"You can get overworked and sick of the things you love and are passionate about. It is ok to take time away from a hobby or person, but It doesn’t mean it’s not something you still love."
LifeProTips,[removed],"LPT if you don’t like wearing masks, wear a plastic face shield instead."
LifeProTips,,Math Riddles and Exercises - iPhone Game for People Who Love to Challenge Their Brain 💎
LifeProTips,"Today I realized that I can cut my homeowners and auto insurance coverage by almost $250/ month just by switching to a different company.  I’ve been with my insurance companies forever and just never bothered to look into switching. 

I’ll be checking all of my other bills in the coming days to see if I can eliminate any other expenses ( I’m looking at you, cable bill...)

I’m going to put reminders in my calendar to review them annually.",LPT: Remember to check your insurance premiums and monthly bills periodically
LifeProTips,"Many on line business, especially ones that use Shopify as their platform, have abandoned cart promos set up to automatically email you a promo for items you put in your cart but didn’t buy. These emails usually trigger between 2 and 4 days after abandoning your purchase.",LPT: save money online by taking advantage of “abandoned shopping cart” promos.
LifeProTips,"“What’s 2 + 2?” and “what’s the meanings of life?” are two easily-worded questions yet only one of them has an easily-worded answer that’s agreed upon by everyone. 

This is because there are agreed-upon definitions to the terms of the question. Everyone knows what ‘2’ means. Everyone knows what ‘+’ means. Everyone can identify a math problem. 

Arguing or discussing over an easily-worded question like “what’s the meaning of life?” is fruitless because there’s a logical fault in the question. In order for everyone to agree upon an answer, there needs to be agreed-upon definitions of the terms of the question. Ask a group of people what ‘meaning’ means, you’ll get a vast variety of answers. Ask a group of people what ‘life’ means, you’ll get a vast variety of answers. Therefore, if no one can agree on what the question means, no one can agree on what the answer is.","LPT: If you can’t find an easily-worded answer to an easily-worded question, that usually means there’s a fault within the question itself, therefore arguing about it could be fruitless. Before discussing a ‘big’ question with someone, verify that you both agree on the terms of the question."
LifeProTips,[removed],THE MOTIVATIONAL VIDEO YOU NEED - CHANGE YOUR LIFE TODAY
LifeProTips,[removed],THE MOTIVATIONAL VIDEO YOU NEED - CHANGE YOUR LIFE TODAY
LifeProTips,[removed],LPT: Have a door mat to prevent delivery complications
LifeProTips,[removed],Package Delivery Mistake?
LifeProTips,"In the US, AAA is pretty reliable, but they can take some time. Instead of resorting to an expensive mobile mechanic or relying on a stranger to ride by, request a very short rideshare trip (Uber, Lyft, etc.). Most would appreciate the break while getting paid. Don’t forget to leave a 5-star review and decent tip!",LPT Battery dead? Rideshare is your fastest and cheapest option
LifeProTips,"Double the cook time and reduce power to 50%.


This way, the food cooks slower and much more evenly. You will never have an icy core in a burrito or rubbery cheese on the edges of pizza again. 


Trust me, it’s worth the wait.",LPT : never use your microwave at full power
LifeProTips,[removed],Battery dead? Rideshare is your fastest and cheapest option.
LifeProTips,[removed],Never use your microwave on full power
LifeProTips,"If you have a better LPT, just post it instead. Don’t put it under the comment.",LPT: Don’t one up LPTs in the comments.
LifeProTips,"I used to make regular coffee, and sometimes my mom would make coffee if I woke up late and it tasted wayy better than what I made. So I experimented in the kitchen and instant coffee with milk tastes amazing compared to water. I'm sure it's not the best for you, but if you feel especially good one morning, make sure to liven it up with some creamy coffee goodness!",LPT: Make your instant coffee with milk rather than water
LifeProTips,"— Download Calibre on your desktop.

— Search for the book title epub (Ex: Harry Potter and the philosophers stone epub). Then download the file. 

— open the file in Calibre and convert it to the correct format for your device (ex: kindles use MOBI) 

— send the file to your e-reader 

And that’s how you get free e-books!

Please still pay for books from small authors though! Have fun reading :)","LPT: get free e-books (for Kindle, Kobo, etc) with Calibre and a google search of: book title epub"
LifeProTips,The heat from the hairdryer neutralizes the saliva from the mosquito that causes the ichiness to go away.,LPT if you have a mosquito bite that's bugging you use a hair dryer to heat it up until it hurts a little then the bite will stop iching for hours. Some people might tell you to use a spoon and hot water but dont! It is super easy to burn yourself whereas a hairdryer is alot easier to control.
LifeProTips,"It’s an indescribable quality in a persons eyes, windows and they are for real and mirrors mean they are giving you the stiff arm.",LPT: you can tell if someone is lying or not based on if they have mirrors or windows in their eyes
LifeProTips,"Often, when my mind is racing and I can't sleep, I focus on just moving my finger to a pattern. My pattern of choice is the paraddidle: Left Right Left Left, Right Left Right Right; LRLL, RLRR... And so on. 

Focus on keeping the tempo steady and lento more than anything. The movements needn't be big; rather, I find it most effective when I'm barely moving my finger at all.

Soon enough, you'll find yourself not moving your finger and the LRLL, RLRR will be happening in your head only. When you notice this, start moving your finger to the pattern again. Otherwise it becomes too easy for your mind to drift.

When your mind does drift (which it will), don't get annoyed that it happened or aggravated that your mind is still racing. Instead, appreciate the thought for what it is and let it go. Trying to suppress it will not let it fade away but will instead push it down, only for the thought - and others - to fight harder to get through.

Continue with your LRLL, RLRR, and surprisingly you will soon feel far more calm.

Hope this helps; rolling over for hours on end has to be one of life's worst inconveniences.","LPT: When you can't sleep, focus solely on wiggling your finger to a pattern."
LifeProTips,,LPT Request: what are some essential items for a new homeowner to purchase that can be easily forgotten?
LifeProTips,[removed],"LPT: If you're going on vacation with your SO, try to take some pictures by yourself. These come in very handy for dating apps after you break up"
LifeProTips,"Ive saved hundreds in the last year alone doing this to save on delivery costs, entry to the zoo, exhibitions, 10-20% item or store discounts etc.","LPT: when ordering something online, google 'promo code for (insert item/event/activity)' and see what comes up. A lot of promos exist that only get advertised in certain places or circumstances, that you wouldnt know exist, but get posted on various promo code forums."
LifeProTips,,"LPT: When packing for a holiday, make a list on your phone of everything you’re bringing. When you’re repacking to come home, you can tick off each item on the list to prevent yourself from forgetting anything."
LifeProTips,"Often times they'll make sure to fix the issue with a refund or other remedy. Win-win, your issue is resolved and they keep a strong reputation.","LPT Before you write a bad review for a company or seller, reach out to them privately."
LifeProTips,[removed],"Before you write a bad review for a business or seller, reach out to them privately with your complaint."
LifeProTips,,LPT: If you ever feel hungry you should eat to stop that feeling.
LifeProTips,[removed],LPT: If you feel like you need to breathe then you should try breathing and you shouldn't feel the need anymore.
LifeProTips,[removed],LPT: If you feel like you need a poo go and sit on the toilet and you should have one.
LifeProTips,[removed],"LPT Instead of Letting People Show you a Picture, Get Them to Describe it to you."
LifeProTips,,LPT: Girls don't seek out advice from your female friends. Girls are very jealous of each other. They may give destructive advice to ruin your life. Men are not jealous of girls unless there's a sibling rivalry between you.
LifeProTips,[removed],Girls don't seek advice from your female friends. Girls are usually very jealous of each other and give destructive advice to ruin your life. Consult with your father or other grown up men. They're not usually jealous of girls unless there's some sort of sibling rivalry between you.
LifeProTips,I just realized this after misplacing my phone more times than I’d like to admit. My bad if this common knowledge already as a I’m new to the sub.,"LPT: Whenever you misplace your iPhone around the house, just yell “hey Siri”. Must have feature on, obviously."
LifeProTips,"If you shove the fact that somebody is wrong in their face it will cause them to not open up as much and won't talk about their opinions in fear of being wrong and being punished for it, let them learn and not be judged while doing so","LPT: If somebody messes up in an argument and it turna out they're wrong, don't shove it in their face"
LifeProTips,,LPT: Mark in your personal calendar when your 🎂day is! I waited for a whole year and I missed it by two days😭
LifeProTips,[removed],LPT: Mark in your personal calendar when your cakeday is! I waited for a whole year and I missed it by two days
LifeProTips,[removed],LPT: Mark in your personal calendar when your cakeday is right now! I waited for a whole year and I missed it by two days😭
LifeProTips,,"LPT: if you browse Reddit on mobile make r/music one of your favourite subs, this way you can find its posts at the beginning, play them and start browsing with music"
LifeProTips,[removed],"Instead of Letting People Show you a Picture, Get them to Describe it to you."
LifeProTips,"There is good and bad in everyone and everything. Sometimes we get tempted by the bad. Perhaps a day comes when you give in to the temptation.

Unfortunately you were not smart enough to look around first. make sure no cameras or people looking at you.

Soon, you are contacted. The person says they know the bad thing you did and they will tell everybody unless you do this bad thing. You say okay then they say now i know two bad things you did and i will tell everybody etc. etc. 

You're trapped. Now there are only two ways out. First: kill the blackmailer. Yay, no more blackmail. Boo, twenty years in prison.

Second: Say: Okay. You got me. I was stupid enough to not look around before doing something bad and now you will blackmail for the rest of my life. 

Well, what I am going to do now is: I am going to contact every person I know on earth and I am going to tell them the bad thing I did. Some will hate me forever and never speak to me again. Some will be angry for a long time and eventually forgive me. Some will say meh, you're human.


But first, before I tell them what I did, I am going to tell them what you did. Everybody will hate you and no one will ever want to know you again. You will always be alone because nobody ever wants to know a blackmailer. Have a nice life. 

Then you turn around and walk away. There is a possibility that as you are walking, you will hear........Wait! If you promise not to tell anyone, I will do anything you want.


At this point, you might choose to say ""Okay. First I want you to rob a bank and bring me all the money. Second, go to the police and tell them you robbed the bank and you can't remember where the money is.""",LPT: Blackmail
LifeProTips,[removed],LPT: If you're flatulent don't put your face mask in your back pocket
LifeProTips,"I'm moving in with my dad soon, and I know that his current girlfriend is bat-shit crazy. I am looking for ways to keep her out of my personal space in every way possible. So far I am buying a bunch of soundproofing foam and a lock for the door. What are some other things I could buy to keep her out? Or what are some things I can do to keep her out?","LPT REQUEST: Ways to ""defend"" my room"
LifeProTips,"I’m here on the toilet writing this, and it works.
Whoever’s gotta un-plunge this toilet isn’t getting paid enough..","LPT: When seeing a new partner that you’re not comfortable around, instead of pooping at their house, run an “errand” and destroy the local gas stations septic, and not your new girls"
LifeProTips,[removed],"LFP: if you browse Reddit on mobile make r/music one of your favourite subs, this way you can find its posts at the beginning, play them and start browsing with music"
LifeProTips,,"LPT: Separate your work and personal life tech. No personal emails, logins, files etc. on your work cellphone / laptop. Ideally carry a 2nd, personal phone. Don't have an expectation of privacy or storage if using a company device; the company can wipe it in an instant."
LifeProTips,,"LPT: Before travelling, ask a neighbour to ensure your home doesn’t look vacant in order to avoid becoming a target to thieves. For example, be mindful about high levels of snow on the driveway or daily newspapers piling up."
LifeProTips,,[LPT] be direct when communicating with coworkers and customers. Don’t leave important things open to interpretation when you’re looking for a specific result.
LifeProTips,"The light heat from the hair dryer melts the adhesive and leaves no residue when you pull off the sticker. Be careful with anything glass or metal, as it may be hot to the touch! If it doesn’t peel right off, you need heat it a little longer.","LPT. If you ever need to get a sticker off of something, blow over it with a hair dryer (high heat, about 1-2 inches away from the surface) for a minute or two. It’ll peel right off."
LifeProTips,[removed],"If you ever need to get a sticker off of something, blow over it with a hair dryer (high heat, about 1-2 inches away from the surface) for a minute or two. It’ll peel right off."
LifeProTips,Tapped means someone is listening onto your phone calls.,"LPT: Dial *#21# to see if your phone is tapped. It is tapped if it says, “Setting Interrogation Succeeded...Disabled,” If it doesn’t say disabled it is tapped. You can dial ##002# to untap it"
LifeProTips,"The fastest way to manipulate masses of people is to get at them emotionally.  If an organization with an agenda can create a headline that makes people react without thinking, they've done their job.  Conversely if you can check your emotions long enough to investigate why someone brought you this bit of 'news', you may find the story, whatever it is, is not as simple as it was suggested to you.","LPT: If, after reading a headline, you realize that you are feeling a strong emotion, you should check for confirmation from other sources."
LifeProTips,"Lead pencils have a thin tip like a stylus, and they do not scratch your Nintendo DS screen.",LPT: Lost the stylus to your Nintendo DS? Use a lead pencil as a substitute.
