subreddit,selftext,title
Showerthoughts,,"Car used in ""im not a robot"" select cars capcha might be most recognizable car in this timeline"
Showerthoughts,[removed],Why dont all showers have built in speakers?
Showerthoughts,Putting 101 after a subject looks like you are laughing at it. Ex: Reproduction 101,Putting 101 after a subject looks like you are laughing at it. Ex: Reproduction 101
Showerthoughts,[removed],Taking sea creatures from the sea and placing them in aquariums on land is the equivalent of an alien abduction to another planet.
Showerthoughts,[removed],What do Millenials and Gen Z refer to their parents as?
Showerthoughts,,Blind people cannot see
Showerthoughts,,Dreams must have been a really weird and mysterious thing for people in the past
Showerthoughts,,2020 is the climatic ending to Trumps 2016-2020 presidency where everything goes wrong
Showerthoughts,[removed],Today's America has a population larger than the population of the whole world only a thousand years ago.
Showerthoughts,[deleted],A part of a person's imagination dies the day they discover internet porn.
Showerthoughts,[removed],A loading bar stopping on 100% is worse than it stopping on 0%
Showerthoughts,[removed],Zoning out is like tabbing out of something irl
Showerthoughts,,"Blind people could go their whole lives not knowing the moon exists, if no one tells them about it."
Showerthoughts,[removed],Ejaculation is your dick ulting
Showerthoughts,,"When someone says they ""did the irish stew"", it means they had vigorous sex with a chick then both the male and female fluids are mixed together in a cup and drank by both."
Showerthoughts,,It’s amazing how many emotions and phrases you can show by saying “mmm”
Showerthoughts,[removed],Wut
Showerthoughts,[removed],I was just wondering
Showerthoughts,[removed],We Are Alive For No Reason But We Found Out Too Late
Showerthoughts,Washing machine? Guy didn't want to wash clothes by hand.,Anybody who invented a machine to do a particular thing was probably too lazy to do it themselves
Showerthoughts,[removed],Probably people during this period are having more shower thoughts than they had in any time of their life since they take more showers to avoid COVID-19.
Showerthoughts,[removed],Wikipedia is basically the hitchhiker's guide to the galaxy
Showerthoughts,[removed],My husband looks at the driver of a car that just cut him off like he looks at a fresh poop he made.
Showerthoughts,,"Some speculate that we can't really imagine what an intelligent life could look like elsewhere in the universe due to our biased viewpoint of what we know and understand. So if there are advanced civilizations out there, they could be doing the same."
Showerthoughts,Lots of bubble letters and cuss words though,Watching the rail cars on a train pass in a small town is an impromptu art show
Showerthoughts,,It's amazing that testicles almost never tangle up despite constantly being moved around.
Showerthoughts,[removed],Something that is found will always be lost again.
Showerthoughts,[removed],I've already lost touch with a couple of people I use to be.
Showerthoughts,,With everyone wearing masks it must be very hard for the deaf/hard of hearing community to understand without being able to read lips.
Showerthoughts,[deleted],"Blind people could go their whole lives not knowing the sun exists, if no one tells them about it."
Showerthoughts,[removed],If there really is intelligent life out there in the cosmos - some speculate that we can't really imagine what an alien being would look like due to our biased viewpoint of what we know and understand. Then there must be advanced civilizations out there who are doing the same.
Showerthoughts,,Getting offended when someone says that you can’t take criticism proves their point
Showerthoughts,,Toaster minutes are shorter than microwave minutes
Showerthoughts,,"In Friends when Chandler and Monica first hook up, Ross bursts into the room saying he was getting married that day. Monica must have been sucking off Chandler to have been under the sheets."
Showerthoughts,[removed],"When you learn from the mistakes of others, you have plenty of time to make your own."
Showerthoughts,[removed],"Games should have an option to turn off the ""Forced"" Diversity, and just turn every character into a copy of the player's character."
Showerthoughts,,"If you were sent back 2000 years you would know that things like electricity existed, but you would have no way of using/making those things"
Showerthoughts,,What would happen if there was a country where there would literally be no rules?
Showerthoughts,[removed],i find it amazing that the whole internet somehow have agreed on what the acceptable volume for audio is
Showerthoughts,[removed],Life is procrastination.
Showerthoughts,[removed],I would really like to see Rage Against the Machine k\Knighted by the Queen...
Showerthoughts,,The problem with capitalism — it’s like a gateway drug that leads to Greed.
Showerthoughts,[removed],Whether you clean up your own mess in a public toilet or not is a one question moral self-assessment tool.
Showerthoughts,[deleted],Yes yes right there RIGHt Theere oh that feels amazing
Showerthoughts,[removed],Burritos are just hot wrap sandwiches
Showerthoughts,[removed],"Look, there is cheese. Cheese has holes. More cheese = more holes. More holes is less cheese. So technically, more cheese is actually less cheese"
Showerthoughts,[removed],If you have a son that becomes a priest do you call him son or father?
Showerthoughts,[removed],The one question that reveals your true character is: do you clean up your own mess in a public toilet or not.
Showerthoughts,[removed],Rotten Tomatoes is just like the Chinese Government. They won't let anything get out that they don't want to hear.
Showerthoughts,[removed],Tomatoes
Showerthoughts,[removed],The one question that reveals your true character is whether you clean up your own mess in a public toilet or not - more accurately and efficiently than any psychological assessment tool.
Showerthoughts,,Fag fag fag fag
Showerthoughts,[removed],Penguins
Showerthoughts,,When man likes other man he can say word that begins with F
Showerthoughts,[removed],Arms on your chairs are just chairs for your arms
Showerthoughts,[deleted],A lot of people need to learn the difference between a pass and a shot.
Showerthoughts,,"Shoutout to all the fallen banana peels. They kept our delicious, sweet banana innards intact until we inevitably discard all the work the peel did, by throwing it in the trash. Thanks banana peel, here's to you."
Showerthoughts,[removed],school stabbing? UK
Showerthoughts,,https://m.youtube.com/watch?v=AvoO8OpA4MM
Showerthoughts,[removed],"When do zombies know when to stop eating you? I mean if they eat you for your flesh, wouldn’t they just keep consuming till your just bones."
Showerthoughts,,"You need prior experience to get an entry level job. Yet, you can't get experience because all entry level jobs require prior experience."
Showerthoughts,[removed],Walking a dog that pulls on the leash constantly is like being the annoying npc who moves too slow in an escort quest
Showerthoughts,,We don't actually hate TikTok. We hate the people using it
Showerthoughts,[removed],It probably tells a lot about your character whether you clean up your own mess in a public toilet or not. People who don’t do it should not be in a job where they make decisions that affect the well-being of others.
Showerthoughts,[removed],Building Legos as a kid really sets you up to build household furniture as an adult.
Showerthoughts,[removed],"Sylvester Stallones Character in Demolition Man, John Spartan, probably clogged the Toilet and caused a huge Mess when he used the little Papers to wipe his Butt instead of using the three Shells."
Showerthoughts,[removed],A perfectly symmetrical face look’s creepy
Showerthoughts,,"As the years progress, anything original will be harder to find due to some part of it being referenced to something, intentional or not."
Showerthoughts,[removed],Sonic would be faster in a paddle cart than in a real car
Showerthoughts,,"If a song is released on the music market first before ending up in a movie score, it's considered a real song. If it's released first as part of a movie score, it's forever part of the fictional world of the movie."
Showerthoughts,,Knowing that we could be monitored just by looking at our phones
Showerthoughts,[removed],I'm approaching midlife. But what if I already had my actual midlife 20 years ago?
Showerthoughts,,"When do zombies know when to stop eating you? I mean if the eat you for your flesh, wouldn’t they just keep consuming till your just bones."
Showerthoughts,,You could be the last person to die in history and you’d never know
Showerthoughts,,"'actor' sounds like a gender neutral term but 'actress' sounds like it is intended, feminine."
Showerthoughts,[removed],Have you ever gone on someone’s reddit profile and stayed so long you thought their posts were the front page?
Showerthoughts,[removed],A father isn't a motherfucker unless the woman he fucks has a kid
Showerthoughts,,"Most “MRA”s are probably not complaining that there is too much support for women, but that there isn’t enough for men."
Showerthoughts,,"Saying ""That's inappropriate"" is inappropriate for something that's not inappropriate."
Showerthoughts,[removed],At this point wooooshing someone is more of a tradition than a joke
Showerthoughts,,Food is young poo
Showerthoughts,,Pubic hair is the eyebrows and eyelashes of genitals.
Showerthoughts,[removed],The first person to crack their neck must have been terrified
Showerthoughts,[removed],"I'm glad fast food companies have gone environmentally friendly with paper straws, but Its so annoying when they stick to my lips."
Showerthoughts,,"If people started balding on the sides of their head instead of the top, it wouldn’t be as bad because you could turn it into a fade."
Showerthoughts,,Men are way more obsessed than women in avoiding holes and such while driving.
Showerthoughts,[removed],Quesadillas are mexican grilled cheese sandwiches.
Showerthoughts,,NSFW Having a child is like keeping cum as a pet
Showerthoughts,[removed],"God did not ask Mary for consent, therefore God is a rapist"
Showerthoughts,,Truman show is more of a horror movie than a comedie imo
Showerthoughts,,If we took out a giraffes vocal cords we could make like 10 guitars out of it.
Showerthoughts,,"If everyone in the world got a million dollars, then the number of poor would increase and rich will decrease"
Showerthoughts,[removed],"There are a lot of guys right now who are really hoping the reason there girlfriend's so sick is COVID-19, and not an 18 year problem."
Showerthoughts,[removed],Red and Green are the Christmas colors. Red is the color for anger and Green is the color for greed. It all makes sense now.
Showerthoughts,,"“For sale: graduation gown, never worn”"
Showerthoughts,[removed],There are a lot of guys right now who are really hoping the reason there girlfriend's so fatigued and sick is just the vid.
Showerthoughts,,Kids who major in STEM fields for the money generally drop out
Showerthoughts,[removed],You don't know what you have forgotten
Showerthoughts,[removed],the harry skty
Showerthoughts,[removed],The last button on a remote and the back button on a remote should technically do the same thing
Showerthoughts,,Adults say that you should get degrees that make money. Kids who follow this advice do not do well in STEM.
Showerthoughts,[removed],Cleopatra was closer time - wise to the opening of the first burger king than she was the the making of the great pyramids
Showerthoughts,,The allen keys that come with the Ikea furnitures are the artifacts you save for later use.. all. of. them
Showerthoughts,,"If all major car companies combined their ideas, they would make a near perfect car"
Showerthoughts,,Adults say that you should get degrees that make money. Kids who try to get STEM degrees fail them if they just care about jobs.
Showerthoughts,[removed],"Fast and furious should have been about a fasting, hangry Muslim person during Ramadan, rushing home in time for iftar"
Showerthoughts,,You can count up to a million out loud in English without your lips touching
Showerthoughts,[removed],Train ticket price should be weighted by popularity more than distance
Showerthoughts,,"If the letter l at the end of the tunnel stands for light, the letter e at the end of Google stands for silence after light."
Showerthoughts,,"I wonder what does the underside of your feet feel, if it was sentient, when you lie down and they stop making full constant contact while carrying your whole weight."
Showerthoughts,,Normal is an illusion.
Showerthoughts,,"Toxic gamers never wanna be a motherf*cker, but always want to f*ck your mother"
Showerthoughts,[removed],Reddit users should be able to pin their favourite comment on their post.
Showerthoughts,,People would have probably liked the Star Wars Special Editions more than the originals if they had removed the scenes of Luke and Leia kissing.
Showerthoughts,[removed],"Depending on the outcome of some very unsettled science, a tanning bed could be either the very safest or very most dangerous place to visit in the next few months (in terms of coronavirus transmission)."
Showerthoughts,[removed],You know when in every movie/series..
Showerthoughts,,Modern “Feminist” confuse too much man shaming with feminism
Showerthoughts,,Pet food companies profit more from making food that pet owners approve of rather than food that pets actually like.
Showerthoughts,[removed],Papercuts got a massive power boost when hand sanitizer became almost mandatory.
Showerthoughts,,Whether or not someone returns the shopping cart is the greatest way to determine whether they are inherently good.
Showerthoughts,[removed],This Pandemic
Showerthoughts,,The Railway of Sodor would be blacklisted for how dangerous and inefficient it was.
Showerthoughts,[removed],Is reality virtual? Or virtual reality
Showerthoughts,[removed],Technically the back button on a remote and the last button on a remote should do the same thing
Showerthoughts,,The Railway of Sodor would be blacklisted for how dangerous and inefficient it was.
Showerthoughts,,Schools would rather have us not learn the answers to problems and just receive poor grades than let us look up the answer and learn it for the future.
Showerthoughts,[removed],The first note of Into the Unknown by Panic at the Disco is the same as the first note in Beastie Boys Fight for your right.
Showerthoughts,,"The vast majority of people have an “inner speech” where they can talk to themselves in their head, however some do not. For those people that do have a voice in their head however, try to change the volume of the voice. You cannot."
Showerthoughts,,Enough people have played Dark Souls that someone has probably had a heart attack and died while playing and then YOU DIED appeared on the screen directly after.
Showerthoughts,[removed],"The conclusion of this should be referred to as Post-Crisis, like a comic book story arc."
Showerthoughts,[removed],It's amazing there isn't a ton of contractors making package dropoff boxes or chutes for houses with all the package theft.
Showerthoughts,,Thomas the Tank Engine's railroad would be known for its absurd amount of crashes and inefficiency.
Showerthoughts,[removed],Shooting Rubber Bands at Coworkers Can Now be Considered Biological Warfare.
Showerthoughts,[removed],It's weird
Showerthoughts,,Thomas the Tank Engine's railroad would be known for its absurd amount of crashes and inefficiency.
Showerthoughts,[removed],When someone says “sorry if what happened offended you in any shape or form” they don’t mean metaphorically; it’s meant to mean by symbol/ abundance of shapes to form an offensive symbol.
Showerthoughts,[removed],god made sure no fart would go unnoticed when he made the silent ones smell worse
Showerthoughts,[removed],When someone says “sorry if I offended you in any shape or form” they don’t mean metaphorically; it’s meant to mean by symbol/ abundance of shapes to form a symbol.
Showerthoughts,[removed],Most Russians are technically Asian
Showerthoughts,The Guiness World's Record goes to....everyone!,"For just one nanosecond, you were the youngest person alive in the world!"
Showerthoughts,,Thomas the Tank Engine's railroad would be known for its absurd amount of crashes and inefficiency.
Showerthoughts,[removed],An interesting title
Showerthoughts,[removed],"If you wish that the rule about not getting infinite wishes did not exist, you could then wish for infinite wishes."
Showerthoughts,[removed],Take the pill
Showerthoughts,[removed],https://www.gofundme.com/f/3jz4rb-help-me-get-a-new-car-please?utm_medium=sms&amp;utm_source=product&amp;utm_campaign=p_susi-sms-welcome
Showerthoughts,[removed],I just watched a heron grab a fish out of a river and instead of being tranquil it made me think humans are so lucky they don’t get pulled out of the air they breath and eaten by giant space birds
Showerthoughts,,"As university has become more expensive, it is also much harder to get admitted"
Showerthoughts,[removed],Military time gets increasingly harder to discern as the day progresses.
Showerthoughts,,Pickpockets must be having a tough time
Showerthoughts,,You are you water bottles water fountain
Showerthoughts,,The furthest you could hold something behind your head is directly in front of your face
Showerthoughts,,"If you whisper to someone, they’ll almost always whisper back. Even if the situation doesn’t warrant it."
Showerthoughts,,Dump trucks don’t go to the dump.
Showerthoughts,,"People used to be able to get into UCLA with good grades. Teens now can't get into UCLA even with perfect grades, test scores, good essays, and a ton of extracurriculars."
Showerthoughts,,You can't truly write someone off as a lost cause without having the life experience of being a lost cause
Showerthoughts,[removed],"P,b,d,q are all the same just rotated"
Showerthoughts,,In the cartoon world the main difference between fairies and witches are intentions. The second is their choice of clothing.
Showerthoughts,,Face masks are the anti-MAGA hats
Showerthoughts,[removed],Weed teaches you how to laugh at anything
Showerthoughts,[removed],The global effort it would take to invent time travel would be less than the global effort to cure every disease in the world
Showerthoughts,[removed],A fish getting plucked out of the water by a bird is like humans being plucked into space by giant space creatures
Showerthoughts,,"The human idea of a ""natural"" death is probably one of the least natural deaths in nature."
Showerthoughts,,People who worked hard to get into the Ivy Leagues are having their degrees devalued because of college admissions bribery
Showerthoughts,[removed],Your wedding day is the only time it’s not weird to let everyone know you’ll be having sex tonight
Showerthoughts,[removed],There is someone living right now who ate more ketchup then anybody else on this planet and he probably doesn't knows it
Showerthoughts,,Chicken nuggets are the most expensive form of chicken
Showerthoughts,,Time travel will never exist because we would've already seen them come back
Showerthoughts,[removed],"I wish I had cherished popping my back on those chairs in high school. Nothing can rival them, and I'll never be able to have that again."
Showerthoughts,[removed],"All odd numbers have ""e"" in them"
Showerthoughts,[removed],Condoms
Showerthoughts,,I’ve wasted a lot of water trying to have deep insightful thoughts to post on this subreddit.
Showerthoughts,[removed],"I think getting killed in a haunted house would be a comforting way to die, at least then you can be assured there is an afterlife."
Showerthoughts,[removed],Every guys penis has been in his mom’s vagina.
Showerthoughts,,Most of our expenses are never gonna happen if we don't get married!
Showerthoughts,,Time is the ultimate final boss
Showerthoughts,[removed],"If dogs experience time slower than humans, then when they don't go to the bathroom for multiple hours, it could be days for them."
Showerthoughts,,Suburbs are cities where the buildings are social distancing
Showerthoughts,[removed],Lightning McQueen must save a lot of money on insurances.
Showerthoughts,[removed],Our body is heated up to 98 degrees but yet a 98 degree day feels w ay too hot.
Showerthoughts,[removed],"Right now, there is someone, somewhere, who is in extraordinary pain."
Showerthoughts,,Gorgeous is a disgusting word to describe something pretty.
Showerthoughts,,There is someone in the Guiness Book of World Records for the most records in the Guiness Book of World Records.
Showerthoughts,[deleted],"No matter what decisions you make, you WILL have regrets in the future."
Showerthoughts,,You know you've made it when you can pay for a 99 cent app
Showerthoughts,,Listening to podcasts is the only acceptable way to have voices in your head
Showerthoughts,,Deaf people will dance when the captions say [Music] regardless of what song is playing since they can't hear the song.
Showerthoughts,,"Every year, all your friends and family, gather to celebrate you did not die that year."
Showerthoughts,[removed],"From what we can see is happening with priests being pedophiles we can assume that pedophilia was very common in the jedi council, as it is also a religious political organisation who's members can't be in a relationship or have sex. Poor younglings"
Showerthoughts,,"Decades from now, we're going to have to explain to our kids why people call bad hairdews ""corona cuts."""
Showerthoughts,,"If you join the military, college is free"
Showerthoughts,,Generational Stereotypes are just Astrology for Boomers
Showerthoughts,,"We are simply just following the years system as they were taught to us. If you went to a different planet, you wouldn't even know how to find the length of an year until you have passed through many years over there."
Showerthoughts,,Joining the military was seen as an alternative to college. This is longer true.
Showerthoughts,,You’ve probably never washed your back in the shower.
Showerthoughts,,"Joining the military was seen as an alternative to college. Today, joining the military is awful."
Showerthoughts,,"In the past, joining the military is seen as an alternative to college. Today, joining the military is awful."
Showerthoughts,,"The story of ‘The Emperor has no clothes’ implies that the emperor was cool with being seen naked, so long as only idiots saw him."
Showerthoughts,[removed],69 hahahah funny secks number
Showerthoughts,[removed],You could’ve come across a family members thread or comment on Reddit without even realizing
Showerthoughts,[deleted],Good things only happen to good people. Because ig it happends to bad people then it's a good thing.
Showerthoughts,,Hi
Showerthoughts,,Face masks are fart shields and burp amplifiers
Showerthoughts,,👁👄👁
Showerthoughts,,"Ice water is the only drink where you don't need to worry about the ice-to-beverage ratio because, even if you overshoot the problem will fix itself"
Showerthoughts,,Our cups are constantly overflowing
Showerthoughts,,"Elsa's superpowers are wide-ranging. She can control ice/snow, materialize clothing out of thin air, freeze people's hearts, and create sentient life among others. She's more powerful than most Avengers."
Showerthoughts,[removed],"When you don't trust ""trust no one"" you still end up trusting it."
Showerthoughts,[removed],"Eventually, there will be no showerthoughts to showerthought about."
Showerthoughts,,If the downvote button had its own world I’d imagine it would be like the upside down in stranger things
Showerthoughts,,Slipping and falling on a banana peel is a lot rarer than lead to believe
Showerthoughts,,"Oedipus Rex's mother must've been a total milf. Her hand in marriage was a reward for killing the former king, so she was basically a trophy wife. Trophy Milf."
Showerthoughts,,"Bad means, well, bad. Ass can also mean bad. But when the two are combined, it is used to describe something impressive."
Showerthoughts,[deleted],You know you gotta run when the boss doesn’t have a HP bar in a game.
Showerthoughts,,If the downvote button had its own world I imagine it would be like the upside down from stranger things
Showerthoughts,[removed],When was languages created
Showerthoughts,[removed],The real hot section of r/unpopularopinion is the controversial section.
Showerthoughts,[removed],Pot moves fast. Canada went from cannabis being illegal to an essential service within 2 years.
Showerthoughts,[removed],family's love
Showerthoughts,[removed],Ice is just frozen water
Showerthoughts,,Horror movie actors' and actresses' children will likely watch their parents die gruesomely on screen at some point.
Showerthoughts,[removed],Turtles
Showerthoughts,,"If Digital Monsters are Digimon, then Analogue Monsters are Analmon."
Showerthoughts,,The real hot section of r/unpopularopinion is the controversial section.
Showerthoughts,,Whoever made Cinderella definitely had a foot fetish. Wack
Showerthoughts,[removed],Restaurants delivering right now should add a “snacks for later” section to their online menu
Showerthoughts,,Blind people can never be certain they’ve fully wiped their butts
Showerthoughts,,Blankets aren't blank.
Showerthoughts,[removed],?!
Showerthoughts,[removed],"Your signature is meant to represent you, but it is not even how you write your name."
Showerthoughts,,Sherbet Straws was the cocaine of our childhood.
Showerthoughts,,Japan animation is cute while they just make Adult American Animations insanely ugly
Showerthoughts,[removed],January 1st is at one point the hottest and coldest day of the year
