subreddit,selftext,title
Showerthoughts,[removed],"The words “movie”, “cookie”, “brownie”, “walkie talkie”, all take a descriptive word and make it cute"
Showerthoughts,[removed],A trojan horse is a virus that attacks your pc system while the condom brand Trojan© is something made to protect your system
Showerthoughts,[removed],It’s possible that the first person who invented the first ever invention also invented inventing.
Showerthoughts,[removed],"The first person who invented the first ever invention, simultaneously also invented inventing."
Showerthoughts,idk I’m tired ok,"If someone says a pun, and follows it up with ‘pun intended’, the pun could either be intended, or it could be its own pun for ‘unintended’"
Showerthoughts,[removed],If Breaking Bad was in a country with free health care there would be no series because the cancer treatment would be free
Showerthoughts,,Epileptic people can literally cause a seizure for themselves by just blinking really fast.
Showerthoughts,[removed],I used to wait hours or days for legal movies to download and watch. Now I won’t wait more than 5-10 seconds for a video to start playing before moving on.
Showerthoughts,[removed],College is now the most expensive streaming service.
Showerthoughts,[removed],Are we all going to forget the part of 2020 when the US military released real UFO footage
Showerthoughts,[removed],Stapler refills are replacing legos as the worst thing to step on barefoot.
Showerthoughts,[removed],Bears are technically pubes
Showerthoughts,[removed],Coffee is stamina potion
Showerthoughts,[removed],Imagine if drivers licenses in the United States were not reciprocated between states and you needed to get a new one for each state to drive there.
Showerthoughts,[removed],"If we were good enough at math, we would be able to find infinite amount of “coincidences” related to any number we wanted like in the movie 23."
Showerthoughts,,"Solid, liquid and gas.... All pass through your butthole"
Showerthoughts,[removed],"With the advent of working from home, stapler refills are replacing legos as the worst thing to step on barefoot."
Showerthoughts,,"When taking alcohol, both you and the drink get ""drunk"""
Showerthoughts,[removed],Busses are just big taxis with fixed destinations
Showerthoughts,[removed],Leonardo DiCaprio has become the new Keanu Reeves of Reddit in a matter of days.
Showerthoughts,[removed],With masks covering up faces I wonder if before Covid passes seeing noses and mouths will be like seeing ankles in the 1800s.
Showerthoughts,,"As an adult, having empty pants pockets is freeing and slightly terrifying."
Showerthoughts,,"Every human is addicted to food; cravings, hunger and starvation are the withdrawal symptoms"
Showerthoughts,,The dear award has point existing
Showerthoughts,,"In most movies or shows, the poor character's actor is probably richer than the wealthy character's actor."
Showerthoughts,"Like sure it's ""technically free"" but good luck getting through the whole game and winning often without spending $ on in-game perks to stay competitive.",Relationships are the original Freemium game.
Showerthoughts,[removed],Pickup trucks are just convertable vans.
Showerthoughts,[removed],Face masks are napkins
Showerthoughts,[removed],The only 2 days.
Showerthoughts,,Having two followers seems to be a no big deal until you are alone on a poorly lit street.
Showerthoughts,[removed],The best liar you know isn’t the best liar you know
Showerthoughts,,"When doing a knock knock joke, no one ever says ""who's there"" with the actual inflection of a question."
Showerthoughts,[removed],"We identify UFOs ( Unidentified Flying Objects ) as UFOs, kinda making them identified as something unidentified."
Showerthoughts,[removed],"Every human is addicted to food; cravings, hunger and starvation are pretty much withdrawal symptoms"
Showerthoughts,,The opposite of long is short and the opposite of tall is short; so calling something short does give you enough information about what dimension is being discussed.
Showerthoughts,[removed],"My, my mind"
Showerthoughts,,You only need 52 emails to get a years worth of free 7 day subscriptions.
Showerthoughts,[removed],Relationships are the original Freemium game. Change my mind.
Showerthoughts,[removed],"Deodorant is that thing you don't realize you have put on, but you do realize when you haven't put on"
Showerthoughts,,"If you got a “0” on a test in school, there’s probably a reasonable explanation. If you got a “10,” there’d be no excuse."
Showerthoughts,[removed],"I can't believe I haven't heard a boomer make the joke: ""your honor, I identify as not guilty"""
Showerthoughts,,AI telemarketing is going to be a real nuisance in the future.
Showerthoughts,[removed],"""A little small"" is bigger than ""small"" even though ""a little small"" includes two words that describe size as smaller than normal."
Showerthoughts,[removed],"For a Latin country of its size, Mexico should have had more success in football. I mean at least a World Cup or something."
Showerthoughts,[removed],"In minecraft, we can somehow hit someone and walk through the same person."
Showerthoughts,[removed],If the Coronavirus pandemic gets worse and lasts longer people might become like the people on the spacecraft colony in WALL-E
Showerthoughts,[removed],You don't realize how stupid your nickname is until you have to tell it for your friend or someone says it aloud in online game
Showerthoughts,[removed],porn sites should end with .cum
Showerthoughts,[removed],"What the fuck does the bear award even mean, like most of the others you can tell what it is meant to mean but the bear one is just random"
Showerthoughts,[removed],Cats are just mini apex predators
Showerthoughts,[removed],"For a pharmaceutical company, the most successful drugs are ones that treat a chronic disease but don’t cure it."
Showerthoughts,Amazing how prophetic Biff Tannen was in BTTF-II.,Trumpesque villains are going to be a Hollywood staple for the next 100 years.
Showerthoughts,[removed],"No one is coming back from the future to prevent the shit events in 2020. In other words, time travel will never be a thing, or we have problems that make 2020 look like a tea party coming up."
Showerthoughts,[removed],"Humans know we’re in a pandemic, but crows see it as a conspiracy."
Showerthoughts,,The only thing consistent in life is its inconsistency.
Showerthoughts,[removed],Nobody goes on wikipedia and comes away having read just one article.
Showerthoughts,[removed],Mike wazowski nodding is the same as him twerking
Showerthoughts,[removed],BP and AP
Showerthoughts,[removed],"When you post on Reddit, the first auto-upvote you give yourself is the only time your post gets 100% upvoted. That means, in a way, every post out there was the best post for a little time."
Showerthoughts,[removed],Crows might think that we caught on to them now that everyone is wearing a face mask.
Showerthoughts,,"Rattles may seem not much of a big deal, but they can be aggravating if they are in a brand new car."
Showerthoughts,[removed],"It can be a sign of respect to refer to someone by their formal name, and it can also be a sign of disrespect."
Showerthoughts,[removed],"Since crows can easily remember human faces, they probably think we caught on to them with all the face masks."
Showerthoughts,[removed],You cant be an aethiest if you celebrate christmas
Showerthoughts,"If the first pig combined straw and mud together, they'd have had adobe bricks. If the second pig used mud (or plaster) and sticks they'd have a wattle and daub house. Both are generally viewed as wolf proof. However, if the third pig built a house of bricks with no mortar it would have collapsed on him during a gentle breeze.",The story 'The Three Little Pigs' is all about the importance of binding agents
Showerthoughts,[removed],Helping your kids through homework is essentially going back to school again.
Showerthoughts,[removed],The best meme of all time could of been lost in new.
Showerthoughts,[removed],People who don't enjoy celebrating their birthdays haven't considered what the alternative of not having one would be like.
Showerthoughts,[removed],The best meme ever could of been lost in new.
Showerthoughts,[removed],Crows are highly intelligent and can remember human faces. They’re probably getting pretty pissed during the pandemic.
Showerthoughts,,It's fortunate that sun burns don't turn your skin into leather
Showerthoughts,[removed],"they say, you cant live. but when you live, they cant say."
Showerthoughts,[removed],Sighing is like pressing the reset button on your breathing
Showerthoughts,[removed],"Because so many more people are working from home, the number of people jerking off on company time has probably drastically increased"
Showerthoughts,,It takes big dick energy to joke about being the owner of a small dick.
Showerthoughts,"Say you were 4 cars back in line at a fast food place, the first person in line places their order and the cars in front of you pull up. Before you can react someone swoops in front of you, cutting in line.

You could get out of your car and approach them, ask them to go to the back of the line, but what could you do if they refused? The cars ahead of you would keep putting in their orders and the line would keep moving while you stood outside your car arguing.

It wouldn't be long before the car that cut in front of you is next line. Then what do you do? Ask the drive-thru employee not to take their order? Is that realistic?

Meanwhile your car is sitting in the way without a driver.

Another angle is that there's not exactly nothing you could do, but that it wouldn't be worth your time to do anything.","If someone cut in front of you at a drive-thru, there’s really nothing you could do if they refused to leave."
Showerthoughts,"When instead of crying when being hurt you just go ""ow fuck that hurt""",There is a point in life
Showerthoughts,,Depth charges dropped in WW2 must have killed a lot of marine life.
Showerthoughts,[removed],"If Adam and Eve gave birth to 3 sons, does thet mean that the sons were breeding with their own mother?"
Showerthoughts,[removed],"At some point in ancient history, everyone was eating using only a single stick. The Asians then thought: I had two sticks, I could pick shit up. The Europeans meanwhile: If my stick had more tips, I could pick shit up. Therefore, we now have chopstichs and forks."
Showerthoughts,[removed],People stop believing in the loc ness monster and big foot when everone got camera phones
Showerthoughts,,You could have been in the background of a photo somewhere. You could be hanging on a stranger's wall somewhere and not even know it.
Showerthoughts,[removed],You don't get many interesting shower thoughts whilst taking cold showers compared to a regular hot shower.
Showerthoughts,[removed],Cheese is just a loaf of milk
Showerthoughts,[removed],I don't get a lot of interesting thoughts when I'm taking cold showers compared to a regular hot shower.
Showerthoughts,[removed],2020 is the culmination of all of the things we didn't forward to avoid bad luck
Showerthoughts,[removed],"We all have that one item on our daily do list that we would have to do four times to keep up with but, we only write it on the list once so we only do it once and let the rest pile up until we write tomorrow daily list."
Showerthoughts,,"Joe Biden is from Scranton, Pennsylvania. The show “The Office” takes place in Scranton, Pennsylvania. If Joe Biden wins, he will be running The Office."
Showerthoughts,,"Before “inventing” fire, humans spent the night in the dark."
Showerthoughts,[removed],Gordon Ramsay is like the opposite of Guy fieri
Showerthoughts,[removed],"Joe Biden is from Scranton, Pennsylvania. The show “The Office” takes place in Scranton, Pennsylvania. If Joe Biden wins, he will be running the office. Coincidence?"
Showerthoughts,[removed],Imagine how good the Morgan Freeman must sound to himself.
Showerthoughts,,75% feels so arbitrary until you're sewing a square.
Showerthoughts,,We are Lovecraftian sized monsters to ants.
Showerthoughts,[removed],"Joe Biden is from Scranton, Pennsylvania. The show “The Office” takes place in Scranton, Pennsylvania. If Joe Biden wins, he will be running the office. Coincidence? I think not."
Showerthoughts,[removed],IKEA is the best escape room
Showerthoughts,,Crack cocaine is the refried beans of drugs
Showerthoughts,[removed],The younger you is also the older you.
Showerthoughts,,It is possible for everyone who has $1 to all give you $1 to make you an instant millionaire.
Showerthoughts,,There is always that one thing on your to-do list that you end up needing to do like three times but you only get the satisfaction of crossing it off once so you leave it for the next day's to-do list.
Showerthoughts,,Eating melted cheese feels more unhealthy than eating normal cheese.
Showerthoughts,[removed],"At some unknown point in time, phone menu options stopped saying ""If you are not calling from a touch tone phone, please stay on the line"""
Showerthoughts,[removed],"Trump ruined wearing a red hat, the same way Hitler ruined the kaiser mustache."
Showerthoughts,,The youngest picture of you is the oldest picture of you
Showerthoughts,[removed],"The letter X is useless, You can easy replace it with CKS or KS and for other words just a Z."
Showerthoughts,,Saying ice cold water doesn't make sense becasue ice cold water would just be ice
Showerthoughts,,Running out of clean underwear is the biggest motivation to do laundry.
Showerthoughts,[removed],Saying ice-cold water doesnt make sense because if water is ice-cold then it is just ice
Showerthoughts,,The difference between 0 and 1 is way higher than the difference between every other pair of adjacent numbers
Showerthoughts,[removed],People say you’re not forced to work and don’t have to. Then they argue if ubi is implemented people wouldn’t work. Hypocrisy.
Showerthoughts,,Turning up the volume is like zooming in with sound
Showerthoughts,[removed],What if the only way to die is by really old age it makes you wonder that life feels like a race for the person who will outlive you in any regions in the world.
Showerthoughts,[removed],“Plain sight” being the best place to hide things is awesome news if you’re lazy and planning to hide something
Showerthoughts,,The brain is the only organ that named itself and knows its an organ
Showerthoughts,,"When you send 1 photo to 10 people, the 1 photo becomes 10 photos"
Showerthoughts,"And if so, in order to make the metaphor accurate to each person, what you do with it while using it to imitate genitalia will be dependent on whether or not you take the peel off, implying that you either have or haven’t been circumcised.","If a banana is used as a sexual innuendo, that makes the peel the foreskin."
Showerthoughts,[removed],My dad is a genious
Showerthoughts,[deleted],The brain is the only organ that named itself and knows it's and organ
Showerthoughts,[removed],Mummies are just raisin zombies
Showerthoughts,,"In the song “Baa Baa Black Sheep”, that poor sheep gives a full breakdown of wool quantities and distribution, only to be promptly ignored and asked again."
Showerthoughts,[removed],"We should get sang happy birthday as soon as we come out in the hospital, since it is our actual BIRTH day and not wait a whole year to finally sing it."
Showerthoughts,[removed],It’s called the rainy day paradox
Showerthoughts,[removed],What if that one time I didn't smile at the waiter/waitress and they spat at my food or did something dodgy?
Showerthoughts,[removed],"Philosopher Michael Scott once said ""Don't ever, for any reason, do anything, to anyone, for any reason, ever, no matter what, no matter where, or who, or who you are with, or where you are going, or where you've been, ever, for any reason whatsoever."" What do you think was meant by this?"
Showerthoughts,[removed],"If a banana is used as a sexual innuendo, I’m pretty sure that makes the peel the foreskin."
Showerthoughts,"And if so, in order to make the metaphor accurate to each person, what you do with it while using it to imitate genitalia will be dependent on whether or not you take the peel off, implying that you either have or haven’t been circumcised.","If a banana is used as a sexual innuendo, I’m pretty sure that makes the peel the foreskin."
Showerthoughts,[removed],40 Instagram photos are the rough data equivalent to all the written works held within the Library of Alexandria when it burned down.
Showerthoughts,[removed],What if the one of the great inventors of the past was really a time traveler from the future to pass off others inventions off as theirs?
Showerthoughts,[removed],"If there are elves who make presents for the good kids, there must be elves who mine coal for the naughty kids."
Showerthoughts,[removed],Canadians might have a better reputation as tourists because people think the rude ones are American
Showerthoughts,[removed],People who play the lottery should be more afraid of lightning.
Showerthoughts,[removed],"The best indicator and motivation to do laundry, is running out of clean underwear."
Showerthoughts,[removed],The best liar you know is not the best liar you know
Showerthoughts,[removed],Humans are just one big meat straw.
Showerthoughts,,It will be quite weird if WhatsApp starts showing memories
Showerthoughts,[removed],"The letter ""X"" is useless, You can easy replace it with ""CKS"" or ""KS"" and for other words just a ""Z""."
Showerthoughts,[removed],"If there are Christmas elves who make presents for the good kids, there should be elves who mine the coal for the naughty kids."
Showerthoughts,,You can talk while you yawn.
Showerthoughts,[removed],"If a banana is used as a sexual innuendo, doesn’t that make the peel the foreskin?"
Showerthoughts,[removed],"If there are Christmas elves who make presents for the good kids, there should be elves who mine the coal for the naughty kids."
Showerthoughts,[removed],If your father or grandfather are astronauts and you don’t call them ‘RocketPop’ - you’re doing it wrong.
Showerthoughts,[removed],"If you look at something, your tongue knows what would it feel like to lick that object, just try it"
Showerthoughts,,"If humans had wings, the size of a person's wings would become something that people compare until a size becomes discriminated against"
Showerthoughts,,There is a slight possibility that the guy who invented garlic bread was really hungry late and night and immensely afraid of the vampires around him.
Showerthoughts,,'Everything matters' is worse than 'Nothing matters'
Showerthoughts,,"Men complain about paying for dates, but the biggest cost of a date is the risk the woman takes by going out with an unknown man."
Showerthoughts,[removed],"Why do I feel guilty eating a full size candy bar, yet I can eat it’s equivalent and then some in the mini size without batting an eye?"
Showerthoughts,,You have probably walked past a stranger who is a murderer
Showerthoughts,,Farmers who raise chickens are literally chicken tenders
Showerthoughts,[removed],Handkerchiefs are just tiny blankets.
Showerthoughts,[removed],If your last name is Head you don’t name your son Richard.
Showerthoughts,[removed],This year is going as if groundhog Phil collapsed dead before seeing his own shadow
Showerthoughts,[removed],"If you have ever said a random sentence with the intention to ""be the first person to ever say that sentence"" then you probably aren't the first person to say that, due to how often that topic comes up in conversation"
Showerthoughts,[removed],"If Souls-like games required a quarter every time you died, they would have made bank in the old arcades."
Showerthoughts,[removed],This year groundhog Phil must have pooped on his own shadow
Showerthoughts,[removed],I wonder what life would be like if scientists discovered that the air we breath is composed of millions of small cells that were alive?...
Showerthoughts,[removed],"If I had 1 quid for each time someone offered me to seek therapy, maybe I would be able to afford therapy."
Showerthoughts,[removed],Most people would happily sacrifice several hours of their lives if it meant they could leave work that much earlier.
Showerthoughts,,Someone needs to make a musical about Michael Jackson’s life with his music as the soundtrack
Showerthoughts,[removed],Money that you’ve held has probably been held by someone now deceased
Showerthoughts,[removed],We could be in an ultra realistic simulation testing our response to covid-19 which ends after developing the vaccine without knowing about it
Showerthoughts,[removed],Titanic
Showerthoughts,,Shortest can be used both laterally and vertically
Showerthoughts,[removed],The reason so many films and cartoons from the thirties and forties were so lighthearted and saccharine is because people needed relief and escapism from the Great Depression and World War II
Showerthoughts,[removed],Money that you’ve held has been held by a person who is now dead
Showerthoughts,[removed],You can grow water by watering it.
Showerthoughts,[removed],Doritos are just triangular taco shells
Showerthoughts,[removed],It's very easy to mistake bloopers and outtakes by the Beatles as a bunch of lads in a Discord group call
Showerthoughts,[removed],"The phrase ""if you want something done right you have to do it yourself"" is about egoism, not the incompetence of others"
Showerthoughts,,The fact that small kids need so much sleep has probably saved mankind from extinction
Showerthoughts,[removed],"Most of the species in history of earth lived in warmer climate than now, we are the weird ones liking it this cold."
Showerthoughts,[removed],Nobody goes on wikipedia and comes away having read just one article.
Showerthoughts,[removed],Being able to admit that you’re a shitty person makes you slightly less of a shitty person
Showerthoughts,[removed],You can tell how free America is by how unfiltered we allow our stupid people to be
Showerthoughts,,The word bed looks like a bed
Showerthoughts,[removed],It won't be long before porn companies write plots around a Zoom call gone wrong
Showerthoughts,,Your FOV in real life is the shape of your eye from the exterior
Showerthoughts,,The afterlife may be such a mystery because it’s so good that everyone would kill themselves if they knew what they could have.
Showerthoughts,[removed],"For nearly everyone you'll ever meet, the last time you speak with them will be completely unremarkable and you won't know it was the last time until much later."
Showerthoughts,,Murder is the most rude thing you can do to someone.
Showerthoughts,[removed],Wearing a mask has really taken the apprehension out of using public restrooms.
Showerthoughts,,Joseph prince could be one of the BTS members
Showerthoughts,,"While it’s true that every day is a new day, it’s on yesterday’s save file"
Showerthoughts,[removed],"For long time stoners : I feel like you don’t start getting less high over time as you smoke; it’s the same speaker, at the same volume, just further away..."
Showerthoughts,[removed],You can't urinate and excrete at the same time...
Showerthoughts,,"Four leaf clovers are actually the most unlucky, since they're the ones that get picked the most often"
Showerthoughts,[removed],"A faucet head's handle's on or off motion, requires one to touch the areas meant for soiled hands and clean hands respectively."
Showerthoughts,,The only difference between a trash can and any other container is what you put in it
Showerthoughts,[removed],"When any of the Wahlbergs bust a nut, do they call it a Wahlnut?"
Showerthoughts,,"If you have a pet cat, or dog, you'll notice their knees bend backwards"
Showerthoughts,[removed],"If four leaf clovers are so lucky, how come they're the ones that always get picked?"
Showerthoughts,[removed],The closer you get to the equator the worse the living standards become
Showerthoughts,[removed],"If you want to try to understand how blind people feel about color, try to imagine a new one"
Showerthoughts,,"Elephants are some of the most bizzare mammals to have ever lived. But because they are still alive, we gloss over that fact."
Showerthoughts,[removed],If we're all God's children then all sex is incestuous.
Showerthoughts,[removed],"To turn faucet head handles on or off, they have designated areas meant for dirty hands and clean hands respectively."
Showerthoughts,[removed],An online class watching a video together is just a live reaction video.
Showerthoughts,"If I walk into a store with my genitals hanging out, nobody's first thought is ""Oh well, he got his pants most of the way on"". How is mask wearing any different?",Walk into a store...
Showerthoughts,[removed],Elephants aren't alive.
Showerthoughts,,"digital clocks' 10minute display never gets to show ""6"""
Showerthoughts,,Rich people are more foreign than the people they try to keep out or kick out.
Showerthoughts,,People with large foreheads are probably taller than they think
Showerthoughts,[removed],Watching a graduation ceremony is like sitting through a movie that is entirely end credits.
Showerthoughts,[removed],There is a point in space far enough from the Sun where you don't have to worry about freezing because it's the perfect distance from the Sun.
Showerthoughts,,"The first place we look for on a new map is usually a know location, like our hometown, which we’d never need a map to find."
Showerthoughts,,"There is no valid, logical, knock-down argument against wearing socks with sandals."
Showerthoughts,,"The digital clock's minute display never get to show ""6"""
Showerthoughts,[removed],Google thinks like 1264 people live in my house
Showerthoughts,[removed],The oft used shortening of the Phillies to the Phils sounds like the team is just made up of bunch of dudes named Phill.
