subreddit,selftext,title
Showerthoughts,,"Everything in the world is either a potato, or it is not a potato."
Showerthoughts,[removed],Google or Measuring tape?
Showerthoughts,,Everyone is dying to get into the cemetery.
Showerthoughts,[removed],The person who made the shower thoughts subredit probably came up with the idea of it while in the shower.
Showerthoughts,[removed],Rent is a monthly membership for shelter
Showerthoughts,[removed],"Given the huge variety of foods in the world, I probably won’t ever try my true favourites."
Showerthoughts,[removed],How is it almost impossible to remember a single sitcom that has male actors sporting beard?
Showerthoughts,[removed],"If the company you work for is willing to hire your significant other, it seems nice but probably means they don't expect you to advance into management."
Showerthoughts,[removed],If DIO masturbated would he be fucking his step brother?
Showerthoughts,[removed],"The saying “if you can’t beat ‘em, join ‘em” basically means that if you’re unique and different than others, you should conform to be how the majority expects you to be."
Showerthoughts,[removed],"For the live action remake of ""Toy Story,"" Disney only needs to change the sets and the human characters"
Showerthoughts,[removed],"In a world without gold, I might have been a hero"
Showerthoughts,[removed],Singing is just speaking in cursive.
Showerthoughts,[removed],If a girl is caught drift racing on the streets she is now a boy racer.
Showerthoughts,[removed],"If you wish that the rule about not getting infinite wishes did not exist, you could then wish for infinite wishes."
Showerthoughts,[removed],People should give coin gifts for people’s cake day instead of cake because on your bday you’d typically get more gifts than cake.
Showerthoughts,,Signing a letter with the word sincerely is one of the least sincere ways to sign a letter.
Showerthoughts,[removed],The creation of the Uruk-hai made no economical sense.
Showerthoughts,[removed],The only time it’s ok to sit on someone’s lap on a plane is when your skydiving.
Showerthoughts,[removed],If a girl is caught drift racing on the streets is she now a Boy racer?
Showerthoughts,[removed],Gay people never spit straight facts
Showerthoughts,[removed],"Writing “sincerely, (name)” at the end of a letter is one of the least sincere ways to sign a letter."
Showerthoughts,,People who can type fast on the Keyboard without looking are the minority.
Showerthoughts,,Every person brushes their teeth slightly differently.
Showerthoughts,,"Everything times infinity is infinity and anything times 0 is 0, so that will make 0 X infinity = 1"
Showerthoughts,[removed],Waiting for Captain Crunch to soften in milk is the cereal equivalent to waiting for soup to cool
Showerthoughts,[removed],Political parties are like bundles of choices on a hundred different policy preferences and you have to choose the one with the least you disagree with.
Showerthoughts,,It's not premarital if you don't get married
Showerthoughts,[removed],"Everything times infinity is infinity and anything times 0 is 0, so will that make 0 X infinity = 1?"
Showerthoughts,[removed],The dumb coworkers you complain about at work probably go home and complain about you being dumb.
Showerthoughts,[removed],Pokémon
Showerthoughts,[removed],There’s probably going to be a huge increase in the amount of germaphobes because of the pandemic.
Showerthoughts,,It's not premarital if you don't get married
Showerthoughts,[removed],I think less of convenience stores if they don’t carry Simply Made Orange Juice but do carry Minute Maid Orange Juice.
Showerthoughts,[removed],Do cats think we only keep them around to harvest their poop from their litter-boxes for recreational/personal purposes?
Showerthoughts,[removed],"If a Girl is caught drift racing on the streets, is she now a Boy racer?"
Showerthoughts,[removed],100+ years from now medical advice we rely on will be debunked
Showerthoughts,[removed],A bats ears are also eyes
Showerthoughts,,Everything you ever bought is somewhere in a trash heap.
Showerthoughts,[removed],You learn how bad at spelling you are until you’re in a chat trying to keep up with a dozen people. It’s 90s chatrooms all over again on zoom calls
Showerthoughts,,Luke Skywalker could just have joined Darth Vader and took over the empire with him so they could have just used it for good.
Showerthoughts,,"The attraction quotient goes down if what you're looking at isn't covered, and doesn't have a sense of mystery."
Showerthoughts,[removed],A female cockroach should be called a cuntroach.
Showerthoughts,[removed],"Older generations had memes too, they were just the comic section of newspapers."
Showerthoughts,[removed],"If you're older and one day you woke up as your younger self with your current mind, you probably wouldn't be able to form relationships because you would view others as too young."
Showerthoughts,[removed],In 200 years everyone in the world right now will be dead.
Showerthoughts,[removed],Whenever we say “do shit” we say “douche it” also...
Showerthoughts,,It's not premarital if you don't get married
Showerthoughts,[removed],"On the bright side, there hasn’t been a school shooting for a while."
Showerthoughts,[removed],The difference between Chaka Khan and Shaka Zulu is astounding.
Showerthoughts,,"Birds are such assholes, shitting on our cars and eating our seeds"
Showerthoughts,[removed],"Eating animal hearts (offal) has cardiac health benefits, which means, when you eat another heart, in a sense, you gain its power."
Showerthoughts,,It's not premarital if you don't get married
Showerthoughts,,If regular animals don’t exist in the Pokémon world then people would eat Pokémon as meat
Showerthoughts,,"If people stop using paper money and coins, you'll have to put in a debit or credit card to use a gumball machine."
Showerthoughts,[removed],"Older generations had memes too, they just called them “funnies” and were the comic section of the newspaper."
Showerthoughts,[removed],What was a roadrunner called before there were roads?
Showerthoughts,,Parking meters probably generate the majority of their money from people not paying.
Showerthoughts,"and you picked him up and put him on that rectangular plastic/fabric thing on your kitchen table that keeps your tablecloth clean.

You would place Mat on a placemat.",If you had a friend named Matthew
Showerthoughts,,Your future spouse is probably a perfect stranger.
Showerthoughts,[removed],"Maybe the reason why flat earthers exist is because real science is too complicated even for smart people, so they choose to believe something that they can understand simply and say anything else is fake."
Showerthoughts,,The word “toiIet” is actually instructions to “toil it” in those extreme conditions.
Showerthoughts,[removed],The word “toilet” is actually instructions to “toil it” in those extreme conditions.
Showerthoughts,[removed],I don't know why while showering the music playlist always decides to play the saddest songs.
Showerthoughts,[removed],"If you time travel to the future to tell a joke, would it be an old joke when the previous time catches up?"
Showerthoughts,,Humans would probably greet each other like dogs great us if everyone just rolled with it and no one every told you that that was weird.
Showerthoughts,,The future looks pretty bleak if you believe in reincarnation
Showerthoughts,,Sitting with your legs crossed looks quite classy... unless you’re on the shitter.
Showerthoughts,,People make it a point to demote others opinions unless it boosts their self ego
Showerthoughts,,Sitting with your legs crossed looks quite classy... unless you’re on the toilet.
Showerthoughts,[removed],Gorillas don't know any body building techniques so that means we have never seen one at full strength
Showerthoughts,,Tensey one Tensey two Tensey three Tensey four would have been much easier to teach kids
Showerthoughts,[removed],"Microsoft, Virgin, and Badcock are all terrible things to name your business if you're trying to get laid."
Showerthoughts,[removed],2 is the only prime number that is also even
Showerthoughts,,"Sitting with your legs crossed looks pretty classy, unless you’re on the toilet."
Showerthoughts,,"Sitting with one leg over the other looks pretty classy, unless you’re on the toilet."
Showerthoughts,,People make it a point to denote others opinions unless it boosts their own self ego.
Showerthoughts,[removed],We like to believe that the people we are surrounded by don't have a reddit account and the rest of the world might
Showerthoughts,[removed],Eyeballs have wings
Showerthoughts,[removed],The difference between Chaka Kahn and Shaka Zulu is astounding
Showerthoughts,[removed],Eventually there will be digital news anchors and that will make me very sad.
Showerthoughts,[removed],Screenslaver from Incredibles 2 is just a boomer telling kids to get off their phones.
Showerthoughts,[removed],"No one can say the sentence ""I'm the most modest person in the world"" and be right"
Showerthoughts,[removed],"Macklemore’s song “Thrift Shop” from 2012, he claimed to have $20 in his pocket which would be $25.90 today, adjusted for inflation."
Showerthoughts,[removed],I have this really weird interesting thought
Showerthoughts,,"meghan markle a gangster, she marry a prince and bring HiM back"
Showerthoughts,,Associating beauty with morality is one of the cruelest things mankind practices.
Showerthoughts,[removed],"Melinda Gates is a trooper for just ignoring the name ""Microsoft"""
Showerthoughts,[removed],In 1878 people would get so excited that they'd crowd around a light bulb to see electrical light for the first time. Today we have devices that light up every second before our eyes and there's no excitement
Showerthoughts,,“quinquennium” has more q’s than “queues”
Showerthoughts,[removed],Imagine if we were born knowing how many years we have to live .
Showerthoughts,,"Pornos are probably the only films where the better they are, the faster someone stops watching"
Showerthoughts,[removed],Corduroy pillowcases make great early morning headlines.
Showerthoughts,[removed],"As children we are taught adults should get absolute respect, but you later learn not all of them actually deserve it."
Showerthoughts,[removed],"Thanks to Reddit, almost no one will name their baby girl “Karen” anymore."
Showerthoughts,[removed],Imagine the thoughts going through Melinda Gates mind when she heard the name of her future husband's company.
Showerthoughts,,Humans are the slowest mammal to start do anything productive like walking
Showerthoughts,,"You aren't supposed to feed Gremlins after midnight, but technically its always after midnight."
Showerthoughts,[removed],Bill Gates wife must have been very worried on their first date after hearing the name of his company.
Showerthoughts,,Little house on the prairie is actually the prequel to Highway to Heaven.
Showerthoughts,[removed],People who cut in line in traffic when lanes reduce should be skinned alive and then rolled in salt.
Showerthoughts,,"They tell us as children that we shouldn’t give out our personal information on the internet. However, if you were to make up information about yourself, there’s a pretty good chance you’re sharing someone else’s information."
Showerthoughts,,"Just a thought about the saying “tough as nails.” A nail can be tough when you hammer it straight on, but if you hit it from an angle it’ll bend, and be completely useless. So yeah, you can be tough as nails. If you get treated wrong you’ll break, but if you’re treated right you’ll be just fine."
Showerthoughts,[removed],"“Sincerely, (name)” is one of the least sincere-sounding ways to sign a letter."
Showerthoughts,[removed],Your battery charge is just your phone’s health bar
Showerthoughts,[removed],whores dont have hormones
Showerthoughts,,The power to see into the future is pointless because if you see the future in which you have the power it is unchangeable and if you see the future without the power then you wont see the future because it is changeable.
Showerthoughts,[removed],whores dont have hormomones
Showerthoughts,,Cats and other animals must think glass is solid air
Showerthoughts,[removed],whores dont have hormones
Showerthoughts,[removed],"Steam should have an option where you're displayed as offline right after you logged in, so nobody can see your ""last online"" time. Same goes for origin, uplay etc."
Showerthoughts,[removed],"Just a thought about the saying “tough as nails.” A nail can be tough when you hammer it straight on, but if you hit it from an angle it’ll bend, and be completely useless. So yeah, I’m tough as nails. If you treat me wrong I’ll break, but if I’m treated right I’ll be just fine."
Showerthoughts,,There are stadiums where more champagne and celebrations have happened in the away teams locker rooms than their own
Showerthoughts,[removed],Hitting a blunt is the same as having shower thoughts.
Showerthoughts,,"We perceive people who speak a second language in a broken manner to be unknowledgeable. However, most people can’t speak even a broken form of a second language. Doesn’t that make the former more educated than the latter?"
Showerthoughts,[removed],Water’s temperature is it’s taste.
Showerthoughts,[deleted],Water’s taste is it’s temperature.
Showerthoughts,[removed],"Water’s taste, is it’s temperature."
Showerthoughts,[removed],"Technicaly, Fans should be making the air hotter. (because they make the air particles move faster)"
Showerthoughts,[removed],Trees were the first backscratchers
Showerthoughts,[removed],"Cold water feels sharp, while warm water feels soft."
Showerthoughts,[removed],"People who judge someones intelligence off of a college degree or a certification are simple-minded, and think like a idiotic person themselves."
Showerthoughts,[removed],One day you’ll be able to buy a $40 ounce of Kirkland brand weed at Costco
Showerthoughts,,A very sizeable amount of Rick Astley’s Never Gonna Give You Up probably comes from people clicking on rickroll links
Showerthoughts,[removed],Enegizer Bunny Energy
Showerthoughts,,if boy. Your sister is the female version of you
Showerthoughts,[removed],Why
Showerthoughts,,If we turn back on our paper billing the post office might get the boost it needs. (US)
Showerthoughts,[removed],We spend our entire lives working to die.
Showerthoughts,,Easy resealable bags from food packaging often aren't easy or don't reseal.
Showerthoughts,[removed],"Newfoundland is literally just Newfound Land, making it the most uncreative nation name"
Showerthoughts,,I wonder how many spiders have climbed over my toothbrush in my absence.
Showerthoughts,[removed],Cat's eyes are just 2d circles that rotate on themselves.
Showerthoughts,[removed],"You can spell the word ""differently"" however you want and it would still be spelled differently"
Showerthoughts,[removed],The only thing standing between us and literal anarchy are imaginary self imposed rules.
Showerthoughts,[removed],Can vegans beat their meat?
Showerthoughts,,Humans are really suggestible except when it’s suggested that they’re suggestible
Showerthoughts,,Getting your Instagram disabled is the influencer version of being grounded.
Showerthoughts,[removed],Why is 'W' pronounced as 'Double U' when clearly we make it using double Vs
Showerthoughts,,"If life is a simulation or a game, driving is load time, memories are save points, Alzheimer’s is saved corruption data."
Showerthoughts,[removed],Saying 'I need to wash my hairs' makes it sound like you have less hair than if you say 'I need to wash my hair'
Showerthoughts,[removed],Clothing trends are just peer pressure from fashion companies.
Showerthoughts,,Star wars must have one hell of a public education system for all humans to speak the same language with almost exactly the same accent across an entire galaxy.
Showerthoughts,[removed],Being old means reading the YouTube comments for your favorite song that was once hip and trendy and seeing that people were sent by a reference you've never heard of. Being young means something hip and trendy sent to a song you've never heard of and leaving a comment.
Showerthoughts,[removed],"Due to gay being used as a derogatory term, there are more gays than there are homosexuals"
Showerthoughts,[removed],How to game the US election
Showerthoughts,,"Someone with a hole cut in their face mask looks dumber than someone not wearing a mask at all, but functionally they are the same"
Showerthoughts,[removed],Lots would be different in a alternate universe like Gender of people
Showerthoughts,[removed],Numbers are adjectives.
Showerthoughts,,People create great things only for people to ruin it with time.
Showerthoughts,,A good post title can save you from a lot of reading.
Showerthoughts,[removed],Philosophers are overthinkers who get paid
Showerthoughts,[removed],"Bisexuals, pansexuals etc have multiple virginity’s"
Showerthoughts,[removed],"If you think about it, if the carriage driver from jojo bizarre Adventure didn't crash we would have an amazing anime (in my opinion)"
Showerthoughts,,"People who sit at a PC all day clicking a mouse have been properly clicker trained, like our canine friends."
Showerthoughts,[removed],"Americans have a pretty firm ""don't ask, don't tell"" policy about the disposal of boogers."
Showerthoughts,[removed],Sleeping is the most ubiquitous fake it til you make instance there is
Showerthoughts,[removed],Facebook
Showerthoughts,,"If Sir Mix-a-Lot was from England and was knighted, would he become Sir Sir Mix-a-Lot?"
Showerthoughts,[removed],"If we hear our voices differently in our head, how do people get so good at celebrity impressions?"
Showerthoughts,[removed],Shaving or trimming your pubes reduce your chances of getting laid
Showerthoughts,,A phone that is $300 off is more expensive than a phone that is $30 off.
Showerthoughts,[deleted],A phone that is $300 off is more expense than a phone that is $30 off.
Showerthoughts,,There is no way to vote morally you can only vote a means to an end.
Showerthoughts,,You can tell a majority of redditors don't read non-fiction because otherwise TIL subs would be hounded.
Showerthoughts,[removed],"LGBTs have claimed the rainbow to represent them, leaving no colors for other Causes"
Showerthoughts,[removed],A gray colored pencil is just a slightly lighter no. 2 writing pencil without an eraser.
Showerthoughts,[removed],The people who were buying toilet paper in bulk are probably the same people protesting to end quarantine.
Showerthoughts,,Birthday party or celebrations are meant to celebrate a person's existence. No wonder I never had one
Showerthoughts,[removed],People say it’s chilly when it’s cold even though Chili is very hot
Showerthoughts,,"Thé cløaca ğushes blõod, sëmen, exčrement, ãnd mųch möre. İt iś júst â reğular wêdnesday"
Showerthoughts,[removed],Finger guns didn't exist before guns were invented
Showerthoughts,[removed],"Aliens invaded the Moon on July 20th, 1969."
Showerthoughts,[removed],We are born into a generation too late to explore the world but too early to explore the galaxy.
Showerthoughts,[removed],"The biggest difference between vowels compared to a consonant letter is that for vowels you end up opening your lips to say them, while the consonants you end up closing your lips to say them."
Showerthoughts,[removed],"Arabic numerals only allow you to count to 5 on one hand, but Roman numerals let you count to 6 or 7 on the same hand."
Showerthoughts,,"If the Breaking Bad scenario took place in a country with free healthcare,Walt might not have needed to do what he did"
Showerthoughts,,"If you see/hear 0 in a count down, it’s already too late."
Showerthoughts,[removed],we got the plague in the year of the rat
Showerthoughts,[removed],Overthought about thinking
Showerthoughts,[removed],Plants are just very slow animals
Showerthoughts,[removed],I must be mentally unwell because I think he's a fat prick too.
Showerthoughts,,It's probably really easier to rob people now that everyone has a mask on.
Showerthoughts,[removed],Doctors probably know more about your body than yourself.
Showerthoughts,[removed],why is no one talking about how we got a plague in the year of the rat
Showerthoughts,,"Since modern computer labs were introduced to colleges, there must be untold amounts of brilliant ideas lost when users graduate and the profile is eventually deleted"
Showerthoughts,[removed],I must be mentally unwell.
Showerthoughts,[removed],"The youngest female author, most likely is Anne Frank."
Showerthoughts,,"When we were young we all thought we were like Aang, little did we know that we would grow up to be like Sokka."
Showerthoughts,[removed],Should you join The R/TheDuccCult
Showerthoughts,[removed],You aren’t you when you’re not who you were.
Showerthoughts,[removed],Coffins are just meat lockers
Showerthoughts,[removed],Welp-
Showerthoughts,[removed],"If you had a button that prints $1000, and you can press it 4 times/second, it would take you 8680 days to print the $3 trillion that the fed has printed so far.s"
Showerthoughts,[removed],YouTube Rewind 2019 would be a lot more fitting this year
Showerthoughts,,A lot of people upvote shitty memes because the comment used in them was good
Showerthoughts,,"A man is the product of four testicles, two pairs of two within two different contexts providing two different uses that are very similar and in some instances, one in the very same......"
Showerthoughts,[removed],"Why do we vote on elitist power-hungry assholes to choose our laws instead of just voting on laws ourselves, isn’t that what true democracy would be"
Showerthoughts,[removed],Fuc* this sub
Showerthoughts,[removed],"If you had a button that prints 1000 dollars, and you can press it 4 times a second, it would take you 8680 days to print the 3 trillion dollars that the fed has printed so far."
Showerthoughts,,"Nobody ever says, ""Oh great, the cops are here!"" in a genuinely delighted tone."
Showerthoughts,[removed],El moderador de este sub es un idiota
Showerthoughts,,"If the mother died after giving birth, it is unfortunate but Thanos would say, ""Perfectly balance""."
Showerthoughts,[removed],The bot on this sub can eat ass
Showerthoughts,[removed],Slime is just chewing gum for your hands.
Showerthoughts,"Men just stand next to each other holding pps and just peeing. In one room. And they can all see each other. Imagine if women just had to squat in one room, just peeing next to each other. Weird.",Urinals are so weird
Showerthoughts,[removed],The automod on this sub can eat ass
Showerthoughts,[removed],What if almost everyone has an allergy to pufferfish but there are some people who are immune
Showerthoughts,[removed],If you could print 1000 dollars everytime you pressed enter and you pressed it 4 times a second it would still take you 8680 days to print the 3 trillion dollars that the fed has printed so far.
Showerthoughts,[removed],"If cats meow to mimic a human baby cry, you would think they'll be able to talk by now."
Showerthoughts,[deleted],Very rarely will people tell you the truth
Showerthoughts,[removed],"The internet, cars &amp; planes may make the earth feel smaller, but you're only sitting on a 510,064,472 km² surface area of terrain, w/ a weight of 5.972 × 10²⁴ kg."
Showerthoughts,[removed],What if reddit light theme user make memes that only they can see like dark mode users
Showerthoughts,[removed],"If Elon Musk were to go on to have three children, he could call them the three musketeers."
Showerthoughts,,We use a walker as babies to help us learn to walk. And then we use a walker again as old people to help us continue to walk.
Showerthoughts,[deleted],You can have an EXTRAvaganza even if you don't have a single vaganza to being with.
Showerthoughts,[removed],One of the nice things about school was the dumb people were told they were dumb. Now all the C and D students have no metrics reminding them to shut up and let the smart people handle things.
Showerthoughts,[deleted],All vaganzas are extravaganzas.
Showerthoughts,,If movies set in the near future were realistic they’d have less teleport technology and more VR that actually kind of works and isn’t as pixelated or glitchy.
Showerthoughts,,It’s a lot easier to make bad impulsive decisions than good ones.
Showerthoughts,,Pocket pussies are the Gogurt of vaginas
Showerthoughts,,"When someone says something is not in their vocabulary, they are literally, always wrong."
Showerthoughts,,"Any combination of ""robot + word"" and ""word + robot"" will be very different things, but equally interesting"
Showerthoughts,,If you nuked the moon you could probably see it from earth
Showerthoughts,,Blerg blerg blerg blerg blerg.
Showerthoughts,[removed],nowadays spitballs are considered poison darts
Showerthoughts,,"A soggy potato with a pigeons brain can be the ""leader"" of our country"
Showerthoughts,,If somebody was magically able to make people romantically attracted to them they probably wouldn't need to. People are attracted to power and restraint.
Showerthoughts,,"You enter this world surrounded by loved ones, and if you’re lucky, you leave the same way."
Showerthoughts,[removed],We've been able to harness nuclear fusion for a long time: it's called solar panels.
Showerthoughts,,It's possible that a potato with a pigeons brain can become president of the US
Showerthoughts,Nor are most that social,Social networking sites often don't involve the 'media'
Showerthoughts,,It’s really wet in here
Showerthoughts,[removed],R/showerthoughts is the twitter of reddit
Showerthoughts,,Pistachios are nut clams
Showerthoughts,[removed],“DO NOT TOUCH” Would be a terrifying thing to read in braille.
Showerthoughts,[removed],...
