subreddit,selftext,title
Showerthoughts,[removed],The best part about being having both Arachnophobia and Glasses is that you can’t see nor get scared of spiders in the shower
Showerthoughts,,I've probably cut off the Invisible Boatmobile and not even known about it
Showerthoughts,,Porn websites probably have the most options out of any websites
Showerthoughts,,If you jump into the ocean you make the level of the water rise.
Showerthoughts,,If it was a European country that ate dogs and not an Asian one we probably wouldn't care as much in the West.
Showerthoughts,,The brain named itself
Showerthoughts,[removed],A muesli bar is actually just compact scroggin.
Showerthoughts,[removed],I wonder how many relationships lost their trust because of the portrayal of “work friends” in the Jim and Pam relationship in the Office.
Showerthoughts,[removed],how many times have you jokingly said “that’s a rapist van” and been right..
Showerthoughts,,Killing off so many prominent Game of Throne characters shows that cramming too many roles at once in a series makes keeping the character development hard and that killing off someone and starting the development with someone new is easier
Showerthoughts,,Ignorance is bliss but living in bliss makes you ignorant.
Showerthoughts,,Masked criminals benefit from the virus as wearing masks in public isn't as suspicious as it once was
Showerthoughts,[removed],History lessons get longer while time goes by
Showerthoughts,,The word bed looks like a bed
Showerthoughts,[removed],I wonder how many times we’ve jokingly said “that’s a rapist van” and been right...
Showerthoughts,[removed],Shower thought: what should I put on r/showerthoughts ???
Showerthoughts,,Mario&amp;Luigi Bowser's Inside Story must've been a porn game for Vore Fetishists
Showerthoughts,,Sneezing/coughing in public feels like a crime.
Showerthoughts,[removed],Minecraft is Tinder for kids
Showerthoughts,[removed],It takes about 3-4 times before you finally cave-in and click on that video that keeps randomly popping up in your YouTube recommendations
Showerthoughts,,"Children don’t get more disrespectful as they age, they just slowly feel that they are mature enough to express their own feelings and concerns."
Showerthoughts,[removed],Christians call themselves “born again” but it really should be the Buddhists who do.
Showerthoughts,,When you are a kid getting older is good. And when your a adult getting older bad.
Showerthoughts,,Some of the world's greatest artists in history will never be known only because their canvasses were skin.
Showerthoughts,[removed],"As many aircraft of the US were built with well ahead of time technologies, UFOs could be their classified projects."
Showerthoughts,[removed],You waited your whole life to read this.
Showerthoughts,[removed],You always drop healthy habits right when you need them most.
Showerthoughts,[removed],Asian Food is Gay
Showerthoughts,,You've probably seen more purple color in your entire life than half of humanity did in their entire lives
Showerthoughts,[removed],"After these Zoom calls, I’m really starting to agree with those tribes that believed that cameras suck away your soul."
Showerthoughts,,You can’t have rich people without poor people.
Showerthoughts,[removed],Emotions are the thoughts of the gut
Showerthoughts,[removed],You just be weird to the people who you think are weird.
Showerthoughts,,"It doesn't matter if it's made with the same ingredients, pasta will taste different depending on the shape."
Showerthoughts,,"The older you get, the closer you get to the shower head when taking a shower"
Showerthoughts,,What do the roots of a cactus look like?
Showerthoughts,"So we know that  cats  are called..well...cats.

But what do cats think they are called? Like, What do they think their species name is?",A cat's opinion on what it is
Showerthoughts,,"If mosquitoes suck my blood when im high as fuck, are they now high as fuck?"
Showerthoughts,,"""I love you too"" won't work. I didn't say I love me, and I wasn't talking about your Uncle You."
Showerthoughts,"I know that upvote is not the same thing as a like but I just cannot make up my mind to upvote a disturbing post
When someone posts something disturbing, it should be downvoted. I guess that would help understand people’s sentiment towards it.
I can’t imagine a reason why this post(https://www.reddit.com/r/awfuleverything/comments/ico640/netflixs_newest_edition_a_show_about_11_year_olds/?utm_source=share&amp;utm_medium=ios_app&amp;utm_name=iossmf) has 30k upvotes!",Reddit should show the top upvoted and top downvoted posts in popular
Showerthoughts,,By this point Howard Stern has basically had a personal concert with almost every band worth talking about.
Showerthoughts,,The only pain you can feel in your dream is stomach ache
Showerthoughts,,It's really weird that so many of our opinions and beliefs about the true state of the world are directly connected with whether you like this one guy.
Showerthoughts,,"If slot machines didn't have chairs in front of them, people probably wouldn't gamble as long."
Showerthoughts,[removed],Parents should dress their kids up as doctors for Halloween. With masks &amp; gloves. Probably the only way to safely enjoy trick-or-treating.
Showerthoughts,[removed],"""I love you too"" is nonsense. I didn't say I love me, and I wasn't talking about your Uncle You."
Showerthoughts,[removed],People who cut in line in dead traffic are no different from rapist
Showerthoughts,,Having sex is just cosplaying your parents.
Showerthoughts,If the bread gets close/in fire it will be toasted at one point. There for there is only burnt toast,There’s no such thing as burnt bread
Showerthoughts,,"The Lion's King's ""Can You Feel the Love Tonight"" is sung by a random woman. It would've been so much better to have it as a passionate duet between Timon and Pumbaa."
Showerthoughts,[removed],Staple removers are the vampires of office supplies
Showerthoughts,[removed],I wish I travelled more in 2019
Showerthoughts,[removed],"At this point, Amazon should have to pay anytime someone named Alexa wants to change their name."
Showerthoughts,[removed],Earth is like a guy who knows exactly where to stand next to a bonfire
Showerthoughts,[removed],It’s mindblowing to think about that there were movies made during the second WW
Showerthoughts,[removed],Slugs are just homeless Snails.
Showerthoughts,[removed],"Kids these days won’t use the choppy, stilted voice we do to imitate robotic speech"
Showerthoughts,[removed],Dwyane Wade and Dwayne Johnson's first names are spelled differently.
Showerthoughts,[removed],"Some people have more money than years in the universe. If you look at it that way, Jeff Bezos has made more than 15 dollars since the beginning of time."
Showerthoughts,[removed],Body wash works the best when you use a loofah.
Showerthoughts,[removed],Body wash doesn't work well if you don't use a loofah.
Showerthoughts,[removed],I will probably never forget the level of selfishness and ignorance of some people close to me that I’ve witnessed in 2020.
Showerthoughts,"we are no different than birds. on a planet with much stronger gravitational force, birds would walk like us. on a planet with much weaker gravitational force, we could fly like birds. we just happen to live in the sour spot where birds can fly but we can't.",humans actually can fly. we just happen to be stuck on a planet where the gravitational force is too strong for us to use it.
Showerthoughts,[removed],"""I love you too"" is not an appropriate response. I didn't say I love me, and I wasn't talking about your Uncle You."
Showerthoughts,The less optimistic among us would probably say we already are.,The older you get the more right wing you become. With modern medicine keeping people alive longer and longer we could soon be living in a world full of Hitlers.
Showerthoughts,,Your nipples are older than your teeth.
Showerthoughts,Quarantine is just nationwide house arrest.,Quarantine
Showerthoughts,,The majority of water is underwater
Showerthoughts,,Everything you see and do has already happened before your brain knows it.
Showerthoughts,[removed],We are currently the cavemen of the internet
Showerthoughts,[removed],no one will ever know who the world's best spy is
Showerthoughts,,"Since signals take time to reach the brain, we're living in the past, which means everything you see and do has already happened."
Showerthoughts,[removed],Brains are just aliens who are controlling a body to be able to communicate with themselves
Showerthoughts,,That little sound your phone makes when you plug it in could just be your phone moaning
Showerthoughts,[removed],???
Showerthoughts,[removed],The easiest way to receive a nickname is to have the same name as someone in your friend group.
Showerthoughts,,"Pasta might be the only food where it's variation it's on shape instead of taste, and yet, it manages to change the whole feel of it."
Showerthoughts,[removed],Puking is just confused diarrhea.
Showerthoughts,[removed],The best way to get a nickname is to be in a friend group with someone that has the same name as you.
Showerthoughts,[removed],All dogs have absolutely no conception of the Revolutionary War.
Showerthoughts,[removed],"You are going to die in three to four days, the only way you can stop it is by drinking water"
Showerthoughts,[removed],Your hand has already grabbed that glass of water by the time you see it because it takes a measurable amount of time for the image to reach the brain.
Showerthoughts,[removed],The best way for any government to share confidential information would be in an MMORPG server. No one would take them seriously if they encountered them in-game.
Showerthoughts,[removed],If you’re a widow that recently married who are you spending the rest of eternity with in the afterlife?
Showerthoughts,,All change is gradual. It is the revelation of it that is not.
Showerthoughts,,Challenge coins are military pogs
Showerthoughts,"Actually, I can't think of another food that is not organic like salt.","Salt is, with water, one of the very few food that is not from an organic source. We basically put little rocks in our plates to eat."
Showerthoughts,,"Other than the irony that dead bodies float, there is nothing funny about a person drowning"
Showerthoughts,[removed],Stranger things is just a detailed SCP containment breach.
Showerthoughts,[removed],Asking someone to remind you of something is just asking them to remember it so you don’t have to.
Showerthoughts,,One day pigs gave up speaking Latin.
Showerthoughts,[removed],"Signals from neurons take time to reach the brain. When you see your hand grabbing that glass of water, it has already happened."
Showerthoughts,[removed],"At the end of the meme ""I am the dumbest man alive"", the person giving away the crown has become dumber, since he was wrong about the identity of the dumbest man alive."
Showerthoughts,[removed],All change is gradual in this world. It is the revelation of it that is not.
Showerthoughts,[removed],When did pigs stop speaking Latin?
Showerthoughts,[removed],"Before you start at a new job, everyone hears a new hire is coming in and hopes it's someone hot... then you show up."
Showerthoughts,,A complete season of losses is also a perfect record.
Showerthoughts,[removed],"Signals from neurons take time to reach the brain. When you see your hand grabbing that glass of water, it has already happened."
Showerthoughts,,Desserts and Deserts are polar opposites
Showerthoughts,,Deserts are usually hot and dry places but Desserts are cool and sweet
Showerthoughts,[removed],Products/companies that have ads that I cannot skip while on YouTube makes me actively want to hate them.
Showerthoughts,[removed],Where on a domination scale would you be?
Showerthoughts,[removed],"I wonder if the reason we peel oranges is because millennia ago some kid complained to their parent that they didn't like it and the parent peeled it for them. The kid's friends decided they wanted it peeled too, they did it for their kids, and so on . . . to today where we (almost) all peel oranges"
Showerthoughts,,Eventually you will have more yesterdays than tomorrows.
Showerthoughts,[removed],"If Superman wore any kind of armor, wouldn’t he just punch through it?"
Showerthoughts,[removed],Cake day for February 29th
Showerthoughts,,"There is no difference between killing 200 children and 205 children. In both cases, you get a life sentence"
Showerthoughts,,People concentrate too much on the fact everyone has a past. Not enough of us focus on the fact we all have a future.
Showerthoughts,,Porn sites in the star wars universe must have so many categories
Showerthoughts,[removed],Melons are just party-gourds
Showerthoughts,,"At one point, when people start to live longer than a century, we won't be able to just put the last two digits for the year."
Showerthoughts,[removed],It’s sad that I can tell how old a podcast / video is by the death count they reference
Showerthoughts,[removed],A redditor has probably not responded to your comment because they recently passed away unexpectedly.
Showerthoughts,[removed],Avatar (the ladt airbender)
Showerthoughts,[removed],Do we actually taste in our mouths?
Showerthoughts,[removed],Being naked with shoes on makes you feel more naked than actually being naked
Showerthoughts,,Women get upset like men get hungry.
Showerthoughts,[removed],It’s impossible to picture a color in your head that doesn’t already exist.
Showerthoughts,,"Calling someone selfish actually makes you the selfish one, because you're mad they aren't doing what you want."
Showerthoughts,,"You’re only a prostitute if it’s not being recorded. Otherwise, you’re an actor/performer."
Showerthoughts,,Ice cream shops that sell birthday cake flavored ice cream can be selling you any flavor.
Showerthoughts,[removed],Eventually you will have more yesterdays than tomorrows.
Showerthoughts,,"When you break bread it most likely breaks along some weak path. So by breaking bread, you are actually creating two stronger pieces of bread."
Showerthoughts,[removed],Quesadillas are just a Mexican grilled cheese.
Showerthoughts,,Every piece of plastic ever created still exists.
Showerthoughts,[removed],"What do people that were born blind, imagine humans look like.."
Showerthoughts,[removed],The human brain does not 100% know how the human brain works
Showerthoughts,[removed],Eventually you will have more yesterdays than tomorrows.
Showerthoughts,[removed],"If pregnant women can travel through time, then they won't give birth."
Showerthoughts,[deleted],"When you break bread, it will most likely break along a weak path. So when you break bread, you are likely creating two stronger pieces of bread."
Showerthoughts,,"Because of these ""impossible standards"", we average looking guys get together with beautiful women."
Showerthoughts,[removed],"In call of duty black ops 2 if you kill Raul Menendez, USA falls in caos because he had lot of followers, the same thing happened with George Floyd"
Showerthoughts,,"If you swallow enough corn, you have a chance of recreating an ear of corn later."
Showerthoughts,,"Most food places are pretty stingy with the sauce packets and cups, but Taco Bell is overly generous with theirs."
Showerthoughts,,Willy Wonka is just saw for children
Showerthoughts,,"Most food places are pretty stringy with their sauce packs and cups, but Taco Bell is overly generous with theirs."
Showerthoughts,,Dogs think their human’s eye become massive whenever humans put on sunglasses.
Showerthoughts,[removed],The Porn Sites of Star Wars Must Have Countless Categories. [NSFW]
Showerthoughts,[removed],"If you think all you're parents all treat their kids the same, youre probably the favorite."
Showerthoughts,,An empty helium tank weighs more than a full one
Showerthoughts,,Salt is to season mixes as peanuts are to mixed nuts.
Showerthoughts,,"Milkshakes are stirred, not shaken"
Showerthoughts,[removed],Tetris is censored porn
Showerthoughts,,"When Peppa Pig and her friends visit the zoo, they are really touring a prison."
Showerthoughts,,Harry Potter would never work in Japan. You'd never be able to schedule a portkey anywhere because the Japanese society is so tidy!
Showerthoughts,[removed],Stick bug is this generation's Rick Roll.
Showerthoughts,[removed],"Every time you eat an egg, you are denying somebody somewhere a roast chicken"
Showerthoughts,[removed],Stick bug is this generation's Rick Roll. I don't get it in the same way people out of the loop didn't get Rick Rolling.
Showerthoughts,[removed],"Because you needed to be the fastest sperm cell to ferilise the egg, you have at least once been a good swimmer in your life."
Showerthoughts,[removed],"US presidential elections nowadays are not about who should be president, but rather who shouldn’t."
Showerthoughts,[removed],The only thing that's worse then not having something you really want is having something you really don't want
Showerthoughts,[removed],Women whose ex-husbands are involved in their child's life and are paying childsupport are not single mothers; just single women.
Showerthoughts,[removed],"If the Avatar would have tattoos and is in the Avatar state, would the tattoos glow just like Aang’s tattoos?"
Showerthoughts,[removed],Why is the non 24 commercial for blind people not just audio? None of their target market can see the ad..
Showerthoughts,[removed],"""Weird Al"" Yankovic should write the song ""soap on the water"""
Showerthoughts,[removed],People’s voices get suddenly annoying the instant you know they’re a toxic or bad person.
Showerthoughts,[removed],Everyone is fine with bacon on a burger but nobody wants to put ham on a hamburger
Showerthoughts,[removed],How many people died at sea in order for Mrs. Puff to have enough boats to open a boating school?
Showerthoughts,[removed],The person who invented escalators must have been the laziest person on the face of the earth
Showerthoughts,[removed],"At some point in time, somewhere, from some angle, there has been a cloud that was shaped like your face."
Showerthoughts,[removed],"Weird Al Yankovic should create the song ""Soap on the Water"" instead of ""smoke on the water"" and do the music video from a bathroom"
Showerthoughts,[removed],We could literally die any second and there would be absolutely nothing we could do about it
Showerthoughts,,The fundamental problem with being a conspiracy theorist is being convinced that you’re special.
Showerthoughts,[removed],"Packing your own moving van is like an adult version of Tetris, mixed with a bit of Jenga, if you're not lucky."
Showerthoughts,[removed],Funny how showerthoughts are usually thought of when in bed and not the shower
Showerthoughts,,The most important part of an email is the subject line. Spellcheck only applies to the body of an email.
Showerthoughts,[removed],"""Weird Al"" Yankovic should write the song, ""Soap on the Water"" while doing the whole music video out of a shower/bathroom"
Showerthoughts,[removed],"A bicycle is just an acoustic motorcycle. Or more accurately, a tandem unicycle."
Showerthoughts,[removed],One of the best things about being wealthy would be using a phone without a case
Showerthoughts,[removed],"if Snowden reavealed his information during Bush or Trump years a lot of democrats would call him an ""hero"" instead a ""traitor"""
Showerthoughts,,"The more wrong someone’s ideas about race are, the harder it is to tell them so"
Showerthoughts,[removed],Dom Mazzetti getting Squished by the Rock - Fan Art Live with Danger Dan
Showerthoughts,[removed],cancel the bad guy is the funniest and nonsense thing cuz like ... it's a ... bad guy
Showerthoughts,[removed],The time you spend worrying about life could be spent on actually living it
Showerthoughts,[removed],It’s impossible to picture a color in your head that doesn’t already exist.
Showerthoughts,,There are more chances someone has masturbated to your mother than to your father.
Showerthoughts,[removed],In the UK this subreddit would be just normal thoughts.
Showerthoughts,[removed],We should domesticate foxes
Showerthoughts,[removed],The punishment of bad people in hell actually means Lucifer is a good guy
Showerthoughts,[removed],"A considerable amount of husbands proposed to their wives during sex (and probably vice versa), but are too embarrassed to ever admit it."
Showerthoughts,,In a great childhood you expect great things to happen. In a great adulthood you make great things happen.
Showerthoughts,[removed],"There's ex partners who have had well known songs written about how awful they were and hear them all the time, all while not being famous."
Showerthoughts,[removed],Why don't we just domesticate foxes
Showerthoughts,[removed],Shower thought in the UK are just normal thoughts.
Showerthoughts,[removed],Being at work with nothing to do somehow feels worse than being home with no work.
Showerthoughts,,Those that tend to chickens are in fact chicken tenders
Showerthoughts,[removed],Maybe
Showerthoughts,[removed],Rehoming fees for pet adoption only hurt the pets
Showerthoughts,[removed],Why do we make the devil out to be bad when punishing bad people who are in hell is actually a good thing
Showerthoughts,[removed],"God saying Noah to make boat, basically has took freedom from people, that he gave to them. So God does not knows everything and giving humans freedom was not expecting killing everyone, making God a not God."
Showerthoughts,,People who tend chickens are actually chicken tenders
Showerthoughts,[removed],"There's ex boyfriends/girlfriends who have had well known songs written about how terrible they were which they have to hear all the time, all while not being famous."
Showerthoughts,[removed],Why do people make the devil out to be bad. He’s punishing the bad guys who are in hell which is actually a good thing
Showerthoughts,,You know you're getting more mature when you start to rationalize weird decisions made by those older than you.
Showerthoughts,[removed],Since mostly everyone is working from home there no need for NSFW flair anymore
Showerthoughts,,Every number is a small number in the grand scheme of things
Showerthoughts,[removed],I wonder if the kid that got harambe killed know that it was him
Showerthoughts,[removed],In my 15 years of trick-or-treating not one time did a magician answer the door.
Showerthoughts,,"For all intents and purposes, breakfast cereal is a soup."
Showerthoughts,,If a computer file is untitled then it’s actually titled
Showerthoughts,,"Being poor and wanting to buy something you don’t necessary need, you mostly not gonna buy it when you have the money."
Showerthoughts,[removed],Avatar (the last airbender)
Showerthoughts,[removed],This will be kids' most boring summer stories to tell their friends when school gets back.
Showerthoughts,,The song that’s playing when you walk in your friends car is the song they REALLY wanted you to hear and it can also tell you their overall mood at the moment.
Showerthoughts,,Tacos are hamburgers with a different kind of bun.
Showerthoughts,[removed],Morning wood should be called slumber lumber
Showerthoughts,,Every human is a slowly rotting smoothie
Showerthoughts,,"The difference between good and evil is, evil tries to control things outside themselves."
Showerthoughts,,Drug search dog is the most common user of drugs
Showerthoughts,[removed],Since mostly everybody works from home shoud we abandon NSFW flair?
Showerthoughts,[removed],Sinusitis
Showerthoughts,[removed],In the Cloudy with a Chance of Meatballs universe there should be a Sharknado parody called S'morenado
Showerthoughts,[removed],Most guys would love to be cat called
Showerthoughts,[removed],"The odds that a huge, hulking person such as Shaq has a smaller-than-average penis is 50%. Women who bang basketball players must often be disappointed."
Showerthoughts,[removed],Obama’s pillow has to be exhausted of being screamed into.
Showerthoughts,,Saying someone ain’t sh*t is the same as saying someone is sh*t
Showerthoughts,[removed],There was a lot more jello in the 90’s
Showerthoughts,,"“Twenty nine” is 29, but “twenty ten” is 2010"
Showerthoughts,[removed],I wonder how many times Obama has screamed into his pillow at night since leaving office. It has be like A LOT. Probably smells fresh AF though.
Showerthoughts,[removed],Dental health would be better if we had a G-spot in our mouths
Showerthoughts,[removed],"If someone says that they are from Korea, there is a 95% chance they mean South"
Showerthoughts,,You can’t imagine the feeling of taste anywhere else on your body other than your tounge
Showerthoughts,[removed],Banks are just big calculators.
Showerthoughts,[removed],Weird...
Showerthoughts,[removed],We don't really know what mucus smells like.
Showerthoughts,,You don't want to be eaten a raw food cannibal
Showerthoughts,[removed],Just realized A. G. Cook can call his album Apple cuz his label is called P. C. (Personal Computer) Music
Showerthoughts,[removed],"Put a mask on a man face you will hide his identity, but you will reveal his true nature."
Showerthoughts,[removed],"In the pandemic; your Work Wife is, just your Actual Wife!"
Showerthoughts,,"Ironically, being superhuman is one of the least human things to be"
Showerthoughts,,Wrestling is redneck performance art.
Showerthoughts,[removed],"There aren't shower thoughts, because shower can't think. So this subreddit, every post says thoughts of person, but not shower."
Showerthoughts,[removed],It’s someone’s cake day
Showerthoughts,[removed],"The Nazis viewed The Ayran race as superior and perfect, but just a few 1000 years earlier that group of people were seen as uncivilized barbarians by The Romans."
Showerthoughts,,"If sperm is made from the nutrients of what you ate, there is a chance you could be made out of an apple"
