subreddit,selftext,title
Showerthoughts,[removed],"Video games have made a lot of people, who don’t know what topography means, able to read topography maps"
Showerthoughts,[removed],Every related lockdown community will eventually die after lockdown is over.
Showerthoughts,[removed],If you eat cookie dough it is like eating fetuses.
Showerthoughts,,Your belly button is a life long scar.
Showerthoughts,[removed],"When people tell about ghost encounters and other paranormal stuff, the stories never seem to start “I was sitting on the toilet...” so maybe the ghosts etc. respect our privacy."
Showerthoughts,,The Duck Dynasty family are the Kardashians of the redneck world.
Showerthoughts,[removed],Every quarantine related Subreddit Will eventually die when lockdown Is over.
Showerthoughts,[removed],Every quarantine related Subreddit Will eventually die when lockdown Is over.
Showerthoughts,[removed],Blind idea
Showerthoughts,[removed],"if something was touching your bones, you couldn't feel it"
Showerthoughts,[removed],It's never skinny people you see drinking diet soda.
Showerthoughts,,"The fear and dread of life has brought alot of people to McDonald's, at two in the morning."
Showerthoughts,,"The universe may have only begun to exist a few seconds ago, and none of us would realize it because we were given false memories"
Showerthoughts,,"""Essence of"" flavored waters are a taste-based analogue of homeopathic medicine."
Showerthoughts,[removed],The people going out and refusing to social distance or wear masks are doing the rest of us a favor. They are like the first penguins to jump off the iceberg and into the ocean to test if there are any leopard seals. Sort of “guinea penguins.”
Showerthoughts,[removed],The Karen Haircut is what happens when The Rachel hits middle age.
Showerthoughts,[removed],Potatoe chips are just flat french frys.
Showerthoughts,[removed],Children Are The Ultimate Cum Stains
Showerthoughts,,Is virtual reality or reality virtual?
Showerthoughts,[removed],Country music is just regular music with a county accent and sometimes a violin.
Showerthoughts,,The Immense fear and dread of life has brought alot of people to McDonald's at two in the morning
Showerthoughts,[removed],Time is never wasted because you are always learning something
Showerthoughts,,I wonder how Trey's basketball game went...
Showerthoughts,[removed],"If each person in a video game was linked to a person in the real life, the human race would be screwed"
Showerthoughts,,It’s gunna be just you on the dance floor.
Showerthoughts,,"If you are what you eat, does that turn domestic, herbivore animals such as cows into vegetables? And thus, by extension all of humanity into vegans?"
Showerthoughts,,Out of the thousands of possible imaginary animal/human hybrids; none of them are more popular than a human and a simple pig.
Showerthoughts,,"there can be aliens, but they might not be smarter than us"
Showerthoughts,[removed],The first porno produced on Mars will be out of this world.
Showerthoughts,[removed],Never have I seen a skinny person drinking diet soda.
Showerthoughts,[removed],Pandas would be extinct if humans didn't get involved
Showerthoughts,[removed],There is no such thing as a waste of time because if you think you wasted your time then you learned something which is not a waste of time
Showerthoughts,[removed],"If you loop the loop and pull, now your shoes are looking cool."
Showerthoughts,,"Parents hit their kids based on how the kids grandparents disciplined them but that same form of used to discipline landed the parents in poverty, repeating the cycle of poverty for the next generation."
Showerthoughts,,We're all living in FPP mode.
Showerthoughts,[removed],"It’s not always easy to select the right breed. But with careful consideration and research, if you loop the loop and pull, now your shoes are looking cool."
Showerthoughts,,"Due to the conceits of modern day pornography, being black with an average-sized penis is probably as socially awkward as having a small penis if you are white."
Showerthoughts,[removed],Pandas would be extinct through to natural selection if human didn't get involved
Showerthoughts,,Anemol crosing if You Go To Mco if thhe isabel
Showerthoughts,,A fire truck is actually a water truck
Showerthoughts,[removed],Whether or not you clean your own mess in a public restroom is pretty much the only question needed to judge persons character and reliability.
Showerthoughts,[removed],"The word ""esoteric"" is esoteric."
Showerthoughts,,The world was going to end in 2012 and as per the ethiopian calendar right now it is 2012.
Showerthoughts,,The History Channel could probably revive itself if it started airing specials of lore of video games and works of fiction.
Showerthoughts,,One day a man will most likely invent a cum powered sex doll that cooks food
Showerthoughts,[removed],One day your family lineage will inevitably end
Showerthoughts,,In a bovie Start Worse Kyle Ren Get A Lot Old And Have To Wheare a Soot and Now her name is dark vador
Showerthoughts,[removed],"If I had a dime for every dime that I had, I would have an infinite amount of dimes thus making me the most wealthy person in the world."
Showerthoughts,[removed],Two-ply
Showerthoughts,[removed],"The fact that twins say they can sense when there is something wrong with one or the other, must have sucked for the clones in Star Wars. Especially because everything is connected through the force, so every clone must have felt every death of one of their brothers."
Showerthoughts,,You have to go to college to work at college
Showerthoughts,[removed],Actors who acted as a different character in a different movie are just playing the same character in an alternative timeline
Showerthoughts,[removed],"In the sentence “(this is/you are) the best [insert noun] I have ever had,” the “I have ever had” is redundant because the word “best” implies that it is already the topper."
Showerthoughts,,It doesn’t have to exist to be an existential threat
Showerthoughts,,"There could be alien life, but not necessarily more intelligent than us"
Showerthoughts,[removed],"When the whole coronavirus thing is over, all of the social distancing signs that stores had made specifically for that store (walmart, sheetz, target, etc) will be quite collectible and/or end up in museums"
Showerthoughts,[removed],Slime is just chewing gum for your hands.
Showerthoughts,[removed],When you smell fart its microscopic part of the shit that got i nto your nose. So whenever you smell fart you have shit in your nose.
Showerthoughts,,The face masks during Corona pandemic might give some famous celebrities the chance to do some mundane stuff like grocery shopping without being besieged by fans.
Showerthoughts,,"More than half your body is not human, the rest are microorganisms. Up to 70% of the human body is water, 99.9999999% of your body is empty space. Your brain makes up its mind up to ten seconds before you even realize it. Are we even real lol"
Showerthoughts,,When. A Poeple a mom or a Daf go through charch they warh the spangrbob a jezys
Showerthoughts,[deleted],"A motorcycle is the perfect way to have a stuntman do some tricks, because they wear helmets without it looking weird"
Showerthoughts,I always find myself yelling at the black women or indian man or woman but never white folk on the phone.,Light skinned CSR are always less infuriating to talk to.
Showerthoughts,[deleted],"No matter how many woMEN you have in a sentence, there will always be an equal or greater amount of MEN in that same sentence."
Showerthoughts,,There is a high probability that some complete stranger broke their TV or gaming console because you beat them on an online game.
Showerthoughts,[removed],People in nursing homes have been paying for house arrest this year.
Showerthoughts,[removed],We might not be able to attend the anniversary for the Area 51 raid
Showerthoughts,[removed],Karma generator
Showerthoughts,[removed],"They probably called it a grapefruit because it’s tastes shitty, but they figured grape-lovers would at least give it a shot."
Showerthoughts,[removed],Archeologists are just government funded grave robbers.
Showerthoughts,,you are the conscious of the creature that your mom and dad brought to life. nothing else.
Showerthoughts,[deleted],A Billionaires house can have basically everything but still not have a revolving door
Showerthoughts,[removed],The L’s are parallel in parallel.
Showerthoughts,[removed],Now is a great time to get braces if you were embarrassed about their appearance.
Showerthoughts,[removed],"Family Guy's writers as so bad, they made a dog unlikable"
Showerthoughts,,It's only a matter of time until someone writes a book entitled: Love in the Time of Covid.
Showerthoughts,,"Since most healthy eyes are continually lubricated, saying that there ""wasn't a dry eye in the audience"" isn't saying much"
Showerthoughts,,"compared to somebody with poor vision, hearing, etc, most of us have superpowers"
Showerthoughts,,"Since comets' tails rarely point in the direction they're travelling, comets ""drift"" through space"
Showerthoughts,Not my joke. Belongs to @LeftAtLondon on Twitter,"The movie Cars is 13 years old, old enough to have a Car Mitzvah"
Showerthoughts,[deleted],In ‘The Truman Show’ (1998) Truman takes vitamin D supplements because the sun on the set isn't real.
Showerthoughts,[removed],Flat Stanley is just a manifestation of his father’s psychosis trying to rationalize that his son didn’t really die when he was crushed after being left alone to play around loose heavy objects
Showerthoughts,[removed],The PSP was the Nintendo Switch from my youth
Showerthoughts,,Farting at work reminds you that you are human.
Showerthoughts,[removed],Whoever has my voodoo doll should give him some Adderall. STAT.
Showerthoughts,,"When I'm at work, farting reminds me I'm human."
Showerthoughts,[removed],Isn’t a tricycle just a unicycle with training wheels
Showerthoughts,,"We express our love for food by smashing it, soaking it in acid, and then flushing the surviving remains down the toilet."
Showerthoughts,[removed],"If aliens were real, Trump would’ve blabbered about it by now. Unless of course, he was never told about it even if it was true."
Showerthoughts,[removed],Stairs are just an organized hill
Showerthoughts,[removed],You almost never see plains in the sky anymore
Showerthoughts,,"If porn bloopers existed, they'd be much closer to real sex that actual porn."
Showerthoughts,[removed],"All the posts in /r/unpopularopinion that have more upvotes than downvotes, are in fact popular"
Showerthoughts,,"Water is as satisfying after eating a salty meal than after exercising, yet tastes very different."
Showerthoughts,,"As a kid with an email address, I would sign up for every website just so I can more emails. As an adult, I’m trying to unsubscribe so I don’t get many emails."
Showerthoughts,,Beauty is quite simply internal consistency or coherency within a thing.
Showerthoughts,,Fish are what they eat...
Showerthoughts,[deleted],Tap water tastes like 2D. Filtered water tastes like 3D.
Showerthoughts,[removed],You only ever hear “it is raining cats and dogs” when someone is trying to come up with an idiom that people use all the time.
Showerthoughts,,Error 404 probably has the best hiding spot ever and humans will never find it
Showerthoughts,,It's a good thing baby rhinos are born without horns.
Showerthoughts,,"Whenever you make two sandwiches, there is always an inferior sandwich."
Showerthoughts,[deleted],You only hear “it’s rain cats and dogs” when someone is trying to come up with an example of an idiom.
Showerthoughts,[deleted],Being attractive is one of the closests thing we have to some kind of genetic superpowers.
Showerthoughts,[removed],David Carradine's rap name
Showerthoughts,,"The word ""ostentatious"" sounds ostentatious."
Showerthoughts,[removed],More biological advances are increasing the chance of over-population crisis.
Showerthoughts,,We use oxygen to inhale oxygen
Showerthoughts,[deleted],Asking for a friend is the biggest and most obvious lie
Showerthoughts,[removed],Due to songs being censored on the radio there may be a trend of unfinished words randomly in songs in the future.
Showerthoughts,,Your fully self driving car might decide to suddenly reboot driving down the highway
Showerthoughts,,"Fire Dragons are unable to blow out birthday candles, or any candles."
Showerthoughts,,"Asking for a friend has been so commonly used for selfish interests, that if you would actually ask for a friend, no one would belive you."
Showerthoughts,,I always feel like I have a new phone when I change my wallpaper.
Showerthoughts,[removed],People saying our reaction to COVID was overblown makes you really feel for the people that prevented Y2K.
Showerthoughts,[removed],Vegans complain about eating dead animals while they eat dead plants...
Showerthoughts,[removed],"Knowing the difference between just a fart and pooping your pants, is a learned skill"
Showerthoughts,,"When you are born leg first, for some brief moments you are wearing your mother as a hat."
Showerthoughts,[removed],"With Nightclubs forced closed, we are essentially living in a modern day Footloose world."
Showerthoughts,[removed],The Big Bang created the universe but what created the Big Bang
Showerthoughts,Edit: He's actually an arachnid (my mistake),If the Internet is a web then mark Zuckerberg is an insect and not a reptile
Showerthoughts,[removed],I sing in the shower so why don’t I sing will I’m taking a bath
Showerthoughts,[removed],"If the water was hot and you were swimming really hard, could you sweat?"
Showerthoughts,,You know you're old when movies while they may be entertaining are no longer charming
Showerthoughts,[removed],"Knowing the difference between just a fart and accidentally shitting your pants, is a learned skill"
Showerthoughts,,The internet is the closest we're to time travelling at the moment.
Showerthoughts,[removed],A Door to Door Hand Sanitizer Salesman could make bank right now
Showerthoughts,[removed],It's said that when you die your brain is alive for 7 minutes and you live your whole life as a dream in those 7 minutes. How do we know if this is our dream or we are actually alive?
Showerthoughts,[removed],If you say something is racist you in turn are also kind of racist
Showerthoughts,,Showers are domesticated waterfalls.
Showerthoughts,[removed],A smoke detector is the only thing that dies from drowning when it has done its job well
Showerthoughts,,The first thing we MUST do with anti-aging technology is make sure dogs live as long as us.
Showerthoughts,[removed],Gyms are just adult playgrounds.
Showerthoughts,Yes I know not all millennials have long hair,Millennials have long hair in order to lower the amount of expensive trips to the barber
Showerthoughts,,Asking a left-handed person if they play baseball is like asking a tall person if they basketball.
Showerthoughts,[deleted],"If the internet didn't exist, we wouldn't be under a lock down."
Showerthoughts,,We have reached the inflection point where the cost of making realistic movies about a new technology is the same as actually engineering it.
Showerthoughts,,Astronaut awkwardness
Showerthoughts,,I wonder if left-handed people get asked if they played baseball/softball as often as tall people get asked about playing basketball?
Showerthoughts,,Barack Obama could go down in history as the last president of America should they succesfully become an autocracy under Donald Trump.
Showerthoughts,[removed],Does mike wazowski wink or blink?
Showerthoughts,[removed],One person who would be stoked about general public acceptance of masks and gloves in public is Michael Jackson
Showerthoughts,,John Mulaney has a very interesting face. Attractive but interesting.
Showerthoughts,,Christmas is the most American holiday. It’s a holiday about capitalism fueled by a race of children who work in a remote location.
Showerthoughts,[removed],Your water will never be as cold as the ice you put in it
Showerthoughts,[removed],"In a society where everyone wears masks and gloves, Michael Jackson would be just another normal guy"
Showerthoughts,[removed],The most powerful person in the USA (who could possibly unite the country) is whoever is best at telling Trump he's the best.
Showerthoughts,[removed],A film from 2010 doesn’t seem that old but a YouTube video from 2010 is like sooooo old.
Showerthoughts,,Unicycles aren´t half as hard as to ride as bicycles
Showerthoughts,[removed],Christmas is just 6 showers away!
Showerthoughts,[removed],"The sentence ""I wouldn't wish it on my worse enemies"" can be used on good things as well"
Showerthoughts,,Error 404 has the best hiding spot
Showerthoughts,,Michael Myers probably doesn't run after you because he knows its not safe while holding sharp objects
Showerthoughts,,Windows are just barrier blocks for insects.
Showerthoughts,[removed],"As I get my paycheck, I notice the portion of my paycheck that goes towards millions of unemployed peoples' benefits. These people are making make way more money than me."
Showerthoughts,[removed],"It's weird how wearing a mask was classed as anti-establishment, now not wearing a mask is being used as an anti-establishment statement."
Showerthoughts,[removed],Soap
Showerthoughts,,Realized that my humor is solely based on self deprecation.
Showerthoughts,[removed],Your cup of water will never be as cold as the ice you put in it.
Showerthoughts,,"The Spanish word for dinner is la Cena. ""Ladies and gentlemen introducing your 16x wwe champion John dinnnnnnnneeeer"""
Showerthoughts,[deleted],"Our gums hurt, not our tooth."
Showerthoughts,[removed],"Garlic is one of the best scents when someone is cooking with it, but it is one of the worst scents when it is on someone's breath"
Showerthoughts,,I am addicted to fapping cuz that's the only time I feel happy there is no other happiness in my life
Showerthoughts,,Realizing that if all the free time in the world doesn't create happiness than what will?
Showerthoughts,,"They could make a lot of money ""Officially"" re-re-releasing Avengers Endgame with audience reactions."
Showerthoughts,Poo poo,"When you go for a number 2, you activate shit mode"
Showerthoughts,,Anime is just a way for companies to make low FPS cartoons
Showerthoughts,[removed],you're never safe because there's something that can get you .
Showerthoughts,[removed],Your glass of water will never be as cold as the ice you put in it.
Showerthoughts,[removed],"If you hit someone with a gun, would that be assault or assault with a weapon?"
Showerthoughts,[removed],If no one is going to say it then I will say it VAMPIRES ARE PEDOPHILES ON ANOTHER LEVEL (boom)'drops microphone'
Showerthoughts,,The deed doesn't make you a bad person; It's the reason.
Showerthoughts,,"There's a random dude in the Star Wars universe who was lucky enough to be flying around underneath the Senators place, and caught a purple lightsaber as it fell from the top floor."
Showerthoughts,[removed],"It won't be long until ""Karen"" becomes synonymous in our vocabulary with ""complain"""
Showerthoughts,[removed],"This is a great time to be a teenager using a fake ID, which a face mask you can look like anyone!"
Showerthoughts,[removed],We were all the youngest person on the planet at some point.
Showerthoughts,[removed],"If you were bulletproof, you would probably live your entire life without knowing."
Showerthoughts,[removed],"What a great time to be a teenager using a fake ID. With a face mask, you look like anyone!"
Showerthoughts,[deleted],Rich people can take anything apart for the fun of it
Showerthoughts,,‘Super Mario Maker’ is technically Shigeru Miyamoto
Showerthoughts,,"The Rs will costs themselves an election with non-virtual rallies and a non-virtual convention. They will show up in droves, get cv 19’ed , and some will lose their capacity to vote through death or illness."
Showerthoughts,,It's a shame we can never be the same.
Showerthoughts,,"Due to the possibly infinite amount of stars, it's entirely possible that every shape imaginable is a constellation somewhere including a perfectly penis-shaped one."
Showerthoughts,,"The Rs will costs themselves an election with non-virtual rallies and a non-virtual convention. They will show up in droves, get cv 19’ed , and some will lose their capacity to vote through death or illness."
Showerthoughts,,Church is just a weekly book club meeting
Showerthoughts,,"The Republicans will costs themselves an election with non-virtual rallies and a non-virtual convention. Conservatives will show up in droves, get coronaed, and some will lose their capacity to vote through death or illness."
Showerthoughts,[removed],Disney Princess movies are made by a country where princesses have never existed.
Showerthoughts,,Most of the people involved with The Office have probably never actually worked an office job
Showerthoughts,[removed],Garlic bread should be called garlic toast
Showerthoughts,,If aids went airborne humanity would have an extinction timer
Showerthoughts,,"""Oh my god"" is getting overrated"
Showerthoughts,,"So pretty much none of the things Alanis Morissette sings about in “Ironic” are actually ironic, even though she asks it to us repeatedly..."
Showerthoughts,[removed],"The phrase ""don't objectify women"" has ""women"" as the object of the sentence."
Showerthoughts,,"Calling someone ‘motherfucker’ is basically calling them daddy ,they come out on top not you"
Showerthoughts,,"So pretty much none of the things Alanis Morissette sings about in “Ironic” are actually ironic, even tho she asks it to us repeatedly..."
Showerthoughts,[removed],Dirt is just poop’s poop’s poop.
Showerthoughts,[removed],Why is it that luggage on a ship🚢 is called “Cargo”......and luggage on a car 🚗 is called “Shipment”. Shouldn’t it be the other way around..?
Showerthoughts,[removed],"The phrase ""don't objectify women"" has ""women"" as the object of the sentence."
Showerthoughts,[removed],"Can someone could explain what is this subredit about please, thank you all"
Showerthoughts,,Maybe this was all done on purpose to help restore the environment. They just didn’t realize how many deaths would happen.
Showerthoughts,[removed],"All jobs are essential, because people need to get paid."
Showerthoughts,[removed],It’s easy to believe in karma when you have a lot of good luck
Showerthoughts,,"I am not “wearing no clothes”, I am wearing the whole universe."
Showerthoughts,,"I am not “wearing no clothes”, I am wearing the entire universe."
Showerthoughts,[removed],Remember When You Parents Told You That You Won't Grow Up If You Don't Eat?
Showerthoughts,,Maybe covid was planned to help restore the environment.
Showerthoughts,[removed],The word verb is actually a noun
Showerthoughts,,"We need a Bill of Rights, but for cyberspace."
Showerthoughts,,Everyone has beaten a 0% run for every game that has or will ever exist.
Showerthoughts,,"It's faster to travel by going up to space, wait for the earth to rotate, and then descend to destination."
Showerthoughts,,Santa’s large belly is actually a stack of some serious ab work due to all the laughing he does while flying.
Showerthoughts,[removed],"During this pandemic, pizza orders have either increased tremendously, or decreased tremendously."
Showerthoughts,,It’s 17 april 2011. Game of thrones airs tonight and you look forward how it is. Life is good.
Showerthoughts,[removed],Seeing an animal that you normally wouldn’t where you live is like seeing a rare Pokémon.
Showerthoughts,[removed],"Knowing the difference between just a fart and ""this one may shit my pants,"" is a learned skill."
Showerthoughts,[removed],Became An Overnight Millionaire In Your Sleep Its Possible Right!
Showerthoughts,[removed],Brown is just dark orange
Showerthoughts,[removed],HELP PLEASE
Showerthoughts,"It's more ""gift account""",Virtual gift cards aren't really gift cards as there is no physical card to store the gift on
Showerthoughts,,Farting and popping your ears feel good for the same reason.
Showerthoughts,,Zoomers are slowly starting to die out.
Showerthoughts,,You fear death cause of your anxiety but you wanna escape because of your depression
Showerthoughts,[removed],Why there aren't more Jeff bezos cospirscy theories with covid19?
Showerthoughts,,"If half of marriages end in divorce, than the other half end in death."
Showerthoughts,,Is it just me or is quarantine simply amazing? :/
Showerthoughts,,"One day when most of the world has shifted to a fully plant-based diet, we will have to slaughter animals just to feed our pets."
Showerthoughts,[removed],gen z is called the zoomers bc now we have to learn everything on zoom
Showerthoughts,,People fight wars to bring peace.
Showerthoughts,[removed],Do plastic twist-off bottle caps count as currency in the apocalypse?
Showerthoughts,"People treat the two differently: the idea of the hot take tends to have a positive connotation while the idea of a conspiracy theory has a negative connotation. However, Hot takes are just deviations from consensus of opinion. Conspiracy theories are also just deviations from consensus. Since both are just deviating from consensus, hot takes are essentially just conspiracy theories.",Hot takes are actually just conspiracy theories.
Showerthoughts,[removed],The Middle Finger Is Only Offensive To Christians So You Could Go Somewhere Where There Is Not A Lot Of Christians And Flip Everyone Off
Showerthoughts,[removed],YouTube is literally a video player worth billions of dollars.
Showerthoughts,,"Before the last 300 years, no human would have travelled more than 50 miles an hour, and lived for more than a few seconds after."
