subreddit,selftext,title
Showerthoughts,,Pro wrestling is an action T.V. Show starring the stunt doubles.
Showerthoughts,,"If everything was the same temperature, then temperature wouldnt exist."
Showerthoughts,,"Beards are face pubes, via versa pubes are genital beards."
Showerthoughts,[removed],The whole purpose of playing golf is trying to play the least golf.
Showerthoughts,[removed],"In the hit song Ms. Jackson by Outkast, have they apologized to Ms. Jackson a trillion times based on how many times the song has been played?"
Showerthoughts,,Not even Bill Gates himself has paid 3 of his salaries for an engagement ring.
Showerthoughts,[removed],Sequels are just kids living off their rich parents
Showerthoughts,[deleted],Not even Bill Gates himself has payed 3 of his salaries for an engagement ring.
Showerthoughts,,"Everyone is aware of the corruption in the police, but in the movies they never believe when the villain is a corrupted police officer"
Showerthoughts,,Waving and not waving your arms during a fall looks odd
Showerthoughts,,"The concept of someone ""watching down on you from heaven"" is very creepy and invasive."
Showerthoughts,[removed],Doritos are just Tostitos with flavored dust
Showerthoughts,,“Girls with bangs” is an impossible type of porn to search for.
Showerthoughts,,"""Hangin' in there"" is the new ""I'm fine""."
Showerthoughts,[removed],Why do we think aliens are smart yet than us?
Showerthoughts,,"Someone just decided that, green = easy/ orange = medium/ red = hard. And everyone just went along with it"
Showerthoughts,[removed],"If robots took over earth, rain would be considered a natural disaster"
Showerthoughts,,It stings a little extra to have a robot tell you your thoughts aren't original enough.
Showerthoughts,,It’s called a stroller because you use it to go on a stroll.
Showerthoughts,[removed],You’ve probably never wiped your butt with your non-dominant hand.
Showerthoughts,,We will all end up being forgotten. Our lives are just a small ripple in an ocean of lives.
Showerthoughts,[removed],"These days, *looks* matter more while casting a child actor than while casting an adult actor"
Showerthoughts,[removed],I tried to post on ask reddit but I guess i did not post correctly
Showerthoughts,[removed],"If robots were to take over the planet, would rain be considered a natural disaster?"
Showerthoughts,,Greek Mythology is one big giant family feud.
Showerthoughts,[removed],A pregnant woman swimming is a human submarine.
Showerthoughts,,Anti-Vaxxers would be following natural selection if it didn’t effect the rest of us negatively.
Showerthoughts,,"If showers never existed , everyone would’ve been fine with being stinky ."
Showerthoughts,"I mean. Think about it. If you're 200 pounds, there's someone who is 350 who wishes they could look like you. So you might feel not great about yourself, but there is always someone, somewhere who admires your insecurities.","Whatever it is that you're insecure about, there is someone who sees it and is jealous of it."
Showerthoughts,[removed],Now is a great time for orthodontic treatment if you're embarrassed about how it looks.
Showerthoughts,,Sick of it!
Showerthoughts,[removed],Word “right” in many languages means direction and similar to “law” or “freedom” in same time
Showerthoughts,,"Reflecting on their actions during this pandemic lockdown, a lot of people must have realised that they wouldn't survive a zombie apocalypse if there ever was one."
Showerthoughts,[removed],"If you're waiting for the waiter, aren't you the waiter"
Showerthoughts,[removed],I can’t believe how disappointed I am that the domain ewetube.com is taken. I was going to be the queen of female sheep videos.
Showerthoughts,[removed],Baby poop is cuter
Showerthoughts,,2012 would’ve been the perfect timing for Coronavirus as everyone was expecting the end of the world .
Showerthoughts,So Basically the power to see into the future is pointless because if you see the future in which you have the power it is unchangeable and if you see the future without the power then you wont see the future because it is changeable.,The Power to see the Future.
Showerthoughts,[removed],"If you're waiting for the waiter, aren't you the waiter"
Showerthoughts,,2012 would’ve been the perfect timing for COVID-19 as everyone was expecting the world to end .
Showerthoughts,[removed],If humans have dominant hands do flamingos have dominant legs?
Showerthoughts,,"We universally decided that we cut our sandwiches diagonally or right through the middle, but never in a slightly different angle."
Showerthoughts,[removed],"Male Karens should be called Richards, then you can refer to them as ""Dicks"""
Showerthoughts,[removed],"I can't name one other pillow company that advertises their products so heavily as the ""MyPillow"" company."
Showerthoughts,,Nearly every adult hand you’ve ever shaken has had a dick in it
Showerthoughts,,"A hotdog isn’t a taco because tacos are crunchy, hence having to put “soft” in front of “soft taco”."
Showerthoughts,,2012 would’ve been the perfect timing for COVID-19 as everyone was expecting the end of the world .
Showerthoughts,,A couch is the crucial difference between a bed and a lawn chair.
Showerthoughts,[removed],Made on my birthday
Showerthoughts,,Dogs at the park/on walks might know each other from “school” (doggie daycare) and we owners would have no way of knowing
Showerthoughts,[removed],Why do people call them ‘hot water heaters’ and not just ‘water heaters’
Showerthoughts,[removed],Post with more upvotes
Showerthoughts,,"Couches are just half-as-thick, bent in half beds."
Showerthoughts,[removed],"When I take my dog to the dog park, she might be playing with “friends from school” (doggie daycare) and I would have no way on knowing it"
Showerthoughts,,"Even though fire and ice are literal opposites, at the exact but opposite temperature they are equal to each other"
Showerthoughts,,"In the universe of anime, it must be relatively common for dancers to hit on the moves from one of those generic pre-fight choreographies and accidentally find themselves wearing magical armour, conjuring a dinosaur or some other weird shit"
Showerthoughts,,"The one truly best, most wholesome, beautiful and down-to-earth, place to live (while still somewhat affordable to most) is probably kept a secret by those who live there."
Showerthoughts,,"Eating fat people ass will taste like cake, while eating skinny people ass will taste like salad."
Showerthoughts,[removed],"I know it’s a weird question but what do you think of guys that wear men thongs, G strings and jockstraps?"
Showerthoughts,[removed],The term ‘hot water heater’ is quite redundant
Showerthoughts,[removed],the term escalator and elevator can be interchanged
Showerthoughts,,"When molten metal or glass hardens into a solid, it is technically frozen, even though it can burn you"
Showerthoughts,,Most men who are attracted to thick women will end up marrying thin women.
Showerthoughts,,Socks are just condoms for your feet
Showerthoughts,[removed],Appetizers are just poorly timed snacks
Showerthoughts,,The fact that there is a movie about fight club means the rules have been violated many times
Showerthoughts,,Can teach man many things but not how to merge properly
Showerthoughts,[removed],"To get a Pokémon into the very first Pokéball, someone beat it with their bare hands."
Showerthoughts,,"If 4D was invented and you could smell what someone else is smelling through your screen, A LOT of people could get high for free."
Showerthoughts,[deleted],Nuclear weapon stockpiles are the geopolitical version of a dick-measuring contest
Showerthoughts,[removed],Useless Alphabet
Showerthoughts,,A Handful of Apples is 1 Apple
Showerthoughts,[removed],You can basically create life by spitting in a lifeless planet
Showerthoughts,[removed],Stabbing is now twice as illegal since it violates social distancing orders.
Showerthoughts,[removed],Everyone hates TikTok and doesn’t have it yet everyone uses TikTok and likes it’s content.
Showerthoughts,,"When did dogs learn this game that someone throws the ball, the dog catches and the person must runs after him to steal the ball"
Showerthoughts,[removed],"If animals can laugh, then it means there's some things that they consider funny"
Showerthoughts,,Half of Indiana Jones’ students probably only took his archeology class because of his looks
Showerthoughts,[removed],People would take all of their antibiotics if the pills also made them feel just as sick.
Showerthoughts,[removed],Getting your underwear stuck in your butt is the lower body equivalent of getting your eyelashes stuck in your eyes
Showerthoughts,[removed],"Everyone has a unique smell that the people they’re closest to recognize instantly, but no one knows their own smell because we get used to it"
Showerthoughts,,If our minds were simple enough for us to understand them we would be so simple that we couldn't.
Showerthoughts,,"""A lifetime"" can be any amount of time"
Showerthoughts,[removed],Creating life by spitting
Showerthoughts,,"I wonder when did my dog learn this game that I throw the ball, he catches and I run after him to steal the ball from him"
Showerthoughts,[removed],Fundraiser to study in University of Glasgow ECE Engineering.
Showerthoughts,,Hogwarts first-graders had probably questioned the purpose of their education while turning the matches into needles.
Showerthoughts,[removed],Raimiverse Peter Parker sold pictures of himself as Spider-Man to a newspaper making him probably the only superhero to make finanicial profit of his superpowers
Showerthoughts,,"If a finalist on a show like the x factor were to Rick roll the entire audience, they would probably become more internet famous than if they sang any other song and won."
Showerthoughts,,No one changes their alarm clock sound anymore since iPhones took over
Showerthoughts,"[Tom Haverford](https://www.youtube.com/watch?v=Pg_-cEqDU8A) from Parks and Rec sounds exactly like [Stefan Urquelle from Family Matters](https://www.youtube.com/watch?v=P6ef62ngfXE)

Given how big a pop culture fan Tom is supposed to be I wonder if Stefan Urequelle is where he got his inspiration to transform from a geek to an attempt at being suave",Tom Haverford from Parks and Rec sounds exactly like Stefan Urquelle from Family Matters
Showerthoughts,[deleted],Revolving doors have all stopped
Showerthoughts,[removed],"W/o Reddit mods, there could be more shitpost than actual good content on the subs."
Showerthoughts,[removed],"On one hand, you can't touch any of your fingertips without your thumb."
Showerthoughts,,One chop stick is just a stick
Showerthoughts,[removed],Elon Musk’s baby is one of the few people in this world who has been truly made fun of since birth.
Showerthoughts,[removed],???
Showerthoughts,[removed],The Pacific Ocean would be a great place to hide Aliens.
Showerthoughts,... it completely ignores people w/o a family.,"The quote ""Friends come and go but family is forever"" is only a half truth..."
Showerthoughts,[removed],"If you claim to be immortal, you can go your entire life without anyone proving you wrong."
Showerthoughts,,The future you thinks about you all of the time.
Showerthoughts,[removed],???
Showerthoughts,,A base in the middle of the Pacific Ocean would be a great place to hide Aliens.
Showerthoughts,[removed],At some point there will be enough people living in our universe that every word capable by humans to hear will be a name at some point.
Showerthoughts,,"If someone really wanted to hide Aliens from humanity, it would probably be on a base in the middle of the Pacific Ocean."
Showerthoughts,,"If someone wanted to hide the existence of aliens, they would probably hide them somewhere generally inaccessible, like on a base in the middle of the Pacific, not somewhere obvious like Area 51."
Showerthoughts,[removed],Kids growing up right now will have excellent hand washing practices as adults.
Showerthoughts,[removed],No matter how hard I try I will never be able to explain why a Blankety Blank Chequebook and pen was SO desirable.
Showerthoughts,[removed],beds are lowkey slept on
Showerthoughts,,"If the government wanted to hide the existence of aliens, they would probably hide them somewhere generally unaccessible, like on a base in the middle of the Pacific, not somewhere obvious like Area 51."
Showerthoughts,[removed],Incorrectly
Showerthoughts,[removed],"Someday, SpaceX may well announce in a press release that Elon Musk is coming for Uranus."
Showerthoughts,"**Not considering other story pathways.**

Same w/ many stories...","Theoretically, if Oliver Twist never asked for more porridge, he'd still be in his orphanage."
Showerthoughts,[removed],The worst thing to lose is your glasses because you can’t see to find them.
Showerthoughts,,"If everybody is descended from Adam and Eve, everybory is also a relative of Hitler."
Showerthoughts,,Diabetes sounds like it could have been the name of some Greek philosopher.
Showerthoughts,,You know you've grown up when you stop licking the lids of ice cream/yogurt cups.
Showerthoughts,,Gifs of handshakes or hugs are currently NSFW content.
Showerthoughts,[removed],We should not use mass destruction weapons against ourselves we should use them to defend our planet if it ever gets invaded by aliens.
Showerthoughts,[removed],Masturbating with an armrest literally means resting your arm
Showerthoughts,[removed],A lama is actually a giraffe in a sheep’s body
Showerthoughts,,If people in the past had done one thing different we could be living in a completely different world.
Showerthoughts,,"Nowadays, spitballs are considered poison darts"
Showerthoughts,[removed],"When you mix purple and pink, does the pink get darker or does the purple get lighter?"
Showerthoughts,[removed],"The phrase ""You just missed them"" makes sense with both meanings of ""just"", barely and recently"
Showerthoughts,[deleted],Still alive despite your worst day
Showerthoughts,,You can just carry a weapon during Halloween and say it is a part of your costume
Showerthoughts,[removed],God did not predict this
Showerthoughts,,Which is worse? To attack or to promulgate a theory without fully understanding it.
Showerthoughts,[removed],Video Game graphics have gotten to the point where they can be more realistic than real life
Showerthoughts,,Halloween is probably the most dangerous time of the year
Showerthoughts,,Bookstores are one of the few places where you can sample a product before you decide to buy it or not
Showerthoughts,,Politician is the only career where it is bad to have more experience
Showerthoughts,[removed],If we put a computer program in charge of the human race that followed rules and had no thirst for power and wealth Communism could actually work.
Showerthoughts,,Goku probably has no idea that his eyes change color when going Super Saiyan.
Showerthoughts,,"If Ghosts are real, everyone has the chance to attend their funeral."
Showerthoughts,,Our mothers have known us longer than we’ve known ourselves.
Showerthoughts,[removed],I wonder
Showerthoughts,[removed],Reddit awards are just Emojis that people spend way too much money on.
Showerthoughts,,Maybe R2D2 doesn't really beep but it's all censored because he communicates exclusively through racial slurs.
Showerthoughts,[removed],"In the future, turning on a TV won’t have any startup time. It will be instant."
Showerthoughts,,Technically no curse word is derogatory if you respect people well enough.
Showerthoughts,[removed],"I just realized, if whales are mammals, and mammals are technically reptiles..."
Showerthoughts,[removed],"If everything is special, nothing is special."
Showerthoughts,,A Children's Hospital is not where child doctors operate on adults
Showerthoughts,[removed],The subreddit r/okbuddyretard is one of the only places where emojis are socially accepted on Reddit
Showerthoughts,,Bumblebees are going to be mistaken for Asian hornets.
Showerthoughts,,?
Showerthoughts,[removed],"If we downvote enough of one ad, theoretically it would be taken down as it is disliked so much."
Showerthoughts,[removed],The idea of creating a showerthoughts subreddit was probably a showerthought
Showerthoughts,[removed],I forget whether I've applied hair wash far too often for it not to be a sign of Alzheimer's.
Showerthoughts,[removed],Telling someone “I hope you have the best birthday ever!” is wishing that all their other birthdays are going to suck
Showerthoughts,[removed],We're all wearing masks during a time when air quality is relatively at its best.
Showerthoughts,[removed],Would people be more physically fit if online selves/photoshop weren’t a thing??
Showerthoughts,[removed],All you can eat restaurants could save on wastage by rewarding customers who have empty plates at the end of their meal
Showerthoughts,[removed],What if you die but what you see has to do with what you believe like if you believe in an after life some dude with a beard pulls up and says come. Or if you’re an atheist and all you see is nothing but a calm sea of nothing.
Showerthoughts,,My mother has known me longer than I have.
Showerthoughts,,"When identifying the gender of an animal in conversation. We do so as boy, or girl. Yet it sounds wrong to id them as man or woman. Even if fully matured"
Showerthoughts,,"A white person, a black person, and a mixed person can all dress up as Michael Jackson for Halloween and still have fun. (Controversial)"
Showerthoughts,[removed],Car hits Car
Showerthoughts,,If being gay was a choice then we’re all bisexuals
Showerthoughts,[removed],"If you take a shower, aren't you underwater?"
Showerthoughts,[removed],We should celebrate Earth Day by staying home.
Showerthoughts,Edit: Genetic factors play a key role too. I can't believe I missed that. Thanks u/one_dead_president,"7.8 billion people are born with the exact same potential until influenced by their environment, yet there are very few people who train to partake in the Olympics."
Showerthoughts,The bats finally took their revenge on mankind for the horrors done by Ozzy.,Revenge of the bats
Showerthoughts,,Bunk Beds are like shelves for humans
Showerthoughts,,There probably is a universe That’s just made out of farts.
Showerthoughts,[removed],There are genres of music that no one will never know about
Showerthoughts,[removed],Some companies are probably using this time as an excuse to fire people to maximize profit vs. out of necessity.
Showerthoughts,,Sex during marriage is technically incest
Showerthoughts,,Theres probably a universe that just is made of farts.
Showerthoughts,[removed],You know who the best barber/ hairstylist is? The one who cuts your barber/ stylists hair.
Showerthoughts,,"Once you win a National Lottery jackpot, you automatically become a professional gambler"
Showerthoughts,,"When a game says ""99% people failed"" it means there are still around 77 million people dumb enough to try the game."
Showerthoughts,,"Assuming pi is irrational, the only number we never will is pi itself"
Showerthoughts,,"A lot of gen alpha kids will face the problem of trying not to see their parents on websites like pornhub, onlyfans, xvideos, etc."
Showerthoughts,[removed],"Lots would be different in a alternate Universe like Language,gender,and race"
Showerthoughts,[removed],"Dang, I’m out of shampoo"
Showerthoughts,[removed],"If an elephant used its trunk to pleasure itself, would this be considered masturbating or self sucking."
Showerthoughts,,"By the time we quarantine’s over, we’ll all have developed some form of supernatural control over our bodies."
Showerthoughts,[removed],Picking a ringtone you hate works better than picking a ringtone you like
Showerthoughts,[deleted],Submitting titles as a speal checker is one way to do it
Showerthoughts,[removed],"Elastigirl would never have to wipe, she could just stretch until her crap didnt ever touch the walls"
Showerthoughts,,The glass is greener on the other side
Showerthoughts,[removed],Attraction With Age
Showerthoughts,,"No pain, no gains is a path to injury. While injured, pain and no gains is true."
Showerthoughts,,Birthday in quarantine
Showerthoughts,,Putting Tabasco in a ghost pepper souce makes it less hot
Showerthoughts,"So i watched shrek and in the Shrek universe the kingdom it plays in is called Far Far Away and most of the characters are characters from older stories and i asked myself if time progresses in shrek don’t they have to adapt themselves to modern story’s thousand years later so wouldn’t that mean the most famous storys of our time are the future of Shrek so at some point storys like star wars would be a thing (even thoe Disney would be against that) or would the town be called the galaxy far far away? Or maybe different famous modern franchises,",shrek in thousand years later.
Showerthoughts,[removed],"We need both hands to count 1 - 10, but if we used roman numerals we would only need one hand to count I - X and two hands to count I - XX"
Showerthoughts,,Does anyone just randomly ask what is life? Like what the fuck is happening right now
Showerthoughts,Change my mind,Bed bunks are human shelves
Showerthoughts,,soble and scorbuny and fenekin Are. A ugly pikeman . A ugly Pokamon
Showerthoughts,,"Always showing muscular men and skinny females in body layouts / schemas / models instead of average bodies is an extremely toxic behaviour for society. Showing average bodies would make a lot more people feel ""normal"" and less self-conscious"
Showerthoughts,,Han Solo was a drug smuggler..
Showerthoughts,[removed],Worms are just unevolved snakes.
Showerthoughts,,"Always showing muscular men and skinny females in body layouts / schemas instead of average bodies is an extremely toxic behaviour for society. Showing average bodies would make a lot more people feel ""normal"" and less self-conscious"
Showerthoughts,[removed],"When you say ""2020-2021"", referring to this year and next, you have to say the word ""twenty"" four times in a row."
Showerthoughts,[removed],What if our vivid day dreams is really a window into an alternate universe where that scenario actually is happening?
Showerthoughts,[removed],Our brain doesn’t know every disease in the world yet our body does
Showerthoughts,[removed],I can run at a fraction of the speed of light
Showerthoughts,,The princess saves the prince is now the overused trope
Showerthoughts,[removed],"What if you take a weapon (eg. pistol) and shoot it upside down (magazine up, barrel down). Will the recoil be downwards?"
Showerthoughts,,Speed runners are Groundhog Daying games
Showerthoughts,Source: my wife’s name is Hannah,Women named Hannah have almost certainly heard and used the word “banana” signicantly more often than the average person
Showerthoughts,[removed],Is a glass really half full or is it half empty?
Showerthoughts,,An apple could seriously fuck you up if thrown hard enough.
Showerthoughts,[removed],There are still people on THIS planet who like Jake Paul...
Showerthoughts,,Jimmy Neutron and Zatch Bell were played by the same actress.
Showerthoughts,,With the size of yoda’s ears its surprising he hasn’t clipped the end of them with his lightsaber while doing the twirly whirly spinning tricks.
Showerthoughts,[removed],Constipation is nothing more than congestive fart failure.
Showerthoughts,[removed],Old accounts with old passwords containing only lower case characters with no capital letters or numbers are plausibly more secure and less likely to be hacked in this day and age.
Showerthoughts,,Cereal commercials promote their brand as well as the abduction of children from a fictional character offering free cereal that'll take them to a magical place unlike any other.
Showerthoughts,[removed],The situation room is just where the President and the U.S. military play IRL Risk with real world consequences
Showerthoughts,,"If a blind person has a service dog that says ""do not pet"" it is a perfect opportunity to test how stealthy you are"
Showerthoughts,,We don't recognize minor actors from commercials but we have probably seen them multiple times.
Showerthoughts,[removed],"The words “noun” and “adjective” are, in themselves, both nouns and adjectives."
Showerthoughts,[removed],Whoever wrote Kim Jung Un's name in their Death Note is probably really confused right now
Showerthoughts,[removed],‪When you watch movies you’re basically watching people working.‬
Showerthoughts,[removed],If u take a meme template someone used does it technicaly make it a repost?
Showerthoughts,,"what was was, before was was was"
Showerthoughts,,I don’t think I have ever seen a shaggy deer.
Showerthoughts,,"Maybe the things that you imagine are real and must've happened before and you must've been through that, that's why you could imagine it in the first place."
Showerthoughts,,Swans are just bourgeoisie geese.
Showerthoughts,[removed],"There's a person out their right now watching what coronavirus is doing to the world, and knowing he/she started all of it."
Showerthoughts,,"Before yesterday was yesterday, yesterday was today"
Showerthoughts,[removed],"One day, your life will be the best it ever has been and ever will be. From that day on, your life will never be that good again."
Showerthoughts,[removed],You can say anything you like about Canada to a Canadian and they'll just be pleased you remembered they're Canadian.
Showerthoughts,,Hvb if the man. A poeppele eat A France he get Rilley FAT becaouse a frinch frize Has A Lote of Calerys
Showerthoughts,[removed],The “old” you is also the “younger” you
Showerthoughts,,"Your taxes are a subscription to where you live, childhood is the free trial"
Showerthoughts,,The date of your birth appears infinite times in Pi
