subreddit,selftext,title
Showerthoughts,[removed],Life is just a pay-to-win game
Showerthoughts,,"It is easier to guess someone's age who is around your age, than someone who is more than 10 years older/younger"
Showerthoughts,,People don’t realise that Newton would have discovered the laws of motion and gravitation even if the apple didn’t fall in front of him.
Showerthoughts,[removed],If you continuously smoke cigarettes out of boredom then technically you are dying of boredom.
Showerthoughts,[removed],Mermaids are wierd
Showerthoughts,,"The older someone is, the harder it is to guess their age"
Showerthoughts,,"In Hell, they have all the latest electronics. In Heaven, there are none."
Showerthoughts,[removed],"If timetravelers existed and were able to change things in the past, that means that the worst events in history have probably already been erased."
Showerthoughts,[removed],"Thanos could've just turned everybody into spaghetti using reality stone, gone to a distant planet without anybody knowing where. Then could've snapped his fingers and yeeted half of living forms."
Showerthoughts,[removed],Mermaids are wierd
Showerthoughts,[removed],"Every c in ""Pacific ocean"" is pronounced differently"
Showerthoughts,[removed],French Canadians are really Europeans in disguise living in North America
Showerthoughts,[removed],Video game remasters basically make old games look how you remember them looking when they were new.
Showerthoughts,[removed],I know this is irrelevant but I’m saving up for a pc to do online classes for school and play games with my friends. Even a $1 would be amazing 🥺
Showerthoughts,[removed],"Whenever you clear lint out of your dryer filter, you're that much more naked the next time you wear through your wardrobe"
Showerthoughts,,Each one of us have had at least an overally enthusiastic as well as a really depressing classmate
Showerthoughts,[removed],"Technically, vaccinated children are more likely to get autism because they are still alive."
Showerthoughts,,vomit is technically a soup
Showerthoughts,[removed],Setting the microwave to 1:60 is way cooler to me than 2:00 even though they do the exact same thing
Showerthoughts,[removed],Interesting Fact
Showerthoughts,[removed],Wearing gloves feels like +5% strength but in real life
Showerthoughts,,A song is perceived as “good” when its corresponding pressure waves unlock dopamine reactions in your brain due to physics.
Showerthoughts,[removed],Nobody knows what a mirror really looks like.
Showerthoughts,[removed],I wish I would know which meme that I saw in lockdown was the funniest.
Showerthoughts,[removed],"Commenting ""lol (thousands of emojis)"" on a post does nothing, it changes nobody's mind about anything, nobody thinks ""interesting"" when seeing it."
Showerthoughts,,Nobody knows (or can ever know) what a mirror really looks like.
Showerthoughts,[removed],"When people say ""downvote me I don't care"" or ""whatever woooosh me"", they say it so they can maybe avoid being downvoted or wooooshed."
Showerthoughts,[removed],"Even if a video of Donald Trump raping 5 years old is to be released today, he won't lose a single vote"
Showerthoughts,[removed],Sign language is just hand emojis.
Showerthoughts,[removed],"The phrase ""up a creek"" doesn't make any sense without knowing it's an idiom of an idiom."
Showerthoughts,[removed],"Commenting ""lol 😂🤣😂😂🤣😂🤣"" on a post does nothing, it changes nobody's mind about anything, nobody thinks ""interesting"" when seeing it."
Showerthoughts,[removed],"If you flip someone off while wearing latex gloves, you are basically saying f*ck you without the consequences."
Showerthoughts,,Al Bundy’s love of toilets doesn’t make sense because he hardly ever eats.
Showerthoughts,[removed],"As words get added to the English language, Scrabble is getting easier and easier until at one point, any combination of letters will be a word and at that point the game will cease to be fun."
Showerthoughts,,Breaking every bone in your body doubles the amount of the bones in your body
Showerthoughts,[removed],"If the dark liquid (the substance that appears in the movie Prometheus and Alien: covenant) destroys or combines with any organism it comes in contact with, I wonder what terrifying things would happen if it merged with things like roaches or mosquitos..."
Showerthoughts,[removed],One day you'll pick up your child / pet and set them down for the last time
Showerthoughts,[removed],"Showering is rain, just inside"
Showerthoughts,[removed],Women whose ex-husbands are involved in their child's life and are paying childsupport are not single mothers; just single women.
Showerthoughts,[removed],Fishing is just gaming for the older generations that didn't have WiFi
Showerthoughts,[removed],Ham is just the arse of a pig
Showerthoughts,[removed],Now would be the best time to rob a store because everyone’s wearing a mask.
Showerthoughts,[removed],Why don't we just fund movie's?
Showerthoughts,,Rubbing salt on an octopus can kill it when it literally lives in saltwater.
Showerthoughts,,You can avoid prison for killing a person but you can go to prison for consuming a mushroom from your backyard
Showerthoughts,[removed],Your hands have probably consumed more alcohol than your mouth this year.
Showerthoughts,[removed],"If oxygen is really a drug controlled by the government, if us gen Z’ers decide to keep pissing off trump he could end all of the life on earth with a push of a button"
Showerthoughts,,The brain is the only body part that named itself.
Showerthoughts,[removed],"Since Jesus can turn water to wine, he may have been drinking water in front of others but turning it to wine as soon as he drinks it. In short, it's possible he had an addiction."
Showerthoughts,[removed],Always support local bands/musicians ect because you may know future celebrities right now
Showerthoughts,[removed],"Long ago, products from China were extremely valuable, but now they're often considered the cheapest you can buy."
Showerthoughts,[removed],If you went really far back in time other humans of the time would probably bully you. Same thing if you went really far into the future
Showerthoughts,[removed],"Kids these days won’t use the choppy, stilted voice we do to imitate robotic speech"
Showerthoughts,[removed],"Asking for, ""50 feet of rope, a tarp, an axe, some kerosene and matches"" makes someone think you're trying to get rid of a body. 100 years ago it was just another day at the general store."
Showerthoughts,[removed],Songs are just pressure waves that unlock chemical reactions in our brains.
Showerthoughts,[removed],There aren't any racist white swears because white people made all the racist swears.
Showerthoughts,[removed],Funny how the only thing I’ve ever asked cortana is if she can shut the f*ck up.
Showerthoughts,[removed],People who say not to talk to them before their morning coffee are basically saying they're unpleasant to be around when their not under the influence of drugs
Showerthoughts,[removed],Technically hagrid and Voldemort used to be friends friends
Showerthoughts,[removed],We might still be oblivious players in games we thought ended a long time ago.
Showerthoughts,[removed],The UK is the world's largest supplier of Independence Days.
Showerthoughts,[removed],It's entirely possible that human beings travelled to the past and eliminated the dinosaurs.
Showerthoughts,[removed],What if you drank milk from the same cow twice? Would you notice?
Showerthoughts,[removed],Wait a minute
Showerthoughts,,Rabid mosquitoes could really fuck us over
Showerthoughts,[removed],Activity trackers are most likely worn by those who are the least likely to be active
Showerthoughts,,"Marathon fundraising (Gamesdonequick, AfterLife, Twitch stream fundraisers, etc) are modern day telethons."
Showerthoughts,,You're closer to becoming a millionaire than Jeff Bezos is.
Showerthoughts,[removed],We put an unbelievable amount of trust in the disposable lids that seal our coffee/tea
Showerthoughts,,It’s possible that we’re surrounded by a clambering psychic din we’re oblivious of because we lack that sense.
Showerthoughts,,We all are mind readers since we can read our own minds
Showerthoughts,[removed],Being able to Honk at cars Behind you would be Extremely useful
Showerthoughts,[removed],Your call with a company might actually be used as quality control or training
Showerthoughts,[removed],"Imagine a world where people never picked up the habit of starting sentences with the word ""imagine"" when they want to sound like they're smart enough to have a point"
Showerthoughts,[removed],"We are technically still half-fish, we still need water for most of our bodily functions and if we spend too much time without it, we die."
Showerthoughts,[removed],Astronauts on the ISS probably email their votes in
Showerthoughts,[removed],weddings are an expensive way to let your entire family know you're fucking that night.
Showerthoughts,,stained glass and a dirty mirror are one in the same.
Showerthoughts,,Left palms have been written on much more than right
Showerthoughts,'Birthdays are created by calendar makers. I's a made up idea.',Birthdays are created by calendar makers
Showerthoughts,,"If the early bird gets the worm, doesn't the poor early worm get eaten by the bird."
Showerthoughts,,You know a show is made for children when there's a lot of porn of it on the internet
Showerthoughts,,The last picture you took could be the photo used for your obituary.
Showerthoughts,[removed],"War, over the centuries, is just humans throwing bigger and better rocks at each other."
Showerthoughts,[removed],We will eventually have astronaut-type jobs for burnouts
Showerthoughts,[removed],Sandwich is just a pig's arse + bread + cheese + wheat cooked
Showerthoughts,[removed],Do transformers have car insurance or life insurance
Showerthoughts,[removed],"When you sneeze, you are coughing with your nose"
Showerthoughts,[removed],"If the early bird gets the worm, doesn't the poor early worm get eaten by the bird?"
Showerthoughts,[removed],I never seen an ambulance at the gas station.
Showerthoughts,,Growing up in the era where computers and even basic knowledge of computers will garner a lot less computer scammers in the future.
Showerthoughts,[removed],Will there ever be astronaut jobs for slackers?
Showerthoughts,[removed],People’s voices get suddenly annoying the instant you know they’re a toxic or bad person.
Showerthoughts,[removed],"At some point in the far far future, someone is going to post the last ever Reddit post."
Showerthoughts,[removed],Cheese is just a loaf of milk
Showerthoughts,[removed],The Trump Administration's response to COVID-19 reminds me a lot of the USSR's response to Cherbonyl.
Showerthoughts,,A song is an over-produced poem
Showerthoughts,[removed],"""Others vs Me"" memes are supposed to say that you are different; but if it's widely spread, you are similar to a lot of people."
Showerthoughts,,"If white lies are innocuous, then black lies must be harmful"
Showerthoughts,,The word bed looks like a bed
Showerthoughts,[removed],"Before you start at a new job, everyone hears a new hire is coming in and hopes it's someone hot... then you show up."
Showerthoughts,,Jeff Bezos can solve many world issues and save many lives if he gave away what he makes in 10 minutes
Showerthoughts,,"If steroids aren't allowed in sports, then makeup shouldn't be allowed in beauty pageants"
Showerthoughts,I have seen them riding mopeds and scooters,I've never seen an obese person riding a crotch rocket/sport bike
Showerthoughts,[removed],"Relatable memes are meant to say that you are different, but if it's widely spread it means that you are just as same as everyone else."
Showerthoughts,,The letter W is the only letter in the alphabet with more than one syllable
Showerthoughts,[removed],"If Google had an app that matched people up by their browsing history, it could be the greatest online dating website of all time."
Showerthoughts,[removed],The intro music to the Netflix show Sugar Rush also sounds like the opening to Danny Phantom.
Showerthoughts,,"The most powerful driver of human advancement is not ""love"", but ""hate"""
Showerthoughts,,"If white-lies are lies that don’t hurt anyone, then black-lies must be lies that are more serious"
Showerthoughts,,You never saw a runner run past you that doesn't have good looking calves
Showerthoughts,[removed],Everything is easier said than done
Showerthoughts,,"Given his 'mystery box' theory, JJ Abrams would have been a very happy UPS driver."
Showerthoughts,[removed],"Since dogs get to know others by sniffing their butthole, if you fart in your dogs face, it's like pouring your heart out, which should make your bond stronger"
Showerthoughts,,Santa is an anagram for Satan.
Showerthoughts,,The eggs we eat are a chicken's menstruation
Showerthoughts,,Cars have done a good job at keeping insect population down
Showerthoughts,,The idea of the groom not being allowed to see the bride before the wedding was probably an excuse for the groom to get out of hours of dress shopping.
Showerthoughts,[removed],When you're fat you lose weight faster than when you're thin or skinny
Showerthoughts,[removed],Delivering packages is like reverse trick-or-treating
Showerthoughts,[removed],"Isnt kneeling for BLM disrespectful, since kneeling is what started the BLM movement?"
Showerthoughts,[removed],Santa is an anagram for Satan. Coincidence? I think not.
Showerthoughts,[removed],Eventually you will have more yesterdays than tomorrows.
Showerthoughts,[removed],Pirate Navy
Showerthoughts,[removed],What if the idea of not being allowed to see the bride before the wedding was a way for the groom to get out of spending hours dress shopping?
Showerthoughts,,"Companies that promote teamwork must remember that protest is also teamwork, just more chaotic and unexpected."
Showerthoughts,,The ability to send information at instantaneous speeds to anywhere in the world is frequently used so we don't have to get up to talk to the person in the next room.
Showerthoughts,,"In the movies , villains origin stories comes from tragedy. In the real life, people can come up after falling down quite fast"
Showerthoughts,,Every vintage narrator sounds the same
Showerthoughts,,From a planet that was once just wilderness we were able to harvest minerals from the ground to send a robot to another planet and send back images.
Showerthoughts,[removed],Family
Showerthoughts,[removed],"The name ""Joy Stick"" suits better on dildos"
Showerthoughts,[removed],"Even though not everyone likes that kids are at home and doing school online, the biggest benefit is that there won't be anymore school shootings"
Showerthoughts,,"If you had just listened to your own advice, you would have avoided most of the major mistakes you ever made."
Showerthoughts,,People who start life over in a different language as an adult are playing in Prestige mode
Showerthoughts,[removed],Sin Filtro
Showerthoughts,[removed],Mr. KRABS lives in BIKINI BOTTOM....
Showerthoughts,[removed],Online schooling
Showerthoughts,,One of the greatest feelings in the world is when you get struck by lightning a second after you activated the star power in Mario Kart.
Showerthoughts,[removed],There is a point where a bathtub becomes large enough where it is sociably acceptable to share with friends.
Showerthoughts,,Any man can make any woman fall for him by making her feel like shes unique
Showerthoughts,,If you water water it grows
Showerthoughts,[removed],You’re birthdays are really just anniversaries if your actual birthday.
Showerthoughts,,Any rice is sticky rice if you cook it long enough
Showerthoughts,,"If you’ve heard gangnam style, you’ve listened to K-pop."
Showerthoughts,,Most of our embarassing secrets are most safe with with online strangers.
Showerthoughts,[removed],Every creak you hear when home alone comes from interdimensional beings visiting your place at a subatomic level
Showerthoughts,[removed],The media could probably say that Jeff Epstein and his client's birth certificates all said they were born in 2000 therefor they aren't guilty and people would probably forget about it by the next day.
Showerthoughts,[removed],Grapes are just bite sized watermelons
Showerthoughts,[removed],"The people who wrote the song ""If i had $1,000,000"" probably have a million dollars now."
Showerthoughts,[removed],Kids born in the two thousand tens will not think Michael Jackson was weird for wearing a mask.
Showerthoughts,[removed],Every creak you heard when home alone comes from interdimensional beings visiting your place at a subatomic level
Showerthoughts,[removed],"Earth is the name we gave to our planet. If there’s another civilization, they probably don’t call our planet Earth."
Showerthoughts,[removed],Most of us have spent much more time trying to crack our own online passwords than any hacker ever will
Showerthoughts,,"AI/machine servants will probably fail, not because of cost or lack of production, but because most people don't understand how exact instructions need to be for machines."
Showerthoughts,[removed],Kids born in the 2010s won’t think Michael Jackson was weird for wearing a mask
Showerthoughts,"School buses don't have moms, dads, and babies, but public buses do, so why is it the default that the bus accompanying [nearly](https://duckduckgo.com/?q=wheels%20on%20the%20bus&amp;iax=images&amp;ia=images) every media (YouTube video, children's book of songs, etc) has a school bus and not the public bus the song is about. I'm not saying that there's not some depictions of the Wheels On the Bus as a public bus, just that it's rare compared to the school bus that is more frequently used.","Most motifs used with *Wheels On the Bus* depict are school buses, but the lyrics are clearly public transportation buses."
Showerthoughts,[removed],People who believe in god do not realise how beautifully our universe works.
Showerthoughts,[removed],if we keep school online this year then students wont have to watch rudy or remember the titans 5 times a year
Showerthoughts,,"If all humans suddenly and spontaneously dropped dead, resources would still be being wasted and the air would still get pollluted because many appliances and vehicles would still be on."
Showerthoughts,,Adding food to a store without permission is more problematic than taking food from a store without permission
Showerthoughts,,Muscles are biomechanical meat ropes attached to rocks.
Showerthoughts,[removed],Centors are insects
Showerthoughts,,There could be a cure for anything on any social media but it isn’t getting recommended yet
Showerthoughts,,The myth that chocolate milk comes from brown cows is technically true because milk comes from brown cows and it can be turned into chocolate milk.
Showerthoughts,[removed],Maybe a woman being moody on her period is her subconscious training her to feel negative for not being pregnant
Showerthoughts,,The last night of summer comes before the last day of summer
Showerthoughts,[removed],"Team Rocket's Jessie and James have a Meowth, a cat, because they're hunting a Pikachu, a mouse."
Showerthoughts,[removed],"If Pinocchio can’t lie without his nose growing, it would be really easy to get closer to the answer to all of life’s questions by making him say things like “Aliens are out there.”"
Showerthoughts,[removed],"In thirty or so years, reddit will be to our kids what Facebook is to us."
Showerthoughts,[removed],Buildings made entirely out of glass are just giant sandcastles.
Showerthoughts,[removed],Ramen is just weeb spaghetti
Showerthoughts,[removed],"We all know the ""every other urinal"" rule, but no one mentions the ""don't exit the shitter at the same time as the guy next to you"" rule"
Showerthoughts,[removed],The shower gels comes in almost every color but the foam is always white
Showerthoughts,,"The parts you didn't like about the way your parents raised you, are often an over correction of the parts they didn't like about they way their parent's raised them."
Showerthoughts,[removed],Hitler is the most famous artist ever
Showerthoughts,,"""You are not alone"" can be used to comfort or scare someone."
Showerthoughts,,"It's strange that the only people outside of a highschool history class that even talk about fascism recently are kids in the streets begging for fascism, yet claiming to be the sole opponents to it."
Showerthoughts,,"While the smurfs do seem to know old age, they don't have a cemetary."
Showerthoughts,[removed],"Damn, some kid born today won't be able to vote until 2038."
Showerthoughts,,"Just like with cows and us, a new species may come to earth and start milking women"
Showerthoughts,Ironic isn't it?,You grow up wanting to be an adult only to wish you were a child again...
Showerthoughts,[removed],Some of the best shows air on Wednesdays and it so happens to be the day with the highest rate of suicide occurrences.
Showerthoughts,,Someone probably saw your post/comment and correctly assumed something about how you are irl
Showerthoughts,,Pets might think some people are immortal.
Showerthoughts,[removed],"We rarely appreciate time as it is, it's either passing too slow while at work/school or too fast when doing things we enjoy"
Showerthoughts,,"Someone who treats people like idiots, tend to be the real idiot"
Showerthoughts,[removed],"Team Rocket's Jessie and James have a Meowth, a cat, because they're hunting a Pikachu, a mouse."
Showerthoughts,[removed],"Schools teach you not to trust .com sources because they are run by corporations, but teach you to trust .gov sources even though the government is just as fallible."
Showerthoughts,[removed],"There should be one short word that would mean ""no time to explain""."
Showerthoughts,,"If Germany is the fatherland, and Russia is the motherland, then the entire Eastern front of WW2 is just one big pile of domestic abuse"
Showerthoughts,[removed],Miss world and Miss universe is just a very expensive and classy strip club
Showerthoughts,,Playing a game on easy mode if your life is busy for what ever reason. MAKES your skill level CONSCIOUSNESS batter you like very hard mode enemies.
Showerthoughts,,Assuming that every payday in the game of life is a year you have kids at the age of 30 retire at the age of 40 and if you roll right you can have grandkids when your kids are 10 or 11
Showerthoughts,[removed],"Publicly-funded schools teach that .gov sources are reliable. Therefore, the government is essentially forcing you to trust the government."
Showerthoughts,[removed],"When publicly-funded schools tell you that .gov sources are reliable, the government is essentially forcing you to trust the government."
Showerthoughts,[removed],Eventually you will have more yesterdays than tomorrows.
Showerthoughts,,"The human brain says the human brain is the smartest thing in the world, but the human brain still doesn't know everything about the human brain."
Showerthoughts,,Jobs pay the lowest possible amount to keep you from leaving.
Showerthoughts,[removed],"Team Rocket's Jessie and James have a Meowth, a cat, because they're hunting a Pikachu, a mouse."
Showerthoughts,[removed],"Buckets and Bags coexist on a scale of rigidity from rigid to flimsy, respectively."
Showerthoughts,[removed],"Kids these days won’t use the choppy, stilted voice we do to imitate robotic speech"
Showerthoughts,[removed],"If schools are teaching us that .gov sources are reliable, then the government is essentially indoctrinating you to trust the government."
Showerthoughts,[removed],How big is a slice of pie the size of pi
Showerthoughts,[removed],"I wonder if early man wanted to give belly rubs, or if the wolves asked first."
Showerthoughts,[removed],Pure beauty isn't beautiful at all
Showerthoughts,[removed],"Wouldn‘t it be absolutely mind-blowing and terrifying if we could hear every single person all around the world moaning, while they are having sex? This would be a gigantic choir!"
Showerthoughts,[removed],I think that women have been exclusively attributed most colors in the same manner that men have been exclusively attributed certain jobs due to traditional roles
Showerthoughts,[removed],"Considering the recent trend of rebooting 20+ year old movies, it's surprising there hasn't been a new ""Back to the Future"" movie."
Showerthoughts,[removed],"Years from now, people won't know why ""white flint"" is a station"
Showerthoughts,[removed],The days start coming and they don’t stop coming...
Showerthoughts,[removed],There's going to be a uptick in mask fetishs after this pandemic
Showerthoughts," I got a weird thought in my head, we could be in a fantasy world from a perspective of another fantasy world and its fantasy to us but normal for them and its fantasy for them but normal for us.",We might be a fantasy world from another fantasy world's perspective.
Showerthoughts,[removed],If I had a slice of pie that was the size of a pie how much would I have
Showerthoughts,,"Anyone who is reading this, is closer to 50 Million Subscribers on Youtube than PewDiePie"
Showerthoughts,,All women who swallow during sex are technically cannibals.
Showerthoughts,[removed],Saying “I don’t mean to make it weird but” is the easiest way to make something weird
Showerthoughts,[removed],"Anyone who is reading this, is closer to 50 million Subscribers on YouTube than PewDiePie"
Showerthoughts,,Second graders must look tall as fuck to kindergarteners.
Showerthoughts,[removed],"If you're well known for being a good liar, then you're not a good liar."
Showerthoughts,[removed],"Watching scary movies is like eating hot peppers, If you can handle it, they're great. But if you go over your limit it really sucks and can't be undone."
Showerthoughts,,Regular Show was a regular show
Showerthoughts,[removed],Condoms are made by humans to prevent humans
