subreddit,selftext,title
Showerthoughts,"Nice job(outdoor man), accepting family, Mandy(especially Mandy), gets a car by trading a lunchbox and father like figures Ed and Mike.",Kyle from Last Man Standing might be stupid but he's the luckiest guy on the planet.
Showerthoughts,[removed],Why is it toothpaste even though we use it on our teeth
Showerthoughts,[removed],Science is just reverse engineering nature
Showerthoughts,[removed],Science is just reverse engineering nature
Showerthoughts,[removed],You could just do your taxes during the Purge. Since everything is legal you could just lie your way into not paying any taxes for the year.
Showerthoughts,[removed],I don't know why I joined r/Showerthoughts...
Showerthoughts,[removed],"Everyone's favorite color is Blue, we've just been told it's called something else because we all see different colors."
Showerthoughts,,"When you set an alarm at 2:00 am for 7:00 am and your phone says ""alarm set for 5 hours from now"" it is unnecessary salt on the wound."
Showerthoughts,[removed],"There's been less kid bullies these days because their parents were probably bullied back then, and didn't wanted their kids to be what made them suffer when they were younger."
Showerthoughts,[removed],"If you jump off a bridge to commit suicide, that means that you were jumping to conclusions."
Showerthoughts,,"VR will create a reverse Platos Allegory of the Cave, in the future"
Showerthoughts,,Dr. Bright is literally just a tamer version of scp-035
Showerthoughts,[removed],Gamers around the world are crashing virtual planes into their cities trying to find their house.
Showerthoughts,[removed],The Lizard-people conspiracy was probably started because rich people were doing coke.
Showerthoughts,[removed],"If large social media platforms didn't have ""economies"" that somewhat encouraged internet popularity, there wouldn't be as many dumb assholes as there is today."
Showerthoughts,[removed],Earth is just a giant spitroast
Showerthoughts,[removed],You have no face. The face simply doesn't exist at all aside from being a name given to a particular collection of sensory patterns.
Showerthoughts,,Just realised that kiwis are kawaii.
Showerthoughts,,There's probably more discord servers than there are spoons.
Showerthoughts,[removed],"If social media like reddit itself didn't have ""economies"" that somewhat encouraged internet popularity, there wouldn't be as many dumb assholes as there is today."
Showerthoughts,[removed],"Before you start at a new job, everyone hears a new hire is coming in and hopes it's someone hot... then you show up."
Showerthoughts,,Chips on the bottom layer of the nacho tray must feel sad that they don’t get toppings
Showerthoughts,[removed],The reason anime 10 second countdowns seem like 10 minutes is because they show the perspective of all the characters. You are just supposed to know that and they never say it.
Showerthoughts,[removed],I just realized A. G. Cook can call his album Apple cuz his label is called P. C. Music for Personal Computer Music
Showerthoughts,[removed],"When you set an alarm at 2:00 am for 7:00 am and your phone says ""alarm set for 5 hours from now"" it is unnecessary salt on the wound."
Showerthoughts,[removed],Professional wrestling is just theatre for jocks.
Showerthoughts,[removed],"In a survival horror, when you see alot of ammo in a certain room, you know that a boss fight is coming."
Showerthoughts,[removed],"If Jesus can walk on water, can he swim on land?"
Showerthoughts,[removed],Do nudists worry about skidmarks on the furniture?
Showerthoughts,,Negative is the new positive
Showerthoughts,,"Some of the ""first day of X grade"" pictures might be the last to some unlucky few."
Showerthoughts,[removed],Your parents are probably only 20+ years older than you.
Showerthoughts,,There is some link between farts and secrets: everyone only seems to be able to hold in one or the other.
Showerthoughts,[removed],If time travel was invented there would have to be some sort of financial fraud police to make sure people don’t go back and mess with the stock market
Showerthoughts,,Ok so why does every depicted centaur have abs like how do they even do their crunches
Showerthoughts,,"The word ""nigh"" is only really ever used for one specific sentence."
Showerthoughts,,"No one will ever know how many stars had died, to only end up as someone’s gold grill or chain."
Showerthoughts,,Swimming is the dark souls of sports
Showerthoughts,[removed],Boomers ruined Facebook.
Showerthoughts,[removed],"A system that refuses to hold everyone accountable, has forfeited the right to hold anyone accountable"
Showerthoughts,[removed],Choosing a dog might be the only time you can pick a relative.
Showerthoughts,,"Considering it's capable of moving a 2,000 pound hunk of metal at speeds in excess of 100 miles an hour, we really take the explosive power of gasoline for granted."
Showerthoughts,,"You almost always recognize click bait, but still click it."
Showerthoughts,,"Kids these days won’t use the choppy, stilted voice we do to imitate robotic speech"
Showerthoughts,,"If humans are mostly water, then drinking water makes us cannibals"
Showerthoughts,[removed],All digital art is pixel art
Showerthoughts,[removed],Debunk
Showerthoughts,,"You're not ugly, you're just not your type"
Showerthoughts,,The year 1337 was a thing
Showerthoughts,[removed],"Shouldn’t September be the 7th month, October be the 8th month, November be the 9th month, and December be the 10th month?"
Showerthoughts,[removed],"If someone has sex with a clone of themselves, is it incest?"
Showerthoughts,,"Somewhere out there one of your exes still hates your guts, while another still dreams of what could have been."
Showerthoughts,,All art is pixel art once you take a photo of it
Showerthoughts,,Lots of children actually have a higher net worth than many adults because many adults get themselves into deep liability at a young age and children have no financial liabilities
Showerthoughts,[removed],Bisexuality is just the lite version of pansexuality
Showerthoughts,,"Condom companies kill their future customers. ,"
Showerthoughts,,The best and most uncomfortable time to protest global warming is outdoors during a heatwave
Showerthoughts,,"Anytime you do anything, there’s a decent chance that at least someone else is doing the exact same thing, same action, movements, thoughts ect..."
Showerthoughts,[removed],"Kids these days won’t use the choppy, stilted voice we do to imitate robotic speech"
Showerthoughts,,People are impressed by your success but don’t care about how you got to be successful.
Showerthoughts,[removed],"Aaron is a boy’s name and Erin is a girl’s name, but they’re both pronounced the same"
Showerthoughts,,You can tell a lot about someone's character by how fast they cross the street in front of your car when they know you're waiting.
Showerthoughts,[removed],Fall guys is pretty much the new fortnite
Showerthoughts,[removed],Eventually you will have more yesterdays than tomorrows.
Showerthoughts,,Every cup will end up broken
Showerthoughts,[removed],"Space travel can be considered to be ""unlockble via paid DLC."""
Showerthoughts,,Dino nuggets are ground up modern dinos to look like ancient dinos.
Showerthoughts,[removed],"If someone clones themselves and have sex with the clone, is it incest?"
Showerthoughts,,"Since we have no idea if afterlife exists, every life ends on a cliffhanger."
Showerthoughts,[removed],"It’d be very strange, but also correct, if Joe Biden choose to use MAGA as his campaign slogan."
Showerthoughts,[removed],"Playing video games all day is considered being lazy, but watching Netflix all day is considered relaxing."
Showerthoughts,[removed],The best liar you know is probably not the best liar you know
Showerthoughts,[removed],"When a man ejaculates, he is committing genocide."
Showerthoughts,[removed],"If someone creates a clone of themselves and have sex with them, is it incest?"
Showerthoughts,[removed],"if you draw spongebob on a sheet of paper you're also technically drawing doodlebob, no matter how good or bad the drawing is."
Showerthoughts,[removed],"If Iraq actually had WMD's, the US would not have invaded Iraq."
Showerthoughts,[removed],"If I madk a clone of myself and have sex with him, is it incest?"
Showerthoughts,[removed],A sinkhole is just a baby canyon.
Showerthoughts,[removed],"if you draw spongebob on a sheet of paper you're also technically drawing doodlebob, no matter how good or bad the drawing is."
Showerthoughts,[removed],A female condom could also be called a beaver dam
Showerthoughts,[removed],People that ride motorcycles with their stereos at full volume are just grown up versions of kids that walk through hallways with speakers in their backpacks
Showerthoughts,The society would be a much more peaceful place and hand shake would be replaced with a high five because you know that the other guy also got a BJ.,If ever man in the world received a blowjob every morning.
Showerthoughts,[removed],The phrase no pressure adds more pressure to a situation
Showerthoughts,,"The human anus can stretch to 7 inches, and a raccoon can fit in a hole 4 inches in diameter. Therefore you can fit almost two whole raccoons in your ass."
Showerthoughts,[removed],"If Adam or Eve were gay, the story would be more complicated"
Showerthoughts,"From ones perspective you are the only real person where everything else is a means to continue the narrative of the game.

Once you die the game is over.",You are playing a single player game and 'people' and events are generated
Showerthoughts,[removed],Marketers are magicians. They turned the sludge on soap into a viable product; body wash. They mixed soap and water to sell it at a higher price than soap alone.
Showerthoughts,,Ice trays can be used as cow bras
Showerthoughts,[removed],"If Peter could walk on water, could he swim on land?"
Showerthoughts,[removed],There is nothing more precious to a man on a mission than time
Showerthoughts,[removed],"History always repeats itself, but people can't ever go back in time."
Showerthoughts,,Changing condoms is a lot easier than changing diapers.
Showerthoughts,,Соnstаntlу tурing “lоl” or “lmао” is thе еquivаlent tо а nеrvоus lаugh irl.
Showerthoughts,[removed],Emojis would depict emitían better if they were anime
Showerthoughts,,An AI will be able to mimic human speech and manipulate the world easily without us knowing it.
Showerthoughts,,Toe socks are just gloves for your feet
Showerthoughts,,Have you ever gotten ready to have a wank but realised you weren’t in the mood but u got everything set up so u end up wanking anyway. Isn’t that you raping yourself.
Showerthoughts,[removed],"If you're using Jesus to justify Agent Orange, then Jesus is only a prophet and Agent Orange is your God"
Showerthoughts,[removed],By eating a chickens eggs we are essentially eating a cooked chicken period
Showerthoughts,,There's a chance that the voice actor for Santa's little helper in the Simpsons will die before the character in the show does.
Showerthoughts,[removed],"Before you start at a new job, everyone hears a new hire is coming in and hopes it's someone hot... then you show up."
Showerthoughts,[removed],"The letter x is useless, You can easy replace it with cks or ks and for other words just a z"
Showerthoughts,[removed],"The letter ""x"" is useless, You can easy replace it with ""cks"" or ""ks"" and for other words just a ""z"""
Showerthoughts,,Girls being stuck in the “friends with benefit” zone to a guy is comparable to a guy being stuck in the “friend-zone” to a girl.
Showerthoughts,[removed],The internet's creative threats are essentially the comeback of Shakespeare's creative insults.
Showerthoughts,[removed],What goes on in the mind of a mental patient as he rocks back and forth inside his padded cell
Showerthoughts,[removed],"Team Rocket's Jessie and James have a Meowth, a cat, because they're hunting a Pikachu, a mouse."
Showerthoughts,[removed],People’s voices get suddenly annoying the instant you know they’re a toxic or bad person.
Showerthoughts,,The most humble man in the world can’t admit it because it would make him less humble.
Showerthoughts,[removed],would it be symmetrical if Cuba Gooding juniors upcoming trial became a tv show. And Oj was cast as Cuba?
Showerthoughts,,"People in the 2100s+ will think, the early Internet was just Catvideos and Emails, because of its ""great"" Representation in the media (movies, series, books,...)."
Showerthoughts,[removed],Most of us have spent much more time trying to crack our own online passwords than any hacker ever will
Showerthoughts,[removed],"If you can read this, you're probably hom o"
Showerthoughts,[removed],"If you can read this, you're probably homo"
Showerthoughts,,A Twinkie is just a cake eclair.
Showerthoughts,[removed],Awards on reddit and new/novel emote reactions on Discord are a very similar type of nebulous award (aside from the gold).
Showerthoughts,[removed],"Given the level of competition in NBA right now in the bubble, should fans want the best basketball available and have the players play in bubble or return to the distraction of arenas? as goes for all professional sports"
Showerthoughts,[removed],"This soap smells really good, I should buy more."
Showerthoughts,[removed],People who drive with their knees are probably the same people who rode their bikes without hands.
Showerthoughts,[removed],This is a bath thought actually
Showerthoughts,[removed],"What if you’re choking on something, but no one will help you because they think you have COVID-19?"
Showerthoughts,[removed],I don't see why we couldn't fill London Underground and have speed boats down there. It'd definitely be a faster system and no doubt cheaper for passengers.
Showerthoughts,[removed],"The message in the tortoise and the hare isn't ""slow and steady wins the race"", it's ""if you snooze you lose"""
Showerthoughts,,Belly button is a scar
Showerthoughts,,Adopted people have 4 parents
Showerthoughts,[removed],"What happens if you choke on something, start coughing, but no one will perform the Heimlich maneuver because they think you have corona virus?"
Showerthoughts,,"Stickbugging, because of its use of lines, will one day become the new loss"
Showerthoughts,[removed],People in the 2100s and onwards will think the early Internet was just Catvideos and Facebook because of the great Representation of it in the movies and series of that time
Showerthoughts,[removed],JAHHAHAHSHA HAHHABA the logo looks like pp when cum xddddd
Showerthoughts,[removed],Zen rock gardens are just adult sand boxes
Showerthoughts,[removed],"I haven't eating a sweet, delicious Watermelon in forever"
Showerthoughts,[removed],"You don't live in a real rural setting unless you have to get out of your pickup to unlock/open a gate, pull up, and get back out of your pickup to close/lock the gate at least once on your way home."
Showerthoughts,[removed],"People in the 2100s+ will think, the early Internet was just Catvideos and Facebook, because of the ""great"" Representation of it in the media"
Showerthoughts,[removed],"People in the 2100s+ will think, the early Internet was just Catvideos and Facebook, because of the ""great"" Representation of it in the media(movies, series, books,...)."
Showerthoughts,,There is going to be a moment in the future where former e-girls are going to start selling their services as e-girl coaches.
Showerthoughts,[removed],"If Cuba Gooding Jrs trial ever gets televised, they should get OJ to play him."
Showerthoughts,,"There needs to be a new emotion for when you see something really funny and try to explain it to a friend, and they don’t laugh."
Showerthoughts,,ኃጢአተኛ ነፍስህ ከድነት በላይ ነው እናም ሰላምን እና ህመምንም አታውቅም ፣ ብቸኛው የባዶነት ቅዝቃዜ ብቻ ነው የንስሐ ጊዜ ተጠናቅቋል ፣ ምክንያቱም ጥፋቶችህ በክፉ ዓይነትህ ከማንኛውም ተልእኮ ይበልጣሉ መጨረሻው
Showerthoughts,[removed],&amp; is just a fancy I
Showerthoughts,[removed],"The US is the only place where the phrase ""hovering between freezing and sub zero temperatures"" doesn't sound stupid."
Showerthoughts,,Lamps in video games use real electricity
Showerthoughts,,When the ice caps melt we'll have to start telling kids Santa lives on a boat
Showerthoughts,,"Considering all places on the body where spicy food feels horrible, it's a bit odd that people like it in the mouth."
Showerthoughts,[removed],Eventually you will have more yesterdays than tomorrows.
Showerthoughts,[removed],We call it “cloud service” but the data is transferred through cables in the land and kept in servers on the land.
Showerthoughts,,Rich actors can portray being in poverty more accurately than poor people could portray being rich
Showerthoughts,[removed],We Actually live in an age where we can refer to the before time... in the long long ago
Showerthoughts,[removed],It would be hilarious if aliens finally visit earth but they just ignore humans
Showerthoughts,[removed],"If equality were truly a thing, gay marriage and gender identity wouldn't be issues at all."
Showerthoughts,,Being close to death is scarier than certain death
Showerthoughts,,"If everyone believes a lie, it becomes the truth"
Showerthoughts,,"At some point, the 100-meter dash world record will reach the limit of human performance and it will never be broken again"
Showerthoughts,[removed],Paying for Term Life insurance for an elderly relative with you as the beneficiary is a great investment.
Showerthoughts,[removed],How funny would it be if aliens finally visit earth but they don't care about humans
Showerthoughts,,The Snoo's (avatar) eyes on your profile are transparent since its colour depends on the background.
Showerthoughts,[removed],You will never know the best liar
Showerthoughts,[removed],"If all the people who make up diseases so they don't have to wear face protection actually had them, they would be exactly the people who need it the most."
Showerthoughts,[removed],"Cats spend most of their time sleeping, but don't like to let their humans sleep."
Showerthoughts,[removed],"English is one of the few languages where a normal sentence can be sexual, threatening, or void of any meaning, yet we still use it"
Showerthoughts,[removed],Phineas and Ferb would have gotten grounded more often if Candace had a phone.
Showerthoughts,[removed],"If all the people who make up diseases so they don't have to wear a mask actually had them, they would be exactly the people who need to wear masks the most."
Showerthoughts,,A photo is never up to date
Showerthoughts,,Socks could be used as slang for bisexuality and shoes for heterosexuality
Showerthoughts,[removed],"When calling someone a bitch, the meaning of the word reverses depending on gender; for a man it can mean he’s weak or cowardly, and for a woman it can mean she’s malicious or aggressive."
Showerthoughts,[removed],Depression is an unfortunate byproduct to a nihilistic way of living.
Showerthoughts,[removed],The person who made binary code literally spammed 1's and 0's and madea computer
Showerthoughts,,"Due to the emergence of self-driving cars, new terminology may have to be used to describe automatic and manual cars in a few years"
Showerthoughts,,Pac-man is a horror game with bad graphics.
Showerthoughts,[removed],"All things considered, we live in the safest time in history, but thanks to the internet and globalization exposing us to potential threats, we are much more paranoid than our ancestors"
Showerthoughts,[removed],"English is one of the few languages where a single sentence has countless different interpretations, and yet it's considered a busi ess language by many"
Showerthoughts,[removed],Irish are the jamaicans of white people.
Showerthoughts,Please don’t turn this into a debate,In dictatorships police often have a different connotation
Showerthoughts,[removed],There is somebody out there with a face mask fetish having the time of their life right now
Showerthoughts,,Jeff Kinney made millions of dollars off of people who hate reading
Showerthoughts,[removed],The word “nowhere” is a combination of the two words “now” “here”
Showerthoughts,[removed],Were all incest
Showerthoughts,[removed],Now everyone’s working from home NSFW isn’t really a thing
Showerthoughts,[removed],"The message in the tortoise and the hare isn't ""slow and steady wins the race"", it's ""if you snooze you lose"""
Showerthoughts,[removed],Titties
Showerthoughts,,The E in her is silent.
Showerthoughts,[removed],"If there are infinite universes, then technically anything and everything could and does exist in those universes so technically you've never told a lie, it was just applicable to a different universe."
Showerthoughts,[removed],Slugs are just homeless snails
Showerthoughts,,"Rome wasn’t built in a day, but it was probably built mostly during the day due to no lights."
Showerthoughts,[removed],5 second ads on YouTube feel a lot longer than 5 second videos on YouTube.
Showerthoughts,,"Based purely on the sample size, girls, who don’t have penises, will in general have a better idea of what a normal penis is than guys, who have penises."
Showerthoughts,,The formula for naming the Ted movies is Ted X
Showerthoughts,,It's hard to get the chocolate cover of some ice-creams perfectly symmetrical while eating.
Showerthoughts,[removed],The E in her is silent. Say her out loud without the e.
Showerthoughts,,"When you set an alarm at 2:00 am for 7:00 am and your phone says ""alarm set for 5 hours from now"" it is unnecessary salt on the wound."
Showerthoughts,[removed],There are going to be a lot less babies named Karen in the next decade or two
Showerthoughts,[removed],"You usually consider your shower far cleaner than your toilet, although you have no problem pissing in both of them."
Showerthoughts,[removed],"The older I get, the more songs I consider “heartbreaking” have nothing to do with romance"
Showerthoughts,,"If you comment under a post, the popularity of your comment depends on the popularity of the post"
Showerthoughts,,Willy Wonka introduced the inventing room in German but Augustus missed it because he fell into the chocolate river earlier.
Showerthoughts,,It's surprising that STDs didn't evolve to create aphrodisiac effects in humans. (Or did they?)
Showerthoughts,,"People will drink tons of alcoholic drinks, tons of sugary drink, but will refuse to drink sink water."
Showerthoughts,,"If a few billionaires put their mind to it, they could probably go a long way towards fixing/solving a couple of the seemingly insurmountable problems facing humanity."
Showerthoughts,,Late stage Alzheimer’s can be cured by late stage Alzheimer’s can be cured by late stage Alzheimer’s can be cured by late stage Alzheimer’s can be cured by.....
Showerthoughts,,The first thing that goes into the first bin bag off a new roll is the wrapper that held the roll together
Showerthoughts,,We've reached a day and age where simply being happy is considered annoying
Showerthoughts,[removed],WHAT
Showerthoughts,,you can only move the lower jaw
Showerthoughts,,New York City is the one city everyone knows but doesn't actually exist on a map
Showerthoughts,"You'd think if the salary was really competitive they'd list it right there in the ad. Instead we have to apply, be chosen to interview, and then they ask us what our ""expectations"" are for salary.","If a job posting advertises that the salary is ""competitive"" chances are it really isn't"
Showerthoughts,,Personal evolution cannot take place without the risk of “extinction”.
Showerthoughts,,"If you don't like your birthday, you haven't considered the alternative of not having one."
Showerthoughts,[removed],Most pet dogs develop Stockholm syndrome
Showerthoughts,[removed],Lights in video games use actual electricity
Showerthoughts,[removed],"Calling someone a bitch has different meanings depending on gender. Calling a woman a bitch insinuates she’s being mean or has an attitude. However, calling a man a bitch is usually insinuating he’s being a pussy or a wimp."
Showerthoughts,[removed],getting a bigger bed means more bed room but less bedroom
Showerthoughts,,"If you don’t understand something, what happens when you don’t undersit something"
Showerthoughts,,"There are three types of people in the world. Those who take the band-aid off slowly and carefully, those who rip the band-aid off fast, and those who have the band-aid on for so long that it comes off on its own and you find it floating in the pool."
Showerthoughts,[removed],“sexily” is a very unsexy word to say/ describe something as
Showerthoughts,[removed],What happens if you you don’t undersit something?
Showerthoughts,[removed],Peaking in college is the new peaking in high school
Showerthoughts,[removed],A book is just paper talking that you hear with your eyes
Showerthoughts,,Most of us haven't ever formally introduced ourselves to our siblings
Showerthoughts,[removed],"Calling someone a bitch has different meanings depending on gender. Calling a woman a bitch insinuates she’s being mean or has an attitude. However, calling a man a bitch is usually insinuating he’s being a pussy or a wimp."
Showerthoughts,[removed],"When you wear your mask, and you smell your breath that’s what you taste like when you make out with someone."
Showerthoughts,[removed],If you don’t understand something what happens when you don’t undersit something?
Showerthoughts,[removed],‘Nutting’ is a weird term for spurting unborn children out of your dick.
Showerthoughts,[removed],sick days are never going to be the same after corona
