subreddit,selftext,title
todayilearned,,"TIL that in the 1893 Supreme Court case Nix. v. Hedden, they ruled unanim. that an imported tomato should be taxed as a veg., rather than a (less taxed) fruit. The court acknowledged that a tom. is a botanical fruit, but went with the ""ordinary"" definition of fruit and veg. — the kitchen ones."
todayilearned,,"TIL With more than 80 percent of the hybrid vehicle market, Toyota is undoubtedly a leader in hybrid technology. Rather than lock that expertise away, Toyota announced it will share nearly 24,000 patents with fellow automakers. This is Toyota's attempt to promote electrified vehicles worldwide"
todayilearned,,"TIL about Ann Hodges, the only person to have been struck by a meteorite"
todayilearned,,"TIL that one of the blackest blacks is licensed exclusively to Anish Kapoor; no other artist is allowed to use it in their art. In return, Stuart Semple developed a pink color and banned Kapoor from buying it."
todayilearned,,TIL Copyright Deadlock. You can create ad-free YouTube videos with multiple copyright infringements triggering ContentID so no one makes money because of competing copyright claims.
todayilearned,,TIL Saint Jude is the patron saint of lost causes.
todayilearned,,"TIL Evarts Graham, a doctor who'd helped discover the link between smoking and lung cancer, showed a fellow surgeon an X-ray of a patient with lung cancer. Evarts's colleague deemed the tumor to be inoperable. Graham then revealed he was the patient."
todayilearned,,"TIL that Artemis Fowl author Eion Colfer penned And Another Thing... , the sixth novel in the Douglas Adams' The Hitchhiker's Guide to the Galaxy ""trilogy"". The book, published in 2009, wraps up the series. Adams passed before publishing the original sixth book titled The Salmon of Doubt."
todayilearned,,"TIL that in 2008, a woman was charged and convicted for falsely reporting a rape that had actually happened to her, after police pressured her into saying that she made the rape up."
todayilearned,,"TIL NBA All-Star Blake Griffin does stand-up comedy. He first got on stage in Montreal in 2016 and would like to make it his next career, after the NBA."
todayilearned,,TIL Ronald Reagan’s son (Ron Reagan) is a liberal
todayilearned,,"TIL that the word ‘Drunk’ has the most synonyms in the English language with over 2,985 synonyms"
todayilearned,,"TIL French photographer Hippolyte Bayard produced the first-ever fake photograph ""self-portrait as a drowned man"" in 1840 just a year after its invention."
todayilearned,,TIL Bill Gates Thought the Cost of Frozen Totino’s Pizza Rolls was $22
todayilearned,,TIL that fossils and some types of shells get “diseases” that look and act like a mold or fungus but are actually just progressive chemical reactions.
todayilearned,,"TIL In 2019, Pras from The Fugees was indicted with illegally helping to funnel $21 million in foreign campaign contributions into the 2012 U.S. presidential election to benefit political candidate Barack Obama."
todayilearned,,TIL Iranians are very advanced scientifically.....
todayilearned,,"TIL Sneezing after cleaning isn’t caused by an allergy to dust, but an allergic reaction to the feces and dead carcasses of dust mites getting trapped in your nose"
todayilearned,,TIL Theodore Roosevelt V partnered with Subaru of America to create and promote a Zero Landfill Initiative at three of the National Park System most iconic parks.
todayilearned,,"TIL that in 1969 on the volcanic island of Surtsey, which was created in an underwater eruption from 1963 to 1967, a plant that scientists were unable to identify was found growing. It turned out that someone had done their business, and the plant was a tomato plant that grew out of the faeces."
todayilearned,,"TIL that Penelope Ashe's Naked Came The Stranger was actually conceived in 1966 by Newsday writer Mike Mcgrady in 1966, who told his co-workers to make a low-effort, sex-filled book. It was published in 1969 by Lyle Stewart and became the first erotica to appear on the New York Times best-sellers."
todayilearned,,"TIL 12 days before the Nuclear accident in Three Mile Island (Pennsylvania), the movie 'The China Syndrome' premiered - At one point in the film, an official tells the main character that an explosion at the plant ""could render an area the size of the state of Pennsylvania permanently uninhabitable"""
todayilearned,,TIL Christina Johansdotter decapitated an infant in 1740 in order to get into heaven. Suicide would send her to hell but killing an infant would allow her to repent her sin before being executed.
todayilearned,,TIL during the Vietnam war soldiers would eat C-4 (explosive) to get high.
todayilearned,,"TIL that Penelope Ashe's book Naked Come The Stranger was actually conceived by Newsday's Mike Mcgrady in 1966 with 24 co-workers to make a low-effort, sex-filled book. It was released in 1969 and became the first best-selling erotica."
todayilearned,,"TIL the official release of Paris Hilton’s pornographic video ‘1 Night in Paris’ opened with a dedication that states: ""In memory of 9/11/01... We will never forget."""
todayilearned,,TIL Napoleon's great-nephew Charles founded the FBI
todayilearned,,"TIL The oldest known wild bird in the world, Wisdom, was banded in 1956!"
todayilearned,,"TIL Van Halen had a clause for venues that required a bowl of M&amp;Ms, but absolutely no brown ones. This wasn’t to be prima-donnas but rather to served a practical purpose: a simple way of ensuring the technical specifications of the contract had been thoroughly read, primarily for safety reasons."
todayilearned,,Why Lifting Women out of Poverty is Essential - BORGEN
todayilearned,,TIL Bacardi is turning plastic straws into vinyl record albums.
todayilearned,,TIL Pablo Escobar had pet hippos and they got loose and are thriving in the wild
todayilearned,,"TIL about the Elan School program, a seemingly ""therapeutic boarding school"" which turned out to be using ""attack therapy"", the idea that teens should express their anger on each other to improve themselves."
todayilearned,,"TIL if you are on most airlines (not all) and hear an announcement referencing ""Jim Wilson"", it's because there's a dead body on the plane"
todayilearned,,TIL about Bass Reeves. The guy who the Lone Ranger is based on and the “real” Lone Ranger was black.
todayilearned,,TIL that the United Kingdom bought T-80 Main Battle Tanks from Russia by posing as a fake trading company that was supposed to deliver them to Morocco.
todayilearned,,TIL - There are more than 2x the amount of Chickens on earth than People.
todayilearned,,TIL that coconuts develop which is sometimes called the 'Coconut Embryo' or 'Coconut Apple'
todayilearned,,"US may soon have a three-digit suicide prevention hotline - The US House of Representatives passed the National Suicide Hotline Improvement Act of 2018 with a nearly unanimous 379-1 vote in July 2018. Within a month, the US Senate approved the bill by unanimous consent and Trump signed it into law"
todayilearned,,TIL: House plants don't purify your house's air
todayilearned,,"TIL Red in Shawshank Redemption was a middle aged Irishman in the novella by Stephen King but Morgan Freeman was cast as he fit the role because of his authoritative presence, demeanor, and deep voice."
todayilearned,,TIL that the United Kingdom bought T-80 Main Battle Tanks from Russia by posing as a trading company that was supposed to deliver them to Morocco.
todayilearned,,"TIL that if you feed a chicken a diet of spicy red peppers, its egg yolk will turn red. This is harmless for the chicken as all birds are immune to capsaicin (the substance that makes food taste spicy)."
todayilearned,,"TIL: The Roman Emporer Elagabalus may have been transgender as he regularly applied cosmetics, liked being called ""mistress, the wife, the queen of Hierocles"" and asked physicians to contrive a woman's vagina in his body."
todayilearned,,"TIL that of the 47 dogs rescued from ex-NFL QB Michael Vick's illegal dog-fighting ring in 2007, 37 were adopted and 10 remained with the rescue group that took them in. 11 of those 47 dogs are still alive today."
todayilearned,,TIL that Gold nanoparticles can be used as a treatment option for prostate and other cancers.
todayilearned,,TIL that Justin Trudeau has worn blackface multiple times in his life
todayilearned,,"TIL that of the 47 dogs rescued from ex-NFL QB Michael Vick's illegal dog-fighting ring in 2007, 37 were adopted and 10 remained with the rescue group that took them in. 11 of those 47 dogs are still alive today."
todayilearned,,Which law schools/states have the highest/lowest percentage of minority students? [MAP]
todayilearned,,"TIL after Israeli Prime Minister Ariel Sharon began demolishing Jewish settlements in Gaza, a group of rabbis placed an ancient curse on Sharon known as the Pulsa diNura, calling on the Angel of Death to intervene and kill him. 6 months later, Sharon entered a coma from which he would never awaken."
todayilearned,,"TIL All In The Family had five spin-offs - the most in TV history: Maude, The Jeffersons, Archie Bunker’s Place, Gloria, and 704 Hauser. Good Times was a spin-off of Maude and Checking In a spin-off of The Jeffersons. All In The Family was based on the British show Till Death Do Us Part."
todayilearned,,TIL You are supposed to crush OXO cubes inside the foil BEFORE opening the wrapper. Mind truly and utterly blown.
todayilearned,,"TIL that the Forgotten of St. Paul are a group of 7 people who in 1930 were abandoned by their employer on the French desert island of St. Paul in the Indian Ocean, they had to watch supplies for 2 months but where forgotten buy the company, 4 of them died and they were rescued 10 months later."
todayilearned,,"TIL in 2017 the heirs of Abbott &amp; Costello attempted to bring a dispute to the US Supreme Court over the fair use of the ""Who's On First"" sketch. The routine is currently over 75 years old and the last member of the duo passed in 1974."
todayilearned,,TIL about 'acquired savant syndrome' where someone becomes a genius after experiencing brain trauma from getting beat up
todayilearned,,TIL 30 Republicans sided with Halliburton over a female employee that was gang raped and brutalized while working in Iraq. They all voted against anti-rape legislation.
todayilearned,,"TIL in 2006, a Canadian blogger made a series of 14 trades. He started with a red paper clip and traded his way up to a house. The items in the trades included a fish pen, snow mobile, KISS snow globe and a paid role in a movie."
todayilearned,,TIL that asparagus leaves a distinctly unpleasant and sulfuric odor in your urine. Researchers claim that about 40% of people can distinguish the smell to varying degrees.
todayilearned,,TIL that a single sperm carries around 760 MB of DNA info.
todayilearned,,TIL about Heinz Heydrich. He was the brother of Nazi top honcho Reinhard Heydrich and helped many Jews escape by forging identity documents and printing them on Die Panzerfaust presses. This was in sharp contrast to his brother who played a central role in committing the Holocaust.
todayilearned,,"TIL a Japanese bomber pilot dropped four bombs on a small Oregon coastal town. The damp atmosphere meant the thermite bombs failed to explode. Years later the citizens of that town invited the pilot to their town. He accepted, and gave them a samurai sword as apology. It's still on display."
todayilearned,,"TIL a Native American asked two Apollo astronauts to relay a message to the spirits on the Moon. They memorized the message in the native language without knowing its meaning. After the moonshot, they learned it meant ""Don't believe a single word these people say. They have come to steal your land."""
todayilearned,,"TIL Snake Oil Salesman has its origin at the Chicago World's fair. Clark Stanley took inspiration from Hopi Medicine Men and Chinese immigrants when devising his product and boiled ""rattlesnakes"" and sold the fat as Stanley's Snake Oil. It was later discovered he was actually selling beef fat."
todayilearned,,"TIL that the United States has officially been in a state of emergency ever since September 14, 2001"
todayilearned,,Personal MBA (How to find Idea for Starting a Business)
todayilearned,,"TIL : According to FIFA the ancient competitive game cuju, is the earliest form of football. Cuju players could use any part of their body's minus their hands to kick a ball though an opening in a net."
todayilearned,,"TIL Buckingham Palace has 775 rooms. These include 19 State rooms, 52 Royal and guest bedrooms, 188 staff bedrooms, 92 offices and 78 bathrooms. Buckingham Palace is 108 metres long across the front, 120 metres deep (including the quadrangle) and 24 metres high."
todayilearned,,TIL: There are 5 separate expressions of love that people subconsciously prefer and do
todayilearned,,SEO - Search Engine Optimization | On Page &amp; Off Page SEO Activities
todayilearned,,A NAVAL Service vessel is being sent to New York one week from now as a major aspect of Ireland's offered to win a seat on the United Nations Security Council
todayilearned,,TIL Wikipedia search for moscow mitch redirects correctly
todayilearned,,"TIL: Rabbit jumping started in Sweden early in the 1970s, when the first rabbit club started to arrange rabbit jumping competitions."
todayilearned,,33% of understudies depend on guardians to pay school charges and have under €100 to sprinkle a month
todayilearned,,"TIL: 1982's ""The Thing"" was Keith David's first-ever film"
todayilearned,,"TIL of Candace Newnaker, who was killed during attachment therapy in 2000, in which she was mocked as she suffocated to death"
todayilearned,,TIL: The High Accuracy Radial Velocity Planet Searcher uses the Doppler shift to measure a star's velocity towards or away from Earth. The precision of these measurements is just under one meter per second
todayilearned,,TIL I learned of the different expressions of love
todayilearned,,"TIL of Candace Newnaker, who was killed during conversion therapy in 2000, in which she was mocked as she suffocated to death"
todayilearned,,"TIL Ima Hogg known as ""The First Lady of Texas"", was an American society leader, philanthropist, patron and collector of the arts, and one of the most respected women in Texas during the 20th century."
todayilearned,,TIL of a brave man named Witold Pilecki who intentionally got himself caught in a roundup and deported to Auschwitz so that he could set up a resistance network there
todayilearned,,TIL that carrots can explode and catch on fire in the microwave due to metals in the soil they were grown in
todayilearned,,"TIL ‘Old-Person Smell’ was confirmed by scientists as real, along with distinct young- and middle-aged-person smells."
todayilearned,,"TIL of the “Big-Five” mass extinction events, all occurring between 65-439 million years ago, with anywhere from 75-96% of species lost/killed off. Most of the Big-Five can be associated with falling sea-levels and other extreme and sudden climate changes."
todayilearned,,"TIL 99% of all asphalt is recycled and used to fix and build roads over and over again. A variety of recycled materials are in that pavement - recycled roof shingles, ground rubber from tires, glass, foundry sand, slag and even pig manure."
todayilearned,,"TIL Contrary to what the name suggests, the world famous german festival 'Oktoberfest' doesn't start in October, but in September."
todayilearned,,"TIL of the Cobra Effect. The term originated when the British government in India put a bounty for every dead cobra to reduce their population and people started to breed cobras to earn more. The scheme ended when Brits became aware of this and the snakes were set free, increasing their population."
todayilearned,,TIL we are not yet sure what thunders are caused by
todayilearned,,"TIL of Eliahu Itzkovitz. A Romanian jew who after witnessing the murder of his family at the hands of a guard in a concentration camp joined the IDF, murdered the guards son and ultimately tracked and killed the guard himself."
todayilearned,,"TIL of Salted Bomb, a nuclear weapon producing enhanced quantities of fallout, rendering a large area uninhabitable - named for salting the earth."
todayilearned,,"TIL The history of Monopoly can be traced back to 1903,when American anti-monopolist Lizzie Magie created a game which she hoped would explain the single tax theory of Henry George. It was intended as an educational tool to illustrate the negative aspects of concentrating land in private monopolies."
todayilearned,,"TIL of Eliahu Itzkovitz. A Romanian jew who witnessed the murder of his family at the hands of a Romanian guard in a concentration camp. After the war, he joined the IDF, murdered the guards son then hunted down and killed the guard himself."
todayilearned,,"TIL That the welsh language doesn’t have K, Q, V, X, and Z, and that silent letters don’t exist either."
todayilearned,,"TIL not all countries have four seasons. Those closest to the equator only have two, wet and dry."
todayilearned,,"TIL that the fear that a power in place could be overtaken by a rising power often leads to war. This phenomenon is called the Thucydide trap. For example, Sparta was completely destroyed because it was afraid of the growing influence of Athens and declared war onto it."
todayilearned,,"TIL that acclaimed actor Michael Caine fought in the Korean war, and was nearly killed when his 3 man patrol found themselves surrounded by Chinese troops"
todayilearned,,"TIL that in 1944, Exercise Tiger, was a rehearsals for the D-Day invasion of Normandy. Coordination and communication problems resulted in friendly fire deaths during the exercise, and an Allied convoy positioning itself for the landing was attacked by E-boats. Causing 746 dead and 200 wounded."
todayilearned,,"TIL of Jeffrey Manchester, an escaped inmate who found a hiding room inside a Toys R Us and secretly lived there for 7-months!"
todayilearned,,TIL liberals and conservatives’ brains are different. Liberals generally have a larger anterior cingulate cortex whereas conservatives have a larger right amygdala. The cortex is theorized to help deal with uncertainty while individuals with a large amygdala are more sensitive to fear.
todayilearned,,TIL there are now more guns per capita in Australia than there were before their gun buy back and rifle ban in 1996
todayilearned,,"TIL of Noor Inayat Khan, Britain's first Muslim war heroine who was posthumously awarded the George Cross for her service in the SOE, the highest civilian decoration in the UK"
todayilearned,,"TIL: In baseball, both runners have to reach base safely to get credit for a steal. If one is caught, the other gets a “fielder’s choice”"
todayilearned,,"TIL Jell-O Shots were invented, by a mathematician that worked for the NSA, as a means of circumventing the base's ban on alcoholic beverages."
todayilearned,,"TIL the google person on google maps changes from just the person to the person inside a UFO. Just go to Amargos Valley, Nevada and drag the person to the map."
todayilearned,,"TIL about Simple English Wikipedia, which uses simple words and grammar so that children and adults (and college students) can easily understand the articles. And unlike the normal Wikipedia site, diving into random articles is much easier with entry level intelligence."
todayilearned,,"TIL Among other quirks and jokes, Elon Musk spent the past 10 years assigning a character to each car to make the model “S3XY”"
todayilearned,,Today I learned Harvard University tracked the physical and emotional well-being of 724 people from 1939 -2014. The study found 3 important factors to success and happiness.
todayilearned,,TIL Silbo Gomero is a whistled language used in the Canary Islands to communicate across deep ravines
todayilearned,,TIL about pandiculation
todayilearned,,"TIL in Sesame Street, cookie monster ate painted rice cakes and not cookies because the oil from the cookie would damage the puppets."
todayilearned,,TIL the letter C in latin is always pronounced as a K. Famous names like Caesar was actually pronounced Kaesar and worlds like Circus is pronounced Kirkos.
todayilearned,,A picture of a world without Christ
todayilearned,,TIL that Terry Fox started a marathon across Canada to raise money for cancer research. Today the Terry Fox Foundation has raised over $750 million in his name
todayilearned,,"TIL about The Filthy Fifteen, a list of music curated by Al Gore's wife Tipper who believed they had the most explicit lyrics, and created Parental Advisory labels."
todayilearned,,"TIL that the flag of River Gee County, Liberia, features two floating trees, a sun with triangles sticking out of it, and a drawing of a river springing out from under a third tree"
todayilearned,,TIL about Larry's Flynt's courtroom diaper incident
todayilearned,,TIL that these flags (which look like they were made in MS Paint) are the actual county flags of Liberia
todayilearned,,"TIL that in 1996, Georgia State Representative Doug Teper unsuccessfully sponsored a bill to replace the state's electric chair with the guillotine."
todayilearned,,TIL a Japan's legendary slugger Sadaharu Oh practiced his batting using a samurai sword
todayilearned,,"TIL it's not ""Rule Britannia, Britannia all the way"", it's ""Rule Britannia, Britannia rules the waves"""
todayilearned,,"TIL in 2015, Nick Cannon (Rapper &amp; Actor) was named Chief Creative Officer of RadioShack."
todayilearned,,"TIL that the 747's iconic hump resulted from Boeing thinking it would be a terrible passenger jet, and the hump made it easy to eventually convert them to cargo jets. It has since become the most iconic jet of all time, having carried more passengers than any other widebody aircraft"
todayilearned,,TIL a successful Roman invasion of Persia was suddenly aborted when the Emperor was struck and killed by a bolt of lightning
todayilearned,,TIL a chess grandmaster can burn 500 calories over a 2 hour game. That’s roughly the same as running 5 miles. Over a 10 day tournament players can lose 10-12 pounds.
todayilearned,,TIL in the USA the phrase 'go back to where you came from' is more racist than doing black/brown face multiple times in your life.
todayilearned,,TIL the addition of the at the time very graphic 'fatalities' in the Mortal Kombat arcade game greatly added to its popularity since kids were bragging to eachother about the finishing moves they saw.
todayilearned,,Forest Whitaker has a twin who is also an actor
todayilearned,,"TIL the Urumi Sword of India is considered the most dangerous sword to wield in history. Instead of a rigid blade, it is made of long, flexible, whip like blades that can be fitted to have more than one blade/whip per handle."
todayilearned,,"TIL the Urumi sword of India is considered the most dangerous sword to wield in history. Instead of a rigid blade, it is made of long, flexible, whip like blades and can be fitted to have more than one blade/whip per handle."
todayilearned,,TIL: You can be injured like a basketball player while gaming...
todayilearned,,"TIL in 1974, Portuguese rebels used Portugal’s entry in the Eurovision song contest as one of two secret signals to start the Carnation Revolution; a peaceful rebellion that overthrew the authoritarian regime that had run the country for over 40 years."
todayilearned,[deleted],~~test~~
todayilearned,,TIL McDonald's and Disney have a connection dating back to WWI before either corporation were formed.
todayilearned,,"TIL in 1974, Portuguese rebels used Portugal’s entry in the Eurovision song contest as one of two secret signals to start the Carnation Revolution; a peaceful rebellion that overthrew the authoritarian regime that had run the country for over 40 years."
todayilearned,,"TIL Sony's name comes not only from Latin ""sonos"" (sound), but also from ""sonny boy"", a slang term for smart and presentable young men - the sort of people Sony founders saw themselves as."
todayilearned,,TIL APPLE'S new iOS 13 update for your iPhone launches today – and it's loaded with new features.
todayilearned,,TIL that you can send websites from PC to your Android phone and vice versa without any third party apps
todayilearned,,"TIL some traders in prehistoric Europe made fake amber beads to cheat rich people. The beads were so accurate, they even fooled a team of trained archaeologists at first."
todayilearned,,TIL that Switzerland is actually a third world country
todayilearned,,"Today I learned about the Cascadia Subduction Zone, which will eventually rupture and cause the worst natural disaster in the recorded history of North America."
todayilearned,,"TIL the 70s pink cartoon character Barbapapa was inspired by cotton candy, which is 'Barbe à papa' in French"
todayilearned,,TIL that a company can sue you for spoiling their book.
todayilearned,,"TIL about the failed “Soul City”, a planned, Republican-funded, all-POC community in rural NC that intended to create jobs and move POC out of inner-city poverty."
todayilearned,,iOS 13 release date
todayilearned,,TIL that West Side Story was originally titled East Side Story and was going to be about Anti-Semitic Irish and Jews as the warring gangs.
todayilearned,,TIL that multiple scientific studies have concluded that having a dog really does make you more attractive to others. Cats not so much.
todayilearned,,TIL how we lose weight from a scientific standpoint. This is a Ted Talk by Ruben Meerman who explains how he lost weight. He is a physicist and delves into the mathematics and sciences that he utilized to visually display experiments on stage and better educate how humans lose weight.
todayilearned,,TIL we are not still sure how thunders work
todayilearned,,TIL The longest match in the history of cricket took place in 1939. England and South Africa took part in a single match that lasted 14 days.
