subreddit,selftext,title
todayilearned,,"TIL Anthony Michael Hall is the youngest Saturday Night Live cast-member at 17 years old - joining the cast of Season 11 in 1985 with Robert Downey Jr., who was only 20 years old at the time."
todayilearned,,"TIL BURT Reynolds was considered for the role of Michael Corleone in The Godfather however Marlon Brando said he would walk if he was cast later saying,"
todayilearned,,"TIL that in 2012 the owner of the website Xvideos.com turned down a reported offer of more than $120 million for the website by saying, ""Sorry, I have to go and play Diablo II."""
todayilearned,,"TIL that the ‘Three Little Pigs’ in the Green Jellÿ 1993 hit song were voiced by musicians Les Claypool of Primus, Maynard James Keenan of Tool, and actor/comedian Pauly Shore"
todayilearned,,TIL RAF squadron 133 was reformed August 1941 and was one of three eagle squadrons that was crewed by American volunteers.
todayilearned,,A 73 year old man with Alien Hand Syndrome could not control his left hand from masturbating himself.
todayilearned,,"TIL: scallops have eyes. And they have a lot of them, up to 200."
todayilearned,,TIL: Reddit was insanely Racist in 2008.
todayilearned,,TIL Lollard was a (very) old word for Noob and even became a religious movement culminating in The Twelve Conclusions of the Lollards
todayilearned,,TIL Biff from back to the future (Tom Wilson) is an successful artist with a focus on pop art.
todayilearned,,TIL in 2010 the Air Force used 1700 PS3s to craft the worlds 33rd largest supercomputer
todayilearned,,IELTS Speaking Evaluation of PM Modi | Will Modi get 6+ Band?
todayilearned,,"TIL that HBO's Chernobyl mini-series was filmed at the Ignalina Nuclear Power Plant in Lithuania due to architectural similarities. Ironically, in 1983 Ignalina first reported the same reactor flaw that led to the Chernobyl disaster 3 years later."
todayilearned,,"TIL that phones and other devices with adjustable brightness often use pulse-width modulation. Basically, a screen at 50% brightness flickers off 50% of the time, but it happens so fast our eyes perceive it as on all the time, just dimmer."
todayilearned,,"TIL walking through a doorway signals your brain to think a task is complete, which leads to the ""why did I walk in here again?"" sensation"
todayilearned,,"TIL that Sting's real name is Gordon Matthew Thomas Sumner, 80s stars then and now"
todayilearned,,"TIL on 1964, 9-year-old Edgar and 8-year-old Randy Williamson, great-great grandchildren of Newt Knight and Rachel, never went to school because the local authorities thought they were Blacks and, due to Mississippi considering them as White (they were 1/32 Black), they couldn't go to a Black one"
todayilearned,,TIL that the NWA is a pro wrestling organization not a rap group and they do have a sub on reddit
todayilearned,,TIL that a speaker “implies” while a listener “infers”.
todayilearned,,TIL the Elvira video game was Computer Gaming World's RPG of the Year in 1991
todayilearned,,"TIL When Explosions in the Sky was signed by Temporary Residence Limited. They signed the band on the strength of their demo (How Strange, Innocence) after only half a listen; the demo was submitted by fellow Austin band with a brief note saying, ""This totally fucking destroys."""
todayilearned,,"TIL the asteroid impact that created Meteor Crater in Arizona hit with up to 20 megatons of energy (Hiroshima was 15 kilotons), which sent out catastrophic winds at roughly 900 mph (1,500 km/h). This debris-hurling shock wave would have killed any human-sized animals within about 4 miles (6 km)."
todayilearned,,"TIL that the Earth is traveling at 67,000 mph, and spins at over 1,000 mph."
todayilearned,,TIL that Greg Lake wrote EL&amp;P's most well known song Lucky Man when he was 12 years old. Lake claims that it was the first song he ever wrote after receiving an acoustic guitar from his mother.
todayilearned,,Quinn official continued extraordinary wounds after snatching and most extreme and savage assault by four conceal men PSNI
todayilearned,,TIL that the phenomenon of making a bot watch 1000 hours of something and making it write a script of its own is completely fake - all the scripts are handwritten by comedian Keaton Patti.
todayilearned,,TIL Walter Morrison (frisbee inventor) got his ashes turned into a frisbee
todayilearned,,"TIL that the weird sound at the beginning of the Beastie Boys tune 'Sure Shot"" is from a Little Caesar's commercial"
todayilearned,,"TIL Researchers found no evidence for a limit to human longevity, and if such a maximum exists, it has yet to be reached or identified. Earlier scientists claimed the data points towards a limit of about 115 years for the human lifespan"
todayilearned,[deleted],"TIL Researchers found no evidence for a limit to human longevity, and if such a maximum exists, it has yet to be reached or identified. Earlier scientists claimed the data points towards a limit to the human lifespan of about 115 years"
todayilearned,,There is a city in France called Nice
todayilearned,,TIL the largest known star is three billion times bigger than our sun
todayilearned,,6 Things I Learned After Publishing My 1st YouTube Video! Let me know if you learned anything and what other things I might've forgot :)
todayilearned,,TIL Shaq is a owner of several Papa Johns as well as a board member. What hasn’t he done?
todayilearned,,"TIL, the reason why ""weed from a can"" is a Brazilian slang meaning good weed is because in 1987 thousands of cans full of weed were found in the beaches of Rio. A lot of locals got some for themselves and for selling and apparently it was of great quality."
todayilearned,,"In 1999, Tony Hawk set a skateboarding world record for most rotations in mid-air by spinning 900 degrees. In 2012, the record was beaten by Tom Schaar, a 12-year-old who managed 1080 degrees."
todayilearned,,"TIL in 2016 two alligators were found guarding €500,000 worth of crystal meth, €300,000 in cash, and several firearms in Amsterdam. The owner of the crocodiles was following the law and had the appropriate permits for the animals."
todayilearned,,Daily Current Affairs 18 September 2019
todayilearned,,"TIL Until 2018, President James A. Garfield was the only one of the four assassinated U.S. presidents without a marker at the site he was shot. The changes to the urban landscape complicated the process of building a proper memorial"
todayilearned,,"TIL Don Cheadle's ancestors, and many other African American slaves, were not freed when slavery ended in the US because they were owned by Native Americans"
todayilearned,,TIL that sweet potato DNA indicates that Polynesia had contact with South America long before the Europeans.
todayilearned,,"TIL of James Matlock, a 17th century Puritan who was thrown out of the church for not having had sex with his wife for two years. “He denyed Coniugall fellowship vnto his wife for the space of 2 years”."
todayilearned,,"TIL the site of Jesus’ Crucifixion was on a skull-shaped hill in Jerusalem. Its exact location is uncertain, but most scholars prefer either the spot now covered by the Church of the Holy Sepulchre or a hillock called Gordon’s Calvary just north of the Damascus Gate"
todayilearned,,"In the 1800s, a doctor (Semmelweis) introduced a radical idea which today is habitual, and mostly common sense. It was hand-washing to prevent illness. Many people didn't believe him, and he lost his job."
todayilearned,,TIL the most damaging attack on Japan during WWII was actually done with firebombs on Tokyo. It is considered the most deadly bombing in history and the US Air Force general who ordered the bombings believed he would have been charged with war crimes if the US lost the war.
todayilearned,[deleted],"TIL of James Matlock, a 17th century Puritan who was thrown out of the church for not having had sex with his wife for two years. Puritans viewed sex in marriage not as an obligation for procreation, but as a fundamental right."
todayilearned,[deleted],"TIL of James Matlock, a 17th century Puritan who was excommunicated from the church for having denied his wife sex for two years. Puritans viewed sex in marriage not as an obligation for procreation, but as a fundamental right."
todayilearned,,These watches called zalsach were initially designed for blind people. You can tell the time by touching the two magnets
todayilearned,,"TIL of James Matlock, a 17th century Puritan who was thrown out of the church for having denied his wife sex for two years. He was seen as having denied her “conjugal fellowship""- he had not adequately performed his husbandly duties."
todayilearned,,TIL Trump’s ‘covfefe’ was a typo for ‘coverage’
todayilearned,,"TIL of Sonny Graham, recipient of a donor heart from a suicide victim who went on to marry the suicide victims wife. After 12 years of marriage, Graham also ended his own life."
todayilearned,[deleted],"TIL Boeing says China will need more than 8,000 airplanes in next 20 years. Boeing forecast that Chinese carriers will need 8,090 new airplanes in the next 20 years, worth nearly $1.3 trillion."
todayilearned,[deleted],"TIL of James Matlock, a 17th century Puritan who was thrown out of the church for not having had sex with his wife for two years. He was judged as having denied her “conjugal fellowship”."
todayilearned,,"TIL Searching for one's own name, or pseudonym on a popular search engine in order to review the results is called ""Egosurfing""."
todayilearned,,"TIL Since 2004, the Cassini spacecraft has been orbiting Saturn, studying the gas giant, its rings and its moon. Before it becomes uncontrollable, on 15 September it will dive into the planet’s atmosphere and burn up."
todayilearned,,"TIL that the element of the Aquarius astrological sign is Air, NOT water!"
todayilearned,,"Since 2004, the Cassini spacecraft has been orbiting Saturn, studying the gas giant, its rings and its moon. Before it becomes uncontrollable, on 15 September it will dive into the planet’s atmosphere and burn up."
todayilearned,,TIL: The presence of hyoid fractures was found to be very rare in cases where cause of death was attributed to hanging.
todayilearned,,"TIL - New calculations suggest the universe could be a couple billion years younger than scientists now estimate, and even younger than suggested by two other calculations published this year that trimmed hundreds of millions of years from the age of the cosmos."
todayilearned,,"TIL Human echolocation is the ability to detect objects by sensing their echoes, by actively creating sounds. People trained to orient by echolocation can interpret the sound waves reflected by nearby objects, accurately identifying their location and size."
todayilearned,,"TIL Oliver Heaviside was an eccentric scientist who, among other things, replaced his furniture with blocks of granite, signed his letters W.O.R.M. for no particular reason and painted his fingernails pink."
todayilearned,,TIL Disney had plans to make a Discworld cartoon on the book Mort
todayilearned,,"TIL Nigerian author Nnedi Okorafor wrote a science fiction novel about the first member of the Himba ethnic group on Earth, closely modelled on the Himba people of Namibia, to be accepted into a prestigious intergalactic university"
todayilearned,,"TIL a ten-year-old girl won the title of world champion ""worm charmer"" by raising 567 worms."
todayilearned,,TIL after the Twin Towers collapsed on 9/11 Donald Trump called a TV station to brag that his building was now the tallest in New York
todayilearned,,TIL that 9/11 WTC Tower Had Power Turned Off For 36 Hours Weekend Before Attack and mysterious ‘engineers’ doing work in the building using spools of wire.
todayilearned,,You can watch Star Wars made Entirely of ASCII via Telnet
todayilearned,,"TIL Taiwanese singer Teresa Teng was mentioned for the first time on China Central Television when she died unexpectedly in 1995, although many of her songs circulated in China. Her dream was to sing on the Chinese mainland but it was never realized because she was suspected of being a spy"
todayilearned,,"TIL: The taxpayers paid for the development of a $6 virtual vaccine for AIDS, but Big Pharma has made it unaffordable while refusing to pay royalties on the patents held by We the People."
todayilearned,,TIL where the names of the continents come from
todayilearned,,TIL that 9/11 plotter Khalid Sheikh Mohammed was known as KFC among Al Qaeda members because he gained so much weight from eating fried chicken
todayilearned,,TIL you can read 9 sets of Terms and conditions before using an iPhone 11.
todayilearned,,"TIL Eugene, Oregon has the highest pollen count in the US. When the Olympic Trials were held there in 1972 a contestant in the 1,500 meter race was flown in by helicopter due to allergies and won."
todayilearned,,TIL that a cat was in a position of a mayor (at least i want to belive it)
todayilearned,,"TIL ""Peachpuff"" is a CSS-recognized color name"
todayilearned,,TIL how fast Beethoven Moonlight Sonata is
todayilearned,,"TIL rather than have clients think they may have bought damaged goods, a car dealer dumped 22 brand new Austin A-40s into Vancouver, BC's English Bay"
todayilearned,,"TIL that, in 1922, Governor of Indiana Warren McCray was offered $10,000 to allow the Ku Klux Klan to become chartered, but refused, the Klan later claimed he was involved in mail fraud, causing McCray to be found guilty and serve three years in prison, when he was paroled and later given a pardon"
todayilearned,,"TIL rather than have clients think they may have bought damaged goods, a car dealer dumped 22 brand new Austin A-40s into Vancouver, BC's England Bay"
todayilearned,,"that ‘Hickory, dickory, dock’ came from the celtic counting words hovera, dovera, dick used to count animals"
todayilearned,,"TIL About Brian Zembic who in 1996 got breast implants after a friend bet him $100,000 if he kept them in for a year, and $10,000 a year afterwards that he did not remove them. He still has the implants to this day."
todayilearned,,"TIL as much as I want it to be (Iron Maiden fan here), the number of the beast is likely 616."
todayilearned,,“About 70 million people move into cities every year - that’s the equivalent of adding 8 New York Cities to the planet every single year.” - Vince Beiser
todayilearned,,"TIL Claude Akins played a Reverend in ""Inherit the wind"" who fights against people being labelled as monkeys, then 13 years later goes on to play the most bad ass gorilla ever in ""Battle for the Planet of the Apes."""
todayilearned,,TIL of the Son of Sam killer who used a serial killer version of 'dog ate my homework' excuse when caught.
todayilearned,,TIL that sea urchins have self-sharpening teeth
todayilearned,,TIL Germany REALLY loves privacy by having almost almost nothing to see on street view
todayilearned,,"TIL that the catalog of publications of the International Telecommunications Union, mean the book with just a list of all the other books published by this organization, is 130 pages long. The amount of law and science involved in this organization is DENSE"
todayilearned,,TIL 'South Park' was rejected by Fox because of Mr. Hankey!
todayilearned,,"Server name: [KR] Happy x3 [해피]서버 3배율 PVP+PVE Server description. 안녕하세요. 해피서버입니다. 점프맵과 보스맵이있는 pvp 서버가있다? 통수와 패드립빼곤 아무것도 제제하지 않는 어드민이 있다? 네 그게 바로 이 서버입니다. 어떤 비리도 허용하지 않으며, 필수 플러그인 탑재 완료! 자원채취레벨, 자동 분배, 나무에서 랜덤하게 떨어지는 사과까지! 모두 준비되어있습니다. 지금 당장, 들어와 즐기세요! 해피서버!"
todayilearned,,TIL Thomas Middleditch is a swinger who has group sex with his wife and fans.
todayilearned,,"TIL that the oldest known gravestone in the United States is for Grace Berry, who died in 1625."
todayilearned,,TIL the Statue of Liberty was modelled on a Muslim woman dressed in traditional Arab garb and was originally called “Egypt Carrying Light to Asia” in a bid to be the lighthouse erected to commemorate the opening of the Suez Canal
todayilearned,,"TIL that artist Blanco Brown famous for ""The Git Down"" dance, heard that student Harvey Bass was suspended from school for recording himself doing the dance. Brown decided to fly him out and have him star in his official music video."
todayilearned,,"TIL that during Richard J. Daley's 21 years of office between the years 1955 &amp; 1976 there were 10,910 homocides in Chicago."
todayilearned,,TIL there are actually people who are allergic to the water molecule and not to trace chemicals in the water
todayilearned,,"TIL of Bayard Rustin, the gay civil rights leader and advisor to MLK who singlehandedly shaped his non-violent protest methods. He was forced to resign to protect the movement when a congressman threatened to fabricate a story of an affair between him and King to dissuade protests in his district."
todayilearned,,"TIL that the oldest known maintained grave in the United States is Mayfair passenger Captain Jonathan Alden, who died in 1697."
todayilearned,,"Mansa Musa, the richest man in history, travelled with 12,000 slaved dressed than most royalty at the time. He gifted Cairo, Medina and Mecca with so much gold that their economies crashed."
todayilearned,,TIL Wild horses are removed from land used for beef by chasing them with helicopters. 🐎🐎🚁
todayilearned,,TIL in 2013 a man caught a 200 year old fish
todayilearned,,"TIL Faux meats are a more sustainable than meat, with both lower carbon footprint and lower land use. Many qualify as complete proteins and also contain substantial levels of dietary fiber and antioxidants, with no cholesterol and lower saturated fat content than meat."
todayilearned,,"Lillehammer, Norway, the town that hosted the 1994 Winter Olympics, shares it's basic namesake with Little Rock, AR."
todayilearned,,TIL: A rhino poacher was killed by an elephant and then devoured by lions in South Africa this year. Fun fact: he won a Darwin Award
todayilearned,,"TIL that Barbra Streisand had two of her dogs, Miss Violet and Miss Scarlett, cloned from her 14-year-old Coton du Tulear Samantha, who died in 2017."
todayilearned,,8 Dogs with the strongest bite in the world
todayilearned,,"TIL: On January 4, 2010, HIV/AIDS Infection Disqualification Rules were removed From U.S. Immigration Screening."
todayilearned,,"TIL of the 'Default-mode network' of the Brain, a collection of brain regions that work together to control and repress consciousness. LSD has been shown to breakdown these connections, which could play an important part in the treatment of Depression."
todayilearned,,"Lillehammer, Norway, the town that hosted the 1994 Olympic Games shares it's namesake with Little Rock, AR."
todayilearned,,"TIL thatvin other countries, the term check, as in paycheck, is spelled ""cheque""."
todayilearned,,"TIL of the ""banquet of chestnuts"", an orgy allegedly hosted by pope Alexander VI and his son in the vatican for the cardinals. It involved fifty hookers who were to chase chestnuts scatered in a dimly lit room. The most virile of the attendants were awarded by the pope with gifts"
todayilearned,,TIL PETA was caught illegally dumping the bodies of dozens of euthanized cats and dogs NSFW
todayilearned,,"TIL Bank of America was founded in in San Francisco, California in 1904 by Amadeo Giannini &amp; was named Bank of Italy back then"
todayilearned,,TIL of Alpha-gal allergy. Certain ticks can transfer Alpha-gal from other animals to a human and the body's immune response renders the person allergic to almost all meats except fish and poultry. The allergy is usually permanent.
todayilearned,,"TIL that Georgia has its own version of Mount Rushmore. In Stone Mountain Park there is a mountain carving of three Confederate figures: Robert E. Lee, Jefferson Davis, and Stonewall Jackson. It was completed in 1972 and is considered the largest relief sculpture in the world."
todayilearned,,TIL Canadian Prime Ministerial candidate Jagmeet Singh is banned from entering India for ties to a Sikh extremist
todayilearned,,"TIL If a baby is born vaginally they share similar gut microflora to the mother's vagina, however babies born via Ceasarian share similar gut microflora to their mother's skin."
todayilearned,,TIL Data from the Australian flu season is used for formulating the flu vaccine for the American flu season
todayilearned,,TIL US Flu Vaccines Utilized Data From the Australian Flu Season to formulate the Flu Vaccine in the US.
todayilearned,,"TIL The model for The Cars album Candy-O was also named Candy, and had once played Lucille Ball's onscreen daughter on The Lucy Show"
todayilearned,,"TIL in 2001 the chemical DuPont used to make Teflon, C-8, contaminated water supplies in Parkersburg, WV and made over 3500 residents sick. Side effects of exposure included kidney cancer, thyroid disease and more. DuPont denies any wrongdoing. They settled a class action lawsuit in 2017."
todayilearned,,"TIL After Steve Irwin died, dead Stingrays began appearing without tails. It is speculated that fans may have been getting revenge by cutting their tails off."
todayilearned,,"TIL I have/had Oral Allergy Syndrome, which wasn’t a “thing” when I had my symptoms as a kid 20+ years ago."
todayilearned,,"TIL the oldest extant sovereign state in the world is San Marino. Founded as a republic in 301, it still remains as such. The state's constitution is in use since the 16th century(the oldest in the world) and they avoided annexation from Napoleon and later the Italy and remained neutral in WW1 and 2"
todayilearned,,"Today I learned of titivillus, the demon responsible for typographical errors."
todayilearned,,"TIL The film ""Borat"" caused a tv producer to lose her job."
todayilearned,,TIL there is a 10 ft bronze statue of Robocop in Michigan.
todayilearned,,"TIL Ronald Reagan's pet name for his wife Nancy was ""Mommie Poo Pants"""
todayilearned,,How to use MATE system Monitor
todayilearned,,TIL Canada is only ~4% larger than the United States.
todayilearned,,"TIL if you enter the word ""askew"" into a Google search, your screen will tilt with the response"
todayilearned,,"TIL, With 25 thousand miles of shoreline, Lake of the Woods, has more shoreline than any other fresh water lake in the world."
todayilearned,,TIL that George Bush banned broccoli in the white house because he didn't like it
todayilearned,,"TIL The Paradise Papers, which came out after the Panama Papers, tied the Trump administration directly to Russian oligarchs and Putin proxies"
todayilearned,,TIL - Scientists Have Built Knives Out of Human Poop to Test Whether They Work
todayilearned,,"TIL russian soldier killed 1000 germans during world war 2 , which makes him most kill count by one man"
todayilearned,,TIL that Guyana derives all its tax revenue from a value-added tax.
todayilearned,,TIL Universal Studios was so horrified of Rob Zombie's House of 1000 Corpses (which they were set to distribute) that they shelved the film for several months. The film was eventually purchased by Zombie who made a deal with Lionsgate to release the movie that later received negative reviews.
todayilearned,,TIL Universal Studios was so horrified of Rob Zombie's House of 1000 Corpses (which they set to distribute) that they shelved the film for several months. The film was eventually purchased by Zombie who made a deal with Lionsgate to release the movie that later received negative views.
todayilearned,,"TIL October is warmer than June in Ponta Delgada in the Azores—and January has never seen a freeze, despite being the same latitude as Maryland. The highest temperature ever recorded there was 83.8 F (28.8 C)."
todayilearned,,Appointment of Aaron as a Prophet
todayilearned,,TIL Mama llama's hum to their babies and can spit from three different stomachs depending on how much they don't like you.
todayilearned,,"TIL that the Coca-Cola company chooses not to patent its secret formula, because then they would have to disclose it to the public."
todayilearned,,TIL: Mustard is a common food allergen -- in Canada?
todayilearned,,"TIL in 1974 Great Britain had a secret plan to cut all ties with Northern Ireland, drawn up by PM Harold Wilson. The plan was ""an attempt to end the Troubles by forcing unionists to share power with nationalists"". The Irish government argued it would cause a civil war."
todayilearned,,"TIL that saying bitch ass nigga together means ""there will be snow"" in Bosnian"
todayilearned,,"TIL that there is a SpongeBob Musical, and its on tour"
todayilearned,,TIL NFL Waterboys get paid up to 53k annually.
todayilearned,,TIL that cooking certain vegetables in the microwave can cause it to spark due to the iron content in the food.
todayilearned,,"Til that for the first time since lions were recognized as endangered, the government has allowed a Florida man to bring back the skin, skull, teeth and claws of a lion he hunted in Tanzania"
todayilearned,,"TIL the word “factoid” was invented by Norman Mailer in his 1973 biography of Marylin Monroe. He defined it as things which are not necessarily true, but are repeated so often people think they are."
todayilearned,,"TILSince the advent of the Internet of Things (IoT), a lot about the way we do things and interact with each other on a global scale has changed. IoT disruption in the healthcare sector #IoT #internet #technology #science #healthcare #mobitel #healthandtechnology #news #education #sciencenews #heal"
todayilearned,,TIL copperhead snakes smell like cucumbers
todayilearned,,TIL The flesh of the bitter tooth (Hydnellum scabrosum) fungus smells like watermelon when cut.
todayilearned,,"TIL Trump Refuses To Believe Warren’s NYC Rally Crowd Size Reached 20,000 People ..."
