subreddit,selftext,title
todayilearned,,"TIL that the same winning lottery jackpot numbers (4, 15, 23, 24, 35 and 42) were drawn in two consecutive draws in Bulgaria, leading to accusations of fixing, but it was deemed completely random"
todayilearned,,Effects of Social Media on Teen’s Self-Esteem and Dignity
todayilearned,,The Leading elder care in East Liverpool OH — Always Best Care combines national strength and standards with local accessibility and personal service. Contact us: (330) 385-5960 #eldercareinEastLiverpoolOH
todayilearned,,TIL That Baby Crocodiles Sound Like Laser Guns Straight Out Of Star Wars
todayilearned,,"TIL the first person to identify mastodon remains as being similar to an elephant’s was an African slave in North Carolia, who found a mastodon tooth and recognized it as an elephant molar."
todayilearned,,Are you fool enought to grow?
todayilearned,,"TIL Until the late 1970s, foreign music had not been allowed into mainland China. Teresa Teng's ""The Moon Represents My Heart"" became one of the first popular foreign songs in China under the new Open Door Policy. Before, such romantic songs were considered bourgeois and decadent in China"
todayilearned,,"TIL printers print an invisible secret code called Machine Identification Code on every single page you print for the lawmakers to track date, time and serial number of the printer that prints it."
todayilearned,,TIL Brad Pitt's first job was him dressing up in a chicken suit to work at and advertise the El Pollo Loco restaurant.
todayilearned,,TIL Beyoncé is the Greatest Singer of All Time
todayilearned,,TIL that Bender from *Futurama* and Marcus Fenix from *Gears of War* are voiced by the same guy: John DiMaggio.
todayilearned,,Khong vao duoc M88 - nhà cái số một thì phải xử lý sao?
todayilearned,,"TIL An American from New York wrote a language handbook to help both native English and French speakers understand and speak Québécois, the common tongue in Québec. He spent over a decade exploring the Québec language and culture, and included over three thousand words and expressions in his book"
todayilearned,,Today i learned that there is a Gnostic Gospel of Judas
todayilearned,,TIL that doctors have the highest suicide rate of all professions.
todayilearned,,TIL the Mediterranean Sea was formed by a colossal flood.
todayilearned,,TIL There has been several documented instances of pedophile US government contractors praying on children in invaded nations
todayilearned,,PLUMBING PROBLEM: Signs That It’s Time for You to Call a Plumber - There is a plumbing problem that you can do and plumbing works should be left to professionals. So know the signs when to call a plumber. Contact us at 07850 649836. #plumberbrixton
todayilearned,,"TIL Cool Mint Listerine PocketPaks, tissue-thin strips that melt in your mouth were invented in 2002. They were an instant hit, with more than 100 million sold"
todayilearned,,"TIL The Menen Hotel is the only hotel in the Republic of Nauru, built in 1969, though there is the OD-N-Aiwo youth hostel. Not many tourists come to the island, so the hotel has some setbacks. It has 119 rooms complete with coffee and tea making facilities in each room"
todayilearned,,TIL An Italian named Galileo Ferraris invented the AC motor before Nikola Tesla
todayilearned,,TIL twitter blocked Jamal Khashoggi per the request of the Saudi Government.
todayilearned,,"TIL there are two famous Jon Favreaus. One is a movie actor, director and writer. The other is a political commentator and former speech writer for Barack Obama."
todayilearned,,"TIL that in 2008, the official Reddit Twitter account said that ""Though blacks are only 24 percent of New York City’s population, they committed 68.5 percent of all murder."""
todayilearned,,TIL that apparently you can use your car’s sun visor sideways by unclipping one side and rotating it towards the driver’s window (1:04 in the video). I’ve owned the car for a few years now and never ever thought of this.
todayilearned,,TIL that feeling poor lowers a person's IQ test score as much as a night without sleep. But recent research shows that chronic financial stress doesn't just cause you to make a few bad decisions – it can actually lower your IQ by as much as 13 points.
todayilearned,,TIL: The gold in Earth’s core could cover the entire planet in a knee-high layer.
todayilearned,,"TIL a Navajo blanket was appraised on PBS’s “Antiques Roadshow” for $500,000. After seeing the broadcast, a disabled man realized he had a similar blanket which had been sitting in his closet for 7 years. He took it to an auctioneer and its final bid was $1.5 million."
todayilearned,,Today I learned you can plant trees passively by playing free educational games (new non-profit)
todayilearned,,A Hidden Life 2019 film
todayilearned,,TIL There was a Game Boy ripoff/copy called the Cougar Boy (also known as Mega Duck)!
todayilearned,,AC Repair: Signs That Your Air Conditioning System Needs a Repair - Know the signs that your air conditioning system needs a repair or maintenance help from a professional technician. Contact us: 305-554-0911 / 954-985-2999 #acrepair #acservice #acmaintenance
todayilearned,,TIL that according to Sumerian mythology the god Enki was believed to have created the Tigris and Euphrates rivers by masturbating and ejaculating into their empty riverbeds.
todayilearned,,Worried About Your Next Business Presentation? 15 Ways to Calm Your Nerves
todayilearned,,"TIL about Helen Duncan, a professional medium who in 1945 became the last person to ever be convicted of witchcraft in the UK, because the Witchcraft Act of 1735 was the only law on the books at the time that forbade fraudulently claiming to conjure spirits"
todayilearned,,"TIL that when a peacock shakes his tail, it produces a low pitched sound humans can't hear despite the noise being about as loud as a car going past a few metres away."
todayilearned,,TIL Shakespeare’s works have lost many of their rhymes and puns as a result of the evolution of the English language and it’s pronunciation
todayilearned,,TIL that according to Sumerian mythology the god Enki was believed to have created the Tigris and Euphrates rivers by masturbating and ejaculating into their empty riverbeds.
todayilearned,,"TIL Kim Jong-un is 35 years old, while Donald Trump is 73, making the President of the United states twice as old as the chairman of North Korea."
todayilearned,,TIL the dog actors that played Benji in both the 1974 film and the 2018 remake were mixed-breed rescue dogs
todayilearned,,Cách giảm mỡ toàn thân nhanh nhất của Nghệ sĩ Phương Dung chỉ sau 1 giấc NGỦ TRƯA
todayilearned,,"Dominican Food for Sweet-Toothed Traveler - Dominican food doesn't just offer brunch, dinner, or an appetizer. It also offers desserts that are made through a heartfelt process and traditional way. Contact us: (305) 322-9843 #BurgerMiami"
todayilearned,,Cần vay tiền trả góp ở đâu uy tín tốt nhất
todayilearned,,"TIL NASA’s Apollo bought almost all the output of IC chips in the early 60’s, driving reliability and capacity improvements. If one chip failed one test, 1000 chip lot was rejected. Moore wrote his Law during this program."
todayilearned,,"TIL Harvard University hired its first woman of color in 1995, 359 years after its founding in 1636."
todayilearned,,TIL Ugg boots were originally worn by surfers in Australia.
todayilearned,,"TIL India has an estimated 3,000 - 8,000 deaths from malnutrition-related causes each day, which equates to 1 - 3 million such deaths annually. This is roughly the same as the number of deaths from the infamous 1943 Bengal Famine."
todayilearned,,TIL teenage chechen soldier killed 1000 nazis with outdated weapons in world war 2
todayilearned,,TIL the morning after pill (Plan B) is only effective on women weighing less than 160 lbs. The average American women weighs 166 lbs.
todayilearned,,"TIL Ryan Gosling, Justin Bieber, and Avril Lavigne are all distant cousins"
todayilearned,,TIL teen dagestan soldier killed 1000 nazis with outdated weapon
todayilearned,,TIL Richard Pryor and Marlon Brando were lovers at one point.
todayilearned,,TIL Hitler's personal nurse revealed in 2005 that the death of Blondi the German Shepherd affected people in the bunker more than Eva Braun's suicide
todayilearned,,TIL Hitler's personal nurse revealed in 2005 thst the death of Blondi the German Shepherd affected people in the bunker more than Eva Braun's suicide.
todayilearned,,"Today I learned that Nirvana's ""Polly"" is about a rape from the perspective of a rapist"
todayilearned,,"TIL About 90 percent of people are right-handed. The remaining 10 percent are either left-handed or some degree of ambidextrous, though people with ""true"" ambidexterity—i.e., no dominant hand at all—only make up about 1 percent of the population."
todayilearned,,TlL Porsche Will Charge You For Your Taycan Engine Sounds - $580 For An Mp3
todayilearned,,TIL that noise pollution is the loudest in black neighborhoods.
todayilearned,,TIL Richard Pryor and Marlon Brando fucked in the ‘70s
todayilearned,,"TIL that in 1993 an atheist Texas lawyer Madalyn O’Hair took a case against mandatory prayer in public schools to Supreme Court and won, was later kidnapped and brutally murdered by one of her employees in 1995 for $500,000"
todayilearned,,"TIL that serial killer Baba Anujka was sentenced to 15 years in prison when she was 90 years old, and was released 8 years later due to ""old age""."
todayilearned,,TIL that Victorians thought women had to have an orgasm to get pregnant.
todayilearned,,"The Leading senior care We provide non-medical in-home care, free independent and assisted living referral services, free memory care referral services, and Philips Lifeline Medical Alert Service. Contact us: 203-269-1522 #seniorcare"
todayilearned,,The Best Live Community Education Room For Forex &amp; Binary Options — Steemit
todayilearned,,TIL that a person who plays the viola da gamba is called a violist da gamba.
todayilearned,,TIL that owls (and most birds) have long legs that are just hidden.
todayilearned,,How to download Ubuntu MATE
todayilearned,,"TIL Sturgeon is considered a ""royal fish"" in the UK, meaning the Queen has to be contacted and offered the fish whenever one is caught."
todayilearned,,"TIL that it costs between $116,000 and $263,000 to open a Subway. In contrast, it costs between $1 million and $2.2 million to open a McDonald's."
todayilearned,,"TIL that it costs between $116,000 and $263,000 to open a Subway. In contrast, it costs between $1 million and $2.2 million to open a McDonald's."
todayilearned,,"TIL that blue eyes are caused by the same process that makes the sky appear blue, Rayleigh Scattering."
todayilearned,,TIL shoulder rumbles have reduced single-vehicle run-off-road crashes by up to 80%.
todayilearned,,TIL: Scallops have hundreds of eyes and they look creepy AF
todayilearned,,TIL Article 11 of the Articles of Confederation state that Canada would have been admitted into the United States if requested.
todayilearned,,TIL there was a cattle semen explosion recently in the Outback.
todayilearned,,TIL of the quaint Michigan town of Gaylord. Home to the seat of the Roman Catholic Diocese of Gaylord. God Bless.
todayilearned,,"TIL: Newton's financial misadventures in the South Sea Bubble. A very popular investment anecdote relates how Isaac Newton, after cashing in large early gains, staked his fortune on the success of the South Sea Company of 1720 and lost heavily in the ensuing crash."
todayilearned,,TIL of the existence of the quaint Michigan town of Gaylord. Home to the seat of the Roman Catholic Diocese of Gaylord. God Bless.
todayilearned,,TIL A man in Florida stole a chainsaw by putting it down his shorts and riding away on a bicycle. He ditched the chainsaw and was later arrested after going back to look for it.
todayilearned,,"TIL within weeks of proclaiming the drug overdose crisis to be a public health emergency in 2016, British Columbia implemented dozens of government-sanctioned ""overdose prevention sites"" around B.C. Since then, thousands of overdoses have been reversed and there have been no deaths at the sites."
todayilearned,,TIL A man in Florida stole a chainsaw by putting it down his shorts and riding away on a bicycle. He ditched it and was later arrested after coming back to look for it.
todayilearned,,0 to Death
todayilearned,,"TIL that Yaniv Roznai wrote a book about unconstitutional constitutional amendments--as in, the idea that a constitutional amendment can be unconstitutional even if it isn't actually explicitly prohibited by a constitution's text."
todayilearned,,TIL Wombats can smash skulls with their butts
todayilearned,,TIL Salvador Dali would dream in “glorious technicolor”
todayilearned,,"TIL Among many other quirks and jokes, Elon Musk has spent the past ten years assigning each model car a character to make the models “S3XY”"
todayilearned,,"TIL Carlos Rafael ran a massive criminal fishing operation in New England, evading taxes, exceeding quotas, and mislabeling fish. He became known as ""The Codfather."""
todayilearned,,"TIL: Author Dr Seuss was a lifelong smoker but had tried to quit by chewing on a corncob pipe he'd planted with strawberry seeds. 20 years later, after a minor heartattack, he tried again, filling his pipe with peatmoss and planting in it radish seeds, which he would water with an eyedropper."
todayilearned,,"TIL In the wild, giraffes almost never lie down because of vulnerability to predators. They usually sleep standing, sometimes sitting, and they give birth standing up. When giraffes sleep, they curl their necks and sleep for about five minutes at a time, sleeping no more than 30 minutes a day."
todayilearned,,Essential Betting Tips for Beginners to Succeed - Some people love sports betting because of the opportunity to make money. You need to pay attention to every betting tips to surely win. Contact us at +254784425299. #Soccertips
todayilearned,,TIL that Tom Delonge of Blink 182 owns a company that produced a UFO miniseries for the History Channel.
todayilearned,,"TIL about the 1977 book Government by Judiciary by Raoul Berger. In this book, he argues that the US Supreme Court has interpreted the 14th Amendment contrary to the intent of its draftsmen on various issues. His book helped spark a debate about originalism and living constitutionalism in the U.S."
todayilearned,,TIL that zebras can come in stripes and POLKA DOTS!
todayilearned,,TIL the top google result for “How to tie a noose” is the suicide prevention hotline number.
todayilearned,,TIL that condoms should be replaced every 30 minutes when engaging in a long sex session.
todayilearned,,"TIL figs bloom internally so to get pollinated, female fig wasps snap off their wings and antennae while forcing themselves permanently into the fig through its shell. She lays eggs, they hatch, and the offspring mate; males are wingless so they can build a tunnel for the females to exit and repeat"
todayilearned,,TIL both Destiny’s Child and Alicia Keys made their debut on the soundtrack to Men in Black
todayilearned,,"TIL that Steve Mnuchen (Trump’s Secretary of the Treasury) has been either a Producer or Executive producer on films such as Mad Max Fury Road, BlacKkKlansman, Batman v Superman, Wonderwoman and so many more"
todayilearned,,TIL that the US Mint doesn’t make paper money but only makes coins. The Bureau of Engraving and Printing makes paper money.
todayilearned,,The Best non-medical in-home care in Abbeville SC We provide adept in-home caregivers to families in Greenwood and surrounding areas. Contact us at (864) 626-0737 #nonmedicalinhomecareinAbbevilleSC
todayilearned,,TIL After the Trudeau news I learned about brownface. I always figured blackface was a uniquely American thing.
todayilearned,,TIL the first time a switch hitter went up against a switch pitcher they kept alternating stances until the umpires stopped the game
todayilearned,,"TIL First Blood, the first Rambo movie released in 1982, took place in the fictional town of Hope, Washington but was almost entirely shot in the real town of Hope, British Columbia."
todayilearned,,TIL 69 Johnsons have played in the NBA
todayilearned,[deleted],TIL 69 Johnsons have played in the NBA
todayilearned,,"TIL of Thorhall Hunter. One of the vikings mentioned who explored America. He is described as a dark skinned worshipper of Thor who was Leif's right hand man. After Leif's journey, he lead a second expedition into the Americas, and was last seen singing songs with 9 other men, off to ""Ireland"" *"
todayilearned,,How subnets help save IP address.
todayilearned,,TIL Something is Clearly Coming From Outside the Solar System
todayilearned,,"TIL Oliver Heaviside was an eccentric scientist who, among other things, replaced his furniture with blocks of granite, signed his letters W.O.R.M. for no particular reason and painted his fingernails pink."
todayilearned,,TIL: Ballet Skiing. That is all.
todayilearned,,"TIL that most airline forbid their pilots from eating the same meal on a flight. That way, in the event that one type of meal is contaminated, both of the pilots won't succumb to food poisoning"
todayilearned,,"TIL Siskel and Ebert hated Jim Carrey and Ace Ventura when it was released, suggesting he retire immediately. Four years later they dedicated an entire episode of their show to him discussing his meteoric rise and admitting they were wrong."
todayilearned,,"TIL The Ancient Romans practiced ""mountain wrecking,"" a mining practice where they pumped water into the crevices of mountains until their pressure caused their rock faces to burst open"
todayilearned,,TIL there's a song/poem called Cock Up Your Beaver which has nothing to do with Cocks or Beavers
todayilearned,,TIL That BMW once made a small little car called the Isetta that had a steering wheel on the door. It is quite possibly the cutest thing I've ever seen.
todayilearned,,"That the nursery rhyme ""Mary had a little lamb"" was based on an actual incident where Mary Elizabeth Sawyer had her pet lamb follow get to school, in 1806."
todayilearned,,TIL Both Alicia Keys and Destiny’s Child made their debut on the soundtrack to Men In Black.
todayilearned,,TIL liquid smoke is actually made of smoke
todayilearned,,"TIL actor George C. Scott declined his best actor nomination for ""Patton"" in 1970, and had the decency to let the Academy know that he would refuse the award if he won. He won anyway, and reportedly called the Oscars a ""two-hour meat parade."""
todayilearned,,TIL That Japan used $30 million of their Tsunami relief funds to support whaling
todayilearned,,"TIL the federal government made $48.2 million from the sale of the 144,336 Bitcoins that were seized from Ross William Ulbricht’s laptop computer in connection with his operation of the Silk Road underground website. If they still had the coins today they would be worth almost $1.5 billion."
todayilearned,,TIL that in the Japanese version of Street Fighter 2 the boxer Balrog was called M. Bison (short for “Mike Bison”) a parody of real-life boxer Mike Tyson. When the game was released in the US the names of the bosses were rotated as Capcom feared a lawsuit from Mike Tyson.
todayilearned,,TIL that Childhood Trauma and negatively biased memory may be a likely predictor of adult ADHD
todayilearned,,TIL you cant cough without clenching your butt.
todayilearned,,"MICHAEL C GARRETT DISCLOSES ""Mark Of The Beast"" Find Out What This MARK Is Before It's To Late"
todayilearned,,"TIL that there are dogs trained to sniff out and retrieve Box Turtles, which might be the cutest thing ever"
todayilearned,,"TIL that the CIA operated ""Operation Midnight Climax"" -- luring men to a bordello and drugging them with LSD"
todayilearned,,"TIL Larry David inadvertently saved an innocent man from Death Row - Juan Catalan was charged in the murder of a teenage girl, until his lawyer found unused footage from HBO’s “Curb Your Enthusiasm” that proved he’d been at a Dodger’s game with his 6 year old daughter on the night of the murder."
todayilearned,,"TIL that in 2015 an entomologist allowed two botflies to develop to maturity in his skin, because ""being a male, this was my only chance to produce another being out of my flesh and blood"""
todayilearned,,many are havingdreams/visions of America's future
todayilearned,,TIL Legends of Racing - Best Cars
todayilearned,,"TIL Volkswagan was originally operated by the German Labour Front (Deutsche Arbeitsfront), a Nazi organization."
todayilearned,,TIL Japan has more publicly traded companies than China as of 2018
todayilearned,,TIL rapper Zuby temporarily decalred himself as a woman with the sole purpose of becoming the womens weightlifting champion in the UK
todayilearned,,Today I learned about the Pylos Combat Agate (and the tomb it was found in) that depicted a combat scene in such tiny detail that they suspect a magnifying glass was used to make it.... in 1450 BCE.
todayilearned,,"TIL Discord User ID 1 is for Clyde#0000, the one saying: ""you can't send a message..."""
todayilearned,,TIL that the Dog and Cat Meat Trade Prohibition Act was passed on December 20 2018 making it illegal to slaughter dogs or cats for food
todayilearned,,"TIL that on this date in 1973, President Jimmy Carter filed an official report claiming he witnessed an UFO"
todayilearned,,"TIL that in 2014 a Cockatoo celebrated it’s 100th birthday, it was also noticed by Queen Elizabeth II who sent a birthday card as is custom to 100 year olds."
todayilearned,,TIL one of the main reasons why the Normandy invasion was successful was due to inflatable balloons 150 miles away.
todayilearned,,You can safely eat mussels even if the shell doesn't open when you cook them
todayilearned,,"TIL about the Greek Autonomous region of Mount Athos. It is a peninsula in Greece which is inhabited by Orthodox monks, and where women have been forbidden from entering for almost a thousand years."
todayilearned,,"TIL that in 1921, virtually every city and town in America with a population over 2500 had its own electric rail system."
todayilearned,,TIL peahens are female peacocks
todayilearned,,"TIL that during a cabinet meeting about the Iran Iraq War, Saddam Hussein's health minister suggested that Saddam temporarily stand down to help with the peace process. In response, Saddam escorted the minister to the next room, shot him with his pistol and then returned to the meeting."
todayilearned,,TIL how to poop and pee in space
todayilearned,,"TIL that great apes, including chimpanzees and orangutans, have absolutely no appreciation of music whatsoever. Research has shown they can’t tell the difference between Beethoven and Bieber, and that music is all just meaningless sound to them."
todayilearned,,"TIL up until the tail-end of the 18th century, tomatoes were considered poisonous, and nicknamed the “poisonous apple.” It wasn’t until 1820, when Colonel Robert Johnson ate an entire basket of the fruit, that those myths were proven false"
todayilearned,,"TIL the equals sign (=) wasn't used in mathematics until 1557, when Welsh physician Robert Recorde proposed it in his book, ""The Whetstone of Witte"""
todayilearned,,TIL WHO (World Health Organization) calls for abolition of drug criminalization
todayilearned,,"TIL about the Triple Point of Water - the conditions under which water will freeze, melt, and boil at the same time"
todayilearned,,TIL that this year marks the 400th anniversary of slaves being imported into America
todayilearned,,TIL that the world’s oldest recorded joke has been traced back to the Sumerians in 1900 BC. The joke goes: “Something which has never occurred since time immemorial; a young woman did not fart in her husband’s lap.” This proves that toilet humour has always been funny.
todayilearned,,"TIL that the Shipping Forecast, broadcast four times daily by the BBC, was established following a shipwreck in 1859 and is the world's longest running continuous weather forecast. With its lyrical sea area names, familiar theme and calm delivery, many listeners use the 0048 broadcast as a lullaby."
todayilearned,,TIL that Roman Emperor Valentinian died whilst yelling at a group of barbarians due to becoming so angry that a blood vessel in his skull burst
todayilearned,,"TIL I learned about Broaden-and-build, A method to achieve happiness"
todayilearned,,"TIL that the US forgot how to make ""FOGBANK"" the fission-fusion interstage for its current nuclear warheads. The delayed their refurbishment, cost millions and require them to reverse engineer the tech from old bombs"
todayilearned,,TIL of the 1996 Elmo Craze
todayilearned,,TIL about the 1996 Elmo Craze
todayilearned,,TIL of that human beings aren’t the only animals that go to war with each other. Two troops of chimpanzees waged a four year war known as the Gombe Chimpanzee War
todayilearned,,"TIL that Governor Pete Ricketts,(Nebraska) and his family, own MLB Chicago Cubs."
todayilearned,,"TIL that the ‘Three Little Pigs’ in the Green Jellÿ 1993 hit song were voiced by musicians Les Claypool of Primus, Maynard James Keenan of Tool, and actor/comedian Pauly Shore"
todayilearned,,TIL the difference between vinted and bottled wine.
todayilearned,,"TIL Burt Reynolds was considered for the role of Michael Corleone but Brando said he would walk if they cast him. “He is the epitome of something that makes me want to throw up. He is the epitome of everything that is disgusting about the thespian, he worships at the temple of his own narcissism.”"
todayilearned,,"TIL Sam Adams founder Jim Koch has 3 degrees from Harvard: BA, MBA, JD"
todayilearned,,TIL That there are currently 46 MLB active players who's fathers also played in MLB
