subreddit,selftext,title
todayilearned,,"TIL that units of the Romanian Army began systematic shootings of the Jewish residents of Kishinev, the capital of Bessarabia, shortly after occupying the city in July 1941 during WW2."
todayilearned,,SUPER HYDROPHOBIC COATING - NANPSCIENCE - LEARNED TODAY
todayilearned,,"TIL before Japan surrendered to end WW2, the US armed forces ordered over 1 million Purple Heart medals in anticipation of a difficult land invasion. That stock is still being used today."
todayilearned,,TIL about the Internment of Japanese Americans in 1942 where around 110k people (60 % of them were US citizens) were forcefully moved to proper concentration camps in the west coast simply for having Japanese descendents.
todayilearned,,"If you can choose between your choices for Lice, Pubic Lice are the best. TIL there are 3 types of lice: Head Lice, Body Lice, Pubic Lice. Pubic Lice is the way to go. They reproduce the slowest, shorter life, and are the smallest."
todayilearned,,TIL how pencils are made!
todayilearned,,How pencils are made!
todayilearned,,"TIL: Each year in California, the Del Mar Dog Beach hosts the ""Surf Dog Surf-A-Thon"". This Surf Dog competition started in 2005 to help raise life saving funds for rescue canines through the Helen Woodward Animal Center. The center and SoCal Surf Dogs offer surfing lessons to dogs."
todayilearned,,TIL some inmates are sharp and all come out of prison with PTSD
todayilearned,,"TIL: Eating moderate amounts of dark chocolate benefits health in many ways. In fact, chocolate is now considered an anti-aging, anti-inflammatory ‘superfood’ for the brain and body."
todayilearned,,"TIL: Hiroo Onoda, one of the Japanese soldiers that did not surrender until 1974, raided villages on Lubang Island and killed 30 people during his campaign."
todayilearned,,TIL that Reddit was saved by it's user with Reddit gold in 2010. The stunt was made possible by employees who got tired of the hiring freeze by Conde Nast and begged it's user for help without them knowing pulling in 6 figures over a weekend.
todayilearned,,7 Things Parents Must Know About Online Dangers For Teens
todayilearned,,"TIL I have Photic Sneeze Reflex (PSR), something that only occurs in 18-35% of people"
todayilearned,,"TIL Blue from the Nickelodeon kids show ""Blue's Clues"" is a girl"
todayilearned,,"TIL The earliest e-cigarette can be traced to American Herbert A. Gilbert, who in 1963 patented ""a smokeless non-tobacco cigarette"" that involved ""replacing burning tobacco and paper with heated, moist, flavored air"". This device produced flavored steam without nicotine."
todayilearned,,TIL: 20+ Compelling UX Statistics Everyone Must Know
todayilearned,,TIL: There have been serious plans to divert the ocean or the Nile into the Sahara to turn it lush
todayilearned,,TIL that Chernobyl nuclear power plant site is scheduled to be cleared by 2065; a disaster lasting just under 80 years.
todayilearned,,"TIL I learned a handful of countries use ""googlemail"" instead of ""gmail"" because the latter was already trademarked there when Google wanted to use it"
todayilearned,,"TIL that the Chernobyl nuclear power plant site, is scheduled to be cleared by 2065; a disaster lasting just under 80 years."
todayilearned,,"”They” can officially be used as a singular, nonbinary pronoun. Merriam-Webster, the oldest dictionary publisher in America, officially recognized the usage today."
todayilearned,,This plumber has been providing low to no cost service to people in need while putting himself into debt. His latest act of kindness finally caught the attention of the media and it is so heartwarming.
todayilearned,,"TIL in WW2 Lt. Martin Monti, after lying his way from Karachi, stole a plane in Italy and defected to the Nazis. He became a propaganda officer, and the war ended he was court-martialed for desertion. He was able to reenlist, but minutes after being discharged in 1948, he was arrested for treason."
todayilearned,,"”They” can officially be used as a singular, nonbinary pronoun. Merriam-Webster, the oldest dictionary publisher in America, officially recognized the usage today."
todayilearned,,"TIL That the logo for Prudential Insurance is not in fact an iceberg, as I had though my whole life, but actually meant to depict the ""Rock of Gibraltar"""
todayilearned,,TIL that dogs are really loyal.This makes me crying
todayilearned,,"TIL that Burundi, Kenya, Rwanda, Uganda, Tanzania &amp; South Sudan have kicked off a process to unify with a single constitution, common market &amp; currency"
todayilearned,,TIL when you put onions to bottom of your feet about in 30 minutes you will start to taste the onions.
todayilearned,,"TIL about Henrietta Lacks, a black American woman who had cervical cancer cells taken from her body without her or her family's knowledge or consent. The cells became immortal. Henrietta was 5 foot tall yet there are now 50m metric tons of her cells in labs around the world."
todayilearned,,TIL that ASMR (Autonomous Sensory Meridian Response) is the name given to the euphoric relaxing sensation I’ve experienced since childhood and that there is a fast growing community online dedicated to providing videos that trigger the sensation.
todayilearned,,TIL that clowns copyright their makeup by painting their faces on eggs. There is a clown egg registry in London.
todayilearned,,TIL Mr. Kellogg invented Cornflakes in 1878 in the hope that plain food would stop people masturbating
todayilearned,,"TIL that year 2038 will face the same issue as the Y2K problem on digital systems. The latest time it can represent is 03:14:07 on Tuesday, 19 January 2038 and will follow by 13 December 1901 at 20:45:52"
todayilearned,,"TIL comic book artist Mike Grell sabotaged his own Superhero ""Tyroc"" in protest at DC’s lack of compelling black characters. He deliberately made him ridiculous drawing him ""somewhere between Elvis’ Las Vegas and a pimp on the street corner.”"
todayilearned,,TIL that there is a new state of matter that exists and it is known as time crystals. These lab-created time crystals are structures that repeat periodically in time rather than space.
todayilearned,,TIL that there is a new state of matter that exists and it is known as time crystals. These lab-created time crystals are structures that repeat periodically in time rather than space.
todayilearned,,TIL Scallops have anywhere from 50-200 eyes.
todayilearned,,"TIL a Chinese man bought a corpse for 4,000 yuan and tried to fake his death in a car accident to avoid paying a debt. His scheme was found out after the body’s DNA did not match his family and it was discovered to belong to a woman."
todayilearned,,"TIL a Chinese man bought a corpse for 4,000 yuan and tried to fake his death in a car accident to avoid paying a debt. His scheme was found out after the body’s DNA did not match his family and it was discovered to be a woman’s."
todayilearned,,"TIL a Chinese man bought a corpse for 4,000 yuan and tried to fake his death in a car accident to avoid paying a debt. He rode his car into a pole and set it on fire with the body inside. His scheme was found out after the body’s DNA did not match his family and it was discovered to be a woman’s."
todayilearned,,"TIL that it is possible to quantify the trade-offs of importing crops into a country, which can be both financial and socioeconomical (for instance in China the expenditure is as high as $621 billion over 30 years)"
todayilearned,,"TIL a Chinese man bought a corpse for 4,000 yuan and tried to fake his death in a car accident to avoid paying a debt. He rode his car into a pole and set it on fire with the body inside. His scheme was found out after the body’s DNA did not match his family and it was discovered to be a woman’s."
todayilearned,,The last known duel in France took place in 1967
todayilearned,,TIL: It Is illegal to name your pig Napoleon in France
todayilearned,,"TIL that a young female (in high school), memory resets every 2 hours, caused by a head injury. She relies on classmates for assistance to help catch her back up on what they learned the previous day in class."
todayilearned,,"TIL that WD-40 is abbreviated from the term ""Water Displacement, 40th formula"", as it was the result of the 40th attempt to create the product."
todayilearned,,TIL how Maury saved millions and unified the world with data in the 1800s (a dozen countries and world's first global data exchange)
todayilearned,,"TIL that the reason cats are not eating from the side of the food bowl it because of ""Whisker Fatigue"". Cats Whiskers are so sensitive that even the slightest touch can make them tired and dizzy"
todayilearned,,TIL there was a dog named Nigger
todayilearned,,TIL one of the 5 largest whirlpools is between NB and Maine
todayilearned,,TIL you're more likely to die from lightning than from being shot from a crazed mass killer
todayilearned,,"The Leading in-home senior care Monroe Township NJ You should only ever choose an in-home care provider that offers insured and bonded staff, as this protects you and your loved one against any theft. Contact us: (732) 483-4611 #inhomeseniorcareMonroeTownshipNJ"
todayilearned,,TIL How pencils are made
todayilearned,,TIL You're More Likely To Die From Lightning Strike Than In Mass Shooting
todayilearned,,TIL I learned that TikTok has more influence on my teenage daughter than me and she's become a vsco girl and I have no idea what's that supposed to mean
todayilearned,,Best Cryo Chamber and Cryotherapy Machine - Cryotherapy is the science of exposing the body to sub-zero temperatures of up to -140°C in order to stimulate multiple physical and mental health benefits. Our cryotherapy machine and chambers are the best in the USA
todayilearned,,TIL that pasteurization of milk was developed in order to stop the spread of tuberculosis. A common way the disease was spread by drinking the milk of infected cows.
todayilearned,,TIL TikTok has more influence on my teenage daughter than me and apparently she's become a back girl
todayilearned,,TIL no part of Equatorial Guinea lies on the Equator.
todayilearned,,"TIL Israel's Ministry of Agriculture banned fishing in the Sea of Galilee in 2010, the site where Jesus told his disciples: ""I will make you fishers of men."" Four Apostles - James, Andrew, John and Peter - worked as fishermen on the shores of the Sea of Galilee"
todayilearned,,"TIL Vladimir Putin is an animal lover, he is working to save Russian dog breeds and he's heavily involved in animal conservation"
todayilearned,,"TIL Israel's Ministry of Agriculture banned fishing in the Sea of Galilee, the site where Jesus told his disciples: ""I will make you fishers of men."" Four Apostles - James, Andrew, John and Peter - worked as fishermen on the shores of the Sea of Galilee"
todayilearned,,TIL a trial by combat in medieval France took place between a King's bodyguard and a Greyhound. The Greyhound attacked the guard in the street so often that people suspected he had murdered the dog's owner. He confessed when the greyhound pinned him to the ground in the duel and was hung.
todayilearned,,TIL a trial by combat in medieval France took place between a King's bodyguard and a Greyhound. The Greyhound attacked the guard in the street so often that people suspected he had murdered the dog's owner. He confessed when the greyhound pinned him to the ground in the duel and was hung.
todayilearned,,Guaranteed Sure Bet Prediction Today with Tips100 - Tips100 provides football predictions/soccer tips and in-depth analysis for over 50 leagues playing across the globe. We guaranteed sure bet prediction today.
todayilearned,,How to install Ubuntu mate OS
todayilearned,,TIL that scientists have developed a way to charge your phones by peeing.
todayilearned,,"TIL the most expensive flag ever sold at auction was the $12.3 million paid in 2006 for the prototype ""Stars and Stripes"" captured by the notorious British General Banastre Tarleton in the Revolutionary War in 1778."
todayilearned,,TIL the city of Chicago was raised by over a foot during the 1850s and '60s without disrupting daily life.
todayilearned,,"TIL Russia's Alfa-Bank founded a Fellowship Program to expand networks of global professionals, develop greater intercultural understanding, and advance knowledge of Russian affairs in the West. Only 18 fellows are selected; it is very competitive, similar to being accepted at a top university"
todayilearned,,TIL When it comes to false abuse allegations non-custodial parents (usually fathers) made them most frequently - 43% of the total
todayilearned,,TIL that Saturn has a hexagon vortex under its famous hexagon clouds at its pole.
todayilearned,,TIL that I've been using pre-1.0 software for a decade
todayilearned,,TIL that China has a strategic pork reserve which is similar to the United States strategic petroleum reserve.
todayilearned,,TIL GUY DONATED HIS KIDNEY TO STRANGER OFF REDDIT
todayilearned,,TIL How are pencils made
todayilearned,,TIL If you mistype Amaon.com then it will still go to Amazon.com
todayilearned,,"TIL Russia's Alfa-Bank founded a Fellowship Program in 2004 to expand networks of American, British, German, and Russian professionals, develop greater intercultural understanding, and advance knowledge of Russian affairs in the West. Only 18 fellows are selected each year"
todayilearned,,Ideal mold mitigation From the moment you pick up the phone to request an inspection until you sign off on the completed work. Contact us: 800-930-5944 #moldmitigation
todayilearned,,TIL that Snowball the cockatoo has recently shown ground-breaking evidence that other animals besides humans can recognize a musical beat and create their own dance moves
todayilearned,,TIL there is an NGO whose specific purpose is to combat health organizations
todayilearned,,"TIL Teresa Teng sang many genres of songs and in several languages/tongues. Other than being the queen of Mandarin-pop, Canto-pop and Japanese-pop, she also sang Chinese folk and Chinese opera; Japanese folk; Indonesia folk; and English pop, jazz and pop-rock"
todayilearned,,"TIL About Ben Johnston, the US military contractor who revealed how many of his coworkers, participating in the US-Bosnian wars were openly pedophiles."
todayilearned,,"TIL:- He made his own clubs: the heads of oak, the faces covered with strips of tin, the shafts of blackthorn branches. The “balls” were marbles."
todayilearned,,TIL that the US Army is unable to account for roughly $6.5 trillion worth of transactions between 1999 and 2015 and the number is still growing.
todayilearned,,Vì sao cần phải tìm link dafabet Việt mới nhất? - DafabetViet
todayilearned,,"TIL that “A Hard Day's Night"", by the Beatles. features an opening chord so revolutionary that it took 40 years and a mathematical formula to figure out what chord was being used"
todayilearned,,What is the quickest way to find new business?
todayilearned,,"Israeli Prime Minister Benjamin Netanyahu fell short of securing a parliamentary majority with his religious and nationalist allies in national elections Tuesday, initial exit polls showed, setting the stage for a period of coalition negotiations"
todayilearned,,The Leading in-home senior care in Birmingham AL Our senior helpers are always ready to serve and assist the clients with any care needs. Contact us: (205) 874-9730 #inhomeseniorcareinBirminghamAL
todayilearned,,TIL that Grenadine is a pomegranate syrup not a cherry syrup
todayilearned,,Making a Drawing for Granite Countertop Quote - Granite Shorts Ep. 5
todayilearned,,TIL that you can prove the Pythagorean Theorem with water.
todayilearned,,"TIL that the Celtic ethnicity (Keltoi) was first recognized historically by Hecataeus of the Greeks in 517 BC, originating from modern day Marseille, France. Julius Caesar recorded them as the Gauls."
todayilearned,,TIL that you can prove the Pythagorean Theorem with water.
todayilearned,,"TIL that when Socrates was found guilty of impiety and corruption of the youth, his punishment was put to a vote. He had the choice to suggest an alternative to death, but instead nominated that Athens provide him free meals for the rest of his life."
todayilearned,,"TIL worth £2 million, Lampy is the oldest garden gnome in existence, made in 1847. There had been 21 of them, but the original owner's daughter hated them and tried to remove them all. She missed this one."
todayilearned,,TIL A bird smuggler was sentenced to a year and a half in federal prison for smuggling endangered “good luck” songbirds into The USA. He taped to the birds to his ankles for the 15-hour flight.
todayilearned,,"TIL Aerospace and weapons development company Lockheed Martin, has a total asset worth of $44Billion USD, and in 2018 had a total revenue of $53.76Billion USD."
todayilearned,,المعادلة الاصعب - منتديات مرايم
todayilearned,,Nature Minimises Damage to Earth’s Ocean Circulation System Caused by Climate Change
todayilearned,,TIL that President John Adams died on the 50th anniversary of the signing of the Declaration of Independence. His last words were “Thomas Jefferson survives” unaware that Jefferson had passed away hours earlier.
todayilearned,,"TIL that when a PepsiCo warehouse collapsed, it flooded a Russian town with various juices"
todayilearned,,TIL how to clean my charging port. Just in case any of your fellow redditor's didn't know.
todayilearned,,TIL that President John Adams died on the 50th anniversary of the signing of the Declaration of Independence. His last words were “Thomas Jefferson survives” unaware that Jefferson had passed away hours earlier.
todayilearned,,TIL All of the 9/11 hijackers were in their 20’s except one.
todayilearned,,TIL there’s a passage in the Bible where a sermon is so long that a man in the audience falls asleep and falls to his death.
todayilearned,,"TIL of Operation Sani-Flush, where a toil.t was dropped from an A1 Skyraider during a bombing run in Vietnam."
todayilearned,,"TIL in 1985 the Philadelphia Police department bombed a house in west Philadelphia, killing 11 people, including 5 children. PPD remains the only American City Police Department to do so."
todayilearned,,"TIL that when a PepsiCo warehouse, it flooded a Russian town with various juices"
todayilearned,,TIL of Operation Sani-Flush
todayilearned,,TIL: Wind is important when hunting
todayilearned,,"TIL Rome and Carthage signed a peace treaty, ending the Punic Wars... in 1985"
todayilearned,,Early interpretations of mammoth depicted a truly bizarre looking animal.
todayilearned,,TIL Solving 2 Rubiks cubes in 1 breath
todayilearned,,"The best basement sealer our team can get to work putting together a precise game plan and price quote to get your home back up to healthy standards, the Healthy Way!Contact us:800-930-5944 #basementsealer"
todayilearned,,TIL that all Cartoon Network games have no predatory microtransactions while all Disney games pray on children! This should not be legal.
todayilearned,,Chick-Fil-A Success Shows Brand’s Ability to Triumph Over PR Problems
todayilearned,,"TIL there's apparently a real place called Wuhu Island, the pictures are of the Nintendo Wuhu Island, and the reviews are jokes about Wii Sports Resort"
todayilearned,,TIL Breaking Glass With Playing Cards!
todayilearned,,Trump backs push for Bible classes in schools reagain
todayilearned,,"TIL: Zambia, a small African nation, had a space program aiming a manned mission to Mars"
todayilearned,,TIL about combat juggling - the team-based competive juggling where the object is to make your opponen to drop all his/her clubs.
todayilearned,,"TIL you don’t have to keep drawing until you can play a card in Uno. You draw just one and if you can play it, you do. If you can’t, the play goes to the next person."
todayilearned,,"1993, India prohibited employment of a person “for manually carrying human excretament”."
todayilearned,,"TIL the naming convention of Tesla's models of vehicles looks like they spell out ""SEXY"" (S, 3, X, Y)."
todayilearned,,"TIL The side effects of some drugs can be so severe they produce illnesses themselves known as Iatrogenic diseases, or, in other words, diseases caused by doctors."
todayilearned,,"TIL Major League Baseball had an official statistic called the ""Game Winning RBI(s)"" which it kept track of from the 1980 to 1988 seasons"
todayilearned,,"TIL Major League Baseball had a stat called the ""Game Winning RBI(s)"" which it kept track of from the 1980 to 1988 seasons"
todayilearned,,"TIL Soundgarden's song ""Spoonman"" was about a Seattle-based street performer named Artis who has traveled the world playing the spoons since the late 1960s. He played spoons and various other percussion ""instruments"" throughout the song."
todayilearned,,TIL Vlad the Impaler (basis for the character Dracula) was Catholic.
todayilearned,,Làm đẹp tại Thẩm Mỹ Viện Nevada - Địa chỉ VÀNG của Sao Việt
todayilearned,,"TIL of Ranavalona, a ruthless ruler of Madagascar. During her reign the population of Madagascar is estimated to have declined from around 5 million to 2.5 million"
todayilearned,,TIL that Homework was extremely controversial in the 1800s and early 1900. In 1901 California even banned homework for everybody under the age of 15.
todayilearned,,"TIL that we've been eating Tictacs wrong our whole lives, even for generations!"
todayilearned,,TIL The voice actor for Happy in Snow White and the Seven Dwarfs was born the same year the Civil War ended
todayilearned,,TIL “Smash Mouth” means blow job.
todayilearned,,"Hey, everybody! Check out the brand new CryptoTab browser! You just use it like a regular browser (watch Youtube, browse websites or social media networks, etc.) and earn income in BTC at the same time thanks to its built-in mining algorithm!"
todayilearned,,Learn to Solve the Rubik’s Cube || Learn Quick in 2 Minutes
todayilearned,,"TIL about Mark Roberts, a streaker who was sponsored by GoldenPalace to streak the 38th Super Bowl for $1 million dollars. He was provided with one of the best defense attorneys in the USA and his charges got reduced to a $1000 fine."
todayilearned,,"TIL By the fourth Century the Christian Church borrowed the common practice of Greco-Roman Mystery cults of intentionally keeping aspects of their religious beliefs and rituals secret, only revealing them to people after becoming initiates to the faith"
todayilearned,,"TIL learned about “Clinical lycanthropy”, a rare psychiatric delusion where the affected individual believes they are transforming or have already transformed into an animal."
todayilearned,,"TIL, Salt was so precious in ancient Rome, it made up a portion of a soldier's pay, which is where we get the word salary from, (from the Latin for salt, sal)."
todayilearned,,"TIL ""Shuffle"" may or may not actually randomize a playlist, depending on the service used. Even if it does, though, it won't feel like it's random."
todayilearned,,"TIL there is a genre of music called “Sovietwave”. A type of synth pop, extremely reminiscent of Soviet themes."
todayilearned,,"TIL there was a live-action Super Mario Bros. film in 1993, made with A-list actors and a production budget of $42m USD. Dustin Hoffman, Danny DeVito, and Tom Hanks were strongly considered for lead roles. it didn't go well."
todayilearned,,TIL that treating cotton wool with DNA made it more flame-resistant.
todayilearned,,TIL a volcanic eruption in Indonesia probably caused the invention of the bicycle and the writing of Frankenstein
todayilearned,,"TIL according to studies, when men and women are ""just friends"", on average men think the woman is still romantically interested in them, and on average women think the men are strictly just friends."
todayilearned,,TIL stalactites hold TIGHT to the ceiling and stalagmites MIGHT make it to the ceiling
todayilearned,,"TIL That the US Government Hired Male Child ""Prostitutes"" in Afghanistan"
todayilearned,,"TIL That the US government Hired Child ""Prostitutes"" In Afghanistan"
todayilearned,,TIL that toothpaste is not necessary for good dental health.
todayilearned,,TIL that Celine Dion has thirteen older siblings.
todayilearned,,Seks seksi saluran pendidikan IT
todayilearned,,TIL China has a National Pork Reserve
todayilearned,,TIL they named the mango after the flamingo
todayilearned,,"TIL The DreamWorks character Shrek is largely believed to have been inspired by French wrestler Maurice Tillet, who suffered from Acromegaly."
todayilearned,,"TIL about Kimani Maruge, a Kenyan who became the oldest person to start elementary school. He enlisted on January 12, 2004, at the age of 84."
todayilearned,,TIL that Princeton researchers created a nuclear war simulation straight out of 1985
todayilearned,,"TIL that a man once robbed a bank after smearing his face with lemon juice, thinking it would blur his image on the cameras because it was invisible ink."
todayilearned,,"TIL Hydrothermal vents on Saturn's moon Enceladus may contain microbial life which formed around hydrothermal vents, similar to the popular theory of life's origin on Earth"
todayilearned,,"TIL Scientology founder L. Ron Hubbard chose his son Quentin to succeed him after his eldest son quit the church. Quentin, who wanted to be a pilot and was gay (against doctrine), committed suicide. When his father discovered this, he shouted ""That stupid fucking kid! Look what he's done to me!"""
todayilearned,,TIL there are No scientific evidence that MSG is bad for you.
todayilearned,,"TIL Sacha Baron Cohen most likely uncovered a pedophile ring in Las Vegas, but the FBI declined to investigate"
